Post Unique Reference,Name,Grade (or equivalent),Job Title,Job/Team Function,Parent Department,Organisation,Unit,Contact Phone,Contact E-mail,Reports to Senior Post,Salary Cost of Reports (£),FTE,Actual Pay Floor (£),Actual Pay Ceiling (£),Professional/Occupational Group,Notes,Valid?
2,Jonathan Day,SCS4,"Permanent Secretary, Chairman of the JIC and Professional Head of Intelligence Analysis","To chair the Joint Intelligence Committee and to oversee the work of the Assessments Staff so as to ensure effective support for the Prime Minister and the National Security Council through provision of timely, accurate and objective all-source intelligence assessments. To oversee the work of the intelligence analytical community across government, so as to ensure the development of necessary capabilities and skills.",Cabinet Office,Cabinet Office,Joint Intelligence Organisation,020 7276 0333,jicchairman@cabinet-office.x.gsi.gov.uk,317,0,1,145000,149999,Policy,,1
5,Tom Scholar,SCS4,"Permanent Secretary, Prime Minister's Adviser, Head of the European and Global Issues Secretariat","EGIS is responsible for coordinating the work of Government in reaching collective agreement on International Economic (including G20/G7, international trade and development issues) and European policy and to provide advice on these matters to the Prime Minister and the Cabinet Office Minister for Government Policy",Cabinet Office,Cabinet Office,European and Global Issues Secretariat,020 7276 1130,psscholar@no10.x.gsi.gov.uk,317,0,1,150000,154999,Policy,Team 5 or fewer: team costs attributed to Post Ref 518,1
7,Sir Mark Lyall Grant,SCS4,"Permanent Secretary, National Security Adviser",Principal adviser to the Prime Minister and the National Security Council across all national security issues.,Cabinet Office,Cabinet Office,National Security Secretariat,020 7276 1234,NSAaction@cabinet-office.x.gsi.gov.uk,317,0,1,160000,164999,Other,,1
8,Eliminated,SCS4,Permanent Secretary of the Cabinet Office and First Parliamentary Counsel,"Was a dual role: Permanent Secretary for the Cabinet Office with responsibility for the leadership and governance of the Cabinet Office, as well as being Accounting Officer. Also First Parliamentary Counsel, overseeing the Government in Parliament Group, which includes Parliamentary Counsel and the Business Managers in each House. The Group works with teams across government to prepare and deliver the government’s legislative programme.",Cabinet Office,Cabinet Office,Government in Parliament,N/A,publiccorrespondence@cabinetoffice.gov.uk,405,0,1,0,0,Law,,1
10,Helen MacNamara,SCS3,Director General and Head of Economic and Domestic Affairs Secretariat,"Lead the Secretariat in supporting effective Cabinet Government and ensuring the Prime Minister, Cabinet Office Ministers and the Cabinet Secretary have access to high quality advice and briefing; and support the development, co-ordination and implementation of economic and domestic policy objectives. Provide oversight of the Implementation Group which drives and co-ordinates the implementation of Government business.",Cabinet Office,Cabinet Office,Economic and Domestic Affairs Secretariat,020 7276 0083,richard.hayward@cabinetoffice.gov.uk,317,375920,1,105000,109999,Policy,Temporary duties,1
13,Paddy McGuinness,SCS3,"Director General, Deputy National Security Adviser, Intelligence Security and Resilience",Responsible for supporting the Prime Minister and National Security Adviser on: counter terrorism; intelligence policy; the governance and resourcing of the secret intelligence agencies; cyber security; and resilience and crisis management.,Cabinet Office,Cabinet Office,National Security Secretariat,020 7276 1234,NSAaction@cabinet-office.x.gsi.gov.uk,7,0,1,0,0,Policy,Not on Payroll,1
16,Edward Chaplin,SCS3,Prime Minister's Appointments Secretary,Prime Minister's Appointments Secretary,Cabinet Office,Cabinet Office,Honours and Appointments Secretariat,020 7276 6732,edward.chaplin@cabinetoffice.gov.uk,317,0,0.4,45000,49999,Policy,,1
22,Liam Maxwell,SCS2,"Director, Chief Technology Officer, HM Government","Chief Technology Officer, HM Government.",Cabinet Office,Cabinet Office,Government Digital Service,0845 0004999,liam.maxwell@cabinetoffice.gov.uk,281,574321,1,140000,144999,Other,,1
24,Guy Lester,SCS2,"Director, Finance and Estates Management","Responsible for the effective operation of the Cabinet Office's financial and audit and assurance processes and systems, including financial management and control; Spending Review negotiations; forward planning and budgeting; investment and other formal approvals.",Cabinet Office,Cabinet Office,Finance & Estates Management,020 7276 0530,guy.lester@cabinetoffice.gov.uk,497,89987,1,90000,94999,Finance,,1
25,Eliminated,SCS2,"Director, Principal Private Secretary to the Deputy Prime Minister","Principal Private Secretary to the Deputy Prime Minister, responsible for: Management of the DPM's private office Commissioning and providing advice across the range of the DPM's policy responsibilities Liaising closely with the Cabinet Secretary and the Prime Minister's private offices to support the functioning of the coalition government",Cabinet Office,Cabinet Office,Deputy Prime Minister's Office,N/A,publiccorrespondence@cabinetoffice.gov.uk,216,0,1,0,0,Policy,,1
31,Adrian Dottridge,SCS2,"Director, Civil Service Workforce Reform","Director for Civil Service Workforce Reform leading on Civil Service and Ministerial Pensions policy and administration, Pay and Terms and Conditions",Cabinet Office,Cabinet Office,Civil Service HR,020 7271 6397,Adrian.Dottridge@cabinetoffice.gov.uk,592,0,1,85000,89999,Human Resources,Team 5 or fewer: team costs attributed to Post Ref 571,1
33,Janette Durbin,SCS2,"Director, Civil Service Talent","Overall responsibility for the appointment, development and performance management of Permanent Secretaries, talent management of the Civil Service Leadership Group and the Civil Service Talent Strategy.",Cabinet Office,Cabinet Office,Civil Service HR,0207 271 6599,janette.durbin@cabinetoffice.gov.uk,592,0,1,100000,104999,Human Resources,,1
35,Christopher Martin,SCS3,"Director General, PPS to Prime Minister",Principal Private Secretary to the Prime Minister,Cabinet Office,Cabinet Office,Prime Minister's Office,020 7930 4433,publiccorrespondence@cabinetoffice.gov.uk,317,366222,1,125000,129999,Policy,,1
37,Ruth Bailey & Crystal Akass,SCS2,"Director, Human Resources",Human Resource Management,Cabinet Office,Cabinet Office,Human Resources,020 7276 1234,hrdmailbox@cabinetoffice.gov.uk,497,0,0.61,50000,54999,Human Resources,"Job-Share: actual combined FTE 1.22 and combined salary range £105,000-£109,999",1
38,Alex Aiken,SCS2,"Executive Director, Government Communications",Leads on Cabinet Office Communications,Cabinet Office,Cabinet Office,Government Communications,020 7276 6009,alex.aiken@cabinetoffice.gov.uk,497,0,1,135000,139999,Communications,Team 5 or fewer: team costs attributed to Post Ref 556,1
42,Vacant,SCS3,"Director General, Deputy National Security Adviser, Defence, Nuclear and Strategy","Responsible for: supporting the Prime Minister and National Security Adviser with advice on defence and nuclear policy business; ensuring that the government's defence policy priorities are delivered in an efficient and coherent manner; leading the defence policy team, supported by one Deputy Director; liaison with national security teams overseas.",Cabinet Office,Cabinet Office,National Security Secretariat,N/A,publiccorrespondence@cabinetoffice.gov.uk,7,0,1,0,0,Policy,,1
51,Paul Rankin,SCS2,"Director, European and Global Issues Secretariat","EGIS is responsible for coordinating the work of Government in reaching collective agreement on International Economic (including G20/G7, international trade and development issues) and European policy and to provide advice on these matters to the Prime Minister and the Cabinet Office Minister for Government Policy",Cabinet Office,Cabinet Office,European and Global Issues Secretariat,020 7276 0215,paul.rankin@cabinetoffice.gov.uk,5,0,1,90000,94999,Policy,Team 5 or fewer: team costs attributed to Post Ref 518,1
54,Vacant,SCS2,Director and Deputy Head of Economic and Domestic Affairs Secretariat,"Lead the Secretariat in supporting effective Cabinet Government and ensuring the Prime Minister, Cabinet Office Ministers and the Cabinet Secretary have access to high quality advice and briefing; and support the development, co-ordination and implementation of economic and domestic policy objectives.",Cabinet Office,Cabinet Office,Economic and Domestic Affairs Secretariat,N/A,publiccorrespondence@cabinetoffice.gov.uk,10,0,1,0,0,Policy,,1
56,Helen Bower,SCS2,"Director, Prime Minister's Official Spokesperson",Prime Minister's Office,Cabinet Office,Cabinet Office,Government Communications,020 7930 4433,publiccorrespondence@cabinetoffice.gov.uk,35,0,1,60000,64999,Communications,Team 5 or fewer: team costs attributed to Post Ref 79,1
57,Sue Gray,SCS3,"Director General, Propriety and Ethics, HMU for Private Office Group","Director General, Propriety and Ethics and Head of Management Unit for Private Office Group. Areas of responsibility include policy and advice on standards and ethics issues under the Ministerial, Civil Service and Special Adviser and Codes of Conduct; policy on public appointments; liaison arrangements with the Public Administration Select Committee, Committee on Standards in Public Life, four Cabinet Office Advisory Bodies, the Parliamentary Ombudsman and Independent Adviser on Ministers' Interests and Freedom of Information.",Cabinet Office,Cabinet Office,Private Office Group,020 7276 1234,sue.gray@cabinetoffice.gov.uk,317,619889,1,115000,119999,Policy,Temporary Promotion,1
59,Lucy Smith,SCS2,"Director, Constitution Group",To lead the Constitution Group to deliver the Government's constitution reform programme.,Cabinet Office,Cabinet Office,Constitution Group,020 7276 1234,lucy.smith@cabinetoffice.gov.uk,594,0,1,95000,99999,Policy,,1
63,Eliminated,SCS1,"Deputy Director, PPS to Minister for Cabinet Office",Principal Private Secretary to the Minister for the Cabinet Office and management of the Cabinet Office Ministers' private offices. Supporting the Minister for the Cabinet Office and other Ministers in delivering Public Sector Efficiency and Reform; Transparency in Government; Government Policy; Structural Reform; Big Society agenda; Responsibilities to Parliament; Cyber Security,Cabinet Office,Cabinet Office,Private Office Group,N/A,publiccorrespondence@cabinetoffice.gov.uk,8,0,1,0,0,Operational Delivery,,1
69,N/D,SCS1,"Deputy Director, Home Affairs","Lead the Home Affairs, Justice, Devolution and Constitutional Reform team  in supporting effective Cabinet Government and ensuring the Prime Minister, Cabinet Office Ministers,  Cabinet Committee and Implementation Task Force Chairs have access to high quality advice and briefing.",Cabinet Office,Cabinet Office,Economic and Domestic Affairs Secretariat,020 7276 1234,publiccorrespondence@cabinetoffice.gov.uk,54,328648,0.8,0,0,Policy,,1
76,N/D,SCS1,"Deputy Director, Growth and Economic Affairs","Lead the Growth and Economic Affairs team in supporting effective Cabinet Government and ensuring the Prime Minister, Cabinet Office Ministers, Cabinet Committee and Implementation Task Force Chairs have access to high quality advice and briefing.",Cabinet Office,Cabinet Office,Economic and Domestic Affairs Secretariat,020 7276 1234,publiccorrespondence@cabinetoffice.gov.uk,54,155901,1,0,0,Policy,,1
77,N/D,SCS1,"Deputy Director, Head of Honours and Appointments","Policy and operational lead on honours, military medals and some church and state appointments; also Clerk to the Privy Council.",Cabinet Office,Cabinet Office,Honours and Appointments Secretariat,020 7276 2770,honours@cabinet-office.x.gsi.gov.uk,380,869623,1,0,0,Policy,,1
79,N/D,SCS1,"Deputy Director, Head of Afghan and NSC Communication",Prime Minister's Office,Cabinet Office,Cabinet Office,Government Communications,020 7930 4433,publiccorrespondence@cabinetoffice.gov.uk,56,411816,0.8,0,0,Communications,,1
81,N/D,SCS1,"Deputy Director, Head of Corporate Services",Corporate Services,Cabinet Office,Cabinet Office,Prime Minister's Office,020 7930 4433,publiccorrespondence@cabinetoffice.gov.uk,35,2409921,1,0,0,Operational Delivery,,1
82,N/D,SCS1,"Deputy Director, Civil Service Talent",Responsible for talent partnering and customer management,Cabinet Office,Cabinet Office,Civil Service HR,020 7276 1234,publiccorrespondence@cabinetoffice.gov.uk,33,309500,1,0,0,Human Resources,,1
99,N/D,SCS1,"Deputy Director, Finance","Leads day-to-day management of the Cabinet Office finance function, including financial and management accounting.",Cabinet Office,Cabinet Office,Finance & Estates Management,020 7276 1234,publiccorrespondence@cabinetoffice.gov.uk,24,2095473,1,0,0,Finance,Temporary Duties,1
100,N/D,SCS1,"Deputy Director, Chief Executive of Office of the Parliamentary Counsel",Manages the support staff and other (non-legal) aspects of the administration of the Office of Parliamentary Counsel.,Cabinet Office,Cabinet Office,Government in Parliament,020 7276 1234,good.law@cabinetoffice.gov.uk,580,881732,1,0,0,Operational Delivery,,1
102,Eliminated,SCS1,"Deputy Director, Perm Sec Appointments and Performance Management","Leads on Permanent Secretary appointments, induction, development, performance management and succession planning",Cabinet Office,Cabinet Office,Civil Service HR,N/A,publiccorrespondence@cabinetoffice.gov.uk,33,0,1,0,0,Human Resources,,1
116,N/D,SCS1,"Deputy Director, Analysis and Insight","Responsible for delivering data, analysis and insight to the Cabinet Secretary, Ministers and senior leaders to support the Efficiency and Reform agenda and for leading the employee engagement programme across the Civil Service, including implementing a Civil Service-wide People Survey. UK representative on the OECD Public Governance Committee.",Cabinet Office,Cabinet Office,Government Innovation Group,020 7276 1234,flexibleresourcing@cabinetoffice.gov.uk,406,944833,1,0,0,Statisticians,,1
118,N/D,SCS1,"Deputy Director, Elections Division","To lead on law and policy on elections, referendums and political parties",Cabinet Office,Cabinet Office,Constitution Group,020 7276 1234,publiccorrespondence@cabinetoffice.gov.uk,59,940864,1,0,0,Policy,,1
124,N/D,SCS1,"Deputy Director, Senior Policy Adviser",Policy Unit,Cabinet Office,Cabinet Office,Prime Minister's Office,020 7930 4433,publiccorrespondence@cabinetoffice.gov.uk,35,400335,1,0,0,Policy,,1
128,Eliminated,SCS1,"Deputy Director, Public Service Mutuals",Leads on embedding mutuals as efficient and resilient models of delivery of public services in the wider public sector,Cabinet Office,Cabinet Office,Transformation,N/A,publiccorrespondence@cabinetoffice.gov.uk,270,0,1,0,0,Policy,,1
133,N/D,SCS1,"Deputy Director, Public Bodies Reform",Co-ordinates the Government's public bodies reform programme and to promote best practice and diversity in public appointments,Cabinet Office,Cabinet Office,Transformation,020 7276 1234,flexibleresourcing@cabinetoffice.gov.uk,270,572848,1,0,0,Policy,,1
140,N/D,SCS1,"Deputy Director, Knowledge and Information Management","Head of the Knowledge and Information Management Unit.  Responsibilities include HMG FOI Policy and oversight of FOI cases and litigation, management of Cabinet Office corporate records, scrutiny and preparation of historical material for The National Archives under the Public Records Act; oversight of Official Histories, and cross-government co-ordination for the propriety of government records.",Cabinet Office,Cabinet Office,Private Office Group,020 7276 1234,foi-team@cabinetoffice.gov.uk,57,634781,1,0,0,Knowledge and Information Management (KIM),,1
141,Roy Stone,SCS2,"Executive Director, Business Management (Commons)",Heads the office which supports the Government's Parliamentary Business Managers (Leader of the House and Chief Whip) in the Commons,Cabinet Office,Cabinet Office,Government in Parliament,020 7276 2020,roy.stone@cabinetoffice.gov.uk,580,687939,1,95000,99999,Programme and Project Management (PPM),,1
142,N/D,SCS1,"Deputy Director, Propriety & Ethics Team","Management of the team responsible for providing advice on standards and ethics issues under the Ministerial Code, Civil Service Code and Code of Conduct for Special Advisers; managing the Whitehall liaison with the Public Administration and Constitutional Affairs Select Committee, Independent Offices and Independent Adviser on Ministers' Interests; providing advice on public inquiries. Management of the teams responsible for the department's responses to FOI and Data Protection requests, and FOI cases and litigation.",Cabinet Office,Cabinet Office,Private Office Group,020 7276 1234,proprietyandethicsteam@cabinetoffice.gov.uk,57,420941,1,0,0,Policy,,1
143,N/D,SCS1,"Deputy Director, Social Action","Leads on promotion / development of social action and participation, including volunteering, charitable giving, community action and the development of neighbourhood groups.  Includes development of several Big Society programmes including: Community Organisers,  Community First, and the Civic Service, In addition, lead on charitable giving and philanthropy policy, and other volunteering programmes for young people and adults.",Cabinet Office,Cabinet Office,Government Innovation Group,020 7276 1234,flexibleresourcing@cabinetoffice.gov.uk,406,438383,1,0,0,Policy,,1
145,N/D,SCS1,Head of HR Expert Services,Human Resource Management,Cabinet Office,Cabinet Office,Human Resources,020 7276 1234,publiccorrespondence@cabinetoffice.gov.uk,37,322688,1,0,0,Human Resources,,1
146,N/D,SCS1,"Deputy Director, Private Secretary to the Prime Minister",Private Office,Cabinet Office,Cabinet Office,Prime Minister's Office,020 7276 1234,publiccorrespondence@cabinetoffice.gov.uk,35,379815,1,0,0,Policy,,1
151,N/D,SCS1,"Deputy Director, Private Secretary to the Prime Minister (Speechwriter)","Speechwriter, Private Office",Cabinet Office,Cabinet Office,Prime Minister's Office,020 7930 4433,publiccorrespondence@cabinetoffice.gov.uk,35,0,1,0,0,Communications,Team 5 or fewer: team costs attributed to Post Ref 35,1
152,N/D,SCS1,"Deputy Director, Private Secretary to the Prime Minister",Private Office,Cabinet Office,Cabinet Office,Prime Minister's Office,020 7930 4433,publiccorrespondence@cabinetoffice.gov.uk,35,277539,1,0,0,Policy,,1
153,N/D,SCS1,"Deputy Director, Parliamentary Adviser","Provide Parliamentary advice to the Cabinet Office, Leader of the House of Commons and other government departments.",Cabinet Office,Cabinet Office,Economic and Domestic Affairs Secretariat,020 7276 1234,publiccorrespondence@cabinetoffice.gov.uk,54,0,1,0,0,Policy,Not on Payroll,1
154,N/D,SCS1,"Deputy Director, Head of News and PMO Press Office",Prime Minister's Office,Cabinet Office,Cabinet Office,Government Communications,020 7930 4433,publiccorrespondence@cabinetoffice.gov.uk,56,618703,1,0,0,Communications,,1
157,Eliminated,SCS1,Assistant Parliamentary Counsel,Assistant Parliamentary Counsel provide assistance to more senior counsel by working in the drafting teams which draft Bills for Government.,Cabinet Office,Cabinet Office,Government in Parliament,N/A,good.law@cabinetoffice.gov.uk,186,0,1,0,0,Law,,1
158,Eliminated,SCS1,Assistant Parliamentary Counsel,Assistant Parliamentary Counsel provide assistance to more senior counsel by working in the drafting teams which draft Bills for Government.,Cabinet Office,Cabinet Office,Government in Parliament,N/A,good.law@cabinetoffice.gov.uk,187,0,0.78,0,0,Law,,1
159,Eliminated,SCS1,Assistant Parliamentary Counsel,Assistant Parliamentary Counsel provide assistance to more senior counsel by working in the drafting teams which draft Bills for Government.,Cabinet Office,Cabinet Office,Government in Parliament,N/A,good.law@cabinetoffice.gov.uk,187,0,0.8,0,0,Law,,1
160,Eliminated,SCS1,Assistant Parliamentary Counsel,Assistant Parliamentary Counsel provide assistance to more senior counsel by working in the drafting teams which draft Bills for Government.,Cabinet Office,Cabinet Office,Government in Parliament,N/A,good.law@cabinetoffice.gov.uk,173,0,1,0,0,Law,,1
161,Eliminated,SCS1,Assistant Parliamentary Counsel,Assistant Parliamentary Counsel provide assistance to more senior counsel by working in the drafting teams which draft Bills for Government.,Cabinet Office,Cabinet Office,Government in Parliament,N/A,good.law@cabinetoffice.gov.uk,187,0,0.8,0,0,Law,,1
162,Eliminated,SCS1,Assistant Parliamentary Counsel,Assistant Parliamentary Counsel provide assistance to more senior counsel by working in the drafting teams which draft Bills for Government.,Cabinet Office,Cabinet Office,Government in Parliament,N/A,good.law@cabinetoffice.gov.uk,186,0,1,0,0,Law,,1
164,Alison Bertlin,SCS2,Parliamentary Counsel (Director),Deputy Parliamentary Counsel lead drafting teams which draft Bills for Government.,Cabinet Office,Cabinet Office,Government in Parliament,020 7276 6524,alison.bertlin@cabinetoffice.gov.uk,182,0,0.8,105000,109999,Law,,1
166,Bernadette Walsh,SCS2,Parliamentary Counsel (Director),Deputy Parliamentary Counsel lead drafting teams which draft Bills for Government.,Cabinet Office,Cabinet Office,Government in Parliament,020 7276 6564,bernadette.walsh@cabinetoffice.gov.uk,182,0,1,130000,134999,Law,,1
167,Catherine O'Riordan,SCS2,Parliamentary Counsel (Director),Deputy Parliamentary Counsel lead drafting teams which draft Bills for Government.,Cabinet Office,Cabinet Office,Government in Parliament,020 7276 6551,c.oriordan@cabinetoffice.gov.uk,187,0,1,135000,139999,Law,,1
169,David Sewell,SCS2,Parliamentary Counsel (Director),Deputy Parliamentary Counsel lead drafting teams which draft Bills for Government.,Cabinet Office,Cabinet Office,Government in Parliament,020 7276 6558,david.sewell@cabinetoffice.gov.uk,183,0,1,90000,94999,Law,,1
171,Godfrey Lyne,SCS2,Parliamentary Counsel (Director),Deputy Parliamentary Counsel lead drafting teams which draft Bills for Government.,Cabinet Office,Cabinet Office,Government in Parliament,020 7276 6586,good.law@cabinetoffice.gov.uk,186,0,1,135000,139999,Law,,1
172,Helene Moore,SCS2,Parliamentary Counsel (Director),Deputy Parliamentary Counsel lead drafting teams which draft Bills for Government.,Cabinet Office,Cabinet Office,Government in Parliament,020 7276 6548,helene.moore@cabinetoffice.gov.uk,187,0,1,125000,129999,Law,,1
173,Jackie Crawford,SCS2,Parliamentary Counsel (Director),Deputy Parliamentary Counsel lead drafting teams which draft Bills for Government.,Cabinet Office,Cabinet Office,Government in Parliament,020 7276 6532,jacqueline.crawford@cabinetoffice.gov.uk,186,0,1,130000,134999,Law,,1
174,James Stephens,SCS2,Parliamentary Counsel (Director),Deputy Parliamentary Counsel lead drafting teams which draft Bills for Government.,Cabinet Office,Cabinet Office,Government in Parliament,020 7276 6563,james.stephens@cabinetoffice.gov.uk,182,0,1,125000,129999,Law,,1
175,Jessica de Mounteney,SCS2,Parliamentary Counsel (Director),Deputy Parliamentary Counsel lead drafting teams which draft Bills for Government.,Cabinet Office,Cabinet Office,Government in Parliament,020 7276 6535,jessica.demounteney@cabinetoffice.gov.uk,182,0,1,90000,94999,Law,,1
176,Lucy Baines,SCS2,Parliamentary Counsel (Director),Deputy Parliamentary Counsel lead drafting teams which draft Bills for Government.,Cabinet Office,Cabinet Office,Government in Parliament,020 7276 6522,lucy.baines@cabinetoffice.gov.uk,183,0,1,135000,139999,Law,,1
177,Mark Hudson,SCS2,Parliamentary Counsel (Director),Deputy Parliamentary Counsel lead drafting teams which draft Bills for Government.,Cabinet Office,Cabinet Office,Government in Parliament,020 7276 6544,mark.hudson@cabinetoffice.gov.uk,182,0,1,135000,139999,Law,,1
178,Nigel Rendell,SCS2,Parliamentary Counsel (Director),Deputy Parliamentary Counsel lead drafting teams which draft Bills for Government.,Cabinet Office,Cabinet Office,Government in Parliament,020 7276 6553,nigel.rendell@cabinetoffice.gov.uk,187,0,1,135000,139999,Law,,1
180,N/D,SCS3,Parliamentary Counsel (Director General),Parliamentary Counsel lead drafting teams which draft Bills for Government.,Cabinet Office,Cabinet Office,Government in Parliament,020 7276 1234,good.law@cabinetoffice.gov.uk,580,0,0.8,120000,124999,Law,,1
181,Catherine Johnston CB,SCS3,Parliamentary Counsel (Director General),Parliamentary Counsel lead drafting teams which draft Bills for Government.,Cabinet Office,Cabinet Office,Government in Parliament,020 7276 6545,catherine.johnston@cabinetoffice.gov.uk,580,0,1,195000,199999,Law,,1
182,David Cook CB,SCS3,"2nd Parliamentary Counsel (Director General), HO and DECC","Team Leaders lead drafting teams which draft Bills for Government and form, with the First Parliamentary Counsel, part of the management team of the office.",Cabinet Office,Cabinet Office,Government in Parliament,020 7276 6531,david.cook@cabinetoffice.gov.uk,580,0,1,180000,184999,Law,,1
183,David Sprackling,SCS3,"Parliamentary Counsel (Director General), DWP, DEFRA, MOJ, MoD and DfT","Team Leaders lead drafting teams which draft Bills for Government and form, with the First Parliamentary Counsel, part of the management team of the office.",Cabinet Office,Cabinet Office,Government in Parliament,020 7276 6561,david.sprackling@cabinetoffice.gov.uk,580,0,1,155000,159999,Law,,1
186,Elizabeth Gardiner CB,SCS3,"Parliamentary Counsel (Director General), HMT, HMRC, DfID, FCO and DCMS","Team Leaders lead drafting teams which draft Bills for Government and form, with the First Parliamentary Counsel, part of the management team of the office.",Cabinet Office,Cabinet Office,Government in Parliament,020 7276 6541,elizabeth.gardiner@cabinetoffice.gov.uk,580,0,1,175000,179999,Law,,1
