380,Darren Tierney,SCS2,"Director, Civil Service Group",Oversight of the delivery of the Government's efficiency agenda and the future strategy for the Civil Service.,Cabinet Office,Cabinet Office,Civil Service Group,020 7276 1234,darren.tierney@cabinetoffice.gov.uk,497,897922,1,85000,89999,Policy,,1
382,N/D,SCS1,"Deputy Director, Fraud, Error, Debt and Grants",Responsible for HMG debt management programme and the Debt Market Integrator Joint Venture,Cabinet Office,Cabinet Office,"Fraud, Error and Debt",020 7276 1234,flexibleresourcing@cabinetoffice.gov.uk,330,277283,1,0,0,Operational Delivery,,1
388,Eliminated,SCS1,"Deputy Director, Tactical Delivery",Leads on IT reform delivery,Cabinet Office,Cabinet Office,Government Digital Service,N/A,publiccorrespondence@cabinetoffice.gov.uk,22,0,1,0,0,Other,,1
396,N/D,SCS1,"Deputy Director, ISSC1 Contract Director",Programme Director of the Independent Shared Service Centre 1,Cabinet Office,Cabinet Office,Transformation,020 7276 1234,flexibleresourcing@cabinetoffice.gov.uk,270,391150,1,0,0,Programme and Project Management (PPM),Temporary Duties,1
397,Eliminated,SCS1,"Deputy Director, Head of Crown Oversight Function",Programme Director of Operations Directorate which works with the Independent Shared Service Centres to improve the quality of services and reduce the cost of shared services,Cabinet Office,Cabinet Office,Transformation,N/A,publiccorrespondence@cabinetoffice.gov.uk,270,0,1,0,0,Programme and Project Management (PPM),,1
398,N/D,SCS1,"Deputy Director, Commercial Models",Responsible for development of Commercial Models,Cabinet Office,Cabinet Office,Transformation,020 7276 1234,flexibleresourcing@cabinetoffice.gov.uk,270,0,1,0,0,Procurement,Team 5 or fewer: team costs attributed to Post Ref 270,1
399,N/D,SCS1,"Deputy Director, Commercial Models",Responsible for development of Commercial Models,Cabinet Office,Cabinet Office,Transformation,020 7276 1234,flexibleresourcing@cabinetoffice.gov.uk,270,288857,1,0,0,Procurement,,1
400,N/D,SCS1,"Deputy Director, Commercial Models",Responsible for development of Commercial Models,Cabinet Office,Cabinet Office,Transformation,020 7276 1234,flexibleresourcing@cabinetoffice.gov.uk,270,0,1,0,0,Procurement,Team 5 or fewer: team costs attributed to Post Ref 270,1
405,Cabinet Office,OF-6,Cabinet Office,Cabinet Office,Cabinet Office,Cabinet Office,Cabinet Office,020 7276 1234,publiccorrespondence@cabinetoffice.gov.uk,xx,0,0.01,0,0,Other,,1
406,Mark Fisher,SCS2,"Executive Director, Government Innovation Group (incl office for Civil Society)","Oversees work of the Government Innovation Group with responsibility for Civil Society, National Citizen Service and Social Action",Cabinet Office,Cabinet Office,Government Innovation Group,020 7276 6316,mark.fisher@cabinetoffice.gov.uk,497,387435,1,125000,129999,Policy,,1
408,N/D,SCS1,"Deputy Director, Digital Inclusion",Setting the overall strategic direction and priorities for the digital inclusion programme over the next two years and beyond,Cabinet Office,Cabinet Office,Government Digital Service,020 7276 1234,people@digital.cabinet-office.gov.uk,281,923670,1,0,0,Other,,1
409,N/D,SCS1,"Deputy Director, Programmes and Strategy Office",Leads on Programmes and Performance across the Government Innovation Group,Cabinet Office,Cabinet Office,Government Innovation Group,020 7276 1234,flexibleresourcing@cabinetoffice.gov.uk,406,527118,1,0,0,Policy,,1
414,Vacant,SCS1,"Deputy Director, Private Secretary to Prime Minister (Defence)",Policy Unit,Cabinet Office,Cabinet Office,Prime Minister's Office,N/A,publiccorrespondence@cabinetoffice.gov.uk,35,0,1,0,0,Policy,,1
416,N/D,SCS1,"Deputy Director, HR Strategy, Planning and Change",Human Resource Management,Cabinet Office,Cabinet Office,Human Resources,020 7276 1234,publiccorrespondence@cabinetoffice.gov.uk,37,688578,1,0,0,Human Resources,,1
417,Eliminated,SCS3,"Director General, Civil Service HR","Responsible for delivering an HR service to the Civil Service’s 400,000+ employees and management. To ensure that the HR service is cost-effective and supports the customer-focused delivery of the Civil Service’s activities, and responsible for HR professional development and for introducing Next Generation HR. The introduction of Next Generation HR allows the HR profession to work together across government, ensuring the delivery of HR services more efficiently and effectively. Also responsible for the HR actions in the Civil Service Reform Plan including implementation of the Capabilities Plan; secondments and interchange; common standards of promotion, improving the modern workplace and employment offer; all contributing to delivering an exceptional civil service that is more skilled, less bureaucratic and more unified.",Cabinet Office,Cabinet Office,Civil Service HR,N/A,publiccorrespondence@cabinetoffice.gov.uk,497,0,1,0,0,Human Resources,,1
418,Eliminated,SCS2,"Executive Director, Strategic HR","To deliver the Next Generation HR phase 2 programme to design and deliver the operating model for the HR function across government for April 2014 and beyond, ensuring the efficient and effective delivery of HR services to the Civil Service",Cabinet Office,Cabinet Office,Civil Service HR,N/A,publiccorrespondence@cabinetoffice.gov.uk,592,0,1,0,0,Human Resources,,1
420,Eliminated,SCS1,"Deputy Director, Civil Service HR Capability and Talent","Build a strong and effective civil service HR function, through developing HR capability, talent, and the HR graduate Fast Stream.",Cabinet Office,Cabinet Office,Civil Service HR,N/A,publiccorrespondence@cabinetoffice.gov.uk,592,0,1,0,0,Human Resources,,1
426,N/D,SCS1,"Deputy Director, Office for Government SIRO",Head of the OGSIRO,Cabinet Office,Cabinet Office,Civil Service Group,020 7276 1234,publiccorrespondence@cabinetoffice.gov.uk,380,232843,1,0,0,Programme and Project Management (PPM),,1
427,Eliminated,SCS1,Chief Executive Group HR Director,Head of CEX HR,Cabinet Office,Cabinet Office,Chief Executive Group,N/A,publiccorrespondence@cabinetoffice.gov.uk,497,0,1,0,0,Human Resources,,1
428,N/D,SCS1,"Deputy Director, Head of Service Quality & Controls",Lead on Cabinet Office spending controls.,Cabinet Office,Cabinet Office,Civil Service Group,020 7276 1234,publiccorrespondence@cabinetoffice.gov.uk,380,0,1,0,0,Policy,Team 5 or fewer: team costs attributed to Post Ref 380,1
431,N/D,SCS1,"Deputy Director, Transition & Technology Lead",Responsible  for leading on transition & technology,Cabinet Office,Cabinet Office,Transformation,020 7276 1234,flexibleresourcing@cabinetoffice.gov.uk,270,243819,1,0,0,Procurement,Not on Payroll,1
439,N/D,SCS1,"Deputy Director, Defence & International",Deputy Director and Operations Manager for Defence & International cluster.,Cabinet Office,Cabinet Office,Major Projects,020 7276 1234,ERGMPA@cabinetoffice.gov.uk,470,0,1,0,0,Programme and Project Management (PPM),Team 5 or fewer: team costs attributed to Post Ref 470,1
445,Bruce Richard Mann,SCS2,"Executive Director, Government Property Unit","Executive Director of the GPU, leading the Government’s Property Strategy across central government and the wider public sector",Cabinet Office,Cabinet Office,Government Property Unit,020 7276 0530,bruce.mann@cabinetoffice.gov.uk,497,0,1,105000,109999,Property and asset management,,1
448,N/D,SCS1,"Deputy Director, Records and Governance",Leads on records management and corporate governance for Cabinet Office.,Cabinet Office,Cabinet Office,Major Events & Operations,020 7276 1234,publiccorrespondence@cabinetoffice.gov.uk,572,0,1,0,0,Policy,Team 5 or fewer: team costs attributed to Post Ref 572,1
452,Chris Ferguson,SCS2,"Director, Digital","Responsible for development and implementation of cross-government digital policies (eg. Government Digital Strategy, assisted digital, digital inclusion, scamming and phishing), working in collaboration with departments, the Digital Advisory Board and other public, private and voluntary sector bodies.",Cabinet Office,Cabinet Office,Government Digital Service,020 7276 1234,people@digital.cabinet-office.gov.uk,281,2681893,1,70000,74999,Other,Temporary duties,1
453,Eliminated,SCS1,"Deputy Director, Digital Transformation","To lead GDS engagement with government departments and agencies for the digital transformation programme, to identify and influence elements of business transformation within departments.",Cabinet Office,Cabinet Office,Government Digital Service,N/A,publiccorrespondence@cabinetoffice.gov.uk,281,0,1,0,0,Other,,1
454,N/D,SCS1,"Deputy Director, Design","Overall responsibility for design across GDS, GOV.UK and multiple government departments as part of the digital exemplars programme.",Cabinet Office,Cabinet Office,Government Digital Service,020 7276 1234,people@digital.cabinet-office.gov.uk,281,888237,1,0,0,Other,,1
456,Eliminated,SCS1,"Deputy Director, Strategy",Overall responsibility for leading strategic development of digital public services across GDS and multiple government departments as part of the digital exemplars programme.,Cabinet Office,Cabinet Office,Government Digital Service,N/A,publiccorrespondence@cabinetoffice.gov.uk,281,0,1,0,0,Other,,1
457,N/D,SCS1,"Deputy Director, Gov.uk",Overall responsibility and sign off for all strategic and implementation decisions on GOV.UK.,Cabinet Office,Cabinet Office,Government Digital Service,020 7276 1234,people@digital.cabinet-office.gov.uk,22,2197336,1,0,0,Other,,1
458,N/D,SCS1,"Deputy Director, Communication & Digital Engagement","Leads on digital engagement and communications for GDS, working across government to deliver an integrated and coherent digital engagement strategy to support the government’s digital agenda.",Cabinet Office,Cabinet Office,Government Digital Service,020 7276 1234,people@digital.cabinet-office.gov.uk,281,335975,1,0,0,Other,,1
459,N/D,SCS1,"Deputy Director, Technical Architect","Overall responsibility for embedding the delivery of a sustainable, high quality technology capability across government.",Cabinet Office,Cabinet Office,Government Digital Service,020 7276 1234,people@digital.cabinet-office.gov.uk,22,3058722,1,0,0,Other,,1
460,N/D,SCS1,"Deputy Director, Common Technology",Responsible for leading Common Technology Services (CTS) the cross government IT delivery function of OCTO and GDS.,Cabinet Office,Cabinet Office,Government Digital Service,020 7276 1234,people@digital.cabinet-office.gov.uk,22,0,1,0,0,Other,Team 5 or fewer: team costs attributed to Post Ref 22,1
461,N/D,SCS1,"Deputy Director, Technology Leadership",Responsible for running the Technology Leadership function of the Office of the Government CTO (OCTO).,Cabinet Office,Cabinet Office,Government Digital Service,020 7276 1234,people@digital.cabinet-office.gov.uk,22,0,1,0,0,Other,Team 5 or fewer: team costs attributed to Post Ref 22,1
470,Vacant,SCS2,"Director, Operations & Efficiency","Director of Operations and Efficiency covering Departmental Clusters, Savings and MPRG.",Cabinet Office,Cabinet Office,Major Projects,N/A,ERGMPA@cabinetoffice.gov.uk,564,1223551,1,0,0,Programme and Project Management (PPM),,1
472,N/D,SCS1,"Deputy Director, Operations Manager, Public Services Cluster",Deputy Director and Operations Manager for Public Services cluster,Cabinet Office,Cabinet Office,Major Projects,020 7276 1234,ERGMPA@cabinetoffice.gov.uk,470,0,1,0,0,Programme and Project Management (PPM),Team 5 or fewer: team costs attributed to Post Ref 470,1
473,N/D,SCS1,"Deputy Director, Operations Manager, Enterprise & Growth",Deputy Director and Operations Manager for Enterprise and Growth,Cabinet Office,Cabinet Office,Major Projects,020 7276 1234,ERGMPA@cabinetoffice.gov.uk,470,0,1,0,0,Programme and Project Management (PPM),Team 5 or fewer: team costs attributed to Post Ref 470,1
474,N/D,SCS1,"Deputy Director, Construction",Deputy Director and Head of Government Construction Team.,Cabinet Office,Cabinet Office,Major Projects,020 7276 1234,ERGMPA@cabinetoffice.gov.uk,564,279891,1,0,0,Programme and Project Management (PPM),,1
475,N/D,SCS1,"Deputy Director, Portfolio Management Group",Deputy Director for portfolio management and Government Major Projects Portfolio data analysis,Cabinet Office,Cabinet Office,Major Projects,020 7276 1234,ERGMPA@cabinetoffice.gov.uk,565,0,1,0,0,Programme and Project Management (PPM),Team 5 or fewer: team costs attributed to Post Ref 565,1
476,N/D,SCS1,"Deputy Director, Leadership Capability & Development","Deputy Director for leadership and capability, covering the Major Projects Leadership Academy, Project Leadership Programme, SRO letters",Cabinet Office,Cabinet Office,Major Projects,020 7276 1234,ERGMPA@cabinetoffice.gov.uk,565,210192,1,0,0,Programme and Project Management (PPM),,1
479,N/D,SCS1,"Deputy Director, Head of Youth Policy",Leads on Youth Policy and National Citizen Service.,Cabinet Office,Cabinet Office,Government Innovation Group,020 7276 1234,flexibleresourcing@cabinetoffice.gov.uk,406,452689,1,0,0,Policy,,1
480,N/D,SCS1,"Deputy Director, Head of Policy Lab",Leads on open policy making agenda.,Cabinet Office,Cabinet Office,Government Innovation Group,020 7276 1234,flexibleresourcing@cabinetoffice.gov.uk,406,0,1,0,0,Policy,Team 5 or fewer: team costs attributed to Post Ref 406,1
481,Eliminated,SCS1,"Deputy Director, Transparency and Open Data",Leads on Government Transparency and Open Data.,Cabinet Office,Cabinet Office,Government Innovation Group,N/A,publiccorrespondence@cabinetoffice.gov.uk,221,0,1,0,0,Policy,,1
482,Eliminated,SCS1,"Deputy Director, Senior Policy Adviser",To provide high quality analysis and advice to the DPM on his policy priorities.,Cabinet Office,Cabinet Office,Deputy Prime Minister's Office,N/A,publiccorrespondence@cabinetoffice.gov.uk,25,0,1,0,0,Policy,,1
483,Eliminated,SCS1,"Deputy Director, Senior Policy Adviser",To provide high quality analysis and advice to the DPM on his policy priorities.,Cabinet Office,Cabinet Office,Deputy Prime Minister's Office,N/A,publiccorrespondence@cabinetoffice.gov.uk,25,0,1,0,0,Policy,,1
484,Eliminated,SCS1,"Deputy Director, Senior Policy Adviser",Policy Unit,Cabinet Office,Cabinet Office,Prime Minister's Office,N/A,publiccorrespondence@cabinetoffice.gov.uk,35,0,1,0,0,Other,,1
485,Eliminated,SCS1,"Deputy Director, Senior Policy Adviser",Policy Unit,Cabinet Office,Cabinet Office,Prime Minister's Office,N/A,publiccorrespondence@cabinetoffice.gov.uk,35,0,1,0,0,Other,,1
486,Eliminated,SCS1,"Deputy Director, Senior Policy Adviser",Policy Unit,Cabinet Office,Cabinet Office,Prime Minister's Office,N/A,publiccorrespondence@cabinetoffice.gov.uk,35,0,1,0,0,Other,,1
487,N/D,SCS1,"Deputy Director, Private Secretary to the Prime Minister",Private Secretary to the Prime Minister,Cabinet Office,Cabinet Office,Prime Minister's Office,020 7930 4433,publiccorrespondence@cabinetoffice.gov.uk,35,778047,1,0,0,Policy,,1
488,N/D,SCS1,"Deputy Director, Head of Events & Visits",Responsible for leading on and overseeing events and visits,Cabinet Office,Cabinet Office,Prime Minister's Office,020 7930 4433,publiccorrespondence@cabinetoffice.gov.uk,35,391191,1,0,0,Communications,Temporary Duties,1
489,N/D,SCS1,Parliamentary Counsel (Deputy Director),"Senior Assistant Parliamentary Counsel work in the drafting teams which draft Bills (and amendments of Bills) for Government in response to instructions, and which provide procedural and other handling advice to legislating departments in connection with those Bills. They vet draft statutory instruments that amend primary legislation, and draft statutory instruments in cases where the specialist expertise of Parliamentary Counsel is required. They provide assistance to more senior counsel.",Cabinet Office,Cabinet Office,Government in Parliament,020 7276 1234,good.law@cabinetoffice.gov.uk,182,0,1,0,0,Law,Team 5 or fewer: team costs attributed to Post Ref 580,1
490,N/D,SCS1,"Deputy Director, HR Business Partnering",Human Resource Management,Cabinet Office,Cabinet Office,Human Resources,020 7276 1234,publiccorrespondence@cabinetoffice.gov.uk,37,435644,1,0,0,Human Resources,,1
491,Andy Heyn,SCS2,"Director, Civil Service Group",Supports the Government’s Lead Non-Executive in delivering better governance and improved departmental boards,Cabinet Office,Cabinet Office,Civil Service Group,020 7271 3510,Andrew.Heyn@cabinetoffice.gov.uk,497,0,1,85000,89999,Policy,Team 5 or fewer: team costs attributed to Post Ref 538,1
494,N/D,SCS1,"Deputy Director, Operations Manager for Home and Legal",Deputy Director and Operations Manager for Home and Legal cluster.,Cabinet Office,Cabinet Office,Major Projects,020 7276 1234,ERGMPA@cabinetoffice.gov.uk,470,0,1,0,0,Programme and Project Management (PPM),Team 5 or fewer: team costs attributed to Post Ref 470,1
495,N/D,SCS1,"Deputy Director, Commercial Operations & Contract Delivery ISSC2",Programme Director of the Independent Shared Service Centre 2,Cabinet Office,Cabinet Office,Transformation,020 7276 1234,flexibleresourcing@cabinetoffice.gov.uk,270,499060,1,0,0,Programme and Project Management (PPM),,1
497,John Manzoni,SCS4,Chief Executive of the Civil Service and Cabinet Office Permanent Secretary,"The Chief Executive of the Civil Service is responsible for improving delivery, efficiency and effectiveness across government. As Cabinet Office Permanent Secretary, he is responsible for the effective running of the department and ensuring the good stewardship of its resources as Principal Accounting Officer.",Cabinet Office,Cabinet Office,Chief Executive Group,020 7276 1234,publiccorrespondence@cabinetoffice.gov.uk,405,0,1,230000,234999,Operational Delivery,,1
498,Eliminated,SCS1,"Deputy Director, Head of Centre for Public Appointments","Head of Centre for Public Appointments, responsible for Policy and Best Practice on Ministerial Appointments to Public Bodies across Government, Co-ordination with Number 10 and Whitehall Departments on Public Appointments. Focus on the Government's aim for 50% of new appointments to be female by 2015",Cabinet Office,Cabinet Office,Private Office Group,N/A,publiccorrespondence@cabinetoffice.gov.uk,57,0,1,0,0,Policy,,1
499,N/D,SCS1,"Deputy Director, PPS to the Chief Executive of the Civil Service","The Principal Private Secretary is the primary advisor to the Chief Executive and Permanent Secretary on complex issues, manages the Chief Executive’s private office team, and supports the Chief Executive in delivering his agenda.",Cabinet Office,Cabinet Office,Chief Executive Group,020 7276 1234,publiccorrespondence@cabinetoffice.gov.uk,497,362747,1,0,0,Operational Delivery,,1
500,N/D,SCS1,"Deputy Director, Specialist Recruiter for Project & Programme Management","Deputy Director and Head of Resourcing Team, covering assurance review resourcing, interim project support resourcing and project recruitment support",Cabinet Office,Cabinet Office,Major Projects,020 7276 1234,ERGMPA@cabinetoffice.gov.uk,565,240485,0.95,0,0,Programme and Project Management (PPM),,1
502,N/D,SCS1,"Deputy Director, Chief Technical Architect for HM Government","The role is to lead the Government Architecture function with the remit to define, build and operate an integrated and coherent technical architecture across government.",Cabinet Office,Cabinet Office,Government Digital Service,020 7276 1234,people@digital.cabinet-office.gov.uk,22,359479,1,0,0,Other,,1
503,N/D,SCS1,"Deputy Director, PSN CTO",Chief Technology Officer for the Public Services Network – transforming the way that public sector organisations buy and operate their cross public sector network capabilities,Cabinet Office,Cabinet Office,Government Digital Service,020 7276 1234,people@digital.cabinet-office.gov.uk,22,324415,1,0,0,Other,,1
504,Eliminated,SCS1,"Deputy Director, Head of Recruitment and Skills Team",To support government departments in the recruitment & training of specialist digital & technology staff.,Cabinet Office,Cabinet Office,Government Digital Service,N/A,publiccorrespondence@cabinetoffice.gov.uk,281,0,1,0,0,Other,,1
505,Vacant,SCS1,"Deputy Director, Head of the Civil Service Board Secretariat","The Head of the Civil Service Board Secretariat supports the Civil Service Board, which is responsible for the strategic leadership of the Civil Service and is chaired by the Cabinet Secretary and Head of the Civil Service, as well as the CSB sub-boards and other Civil Service-wide governance.",Cabinet Office,Cabinet Office,Chief Executive Group,N/A,publiccorrespondence@cabinetoffice.gov.uk,497,0,1,0,0,Operational Delivery,,1
507,Eliminated,SCS1,"Deputy Director, Head of Transformation",Heads transformation projects such as shared services,Cabinet Office,Cabinet Office,Government Property Unit,N/A,publiccorrespondence@cabinetoffice.gov.uk,445,0,1,0,0,Property and asset management,,1
508,Diggory Bailey,SCS2,Parliamentary Counsel (Director),Deputy Parliamentary Counsel lead drafting teams which draft Bills for Government.,Cabinet Office,Cabinet Office,Government in Parliament,020 7276 1234,good.law@cabinetoffice.gov.uk,186,0,1,125000,129999,Law,,1
509,Louise Davies,SCS2,Parliamentary Counsel (Director),Deputy Parliamentary Counsel lead drafting teams which draft Bills for Government.,Cabinet Office,Cabinet Office,Government in Parliament,020 7276 1234,good.law@cabinetoffice.gov.uk,186,0,1,125000,129999,Law,,1
510,N/D,SCS1,"Deputy Director, New Property Model","SCS lead for NPM early stage design and development, working to GPU Executive Director",Cabinet Office,Cabinet Office,Government Property Unit,020 7276 1234,publiccorrespondence@cabinetoffice.gov.uk,445,0,1,0,0,Property and asset management,Team 5 or fewer: team costs attributed to Post Ref 296,1
511,James Quinault,SCS2,"Director, Head of Implementation Group","Head of the Implementation Group, covering Open Public Services , Cutting Red Tape and Implementation.",Cabinet Office,Cabinet Office,Implementation Group,020 7271 6335,james.quinault@cabinetoffice.gov.uk,10,465684,1,85000,89999,Policy,,1
512,N/D,SCS1,"Deputy Director, Functions and Reform",Encouraging and monitoring the delivery of the Government's Civil Service Reform plan,Cabinet Office,Cabinet Office,Civil Service Group,020 7276 1234,publiccorrespondence@cabinetoffice.gov.uk,380,461567,1,0,0,Policy,,1
513,N/D,SCS1,"Deputy Director, Digital Commercial Programme",Transform the way the Public Sector buys IT and digital services by creating an open and competitive market that gives access to quality suppliers. Programme Director for G-Cloud and the Digital Service frameworks,Cabinet Office,Cabinet Office,Government Digital Service,020 7276 1234,people@digital.cabinet-office.gov.uk,22,0,1,0,0,Other,Team 5 or fewer: team costs attributed to Post Ref 22,1
514,N/D,SCS1,"Deputy Director, Central & Corporate",Deputy Director and Operations Manager for  Central and Corporate Cluster.,Cabinet Office,Cabinet Office,Major Projects,020 7276 1234,ERGMPA@cabinetoffice.gov.uk,470,436639,1,0,0,Programme and Project Management (PPM),,1
515,N/D,SCS1,Parliamentary Counsel (Deputy Director),"Senior Assistant Parliamentary Counsel work in the drafting teams which draft Bills (and amendments of Bills) for Government in response to instructions, and which provide procedural and other handling advice to legislating departments in connection with those Bills. They vet draft statutory instruments that amend primary legislation, and draft statutory instruments in cases where the specialist expertise of Parliamentary Counsel is required. They provide assistance to more senior counsel.",Cabinet Office,Cabinet Office,Government in Parliament,020 7276 1234,good.law@cabinetoffice.gov.uk,183,0,1,0,0,Law,Team 5 or fewer: team costs attributed to Post Ref 580,1
516,N/D,SCS1,Parliamentary Counsel (Deputy Director),"Senior Assistant Parliamentary Counsel work in the drafting teams which draft Bills (and amendments of Bills) for Government in response to instructions, and which provide procedural and other handling advice to legislating departments in connection with those Bills. They vet draft statutory instruments that amend primary legislation, and draft statutory instruments in cases where the specialist expertise of Parliamentary Counsel is required. They provide assistance to more senior counsel.",Cabinet Office,Cabinet Office,Government in Parliament,020 7276 1234,good.law@cabinetoffice.gov.uk,186,0,0.8,0,0,Law,Team 5 or fewer: team costs attributed to Post Ref 580,1
517,N/D,SCS1,"Chief Operating Officer, Government Property Unit, and Head of Government Property Profession","Oversight of day to day GPU operations, leading and developing overall estate strategy across departments, Head of the Government Property Profession across the civil service and Fellow of RICS and member of the RIBA.",Cabinet Office,Cabinet Office,Government Property Unit,020 7276 1234,publiccorrespondence@cabinetoffice.gov.uk,445,1467095,1,0,0,Property and asset management,,1
518,N/D,SCS1,"Deputy Director, European and Global Issues Secretariat","EGIS is responsible for coordinating the work of Government in reaching collective agreement on International Economic (including G20/G7, international trade and development issues) and European policy and to provide advice on these matters to the Prime Minister and the Cabinet Office Minister for Government Policy",Cabinet Office,Cabinet Office,European and Global Issues Secretariat,020 7276 1234,publiccorrespondence@cabinetoffice.gov.uk,51,413415,1,0,0,Policy,,1
519,N/D,SCS1,"Deputy Director, Head of Ideas",Cabinet Office Communications,Cabinet Office,Cabinet Office,Government Communications,020 7276 1234,publiccorrespondence@cabinetoffice.gov.uk,38,566012,1,0,0,Communications,,1
520,N/D,SCS1,"Deputy Director, Head of Insight",Cabinet Office Communications,Cabinet Office,Cabinet Office,Government Communications,020 7930 4433,publiccorrespondence@cabinetoffice.gov.uk,38,374480,1,0,0,Communications,,1
