521,N/D,SCS1,"Deputy Director, Head of Implementation",Cabinet Office Communications,Cabinet Office,Cabinet Office,Government Communications,020 7930 4433,publiccorrespondence@cabinetoffice.gov.uk,38,449047,1,0,0,Communications,,1
522,N/D,SCS1,"Deputy Director, Head of Impact",Cabinet Office Communications,Cabinet Office,Cabinet Office,Government Communications,020 7276 1234,publiccorrespondence@cabinetoffice.gov.uk,38,1432453,1,0,0,Communications,Temporary Duties,1
523,Eliminated,SCS1,"Deputy Director, Head of Statistics, Analysis and Insight",Oversees the statistical work carried out by A&I,Cabinet Office,Cabinet Office,Government Innovation Group,N/A,publiccorrespondence@cabinetoffice.gov.uk,116,0,1,0,0,Statisticians,,1
525,N/D,SCS1,"Deputy Director, Civil Service Strategy",Facilitating and leading the thinking about the next phase of reform,Cabinet Office,Cabinet Office,Civil Service Group,020 7276 1234,publiccorrespondence@cabinetoffice.gov.uk,380,0,1,0,0,Policy,Team 5 or fewer: team costs attributed to Post Ref 380,1
526,Eliminated,SCS1,"Deputy Director, Collective Leadership","Developing clear, collective leadership of the Civil Service",Cabinet Office,Cabinet Office,Civil Service Group,N/A,publiccorrespondence@cabinetoffice.gov.uk,380,0,1,0,0,Policy,,1
527,N/D,SCS1,"Deputy Director, European and Global Issues Secretariat","EGIS is responsible for coordinating the work of Government in reaching collective agreement on International Economic (including G20/G7, international trade and development issues) and European policy and to provide advice on these matters to the Prime Minister and the Cabinet Office Minister for Government Policy",Cabinet Office,Cabinet Office,European and Global Issues Secretariat,020 7276 1234,publiccorrespondence@cabinetoffice.gov.uk,51,426696,1,0,0,Policy,,1
528,N/D,SCS1,"Deputy Director, European and Global Issues Secretariat","EGIS is responsible for coordinating the work of Government in reaching collective agreement on International Economic (including G20/G7, international trade and development issues) and European policy and to provide advice on these matters to the Prime Minister and the Cabinet Office Minister for Government Policy",Cabinet Office,Cabinet Office,European and Global Issues Secretariat,020 7276 1234,publiccorrespondence@cabinetoffice.gov.uk,340,174438,1,0,0,Policy,,1
529,N/D,SCS1,"Deputy Director, Investment, Environment and Infrastructure","Lead the Investment, Environment and Infrastructure team in supporting effective Cabinet Government and ensuring the Prime Minister, Cabinet Office Ministers, Cabinet Committee and Implementation Task Force Chairs have access to high quality advice and briefing.",Cabinet Office,Cabinet Office,Economic and Domestic Affairs Secretariat,020 7276 1234,publiccorrespondence@cabinetoffice.gov.uk,54,0,1,0,0,Policy,Not on Payroll - Team 5 or fewer: team costs attributed to Post Ref 10,1
533,N/D,SCS1,"Deputy Director, Chief Digital Officer","Responsible for managing a new service organisation which is responsible for Digital and Technology Services for the Cabinet Office, the Department of Culture, Media and Sport and Crown Commercial Services.",Cabinet Office,Cabinet Office,Digital & Technology Team,020 7276 1234,publiccorrespondence@cabinetoffice.gov.uk,497,1647895,1,0,0,Information Technology,,1
534,N/D,SCS1,"Deputy Director, Digital Transformation Lead DVLA","To drive transformation via digitization, creating a re-useable model for centralised transformation and consolidation in departments",Cabinet Office,Cabinet Office,Government Digital Service,020 7276 1234,publiccorrespondence@cabinetoffice.gov.uk,281,0,1,0,0,Other,Team 5 or fewer: team costs attributed to Post Ref 281,1
536,N/D,SCS1,Parliamentary Counsel (Deputy Director),"Senior Assistant Parliamentary Counsel work in the drafting teams which draft Bills (and amendments of Bills) for Government in response to instructions, and which provide procedural and other handling advice to legislating departments in connection with those Bills. They vet draft statutory instruments that amend primary legislation, and draft statutory instruments in cases where the specialist expertise of Parliamentary Counsel is required. They provide assistance to more senior counsel.",Cabinet Office,Cabinet Office,Government in Parliament,020 7276 1234,good.law@cabinetoffice.gov.uk,187,0,0.8,0,0,Law,Team 5 or fewer: team costs attributed to Post Ref 580,1
538,N/D,SCS1,"Deputy Director, Civil Service Diversity & Inclusion (Job Share)",Supports work to remove the barriers to talent as set out by the Minister for Cabinet Office and Sir Jeremy Heywood,Cabinet Office,Cabinet Office,Civil Service Group,020 7276 1234,publiccorrespondence@cabinetoffice.gov.uk,491,263394,1,0,0,Policy,Job-Share - combined FTE 1.2,1
541,Eliminated,SCS3,Parliamentary Counsel (Director General),Parliamentary Counsel lead drafting teams which draft Bills for Government.,Cabinet Office,Cabinet Office,Government in Parliament,N/A,publiccorrespondence@cabinetoffice.gov.uk,580,0,1,0,0,Law,,1
542,N/D,SCS1,"Deputy Director, Deputy Spokesperson",Prime Minister's Office,Cabinet Office,Cabinet Office,Government Communications,020 7930 4433,publiccorrespondence@cabinetoffice.gov.uk,56,0,1,0,0,Communications,,1
543,N/D,SCS1,"Deputy Director, Ombudsman Reform Programme",Responsible for Policy and Draft Bill creating a Public Service Ombudsman.,Cabinet Office,Cabinet Office,Private Office Group,020 7276 1234,publiccorrespondence@cabinetoffice.gov.uk,57,0,1,0,0,Policy,Team 5 or fewer: team costs attributed to Post Ref 57,1
545,Eliminated,SCS1,"Deputy Director, Management Information","Deputy Director, Management Information",Cabinet Office,Cabinet Office,Civil Service Group,N/A,publiccorrespondence@cabinetoffice.gov.uk,380,0,1,0,0,Policy,,1
546,N/D,SCS1,"Deputy Director, Efficiency Planning",To lead the process and drive the analysis to deliver fully costed Efficiency Savings Plans for the Spending Review,Cabinet Office,Cabinet Office,Civil Service Group,020 7276 1234,publiccorrespondence@cabinetoffice.gov.uk,380,213220,1,0,0,Policy,,1
547,Eliminated,SCS2,"Executive Director, Director of Professions",HR lead on streamlining and strengthening functions and professions across government,Cabinet Office,Cabinet Office,Civil Service HR,N/A,publiccorrespondence@cabinetoffice.gov.uk,592,0,1,0,0,Human Resources,,1
548,N/D,SCS1,"Deputy Director, Civil Service Talent","Responsible for performance management and pay for Permanent Secretaries across government, and implementing the Civil Service talent strategy",Cabinet Office,Cabinet Office,Civil Service HR,020 7276 1234,publiccorrespondence@cabinetoffice.gov.uk,33,365992,1,0,0,Human Resources,,1
549,N/D,SCS1,"Deputy Director, Civil Service Talent",Responsible for design and delivery of corporate talent schemes across the Civil Service,Cabinet Office,Cabinet Office,Civil Service HR,020 7276 1234,publiccorrespondence@cabinetoffice.gov.uk,33,553680,1,0,0,Human Resources,,1
550,Eliminated,SCS1,Deputy Director,Lead work on improving complaints handling in government for the Minister for Government Policy,Cabinet Office,Cabinet Office,Economic and Domestic Affairs Secretariat,N/A,publiccorrespondence@cabinetoffice.gov.uk,54,0,0.9,0,0,Policy,,1
551,N/D,SCS1,"Deputy Director, Cutting Red Tape & Deregulation Bill",Leads on delivery of the Cutting Red Tape work programme,Cabinet Office,Cabinet Office,Implementation Group,020 7276 1234,publiccorrespondence@cabinetoffice.gov.uk,511,358462,0.79,0,0,Policy,,1
552,Leonie McLaughlin,SCS3,Parliamentary Counsel (Director General),Parliamentary Counsel lead drafting teams which draft Bills for Government.,Cabinet Office,Cabinet Office,Government in Parliament,020 7276 6513,leonie.mclaughlin@cabinetoffice.gov.uk,580,0,1,170000,174999,Law,,1
553,N/D,SCS1,"Deputy Director, Strategy, Performance & Capability","Responsible for implementation strategy, capability, government performance and group business operations",Cabinet Office,Cabinet Office,Implementation Group,020 7276 1234,publiccorrespondence@cabinetoffice.gov.uk,511,412807,1,0,0,Policy,Temporary Duties,1
554,N/D,SCS1,"Deputy Director, Constitutional Settlement",To lead on political and constitutional reform on consitutional and parliamentary policy matters,Cabinet Office,Cabinet Office,Constitution Group,020 7276 1234,publiccorrespondence@cabinetoffice.gov.uk,59,530072,1,0,0,Policy,,1
555,N/D,SCS1,"Deputy Director, European and Global Issues Secretariat","EGIS is responsible for coordinating the work of Government in reaching collective agreement on International Economic (including G20/G7, international trade and development issues) and European policy and to provide advice on these matters to the Prime Minister and the Cabinet Office Minister for Government Policy",Cabinet Office,Cabinet Office,European and Global Issues Secretariat,020 7276 1234,publiccorrespondence@cabinetoffice.gov.uk,340,541234,1,0,0,Policy,,1
556,N/D,SCS1,"Deputy Director, Head of GREAT Campaign",Cabinet Office Communications,Cabinet Office,Cabinet Office,Government Communications,020 7276 1234,publiccorrespondence@cabinetoffice.gov.uk,38,409433,1,0,0,Communications,Temporary Duties,1
557,N/D,SCS1,"Deputy Director, GDS Enabling Strategy",Responsible for engagement with departments to coordinate the work of GDS' Enabling Strategy for Digital programme,Cabinet Office,Cabinet Office,Government Digital Service,020 7276 1234,people@digital.cabinet-office.gov.uk,281,0,1,0,0,Other,Team 5 or fewer: team costs attributed to Post Ref 281,1
558,N/D,SCS1,"Deputy Director, Profession","Deputy Director for the profession team, responsible for building the project delivery profession in government",Cabinet Office,Cabinet Office,Major Projects,020 7276 1234,ERGMPA@cabinetoffice.gov.uk,565,0,1,0,0,Programme and Project Management (PPM),Team 5 or fewer: team costs attributed to Post Ref 565,1
559,Emily Miles,SCS2,"Director, Projects, Economic & Domestic Affairs Secretariat",Lead cross-cutting policy projects,Cabinet Office,Cabinet Office,Economic and Domestic Affairs Secretariat,020 7276 0631,Emily.Miles@cabinetoffice.gov.uk,10,0,1,85000,89999,Policy,Team 5 or fewer: team costs attributed to Post Ref 10,1
560,Rachel Hopcroft,SCS2,"Director, Principal Private Secretary to Cabinet Secretary","Principal Private Secretary to the Cabinet Secretary and Head of the Civil Service, responsible for management of the Cabinet Secretary's Private Office; supporting the Cabinet Secretary to ensure the Civil Service is equipped with the skills and capability to meet the challenges it faces every day, ensure the Civil Service provides effective and efficient support to the Prime Minister and the Government, and support the Minister for the Cabinet Office, to make sure our staff in the Department work as effectively and efficiently as possible.",Cabinet Office,Cabinet Office,Private Office Group,020 7276 1234,cabsecandhocs@cabinetoffice.gov.uk,57,0,1,85000,89999,Operational Delivery,Team 5 or fewer: team costs attributed to Post Ref 57,1
561,Robert Branagh,SCS2,Interim Director of Pensions Operations,Interim Director for the Civil Service Pensions programmes operations,Cabinet Office,Cabinet Office,Civil Service HR,07734 777 011,robert.branagh@cabinetoffice.gov.uk,31,0,1,0,0,Programme and Project Management (PPM),Contractor,1
562,Eliminated,SCS2,Parliamentary Counsel (Director),Deputy Parliamentary Counsel lead drafting teams which draft Bills for Government.,Cabinet Office,Cabinet Office,Government in Parliament,N/A,publiccorrespondence@cabinetoffice.gov.uk,552,0,1,0,0,Law,,1
563,Eliminated,SCS1,"Deputy Director, Savings Delivery","Deputy Director, Savings Delivery",Cabinet Office,Cabinet Office,Civil Service Group,N/A,publiccorrespondence@cabinetoffice.gov.uk,380,0,1,0,0,Policy,,1
564,Tony Meggs,SCS3,"Director General, Head of Major Projects Authority",Director General responsible for delivering the Major Projects Authority agenda and increasing the capability of project and programme management across Government,Cabinet Office,Cabinet Office,Major Projects,020 7271 1492,ceo-mpa@cabinetoffice.gov.uk,497,0,1,190000,194999,Programme and Project Management (PPM),,1
565,Tim Banfield,SCS2,"Director, Portfolio Oversight","Head of Project Delivery Profession, covering the project profession, capability, resourcing, portfolio management and data analysis",Cabinet Office,Cabinet Office,Major Projects,020 7271 9793,tim.banfield@cabinetoffice.gov.uk,564,300696,1,120000,124999,Programme and Project Management (PPM),,1
566,N/D,SCS1,"Deputy Director, Operations Manager Tax & Welfare",Deputy Director and Operations Manager Tax & Welfare,Cabinet Office,Cabinet Office,Major Projects,020 7276 1234,ERGMPA@cabinetoffice.gov.uk,470,0,1,0,0,Programme and Project Management (PPM),Team 5 or fewer: team costs attributed to Post Ref 470,1
567,N/D,SCS1,Parliamentary Counsel (Deputy Director),"Senior Assistant Parliamentary Counsel work in the drafting teams which draft Bills (and amendments of Bills) for Government in response to instructions, and which provide procedural and other handling advice to legislating departments in connection with those Bills. They vet draft statutory instruments that amend primary legislation, and draft statutory instruments in cases where the specialist expertise of Parliamentary Counsel is required. They provide assistance to more senior counsel.",Cabinet Office,Cabinet Office,Government in Parliament,020 7276 1234,good.law@cabinetoffice.gov.uk,183,0,1,0,0,Law,Team 5 or fewer: team costs attributed to Post Ref 580,1
568,Eliminated,SCS2,Parliamentary Counsel (Deputy Director),"Senior Assistant Parliamentary Counsel work in the drafting teams which draft Bills (and amendments of Bills) for Government in response to instructions, and which provide procedural and other handling advice to legislating departments in connection with those Bills. They vet draft statutory instruments that amend primary legislation, and draft statutory instruments in cases where the specialist expertise of Parliamentary Counsel is required. They provide assistance to more senior counsel.",Cabinet Office,Cabinet Office,Government in Parliament,N/A,publiccorrespondence@cabinetoffice.gov.uk,552,0,1,0,0,Law,,1
569,Eliminated,SCS2,Director - Digital Transition Reports,Responsible for the development of evidence based case-studies to demonstrate the benefits of digital transformation to government.,Cabinet Office,Cabinet Office,Government Digital Service,N/A,publiccorrespondence@cabinetoffice.gov.uk,281,0,1,0,0,Other,,1
570,N/D,SCS1,"Deputy Director, Civil Service Pensions","Deputy Director, in charge of policy for the Civil Service pension and compensation scheme, and Ministerial pensions. Additionally the Cabinet Office lead on public sector bodies pensions reform and wider public sector pensions issues.",Cabinet Office,Cabinet Office,Civil Service HR,020 7276 1234,publiccorrespondence@cabinetoffice.gov.uk,31,620132,1,0,0,Human Resources,Temporary Duties,1
571,N/D,SCS1,"Deputy Director, Programme Management",Responsible for delivering major projects and programme management in the workforce reform team,Cabinet Office,Cabinet Office,Civil Service HR,020 7276 1234,publiccorrespondence@cabinetoffice.gov.uk,31,591388,1,0,0,Programme and Project Management (PPM),Temporary Duties,1
572,Marianthi Leontaridi,SCS2,"Director, Major Events & Operations",Leads on the delivery response to major events across Government; and the delivery of improvements to the corporate and operational functioning of the Cabinet Office,Cabinet Office,Cabinet Office,Major Events & Operations,020 7276 1234,rannia.leontaridi@cabinetoffice.gov.uk,497,531049,1,85000,89999,Policy,,1
573,N/D,SCS1,Interim Head of Supplier Management,"Deputy Director, in charge of liaising and managing suppliers of the pensions scheme and other stakeholders.",Cabinet Office,Cabinet Office,Civil Service HR,020 7276 1234,publiccorrespondence@cabinetoffice.gov.uk,31,0,1,0,0,Programme and Project Management (PPM),Contractor,1
574,N/D,SCS1,"Deputy Director, Professions & Strategic HR","Deputy Director, Professions & Strategic HR",Cabinet Office,Cabinet Office,Civil Service HR,020 7276 1234,publiccorrespondence@cabinetoffice.gov.uk,592,931222,1,0,0,Human Resources,,1
575,N/D,SCS1,"Deputy Director, Head of Centre for Public Appointments","Head of the Centre for Public Appointments, responsible for policy and best practice across departments on Ministerial appointments to the boards of public bodies across Government. Focus on the Government's aspiration that 50% of new appointments should be women and at least 10% of new appointments made to candidates from a BAME background.",Cabinet Office,Cabinet Office,Private Office Group,020 7276 1234,publicappointments@cabinetoffice.gov.uk,57,247590,1,0,0,Policy,Temporary Duties,1
576,Vacant,SCS1,"Deputy Director, Principal Private Secretary to the Minister for the Cabinet Office and Head of Extended Ministerial Office","Principal Private Secretary to the Minister for the Cabinet Office responsible for the management of the Minister's private office, Extended Ministerial Office, the Minister for Civil Society's private office and Parliamentary and Correspondence Team, and supporting the Minister in driving efficiency and reform, making the  public service work better; building a more united democracy and a stronger civil society; and in strengthening and securing the UK at home and abroad.",Cabinet Office,Cabinet Office,Private Office Group,N/A,publiccorrespondence@cabinetoffice.gov.uk,57,8500,1,0,0,Operational Delivery,,1
577,N/D,SCS1,"Deputy Director, Principal Private Secretary to the Chancellor of the Duchy of Lancaster","Principal Private Secretary to the Chancellor of the Duchy of Lancaster (in overall charge of the Cabinet Office) responsible for the overall management of the Chancellor's private office, and the private offices of the Minister for Constitutional Reform and the Parliamentary Secretary (Lords), and supporting the Chancellor in his role advising the Prime Minister on the implementation of government policy; coordinating constitutional reform; the resilience of the UK's infrastructure; and deregulation.",Cabinet Office,Cabinet Office,Private Office Group,020 7276 1234,publiccorrespondence@cabinetoffice.gov.uk,57,507510,1,0,0,Operational Delivery,Temporary Duties,1
578,N/D,SCS1,"Deputy Director,  Parliamentary Business and Legislative Programme","Lead the Parliamentary Business and Legislative programme team in supporting effective Cabinet Government and ensuring the Prime Minister, Cabinet Office Ministers, Cabinet Committee and Implementation Task Force Chairs have access to high quality advice and briefing.",Cabinet Office,Cabinet Office,Economic and Domestic Affairs Secretariat,020 7276 1234,publiccorrespondence@cabinetoffice.gov.uk,54,0,1,0,0,Policy,Temporary Duties - Team 5 or fewer: team costs attributed to Post Ref 10,1
579,Vacant,SCS1,"Deputy Director, European and Global Issues Secretariat","EGIS is responsible for coordinating the work of Government in reaching collective agreement on International Economic (including G20/G7, international trade and development issues) and European policy and to provide advice on these matters to the Prime Minister and the Cabinet Office Minister for Government Policy",Cabinet Office,Cabinet Office,European and Global Issues Secretariat,N/A,publiccorrespondence@cabinetoffice.gov.uk,375,0,1,0,0,Policy,,1
580,Vacant,SCS4,"Permanent Secretary, First Parliamentary Counsel","First Parliamentary Counsel, overseeing the Government in Parliament Group, which includes Parliamentary Counsel and the Business Managers in each House. The Group works with teams across government to prepare and deliver the government’s legislative programme.",Cabinet Office,Cabinet Office,Government in Parliament,N/A,publiccorrespondence@cabinetoffice.gov.uk,317,1047893,1,0,0,Law,,1
581,N/D,SCS1,"Deputy Director, Planning and Performance",Leads annual planning round and Spending Review along with performance management and governance functions.,Cabinet Office,Cabinet Office,Finance & Estates Management,020 7276 1234,publiccorrespondence@cabinetoffice.gov.uk,24,539235,1,0,0,Finance,,1
582,N/D,SCS1,"Deputy Director, Fraud, Error, Debt and Grants",Responsible for managing the FED strategy and portfolio and providing technical and security assurance across all strands,Cabinet Office,Cabinet Office,"Fraud, Error and Debt",020 7276 1234,publiccorrespondence@cabinetoffice.gov.uk,330,0,1,0,0,Policy,Team 5 or fewer: team costs attributed to Post Ref 330,1
583,N/D,SCS1,"Deputy Director, Major Events",Coordination of cross government major events,Cabinet Office,Cabinet Office,Major Events & Operations,020 7276 1234,publiccorrespondence@cabinetoffice.gov.uk,572,0,1,0,0,Policy,Short term project - Team 5 or fewer: team costs attributed to Post Ref 572,1
584,N/D,SCS1,"Deputy Director, Fraud, Error, Debt and Grants",Responsible for reducing financial loss by developing cross Government policies to identify and reduce levels of public sector fraud and error,Cabinet Office,Cabinet Office,"Fraud, Error and Debt",020 7276 1234,publiccorrespondence@cabinetoffice.gov.uk,330,237485,1,0,0,Policy,Temporary duties,1
585,N/D,SCS1,"Deputy Director, Fraud, Error, Debt and Grants",Responsible for driving and enabling the efficient and effective management of grants across government,Cabinet Office,Cabinet Office,"Fraud, Error and Debt",020 7276 1234,publiccorrespondence@cabinetoffice.gov.uk,330,395018,0.63,0,0,Policy,Temporary duties,1
586,Paul Maltby,SCS2,Director of Data,Overall responsibility for running the Data group and leading the cross government approach to information use,Cabinet Office,Cabinet Office,Government Digital Service,020 7276 1234,paul.maltby@cabinetoffice.gov.uk,281,0,1,90000,94999,Other,,1
587,N/D,SCS1,"Deputy Director, Chief Operating Officer",Overall responsibility for running the business and delivery operations of the Government Digital Service,Cabinet Office,Cabinet Office,Government Digital Service,020 7276 1234,people@digital.cabinet-office.gov.uk,281,851840,1,0,0,Other,,1
588,N/D,SCS1,"Deputy Director, Data Sharing","Leading on data science, using open date for government challenges and data literacy",Cabinet Office,Cabinet Office,Government Digital Service,020 7276 1234,people@digital.cabinet-office.gov.uk,586,277387,1,0,0,Operational delivery,Temporary duties,1
589,Vacant,SCS2,"Director, Common Technology Services","Running the CTS organisation, building capability whilst identifying and enabling value in Central Government Departments in line with business case projections",Cabinet Office,Cabinet Office,Government Digital Service,N/A,publiccorrespondence@cabinetoffice.gov.uk,281,0,1,0,0,Other,,1
590,Vacant,SCS1,"Deputy Director, Standards & Assurance",Leading the central government challenge and approval function for digital and technology projects,Cabinet Office,Cabinet Office,Government Digital Service,N/A,publiccorrespondence@cabinetoffice.gov.uk,22,0,1,0,0,Other,Temporary duties,1
591,N/D,SCS1,"Deputy Director, Planning and Governance",Leads on approvals transformation and audit and risk.,Cabinet Office,Cabinet Office,Finance & Estates Management,020 7276 1234,publiccorrespondence@cabinetoffice.gov.uk,24,0,1,0,0,Finance,Team 5 or fewer: team costs attributed to Post Ref 24,1
592,Vacant,SCS3,"Director General, Chief People Officer","The aims of this role include continuing to build the HR Function so it can effectively support the changing Civil Service, strengthening the centre and providing leadership to HR professionals across departments.",Cabinet Office,Cabinet Office,Civil Service HR,N/A,publiccorrespondence@cabinetoffice.gov.uk,497,0,1,0,0,Human Resources,,1
593,David Blackall,SCS2,"Director, Temporary Projects",Specialist Projects,Cabinet Office,Cabinet Office,Major Projects,020 7276 6907,david.blackall@cabinetoffice.gov.uk,564,0,1,90000,94999,Programme and Project Management (PPM),,1
594,Philip Rycroft,SCS4,"Second Permanent Secretary, Head UK Governance Group",The Group leads on the Government's constitutional reform agenda and on devolution to Scotland and Wales,Cabinet Office,Cabinet Office,UK Governance Group,020 7276 1234,philip.rycroft@cabinetoffice.gov.uk,317,0,1,155000,159999,Policy,,1
595,N/D,SCS1,"Deputy Director, Head of Professional Development for D&T",Leading the design and delivery of the professional capability plan for the Digital and Technology Function,Cabinet Office,Cabinet Office,Government Digital Service,020 7276 1234,people@digital.cabinet-office.gov.uk,281,0,1,0,0,Other,Team 5 or fewer: team costs attributed to Post Ref 281,1
596,N/D,SCS1,"Deputy Director, Operations",Responsible for running the operations and business planning for the Technology function,Cabinet Office,Cabinet Office,Government Digital Service,020 7276 1234,people@digital.cabinet-office.gov.uk,22,0,1,0,0,Other,Team 5 or fewer: team costs attributed to Post Ref 22,1
597,N/D,SCS1,"Deputy Director, D&I Delivery",Supports work to remove the barriers to talent as set out by the Minister for Cabinet Office and Sir Jeremy Heywood,Cabinet Office,Cabinet Office,Civil Service Group,020 7276 1234,publiccorrespondence@cabinetoffice.gov.uk,491,0,1,0,0,Policy,Not on payroll,1
598,N/D,SCS1,"Deputy Director, Civil Service Talent",Responsible for DG resourcing,Cabinet Office,Cabinet Office,Civil Service HR,020 7276 1234,publiccorrespondence@cabinetoffice.gov.uk,33,0,1,0,0,Human Resources,,1
599,N/D,SCS1,"Deputy Director, Special Project",Lead work on complaints handling across public services for the Chancellor of the Ducy of Lancaster,Cabinet Office,Cabinet Office,Economic and Domestic Affairs Secretariat,020 7276 1234,publiccorrespondence@cabinetoffice.gov.uk,54,0,1,0,0,Policy,Temporary duties - Team 5 or fewer: team costs attributed to Post Ref 10,1
