Ratepayer,Billing Account Balance ,Liable Unit Balance ,Year,Property Address,Billing Address,Date Start,Date End
York Mill Ltd (In Liquidation),-1203.4,-1203.4,2014,"York Mill Ltd, Gooder Lane, Brighouse, HD6 1HF","Brook Business Recovery, C/O The Media Centre, 7 Northumberland Street, Huddersfield, West Yorkshire, HD1 1RL",06/01/13,11/29/15
,-3.52,-3.52,2017,"21 Bradford Road, Brighouse, HD6 1RW",,11/06/13,
Bizspace Ltd,-842.62,-842.62,2015,"Unit 16I & Unit 16J, Calderdale Business Park, Club Lane, Halifax              HX2 8DB","Sovereign House, Fao Mital Shah, 1 Albert Place, Finchley, London, N3 1QB",01/01/14,01/24/16
Marrtree Investments Limited,-1264.55,-2093.75,2014,"Unit 22, Branxholme Industrial Est., Bradford Road, Brighouse            HD6 4EA","4a Greengate, Cadale Park, Harrogate, HG3 1GY",02/08/14,12/07/14
Marrtree Investments Limited,-829.2,-2093.75,2015,"Unit 22, Branxholme Industrial Est., Bradford Road, Brighouse            HD6 4EA","4a Greengate, Cadale Park, Harrogate, HG3 1GY",02/08/14,12/07/14
Advanced Processing Ltd,-9,-76.81,2015,"Unit 2 Springvale Works, Elland Road, Brighouse, HD6 2RN","Fao Accounts Dept, 606 Building, Wharfedale Road, Euroway Trading Estate, Bradford, BD4 6SG",05/12/14,12/29/16
Advanced Processing Ltd,-67.81,-76.81,2016,"Unit 2 Springvale Works, Elland Road, Brighouse, HD6 2RN","Fao Accounts Dept, 606 Building, Wharfedale Road, Euroway Trading Estate, Bradford, BD4 6SG",05/12/14,12/29/16
Ovenden Road Ltd (Company Dissolved 6.10.15),-1229.01,-1381.47,2014,"White Horse Inn, Spring Gardens, Burnley Road, Sowerby Bridge      HX6 2TW","2 South Lane, Elland, HX5 0HG",07/21/14,05/01/15
,-435.79,-435.79,2014,"Northern Timber Merchants, Gooder Lane, Brighouse, HD6 1HF",,12/08/14,01/31/15
Bizspace Ltd,-192.3,-192.3,2016,"Unit 18H, Calderdale Business Park, Club Lane, Halifax              HX2 8AX","Sovereign House, Fao Mital Shah, 1 Albert Place, Finchley, London, N3 1QB",11/01/14,12/02/15
James Robinson Fibres Ltd,-225.2,-361.52,2016,"56 Huddersfield Road, Elland, HX5 9AA","Millersdale Close, Euroway Industrial Estate, Bradford, BD4 6SG",03/07/16,03/06/16
Wattlid Ltd,-4613.29,-4613.29,2015,"Units 18C, 18D & 18E, Moderna Business Park, Burnley Road, Mytholmroyd          HX7 5QQ","The Continuum, Moderna Business Park, Mytholmroyd, HX7 5QQ",07/01/14,08/31/15
Yorkshire Security Group Ltd,-84,-84,2017,"Unit 11, Thornhill Briggs Mill, Thornhills Beck Lane, Brighouse            HD6 4AW",,03/15/15,
East Street Arts,-43.9,-43.9,2016,"Office B19 First Floor, Croft Myl, West Parade, Halifax              HX1 2EQ","Patrick Studios, St Marys Lane, Leeds, LS9 7EH",09/01/13,02/28/17
,-1144.84,-1144.84,2016,"19 Crown Street, Hebden Bridge, HX7 8EH",,09/27/15,10/01/16
David Wilson Homes (Northern) Ltd,-5855.33,-5855.33,2016,"82 Fountain Head Road, Ovenden Wood, Halifax, HX2 0SR","Vico Court, Ring Road, Lower Wortley, Leeds, LS12 6AN",06/22/15,07/08/16
Carillion Utility Services Group Ltd,-1235.7,-1235.7,2014,"Carillion, Black Brook Way, Stainland Road, Greetland            HX4 8BQ","P O Box 4919, Sheffield, S1 9FY",11/01/13,05/31/14
Dean Clough Ltd,-5416.5,-12118.95,2014,"Crib Lane Level 3 Bottom, Dean Clough Mils, Halifax, HX3 5AX","Office Suite E345, Dean Clough, Halifax, HX3 5AX",12/24/12,05/31/13
Thai Corner @ Halifax Market Ltd,-224,-224,2017,"40/42 Borough Market, Halifax, HX1 1DY","C/O 50 Ogden Cresent, Denholme, Bradford, BD13 4LB",08/01/15,
Melling Construction Ltd,-62.73,-62.73,2015,"Unit 36A, Phoebe Lane Industrial Est., Phoebe Lane, Halifax              HX3 9EX","Shed 1 Merton Grange, Bielby, York, YO42 4JW",12/01/15,02/19/16
David Wilson Homes (Northern) Ltd,-907.6,-907.6,2016,"78 Fountain Head Road, Ovenden Wood, Halifax, HX2 0SR","Vico Court, Ring Road, Lower Wortley, Leeds, LS12 6AN",08/15/15,10/13/16
,-8.92,-8.92,2016,"Cooper House, Cooper Lane, Shelf, Halifax              HX3 7RJ",,02/09/16,10/18/16
,-225,5736.19,2016,"129/135 Halifax Road, Todmorden, OL14 5BE",,04/01/16,
J & C Joel Limited,-2049.51,-2049.51,2016,"Unit 11 Woodman Works, South Lane, Elland, HX5 0PA","Corporation Mill, Corporation Street, Soweby Bridge, HX6 2QQ",08/05/15,10/14/16
,-318.45,-318.45,2015,"Unit 1B, Dean Hey Country Business Pk, Cragg Road, Mytholmroyd          HX7 5RU",,04/01/14,12/31/15
Tru Property Investments Ltd,-834.11,-834.11,2016,"Huddersfield Road, Elland, HX5 9BZ","C R Marshall, Marshall House, Huddersfield Road, Elland, HX5 9BW",02/01/16,12/31/16
Bizspace Ltd,-149.35,-149.35,2015,"Units 12A & 12B, Calderdale Business Park, Club Lane, Halifax              HX2 8AX","Sovereign House, Fao Mital Shah, 1 Albert Place, Finchley, London, N3 1QB",06/02/14,09/30/14
,-147.88,-147.88,2015,"Unit 4 Victoria Lodge, 30 Lister Lane, Halifax, HX1 5AX",,10/02/14,05/30/15
Central Street Infant School,-677.87,-1319.97,2016,"Central Street, Hebden Bridge, HX7 6HB","Central Street, Hebden Bridge, HX7 6HB",12/25/15,12/24/15
Marrtree Investments Limited,-309.09,-309.09,2015,"Unit 5 Branxholme Estate, Bradford Road, Bailiff Bridge, Brighouse            HD6 4EA","4a Greengate, Cadale Park, Harrogate, HG3 1GY",10/10/14,12/22/14
Integro Insurance Brokers Ltd,-1016.4,-2133.2,2016,"Unit 3 1ST Floor, No 4 Warehouse, Canal Wharf, Sowerby Bridge       HX6 2AG","C/O Ruth Osborne, Century House, Pepper Road, Hazel Grove, Stockport, SK7 5BW",04/01/15,03/31/15
P I Consultants Limited,-204.21,-204.21,2016,"Unit W3, Tenterfield Business Pk, Burnley Road, Luddendenfoot        HX2 6EQ","Unit W1, Tenterfield Business Park, Burnley Road, Luddendenfoot, HX2 6EJ",01/24/16,02/15/17
,-39.05,-39.05,2016,"17/19 Burnley Road, Todmorden, OL14 7BU",,08/05/15,01/14/17
Trustees Of The Doreen Harker Sipp,-1840.27,-1840.27,2016,"44 Southgate, Elland, HX5 0ES","C/O Iain Simpson & Company, Homr Farm, Duggleby, Malton, North Yorkshire, YO17 8BN",05/17/16,12/19/16
Bizspace Ltd,-246.83,-246.83,2016,"Unit 16I & Unit 16J, Calderdale Business Park, Club Lane, Halifax              HX2 8DB","Sovereign House, Fao Mital Shah, 1 Albert Place, Finchley, London, N3 1QB",04/09/16,06/27/16
W A Shearings Ltd,-810.13,-2211.26,2017,"9 Russell Street, Halifax, HX1 1RL","C/O Gl Hearn Management Ltd, Po Box 1821, Southampton, SO18 9NA",11/06/15,02/17/17
,-495.37,-495.37,2016,"Central Street, Hebden Bridge, HX7 6HB",,12/25/15,12/24/15
Protreat Preservation Ltd,-690.86,-690.86,2016,"Protreat Preservation Ltd, Lock Hill Mills, Holmes Road, Sowerby Bridge       HX6 3LD","Office 3G Premier House, Lock Hill Mills, Holmes Road, Sowerbhy Bridge, HX6 3LD",04/01/15,12/04/16
Fenland Fire Contracts Limited,-82.69,0,2016,"Suite 2 Harley House, Mill Fold, Ripponden, Sowerby Bridge       HX6 4DJ","5B Croft Court, Mount Lane, Brighouse, HD6 3QZ",01/27/16,10/28/16
Bizspace Ltd,-776.55,-776.55,2016,"Unit 11, Calderdale Business Park, Club Lane, Halifax              HX2 8AX","Sovereign House, Fao Mital Shah, 1 Albert Place, Finchley, London, N3 1QB",08/24/16,10/09/16
Star Pubs & Bars Ltd,-8823.45,-8823.45,2016,"Duke William Inn, Wade House Road, Shelf, Halifax             HX3 7PF","3 - 4 Broadway Park, South Gyle, Broadway, Edinburgh, EH12 9JZ",02/10/16,05/11/16
Bizspace Ltd,-75.98,-323.37,2016,"Unit 16I & Unit 16J, Calderdale Business Park, Club Lane, Halifax              HX2 8DB","Sovereign House, Fao Mital Shah, 1 Albert Place, Finchley, London, N3 1QB",08/24/16,02/13/17
Alco Valves Group Ltd,-5623.59,-5623.59,2016,"Mission Works, Birds Royd Lane, Brighouse, HD6 1LQ","Gooder Lane, Brighouse, HD6 1HB",04/01/90,01/31/17
Tefonica O2 (Uk) Ltd,-3132.15,-15536.76,2014,"Birkby Lane, Bailiff Bridge, Brighouse, HD6 4JJ","Fao Telecoms Rating Team, C/O Cluttons Llp, Portman House, 2 Portman Street, London, W1H 6DU",04/01/95,
Controlled Speed Ltd In Administration,-748.28,-1599.81,2011,"St Pegs House, Thornhill Beck Lane, Brighouse, HD6 4AW","Frp Advisory Llp, 1 St Ann Street, Manchester, M2 7LR",09/15/01,11/16/11
,-0.01,-0.01,2010,"Model Railway Club, Cawcliffe Road, Brighouse, HD6 2HP",,04/01/90,
Adtech Studios Ltd (In Liquidation),-9.95,-9.95,2002,"Unit 2, County Workshops, Clifton Road, Brighouse           HD6 1SL","C/O Messrs Revell Ward, Horton, Norwich Union House, High StreetHuddersfield",10/14/91,11/09/92
Dempster H Lister Ltd [In Liquidation],-543.81,-543.81,2002,"9 Commercial Street, Brighouse, HD6 1AF","C/O Cork Gully, Benson House, 33 Wellington Street, Leeds, LS1 4JP",04/01/90,12/12/98
Eccles & Scott Ltd,-214.38,-214.38,2004,"Ground Floor, Cromwell House, Elland Road, Brighouse            HD6 2RG","Cromwell House, 421 Elland Road, Brighouse, HD6 2RG",12/01/00,01/24/05
,-0.07,-0.07,2017,"St Pauls Buildings, Southgate, Elland, HX5 0EX",,05/01/01,
Jack Pearson (Turf Accountants) Ltd,-8.43,-8.43,2012,"16 Victoria Road, Elland, HX5 0PU","44 Wood Street, Huddersfield, HD1 1EG",04/01/90,07/17/12
,-55.88,-55.88,2002,"Albert Street, Halifax, HX1 5NW",,03/21/95,03/01/96
A H Fabrications (Halifax) Ltd (In Receivership),-224.82,-224.82,2002,"Arundel Street, Halifax, HX1 4LE","C/O Messrs Grant Thornton, St Johns Centre, 110 Albion Street, Leeds, LS2 8LA",04/01/90,04/01/91
G.J.B Upholstery Services Ltd [In Liquidation],-258.49,-258.49,2002,"51 Smithy Carr Lane, Brighouse, HD6 4BG","C/O A M Rogers, 9 South Lane, Holmfirth, HD7 1HN",04/01/90,01/27/94
,-6.58,-6.58,2002,"Unit 2, Upper Bonegate, Brighouse, HD6 1RT",,04/01/01,09/29/02
Woodvale Holdings Ltd [In Liquidation],-391.78,-391.78,2002,"Oak House, Woodvale Road, Brighouse, HD6 4AB","C/O Pannell Kerr & Forster, Ref L/73057/CVL/1304/DMH/IPS, 6 Queen Street, Leeds,, LS1 2TW",11/29/91,10/11/93
Neal Brothers (Leicester)Ltd,-34.46,-34.46,2001,"Bay 1, Rosemount Estate, Huddersfield Road, Elland               HX5 0EE","Queens Buildings, Hastings Road, LEICESTERle5 Olj",10/16/00,09/29/01
,-41.09,-41.09,2017,"Unit 1, The Ainleys, Huddersfield Road, Elland              HX5 9JR",,03/01/93,
J W Mitchell & Sons Ltd (In Liquidation),-2.67,-2.67,2002,"Unit 11, The Ainleys, Huddersfield Road, Elland              HX5 9DW","C/O Messrs K W Howarth & Co, 36 Clare Road, Halifax, HX1 2HX",04/22/91,09/30/92
Benjamin Whiteley & Sons Ltd,-0.3,-0.3,2017,"Park Road Mills, Park Road, Elland, HX5 9HX","Park Road Mills, Park Road, Elland, HX5 9HX",08/01/01,
,-12.81,-12.81,2002,"Pressers Arms Inn, 2 South Lane, Elland, HX5 0HG",,10/10/96,05/21/97
Outsourced Credit Management Ltd,-287.26,-287.26,2006,"3 Carlton Place, Halifax, HX1 2SB","3 Carlton Place, Halifax, HX1 2SB",08/01/99,04/30/06
,-25.99,-25.99,2002,"Goose Inn, 24 Causeway Foot, Halifax, HX2 8YB",,11/01/94,06/23/95
,-361.78,-361.78,2002,"Part 1ST Floor, 18 Clare Road, Halifax, HX1 2HX",,09/18/00,03/31/01
Halifax Estate Agencies Ltd,-2441.61,-2441.61,2009,"15/17/19 Commercial Street, Halifax, HX1 1HJ","C/O B N P Paribas Real Estate, Rating Support Unit, 9 Colmore Row, Birmingham, B3 2BT",01/31/92,01/15/10
Joseph Walker & Son Ltd [In Liquidation],-320.26,-320.26,2002,"561 Gibbet Street, Halifax, HX2 0AL","C/O Pannell Kerr Forster, Pannell House, 6 Queen Street, Leeds, LS1 2TW",04/01/90,11/09/94
,-0.91,-0.91,2017,"10 Cow Green, Halifax, HX1 1JF",,05/04/92,
,-200,-200,2003,"6a Dodge Holme Drive, Mixenden, Halifax, HX2 8PE",,04/08/02,07/17/03
Kelly Services (Uk) Ltd,-477,-477,2007,"25 Bull Green, Halifax, HX1 2RZ","Finance Dept, Apple Market House, 17 Union Street, Kingston Upon Thames, KT1 1RR",03/06/98,03/25/07
,-53.26,-53.26,2009,"Friendly Quarry, Burnley Road, Luddendenfoot, Halifax             HX2 6BD",,04/01/96,01/31/10
,-0.41,-0.41,2017,"9 Lane Ends Terrace, Halifax Road, Hipperholme, Halifax              HX3 8HJ",,08/01/98,
Reichenbacher (Uk) Ltd [In Liquidation],-311.03,-311.03,2003,"Unit 8/9 Victoria Park, Lightowler Road, Pellon, Halifax             HX1 5NB","C/O Kanzlei Linse, 22 Rosenstrasse, Coburg, Germany",10/01/90,01/31/04
Treble Vision Ltd [In Administration],-386.94,-386.94,2004,"Unit A4, Lower Ladyship Mills, Old Lane, Halifax              HX3 5QN",,12/03/96,08/15/04
,-8.68,-8.68,2002,"358 Ovenden Road, Halifax, HX3 5TJ",,07/01/93,10/31/95
,-2925,-12849.03,2012,"The Surgery, 117 Oxford Lane, Siddal, Halifax             HX3 9DG",,04/12/90,
,-3061.5,-12849.03,2014,"The Surgery, 117 Oxford Lane, Siddal, Halifax             HX3 9DG",,04/12/90,
,-541.83,5984,2016,"21/23 Park Drive, Rochdale Road, Halifax, HX2 7NP",,11/02/99,
,-1.41,-1.41,2017,"7 Park View, Stainland, Halifax, HX4 9HJ",,09/29/97,
,-163.38,-163.38,2004,"14a Hall Street North, Boothtown, Halifax, HX3 6TS",,10/01/02,02/08/05
,-47.08,-47.08,2002,"Hansonlane Enterprise Centre, Hanson Lane, Halifax, HX1 5PG",,04/01/00,01/02/03
Gamblinns Ltd [In Liquidation],-180.03,-180.03,2002,"Unofficial Address, Harrison Social, 11 Harrison Road, Halifax              HX1 2AF","C/O Baker Tilly, Carlton House, Grammar School Street, Bradford, BD1 4NF",10/26/90,08/08/95
Sally Salon Services Ltd,-124.2,1461.29,2010,"Unit 7, Margram Business Centre, Horne Street, Halifax             HX1 5UA","C/O Rate Account Management, C/O Colliers Int Rating Uk Llp, 12th Flr Eleven Brindleyplace, 2 Brunswick Square, Brindleyplace Birmingham, B1 2LP",03/21/99,
Sally Salon Services Ltd,-129.9,1461.29,2011,"Unit 7, Margram Business Centre, Horne Street, Halifax             HX1 5UA","C/O Rate Account Management, C/O Colliers Int Rating Uk Llp, 12th Flr Eleven Brindleyplace, 2 Brunswick Square, Brindleyplace Birmingham, B1 2LP",03/21/99,
Sally Salon Services Ltd,-138.6,1461.29,2013,"Unit 7, Margram Business Centre, Horne Street, Halifax             HX1 5UA","C/O Rate Account Management, C/O Colliers Int Rating Uk Llp, 12th Flr Eleven Brindleyplace, 2 Brunswick Square, Brindleyplace Birmingham, B1 2LP",03/21/99,
,-41.77,-41.77,2004,"14 Hunger Hill, Halifax, HX1 2JT",,04/01/90,08/05/04
B Rhodes & Son Ltd (In Liq.)(Moorfield Wireworkers Ltd),-387.87,-387.87,2002,"Moorfield Works, Ingram Street, Halifax, HX1 3HA","C/O Messrs. Revell Ward, Horton,, Lister House,, Lord Street,Halifax",04/01/90,01/25/91
,-68.06,-68.06,2002,"113 Keighley Road, Halifax, HX2 8JE",,04/01/90,03/02/02
,-22.11,-22.11,2010,"201 Queens Road, Halifax, HX1 4NE",,03/01/99,09/06/10
,-33.27,-33.27,2002,"212 Queens Road, Halifax, HX1 4NE",,09/02/96,09/09/96
Premier Accident Management Uk (Yorkshire)Ltd,-523,-523,2009,"327a Queens Road, Halifax, HX1 4PY",No Forwarding Address,04/26/02,03/31/09
Cunninghams (Halifax) Ltd [In Admin Receivership],-399.1,-399.1,2002,"Range Lane, Halifax, HX3 6DL","C/O Armitage & Co, Park House, Park Square, Leeds, LS1 2PS",04/01/90,10/13/93
Fred Wade Ltd (In Liquidation),-146.14,-146.14,2013,"14 Rawson Street, Halifax, HX1 1NH","C/O Lee & Company, Crown House, Armley Road, Leeds, LS12 2EJ",04/01/90,12/05/13
,-230.57,-230.57,2002,"1 Roydlands Terrace, Hipperholme, Halifax, HX3 8NG",,04/01/90,12/02/93
,-357.31,-357.31,2017,"70 Saddleworth Road, Greetland, Halifax, HX4 8AG",,03/21/92,
,-3.23,-3.23,2002,"76 Saddleworth Road, Greetland, Halifax, HX4 8AG",,04/09/95,12/11/99
Neaversons Of Halifax Ltd,-577.84,-577.84,2011,"12 The Old Arcade, Halifax, HX1 1TJ","5 Russell Street, Halifax, HX1 1RL",04/01/90,06/24/11
,-37.19,-37.19,2017,"255/257 Shay Lane, Halifax, HX2 9AG",,12/30/99,
,-0.05,-0.05,2017,"44/46 South Parade, Halifax, HX1 2LY",,04/01/92,
,-1.25,-1.13,2017,"52 Market Street, Hebden Bridge, HX7 6AA",,02/15/91,
,-17.8,-17.8,2002,"Part 3rd Floor, Mount Pleasant Mill, Mytholmroyd, Hebden Bridge       HX7 5NR",,04/01/90,06/18/91
,-11.97,-36.96,2002,"Stubbing Wharf Hotel, Hebden Bridge, HX7 6LU",,04/24/02,06/10/04
,-24.99,-36.96,2004,"Stubbing Wharf Hotel, Hebden Bridge, HX7 6LU",,04/24/02,06/10/04
,-81.89,-81.89,2017,"Windsor Garage, Victoria Road, Hebden Bridge, HX7 8JX",,04/01/90,
,-108.36,-108.36,2005,"Flyover Works, 30 West Parade, Halifax, HX1 2TE",,05/01/01,08/12/05
,-53.35,-53.35,2008,"1ST Floor, 4 Garden Street, Hebden Bridge, HX7 8AQ",,02/03/98,12/31/08
Kasshall Ltd T/A Custom Kitchens [In Liquidation],-17.44,-17.44,2002,"R/O 88 Wharf Street, Sowerby Bridge, HX6 2AF","C/O Cork Gully, Albion Court, 5 Albion Place, Leeds, LS1 6JP",04/01/90,03/24/95
Norman Jowett Ltd,-705,-705,2004,"Opp Portsmouth Mill, Burnley Road, Todmorden, OL14 8PP","159 Knowlwood Road, Todmorden, OL14 6RD",04/01/90,03/31/04
,-17.12,-17.12,2017,"R/0 739 Burnley Road, Todmorden, OL14 8LF",,04/01/93,
,-76.78,-76.78,2002,"Duke Of York Inn, 20 Halifax Road, Todmorden, OL14 5AD",,10/03/97,11/09/01
,-4.53,-4.53,2010,"Market Stall 89-90, Market Hall, Borough Market, Halifax             HX1 1DZ",,11/25/03,04/20/10
Hollins Park Sports & Social Club,-0.73,-0.73,2017,"Changing Rooms, Hollins Mill Lane, Sowerby Bridge, HX6 2RF",,11/01/02,
Specialised Coatings Holdings Ltd,-41.08,-41.08,2015,"Mile Cross Works, Gibbet Street, Halifax, HX1 4JQ","Units 1-4 Mile Cross Works, Gibbet Street, Halifax, HX1 4JQ",05/15/03,03/31/15
,-27.39,-27.39,2005,"Rooms 7 & 8, Victoria Buildings, Luddendenfoot, Halifax             HX2 6AA",,05/28/03,06/30/05
Halifax Property Restoration Ltd,-200,-200,2001,"2ND Floor, Westfield, Sowerby New Road, Sowerby Bridge, HX6 3AS","Westfield House, Sowerby New Road, Sowerby Bridge, Halifax, HX6 1AB",01/21/01,01/20/01
,-81.89,-81.89,2007,"First Floor, 14 Portland Place, Halifax, HX1 2QN",,07/10/03,01/31/08
,-75.5,-75.5,2003,"1 Elland Road, Ripponden, Sowerby Bridge, HX6 4DB",,09/01/03,02/13/04
,-189.3,-189.3,2006,"39 Horton Street, Halifax, HX1 1QE",,09/01/04,02/04/07
,-20,-20,2003,"Queen Hotel, 97 Stainland Road, Greetland, Halifax             HX4 8BD",,01/13/04,04/26/04
Blue Lagoon (Uk) Ltd [In Liquidation],-203.73,-203.73,2007,"Unit 18, Hansonlane Enterprise Centre, Hanson Lane, Halifax             HX1 5PG","C/O Mazars Llp, Mazars House, Gelderd Road, Gildersome , Leeds, LS27 7JN",07/09/04,12/12/07
Repack Services Ltd,-227.07,-227.07,2005,"Unit 16, Sdh Industrial Estate, West Street, Sowerby Bridge       HX6 3BS","Unit 2 S.D.H Industrial Estate, West Street, Sowerby Bridge, HX6 3BT",04/01/04,08/31/05
,-156.37,-156.37,2004,"3 Garden Street, Hebden Bridge, HX7 8AQ",,01/02/04,10/31/04
Chief Environmental Health Officer,-299.24,-994.84,2000,"Stainland Road, Barkisland, Halifax","Fao Wendy Backhouse, Northgate House, Northgate, Halifax, HX1 1UN",04/01/90,03/31/00
Matrix Chemie Ltd,-167,-167,2004,"Mezzanine Office 6 & 7, Lumbrook Mills, Westercroft Lane, Halifax              HX3 7TY","Offices 6 & 7, Mezzanine Floor, Lumbrook Mills, Westercroft Lane, Halifax, HX3 7TY",12/06/03,12/05/03
,-0.66,-0.66,2017,"15 Borough Market, Halifax, HX1 1DY",,01/26/04,
Rastrick Racing,-49.5,-49.5,2008,"9 Church Street, Brighouse, HD6 3NF","Fao Ben Stephens, 9 Church Street, Rastrick, Brighouse, HD6 3NF",04/01/04,09/30/08
,-99.63,-99.63,2005,"18d Lydgate, Northowram, Halifax, HX3 7EJ",,05/31/04,12/11/05
,-1.74,-1.74,2017,"The Chalet, Adj Cairnacre, Midgehole Road, Hebden Bridge        HX7 7AL",,04/01/04,
,-53.63,-53.63,2006,"Golden Lion Hotel, 523 Gibbet Street, Halifax, HX2 0AX",,09/24/04,10/29/06
,-0.51,-0.51,2017,"Unit 3A, Mitchell Street, Todmorden, OL14 7DW",,04/01/05,
,-0.91,-0.91,2017,"339 Skircoat Green Road, Halifax, HX3 0LX",,07/23/05,
Michael A Taylor Solicitors [ In Liquidation ],-12.88,-12.88,2010,"Fairway House, 20 Bethel Street, Brighouse, HD6 1JN","C/O P S Wallace & Co, 284 Clifton Drive South, Lytham St Annes, Lancs, FY8 1LH",04/01/05,04/30/10
,-64.75,-64.75,2011,"Station Road, Sowerby Bridge, HX6 3LB",,10/09/05,09/30/11
,-561,-561,2017,"Warley Springs Garage, Burnley Road, Halifax, HX2 7NB",,04/01/05,
,-41.85,-41.85,2010,"Market Stall 85-86, Market Hall, Borough Market, Halifax             HX1 1DZ",,06/06/05,08/01/10
,-711.72,-1208.55,2010,"The Oddfellows Arms, 158 Haugh Shaw Road, Halifax, HX1 3BG",,06/09/05,06/12/11
,-26.08,-26.08,2007,"The Delvers, Wainstalls, Halifax, HX2 7UA",,07/18/05,01/31/08
Almado Hom Pub Ltd,-112.8,-112.8,2005,"The Crown Inn, 10 Crown Street, Hebden Bridge, HX7 8EH","Bradley Wharton House, 2 Market Street, Broadbottom, Cheshire, SK14 6AX",05/20/05,02/01/06
,-2.71,-2.71,2007,"R/O 1 Hullen Edge, Goose Nest Lane, Norland, Sowerby Bridge       HX6 3QW",,09/02/05,03/30/08
,-481,-1534.14,2009,"Old Pond Inn, 15 Spout House Lane, Brighouse, HD6 2PL",,10/18/04,10/27/10
Worthington Nicholls Ltd,-180.08,-180.08,2006,"Office Suite D140, Dean Clough Mills, Halifax, HX3 5AX","Fao Mr N Smith, Office Suite D140, Dean Clough Mills, Halifax, HX3 5AX",05/01/05,02/15/07
,-100.81,-100.81,2006,"Office No 1, Ladyship Industrial Estate, Old Lane, Halifax             HX3 5QN",,03/28/06,09/11/06
,-18.01,-11.16,2010,"27 Queens Road, Halifax, HX1 3NS",,04/01/06,05/31/10
,-77.15,-77.15,2004,"112 Gibbet Street, Halifax, HX1 5BZ",,02/22/05,04/22/06
,-426.46,-426.46,2008,"Unit 4, S D H Industrial Estate, West Street, Sowerby Bridge       HX6 3BT",,11/01/05,03/31/08
,-1.24,-1.24,2017,"Lee Hill Equestrian Centre, Lee Hill Farm, Swan Lane, Outlane              HD3 3YH",,04/01/05,
The Shay Stadium Trust Ltd,-198.04,-198.04,2005,"Car Park, Hunger Hill, Halifax, HX1 2JT","The Shay Stadium, Halifax, HX1 2YT",04/27/05,04/26/05
,-35,-35,2006,"Room 7, 47 Bethel Street, Brighouse, HD6 1JR",,12/05/05,08/01/06
,-17.14,-17.14,2008,"Robin Hood Inn, Cragg Road, Cragg Vale, Hebden Bridge       HX7 5SQ",,12/05/05,08/13/08
La Romantica Beds Ltd,-708.13,-708.13,2014,"Unit 8, Brunswick Industrial Estate, Brassey Street, Halifax              HX1 2EA","Unit 1 Moorbank Mills, Artillery Street, Heckmondwike, WF16 0NT",12/22/05,12/20/15
,-19.54,-19.54,2007,"39 Horton Street, Halifax, HX1 1QE",,02/05/07,03/26/08
,-21.53,-21.53,2008,"Heart Gallery Arts Centre, 4 Market Street, Hebden Bridge, HX7 6AA",,10/01/06,06/03/08
Spot On Concrete [Hx] Ltd,-211.08,-211.08,2009,"Unit 39 Empire Works, Watkinson Road, Halifax, HX3 6SD","Fao Steven Walker, 90 Pye Nest Road, Pye Nest, Halifax, HX2 7HS",04/01/05,07/31/09
,-4239,-33031.27,2014,"Law Lane, Southowram, Halifax, HX3 9QU",,09/13/90,
,-7.3,-7.3,2008,"37a Stainland Road, Greetland, Halifax, HX4 8AD",,04/01/07,03/17/09
,-58.75,-58.75,2017,"Unit 1 Tower Block, Robinwood Mill, Burnley Road, Todmorden           OL14 8JA",,06/13/07,
,-189.33,-347.46,2014,"2ND Floor, 52 Manor Heath Road, Halifax, HX3 0BE",,08/01/07,05/01/10
Hebden Bridge Group Practice,-11915.83,-77444.65,2013,"Grange Dene Medical Centre, Grange Dene, Burnley Road, Mytholmroyd          HX7 5LF","Valley Medical Centre, Valley Road, Hebden Bridge, HX7 7BZ",04/01/05,
Hebden Bridge Group Practice,-27977.75,-77444.65,2015,"Grange Dene Medical Centre, Grange Dene, Burnley Road, Mytholmroyd          HX7 5LF","Valley Medical Centre, Valley Road, Hebden Bridge, HX7 7BZ",04/01/05,
Southdale  Ltd (In Liquidation),-452.23,-452.23,2015,"Southdale House, Westholme Road, Halifax, HX1 4JF","Begbies Traynor (Syl) Llp, Kendall House, 41 Scotland Street, Sheffield, S3 7BS",11/26/05,04/29/15
,-70.01,-70.01,2017,"68 Huddersfield Road, Elland, HX5 9AA",,02/16/08,
Fourward Engineering Ltd In Liquidation,-51.56,-51.56,2010,"Wood Mill, Halifax Road, Todmorden, OL14 6EE","C Brooksbank, O'Hara & Co, Wesley House, Huddersfiled Road, Birstall Batley, WF17 9EJ",03/13/08,03/24/11
,-2.23,-2.23,2010,"Office 29 First Floor, The E W Innovation Centre, Hopwood Lane, Halifax              HX1 5ER",,03/10/08,08/20/10
,-53.67,-53.67,2008,"Office 24, 11 Owler Ings Road, Brighouse, HD6 1EJ",,01/01/08,09/30/08
K Hamnett [Machinery Removers],-756.98,-756.98,2007,"Philmar House, Gibbet Street, Halifax, HX2 0AR","Philmar House, Highroad Well Works, Gibbet Street, Halifax, HX2 0AR",06/18/07,09/03/07
,-8,-8,2009,"17/21 The Old Arcade, Halifax, HX1 1TJ",,03/01/08,11/24/09
,-843.91,-843.91,2008,"Unit 1A, Prince Of Wales Business Pk, Birds Royd Lane, Brighouse            HD6 1LQ",,10/01/07,01/17/09
Structured Technologies Services Ltd [In Administration],-481.23,-481.23,2013,"Office Suite G 426, Dean Clough Mills, Halifax, HX3 5AX","C/O Castle Acres, Everard Way, Narborough, Leicester, LE19 1BY",04/25/08,11/28/13
Heritage Cashmere Ltd [In Administration],-231,-299.25,2008,"White Rose Mill, Holdsworth Road, Holmfield, Halifax              HX3 6SN","C/O Armstrong Watson, Central House, 47 St Pauls Street, Leeds, LS1 2TE",02/12/08,05/28/09
,-52.2,-52.2,2009,"Unit 34, Empire Works, Watkinson Road, Halifax              HX2 9AB",,12/01/07,08/01/09
,-170.25,-170.25,2012,"Workspace Unit 19, Hansonlane Enterprise Centre, Hanson Lane, Halifax             HX1 5PG",,04/01/08,08/31/12
B & Q Plc,-76135.71,-319259.62,2011,"7 Shroggs Road, Halifax, HX1 5HZ","C/O Gl Hearn Management Ltd, Po Box 1821, Southampton, SO18 9NA",04/04/08,
B & Q Plc,-99400,-319259.62,2016,"7 Shroggs Road, Halifax, HX1 5HZ","C/O Gl Hearn Management Ltd, Po Box 1821, Southampton, SO18 9NA",04/04/08,
Telecon Implementation Services Ltd,-55.96,-55.96,2015,"1ST Floor, 32 Cross Lee Road, Todmorden, OL14 8EH","Mazars House, Gelderd Road, Gildersome, Leeds, LS27 7JN",03/01/08,12/22/15
,-127.5,-395.9,2009,"Unit 17, Topland Country Business Pk, Cragg Road, Mytholmroyd          HX7 5RU",,05/01/08,12/31/09
,-2.17,-2.17,2009,"Unit 9 Sdh Industrial Estate, West Street, Sowerby Bridge, HX6 3BS",,02/01/08,07/20/09
Citexx Ltd [In Administration],-2159.37,-2159.37,2008,"Unit 1, Elland Industrial Estate, Elland Lane, Elland              HX5 9DZ","C/O Baker Tilly, 3 Hardman Street, Manchester, M3 3HF",05/28/08,06/02/08
,-1.18,-1.18,2017,"42/44 Burnley Road, Todmorden, OL14 5EZ",,06/14/08,
Chunky Chicken (Halifax) Ltd,-227.7,-227.7,2012,"112 Gibbet Street, Halifax, HX1 5BZ","116 Heights Lane, Rochdale, OL12 0QS",11/10/08,07/31/13
,-165.01,-900.19,2012,"Market Stall 5,6-8, Borough Market, Halifax, HX1 1DZ",,12/01/08,11/09/12
,-201.75,-201.75,2012,"194 Savile Park Road, Halifax, HX1 2XP",,01/07/09,01/12/15
,-0.48,-0.48,2017,"39 Halifax Road, Todmorden, OL14 5BB",,05/12/08,
,-10.73,-10.73,2011,"15 Ovenden Road, Halifax, HX3 5PN",,03/07/09,01/15/12
