OD402,N/D,SCS1,"Deputy Director Strategic Compliance, Avoidance and Employment Status","PT Customer Product & Process are responsible for the PAYE, SA and NICs processes and income tax in relation to employees and pensioners, so they deliver Ministers’ policy objectives, can be operated efficiently by HMRC and support voluntary compliance by customers. We also manage processes, provide policy input and deliver change for other government departments in relation to student finance, statutory payments and the national minimum wage.",Her Majesty's Revenue and Customs,Her Majesty's Revenue and Customs,PT Customer Product & Process,N/D,ContactUs@hmrc.gsi.gov.uk,OD369,2683000,0.89,N/A,N/A,Policy,,1
OD533,N/D,SCS1,Deputy Director Demand Management Group,"PT Customer Product & Process are responsible for the PAYE, SA and NICs processes and income tax in relation to employees and pensioners, so they deliver Ministers’ policy objectives, can be operated efficiently by HMRC and support voluntary compliance by customers. We also manage processes, provide policy input and deliver change for other government departments in relation to student finance, statutory payments and the national minimum wage.",Her Majesty's Revenue and Customs,Her Majesty's Revenue and Customs,PT Customer Product & Process,N/D,ContactUs@hmrc.gsi.gov.uk,OD369,4769000,1,N/A,N/A,Tax Professionals,,1
OD538,N/D,SCS1,"Deputy Director Strategy & Analysis PT Customer, Product & Process","PT Customer Product & Process are responsible for the PAYE, SA and NICs processes and income tax in relation to employees and pensioners, so they deliver Ministers’ policy objectives, can be operated efficiently by HMRC and support voluntary compliance by customers. We also manage processes, provide policy input and deliver change for other government departments in relation to student finance, statutory payments and the national minimum wage.",Her Majesty's Revenue and Customs,Her Majesty's Revenue and Customs,PT Customer Product & Process,N/D,ContactUs@hmrc.gsi.gov.uk,OD369,975000,1,N/A,N/A,Statisticians,,1
OD368,Mike Baker,SCS2,Director PT Operations,"PT Operations handles the majority of customer initiated contact to service levels agreed with the customer units. We help our customers pay what they owe and claim what they are entitled to. We do this by providing accurate and easy to understand information, support and guidance when our customers need it.",Her Majesty's Revenue and Customs,Her Majesty's Revenue and Customs,PT Operations,N/D,ContactUs@hmrc.gsi.gov.uk,OD103,1631000,1,110000,114999,Operational Delivery,,1
OD377,N/D,SCS1,"Deputy Director, Area 3 PT Operations","PT Operations handles the majority of customer initiated contact to service levels agreed with the customer units. We help our customers pay what they owe and claim what they are entitled to. We do this by providing accurate and easy to understand information, support and guidance when our customers need it.",Her Majesty's Revenue and Customs,Her Majesty's Revenue and Customs,PT Operations,N/D,ContactUs@hmrc.gsi.gov.uk,OD368,59329000,1,N/A,N/A,Operational Delivery,,1
OD387,N/D,SCS1,Deputy Director Area 4 PT Ops,"PT Operations handles the majority of customer initiated contact to service levels agreed with the customer units. We help our customers pay what they owe and claim what they are entitled to. We do this by providing accurate and easy to understand information, support and guidance when our customers need it.",Her Majesty's Revenue and Customs,Her Majesty's Revenue and Customs,PT Operations,N/D,ContactUs@hmrc.gsi.gov.uk,OD368,77477000,1,N/A,N/A,Operational Delivery,,1
OD388,N/D,SCS1,Deputy Director Area 1 PT Ops,"PT Operations handles the majority of customer initiated contact to service levels agreed with the customer units. We help our customers pay what they owe and claim what they are entitled to. We do this by providing accurate and easy to understand information, support and guidance when our customers need it.",Her Majesty's Revenue and Customs,Her Majesty's Revenue and Customs,PT Operations,N/D,ContactUs@hmrc.gsi.gov.uk,OD368,78728000,1,N/A,N/A,Operational Delivery,,1
OD389,N/D,SCS1,Deputy Director Area 3 PT Ops,"PT Operations handles the majority of customer initiated contact to service levels agreed with the customer units. We help our customers pay what they owe and claim what they are entitled to. We do this by providing accurate and easy to understand information, support and guidance when our customers need it.",Her Majesty's Revenue and Customs,Her Majesty's Revenue and Customs,PT Operations,N/D,ContactUs@hmrc.gsi.gov.uk,OD368,45130000,1,N/A,N/A,Operational Delivery,,1
OD390,VACANT,SCS1,Deputy Director PT Operations Planning & Performance,"PT Operations handles the majority of customer initiated contact to service levels agreed with the customer units. We help our customers pay what they owe and claim what they are entitled to. We do this by providing accurate and easy to understand information, support and guidance when our customers need it.",Her Majesty's Revenue and Customs,Her Majesty's Revenue and Customs,PT Operations,N/A,N/A,OD368,0,1,0,0,Operational Delivery,,1
OD561,N/D,SCS1,Deputy Director Contact Platform Operational Implementation,"PT Operations handles the majority of customer initiated contact to service levels agreed with the customer units. We help our customers pay what they owe and claim what they are entitled to. We do this by providing accurate and easy to understand information, support and guidance when our customers need it.",Her Majesty's Revenue and Customs,Her Majesty's Revenue and Customs,PT Operations,N/D,ContactUs@hmrc.gsi.gov.uk,OD368,318000,1,N/A,N/A,Operational Delivery,,1
OD420,Jon Ashton,SCS2,Director of Security & Information,Security and Information Directorate is responsible for setting the standards and policy and providing advice and guidance on security and business continuity in HMRC.,Her Majesty's Revenue and Customs,Her Majesty's Revenue and Customs,Security & Information Directorate,N/D,ContactUs@hmrc.gsi.gov.uk,OD107,1678000,1,115000,119999,Programme and Project Management (PPM),,1
OD444,N/D,SCS1,Deputy Director Head of Assurance,Security and Information Directorate is responsible for setting the standards and policy and providing advice and guidance on security and business continuity in HMRC.,Her Majesty's Revenue and Customs,Her Majesty's Revenue and Customs,Security & Information Directorate,N/D,ContactUs@hmrc.gsi.gov.uk,OD420,1502000,1,N/A,N/A,Programme and Project Management (PPM),,1
OD450,N/D,SCS1,Head of Information Security,Security and Information Directorate is responsible for setting the standards and policy and providing advice and guidance on security and business continuity in HMRC.,Her Majesty's Revenue and Customs,Her Majesty's Revenue and Customs,Security & Information Directorate,N/D,ContactUs@hmrc.gsi.gov.uk,OD420,1251000,1,N/A,N/A,Information Technology,,1
OD110,Gill Aitken,SCS3,General Counsel & Solicitor,"Solicitor's Office provides legal services to the whole of HMRC. This includes the conduct of tribunal and civil litigation, the provision of legal advice to the Board; work on new legislation, draft statutory instruments and other legal documents, on a very full range of services.",Her Majesty's Revenue and Customs,Her Majesty's Revenue and Customs,Solicitor's Office,N/D,ContactUs@hmrc.gsi.gov.uk,ODR2,0,1,130000,134999,Law,,1
OD344,David Bunting,SCS2,Director Solicitors A - Litigation & Enforcement,"Solicitor's Office provides legal services to the whole of HMRC. This includes the conduct of tribunal and civil litigation, the provision of legal advice to the Board; work on new legislation, draft statutory instruments and other legal documents, on a very full range of services.",Her Majesty's Revenue and Customs,Her Majesty's Revenue and Customs,Solicitor's Office,N/D,ContactUs@hmrc.gsi.gov.uk,OD110,0,1,95000,99999,Law,,1
OD346,Sinead Murray,SCS2,"Director Solicitors C - Personal Tax, Benefits & Credits & Corporate Services","Solicitor's Office provides legal services to the whole of HMRC. This includes the conduct of tribunal and civil litigation, the provision of legal advice to the Board; work on new legislation, draft statutory instruments and other legal documents, on a very full range of services.",Her Majesty's Revenue and Customs,Her Majesty's Revenue and Customs,Solicitor's Office,N/D,ContactUs@hmrc.gsi.gov.uk,OD110,0,1,90000,94999,Law,,1
OD347,N/D,SCS1,Commissioners' Advisory Accountant,"Solicitor's Office provides legal services to the whole of HMRC. This includes the conduct of tribunal and civil litigation, the provision of legal advice to the Board; work on new legislation, draft statutory instruments and other legal documents, on a very full range of services.",Her Majesty's Revenue and Customs,Her Majesty's Revenue and Customs,Solicitor's Office,N/D,ContactUs@hmrc.gsi.gov.uk,OD110,1026000,1,N/A,N/A,Law,,1
OD348,N/D,SCS1,Deputy Director Enforcement & Insolvency Team,"Solicitor's Office provides legal services to the whole of HMRC. This includes the conduct of tribunal and civil litigation, the provision of legal advice to the Board; work on new legislation, draft statutory instruments and other legal documents, on a very full range of services.",Her Majesty's Revenue and Customs,Her Majesty's Revenue and Customs,Solicitor's Office,N/D,ContactUs@hmrc.gsi.gov.uk,OD344,769000,1,N/A,N/A,Law,,1
OD349,N/D,SCS1,"Deputy Director Customs, Excise & Environmentl Taxes Litigation","Solicitor's Office provides legal services to the whole of HMRC. This includes the conduct of tribunal and civil litigation, the provision of legal advice to the Board; work on new legislation, draft statutory instruments and other legal documents, on a very full range of services.",Her Majesty's Revenue and Customs,Her Majesty's Revenue and Customs,Solicitor's Office,N/D,ContactUs@hmrc.gsi.gov.uk,OD344,655000,1,N/A,N/A,Law,,1
OD350,N/D,SCS1,Deputy Director Personal Tax Litigation Team,"Solicitor's Office provides legal services to the whole of HMRC. This includes the conduct of tribunal and civil litigation, the provision of legal advice to the Board; work on new legislation, draft statutory instruments and other legal documents, on a very full range of services.",Her Majesty's Revenue and Customs,Her Majesty's Revenue and Customs,Solicitor's Office,N/D,ContactUs@hmrc.gsi.gov.uk,OD344,634000,1,N/A,N/A,Law,,1
OD351,N/D,SCS1,Deputy Director Strategic Litigation & Special Investigations Team,"Solicitor's Office provides legal services to the whole of HMRC. This includes the conduct of tribunal and civil litigation, the provision of legal advice to the Board; work on new legislation, draft statutory instruments and other legal documents, on a very full range of services.",Her Majesty's Revenue and Customs,Her Majesty's Revenue and Customs,Solicitor's Office,N/D,ContactUs@hmrc.gsi.gov.uk,OD344,843000,1,N/A,N/A,Law,,1
OD352,N/D,SCS1,Deputy Director VAT Litigation,"Solicitor's Office provides legal services to the whole of HMRC. This includes the conduct of tribunal and civil litigation, the provision of legal advice to the Board; work on new legislation, draft statutory instruments and other legal documents, on a very full range of services.",Her Majesty's Revenue and Customs,Her Majesty's Revenue and Customs,Solicitor's Office,N/D,ContactUs@hmrc.gsi.gov.uk,OD344,957000,1,N/A,N/A,Law,,1
OD353,N/D,SCS1,Deputy Director Business & Property Taxes Litigation Team,"Solicitor's Office provides legal services to the whole of HMRC. This includes the conduct of tribunal and civil litigation, the provision of legal advice to the Board; work on new legislation, draft statutory instruments and other legal documents, on a very full range of services.",Her Majesty's Revenue and Customs,Her Majesty's Revenue and Customs,Solicitor's Office,N/D,ContactUs@hmrc.gsi.gov.uk,OD344,780000,1,N/A,N/A,Law,,1
OD354,N/D,SCS1,Deputy Director Corporation Tax Advisory,"Solicitor's Office provides legal services to the whole of HMRC. This includes the conduct of tribunal and civil litigation, the provision of legal advice to the Board; work on new legislation, draft statutory instruments and other legal documents, on a very full range of services.",Her Majesty's Revenue and Customs,Her Majesty's Revenue and Customs,Solicitor's Office,N/D,ContactUs@hmrc.gsi.gov.uk,OD357,672000,1,N/A,N/A,Law,,1
OD355,N/D,SCS1,"Deputy Director Professionalism, Litigation, Operations and Business Transformation","Solicitor's Office provides legal services to the whole of HMRC. This includes the conduct of tribunal and civil litigation, the provision of legal advice to the Board; work on new legislation, draft statutory instruments and other legal documents, on a very full range of services.",Her Majesty's Revenue and Customs,Her Majesty's Revenue and Customs,Solicitor's Office,N/D,ContactUs@hmrc.gsi.gov.uk,OD357,0,1,N/A,N/A,Law,Salary costs included in OD605,1
OD356,N/D,SCS1,"Deputy Director Legislation & European Coordination, Constitutional & Information Law & Disclosure Team","Solicitor's Office provides legal services to the whole of HMRC. This includes the conduct of tribunal and civil litigation, the provision of legal advice to the Board; work on new legislation, draft statutory instruments and other legal documents, on a very full range of services.",Her Majesty's Revenue and Customs,Her Majesty's Revenue and Customs,Solicitor's Office,N/D,ContactUs@hmrc.gsi.gov.uk,OD357,503000,1,N/A,N/A,Law,,1
OD357,N/D,SCS1,"Deputy Director HRCP, Capital Allowances, Reliefs, CFC & GAAR Advisory","Solicitor's Office provides legal services to the whole of HMRC. This includes the conduct of tribunal and civil litigation, the provision of legal advice to the Board; work on new legislation, draft statutory instruments and other legal documents, on a very full range of services.",Her Majesty's Revenue and Customs,Her Majesty's Revenue and Customs,Solicitor's Office,N/D,ContactUs@hmrc.gsi.gov.uk,OD110,879000,1,N/A,N/A,Law,,1
OD358,N/D,SCS1,"Deputy Director Business International, Gains & VAT Advisory","Solicitor's Office provides legal services to the whole of HMRC. This includes the conduct of tribunal and civil litigation, the provision of legal advice to the Board; work on new legislation, draft statutory instruments and other legal documents, on a very full range of services.",Her Majesty's Revenue and Customs,Her Majesty's Revenue and Customs,Solicitor's Office,N/D,ContactUs@hmrc.gsi.gov.uk,OD357,957000,1,N/A,N/A,Law,,1
OD359,N/D,SCS1,Deputy Director Rating & Valuation,"Solicitor's Office provides legal services to the whole of HMRC. This includes the conduct of tribunal and civil litigation, the provision of legal advice to the Board; work on new legislation, draft statutory instruments and other legal documents, on a very full range of services.",Her Majesty's Revenue and Customs,Her Majesty's Revenue and Customs,Solicitor's Office,N/D,ContactUs@hmrc.gsi.gov.uk,OD357,409000,1,N/A,N/A,Law,,1
OD360,N/D,SCS1,Deputy Director Personal Tax Advisory,"Solicitor's Office provides legal services to the whole of HMRC. This includes the conduct of tribunal and civil litigation, the provision of legal advice to the Board; work on new legislation, draft statutory instruments and other legal documents, on a very full range of services.",Her Majesty's Revenue and Customs,Her Majesty's Revenue and Customs,Solicitor's Office,N/D,ContactUs@hmrc.gsi.gov.uk,OD346,764000,1,N/A,N/A,Law,,1
OD362,N/D,SCS1,Deputy Director Personal Tax,"Solicitor's Office provides legal services to the whole of HMRC. This includes the conduct of tribunal and civil litigation, the provision of legal advice to the Board; work on new legislation, draft statutory instruments and other legal documents, on a very full range of services.",Her Majesty's Revenue and Customs,Her Majesty's Revenue and Customs,Solicitor's Office,N/D,ContactUs@hmrc.gsi.gov.uk,OD346,737000,1,N/A,N/A,Operational Delivery,,1
OD363,N/D,SCS1,Deputy Director Criminal Law & Benefits & Credits Advisory,"Solicitor's Office provides legal services to the whole of HMRC. This includes the conduct of tribunal and civil litigation, the provision of legal advice to the Board; work on new legislation, draft statutory instruments and other legal documents, on a very full range of services.",Her Majesty's Revenue and Customs,Her Majesty's Revenue and Customs,Solicitor's Office,N/D,ContactUs@hmrc.gsi.gov.uk,OD346,772000,1,N/A,N/A,Law,,1
OD364,N/D,SCS1,Deputy Director Commercial - Manchester,"Solicitor's Office provides legal services to the whole of HMRC. This includes the conduct of tribunal and civil litigation, the provision of legal advice to the Board; work on new legislation, draft statutory instruments and other legal documents, on a very full range of services.",Her Majesty's Revenue and Customs,Her Majesty's Revenue and Customs,Solicitor's Office,N/D,ContactUs@hmrc.gsi.gov.uk,OD346,375000,1,N/A,N/A,Law,,1
OD547,N/D,SCS1,Deputy Director Leagal Operations,"Solicitor's Office provides legal services to the whole of HMRC. This includes the conduct of tribunal and civil litigation, the provision of legal advice to the Board; work on new legislation, draft statutory instruments and other legal documents, on a very full range of services.",Her Majesty's Revenue and Customs,Her Majesty's Revenue and Customs,Solicitor's Office,N/D,ContactUs@hmrc.gsi.gov.uk,OD605,18233000,1,N/A,N/A,Law,,1
OD599,N/D,SCS1,Head of Commercial Law - London,"Solicitor's Office provides legal services to the whole of HMRC. This includes the conduct of tribunal and civil litigation, the provision of legal advice to the Board; work on new legislation, draft statutory instruments and other legal documents, on a very full range of services.",Her Majesty's Revenue and Customs,Her Majesty's Revenue and Customs,Solicitor's Office,N/D,ContactUs@hmrc.gsi.gov.uk,OD346,487000,1,N/A,N/A,Law,,1
OD605,Tracy Gale,SCS2,Head of Operational Litigation Delivery and Business Change,"Solicitor's Office provides legal services to the whole of HMRC. This includes the conduct of tribunal and civil litigation, the provision of legal advice to the Board; work on new legislation, draft statutory instruments and other legal documents, on a very full range of services.",Her Majesty's Revenue and Customs,Her Majesty's Revenue and Customs,Solicitor's Office,N/D,ContactUs@hmrc.gsi.gov.uk,OD110,1952000,1,90000,94999,Operational Delivery,Includes salary costs for OD355,1
OD370,Brian Redford,SCS2,Director Specialist Personal Tax,"Specialist PT deals with the specialist aspects of the personal tax system. This covers: specialist taxes like Inheritance Tax and Capital Gains Tax; specialist tax incentives, like pension reliefs and Gift Aid; and specialist customer groups, like Trusts",Her Majesty's Revenue and Customs,Her Majesty's Revenue and Customs,Specialist PT,N/D,ContactUs@hmrc.gsi.gov.uk,OD103,0,1,90000,94999,Operational Delivery,,1
OD406,N/D,SCS1,Deputy Director Charities,"Specialist PT deals with the specialist aspects of the personal tax system. This covers: specialist taxes like Inheritance Tax and Capital Gains Tax; specialist tax incentives, like pension reliefs and Gift Aid; and specialist customer groups, like Trusts",Her Majesty's Revenue and Customs,Her Majesty's Revenue and Customs,Specialist PT,N/D,ContactUs@hmrc.gsi.gov.uk,OD370,829000,1,N/A,N/A,Operational Delivery,,1
OD409,N/D,SCS1,"Deputy Director Charities, Savings & International","Specialist PT deals with the specialist aspects of the personal tax system. This covers: specialist taxes like Inheritance Tax and Capital Gains Tax; specialist tax incentives, like pension reliefs and Gift Aid; and specialist customer groups, like Trusts",Her Majesty's Revenue and Customs,Her Majesty's Revenue and Customs,Specialist PT,N/D,ContactUs@hmrc.gsi.gov.uk,OD370,10795000,1,N/A,N/A,Tax Professionals,,1
OD410,N/D,SCS1,"Deputy Director Trusts, Estates & Pensions Process Operations Owner","Specialist PT deals with the specialist aspects of the personal tax system. This covers: specialist taxes like Inheritance Tax and Capital Gains Tax; specialist tax incentives, like pension reliefs and Gift Aid; and specialist customer groups, like Trusts",Her Majesty's Revenue and Customs,Her Majesty's Revenue and Customs,Specialist PT,N/D,ContactUs@hmrc.gsi.gov.uk,OD370,13142000,0.92,N/A,N/A,Tax Professionals,,1
OD411,N/D,SCS1,Deputy Director Pensions & Savings Product Owner,"Specialist PT deals with the specialist aspects of the personal tax system. This covers: specialist taxes like Inheritance Tax and Capital Gains Tax; specialist tax incentives, like pension reliefs and Gift Aid; and specialist customer groups, like Trusts",Her Majesty's Revenue and Customs,Her Majesty's Revenue and Customs,Specialist PT,N/D,ContactUs@hmrc.gsi.gov.uk,OD370,3235000,1,N/A,N/A,Policy,,1
OD416,N/D,SCS1,Deputy Director Assets & Residence Policy,"Specialist PT deals with the specialist aspects of the personal tax system. This covers: specialist taxes like Inheritance Tax and Capital Gains Tax; specialist tax incentives, like pension reliefs and Gift Aid; and specialist customer groups, like Trusts",Her Majesty's Revenue and Customs,Her Majesty's Revenue and Customs,Specialist PT,N/D,ContactUs@hmrc.gsi.gov.uk,OD370,1000000,1,N/A,N/A,Policy,,1
OD417,N/D,SCS1,Deputy Director Capital and Valuation Technical and Advisory Teams,"Specialist PT deals with the specialist aspects of the personal tax system. This covers: specialist taxes like Inheritance Tax and Capital Gains Tax; specialist tax incentives, like pension reliefs and Gift Aid; and specialist customer groups, like Trusts",Her Majesty's Revenue and Customs,Her Majesty's Revenue and Customs,Specialist PT,N/D,ContactUs@hmrc.gsi.gov.uk,OD370,5549000,1,N/A,N/A,Operational Delivery,,1
ODR1,N/D,SCS4,"Tax, Duties, Benefits & Credits","Tax, Duties, Benefits & Credits",Her Majesty's Revenue and Customs,Her Majesty's Revenue and Customs,Tax,N/D,ContactUs@hmrc.gsi.gov.uk,OD101,0,1,0,0,,,1
OD421,N/D,SCS1,Head of Adjudicators Office,"The Adjudicator acts as a fair and unbiased referee looking into complaints about HM Revenue & Customs (HMRC), including the Tax Credit Office (TCO) and the Valuation Office Agency (VOA)",Her Majesty's Revenue and Customs,Her Majesty's Revenue and Customs,Central Customer & Strategy,N/D,ContactUs@hmrc.gsi.gov.uk,OD230,2156000,1,N/A,N/A,Tax Professionals,,1
OD109,Jim Harra,SCS3,Director General Business Tax and Central Tax and Strategy,"The Business Tax part of HMRC combines the product and process ownership and design of the main business taxes, plus strategy for Small and Medium Enterprises and large businesses, and the Large Business Service which deals with the affairs of the 800 biggest multinationals. We are also responsible for running Businesslink.gov – the cross-Government web service for businesses – and cross-HMRC IT programmes for business.",Her Majesty's Revenue and Customs,Her Majesty's Revenue and Customs,BT Corporate Centre,N/D,ContactUs@hmrc.gsi.gov.uk,ODR1,712000,1,135000,139999,Tax Professionals,,1
OD164,N/D,SCS1,"Director BT Finance, Performance & Risk","The Business Tax part of HMRC combines the product and process ownership and design of the main business taxes, plus strategy for Small and Medium Enterprises and large businesses, and the Large Business Service which deals with the affairs of the 800 biggest multinationals. We are also responsible for running Businesslink.gov – the cross-Government web service for businesses – and cross-HMRC IT programmes for business.",Her Majesty's Revenue and Customs,Her Majesty's Revenue and Customs,BT Corporate Centre,N/D,ContactUs@hmrc.gsi.gov.uk,OD109,1607000,1,N/A,N/A,Operational Delivery,,1
OD473,VACANT,SCS1,Change Director Business Tax,"The Business Tax part of HMRC combines the product and process ownership and design of the main business taxes, plus strategy for Small and Medium Enterprises and large businesses, and the Large Business Service which deals with the affairs of the 800 biggest multinationals. We are also responsible for running Businesslink.gov – the cross-Government web service for businesses – and cross-HMRC IT programmes for business.",Her Majesty's Revenue and Customs,Her Majesty's Revenue and Customs,BT Corporate Centre,N/A,N/A,OD109,0,1,0,0,Programme and Project Management (PPM),,1
OD618,Cerys McDonald,SCS2,Director - EU Transition,"The Business Tax part of HMRC combines the product and process ownership and design of the main business taxes, plus strategy for Small and Medium Enterprises and large businesses, and the Large Business Service which deals with the affairs of the 800 biggest multinationals. We are also responsible for running Businesslink.gov – the cross-Government web service for businesses – and cross-HMRC IT programmes for business.",Her Majesty's Revenue and Customs,Her Majesty's Revenue and Customs,BT Corporate Centre,N/D,ContactUs@hmrc.gsi.gov.uk,OD109,187000,1,85000,89999,Operational Delivery,Includes salary costs for OD619,1
OD619,N/D,SCS1,Deputy Director - Head of Stragy and Policy Co-ordination,"The Business Tax part of HMRC combines the product and process ownership and design of the main business taxes, plus strategy for Small and Medium Enterprises and large businesses, and the Large Business Service which deals with the affairs of the 800 biggest multinationals. We are also responsible for running Businesslink.gov – the cross-Government web service for businesses – and cross-HMRC IT programmes for business.",Her Majesty's Revenue and Customs,Her Majesty's Revenue and Customs,BT Corporate Centre,N/D,ContactUs@hmrc.gsi.gov.uk,OD618,0,1,N/A,N/A,Policy,Salary costs included in OD618,1
