OD105,Justin Holliday,SCS3,Chief Finance Officer,"The Chief Finance Officer is responsible for ensuring the highest standards of financial management within the Department and leading the Commercial, Estates and Support Services, Corporate Finance, Government Banking, Change Assurance & Investment and Internal Audit directorates. The Chief Finance Officer continues to lead Corporate Finance which is at the heart of the department and comprises Chief Financial Accountant, Finance Professions and Finance Planning and Performance. The Chief Finance officer plays a key role in supporting HMRC to bring in record compliance revenues, continue to improve customer service and deliver sustainable cost reductions.",Her Majesty's Revenue and Customs,Her Majesty's Revenue and Customs,CFO Corporate Support,N/D,ContactUs@hmrc.gsi.gov.uk,ODR2,0,1,160000,164999,Finance,Includes salary costs for OD553,1
OD251,N/D,SCS1,"Director CFO Finance, Performance & Risk","The Chief Finance Officer is responsible for ensuring the highest standards of financial management within the Department and leading the Commercial, Estates and Support Services, Corporate Finance, Government Banking, Change Assurance & Investment and Internal Audit directorates. The Chief Finance Officer continues to lead Corporate Finance which is at the heart of the department and comprises Chief Financial Accountant, Finance Professions and Finance Planning and Performance. The Chief Finance officer plays a key role in supporting HMRC to bring in record compliance revenues, continue to improve customer service and deliver sustainable cost reductions.",Her Majesty's Revenue and Customs,Her Majesty's Revenue and Customs,CFO Corporate Support,N/D,ContactUs@hmrc.gsi.gov.uk,OD105,1135000,1,N/A,N/A,Finance,,1
TBC1,Eliminated,SCS1,Role within Estates - Awaiting details,"The Chief Finance Officer is responsible for ensuring the highest standards of financial management within the Department and leading the Commercial, Estates and Support Services, Corporate Finance, Government Banking, Change Assurance & Investment and Internal Audit directorates. The Chief Finance Officer continues to lead Corporate Finance which is at the heart of the department and comprises Chief Financial Accountant, Finance Professions and Finance Planning and Performance. The Chief Finance officer plays a key role in supporting HMRC to bring in record compliance revenues, continue to improve customer service and deliver sustainable cost reductions.",Her Majesty's Revenue and Customs,Her Majesty's Revenue and Customs,CFO Corporate Support,N/A,N/A,OD105,0,1,0,0,Finance,,1
OD278,Mark de Brunner,SCS2,Programme Director Compilance of the Future,"The Compliance for the Future Programme will deliver a new model for compliance across HMRC, allowing us to secure compliance at a lower cost. This will involve targeting our activities to areas of greatest risk, using better case management systems, developing more effective and efficient ways to address tax risk, and using technology more effectively to support HMRC’s Promote, Prevent and Respond Strategy.",Her Majesty's Revenue and Customs,Her Majesty's Revenue and Customs,Compliance for the Future,N/D,ContactUs@hmrc.gsi.gov.uk,OD104,0,1,85000,89999,Tax Professionals,,1
OD279,N/D,SCS1,Compliance for the Future - Design Lead,"The Compliance for the Future Programme will deliver a new model for compliance across HMRC, allowing us to secure compliance at a lower cost. This will involve targeting our activities to areas of greatest risk, using better case management systems, developing more effective and efficient ways to address tax risk, and using technology more effectively to support HMRC’s Promote, Prevent and Respond Strategy.",Her Majesty's Revenue and Customs,Her Majesty's Revenue and Customs,Compliance for the Future,N/D,ContactUs@hmrc.gsi.gov.uk,OD278,1127000,1,N/A,N/A,Programme and Project Management (PPM),,1
OD281,N/D,SCS1,Compliance For the Future - Data Theme Lead,"The Compliance for the Future Programme will deliver a new model for compliance across HMRC, allowing us to secure compliance at a lower cost. This will involve targeting our activities to areas of greatest risk, using better case management systems, developing more effective and efficient ways to address tax risk, and using technology more effectively to support HMRC’s Promote, Prevent and Respond Strategy.",Her Majesty's Revenue and Customs,Her Majesty's Revenue and Customs,Compliance for the Future,N/D,ContactUs@hmrc.gsi.gov.uk,OD278,2655000,1,N/A,N/A,Programme and Project Management (PPM),,1
OD299,N/D,SCS1,HMRC Compliance Plan,"The Compliance for the Future Programme will deliver a new model for compliance across HMRC, allowing us to secure compliance at a lower cost. This will involve targeting our activities to areas of greatest risk, using better case management systems, developing more effective and efficient ways to address tax risk, and using technology more effectively to support HMRC’s Promote, Prevent and Respond Strategy.",Her Majesty's Revenue and Customs,Her Majesty's Revenue and Customs,Compliance for the Future,N/D,ContactUs@hmrc.gsi.gov.uk,OD278,446000,1,N/A,N/A,Policy,,1
OD106,Jennie Granger,SCS3,Director General Enforcement & Compliance,"The Director General of Enforcement and Compliance has overall responsibility for a group of directorates whose staff ensure that HMRC successfully collects the full and correct amount of money due from UK taxpayers, investigates offences against the tax system and takes action to identify and mitigate potential threats.",Her Majesty's Revenue and Customs,Her Majesty's Revenue and Customs,E&C Central Services,N/D,ContactUs@hmrc.gsi.gov.uk,ODR1,231000,1,150000,154999,Tax Professionals,,1
OD103,Ruth Owen,SCS3,Director General Customer Services,"The Director General, Customer Services, has overall responsibility for policy and service delivery for individual customers (including employees and pensioners), and for PAYE, Self Assessment, National Insurance, other taxes including Inheritance Tax and Capital Gains Tax, and delivery of Real Time Information. The Director General is also HMRC’s Head of Profession for Operational Delivery and Diversity champion for gender.",Her Majesty's Revenue and Customs,Her Majesty's Revenue and Customs,PT Director,N/D,ContactUs@hmrc.gsi.gov.uk,ODR1,598000,1,140000,144999,Operational Delivery,,1
OD373,N/D,SCS1,Deputy Director CS Finance,"The Director General, Personal Tax, has overall responsibility for policy and service delivery for individual customers (including employees and pensioners), and for PAYE, Self Assessment, National Insurance, other taxes including Inheritance Tax and Capital Gains Tax, and delivery of Real Time Information. The Director General is also HMRC’s Head of Profession for Operational Delivery and Diversity champion for gender.",Her Majesty's Revenue and Customs,Her Majesty's Revenue and Customs,PT Director,N/D,ContactUs@hmrc.gsi.gov.uk,OD103,1878000,1,N/A,N/A,Tax Professionals,,1
OD555,Rachel McLean,SCS2,Director Finance Planning and Performance,"The Director General, Personal Tax, has overall responsibility for policy and service delivery for individual customers (including employees and pensioners), and for PAYE, Self Assessment, National Insurance, other taxes including Inheritance Tax and Capital Gains Tax, and delivery of Real Time Information. The Director General is also HMRC’s Head of Profession for Operational Delivery and Diversity champion for gender.",Her Majesty's Revenue and Customs,Her Majesty's Revenue and Customs,PT Director,N/D,ContactUs@hmrc.gsi.gov.uk,OD103,0,1,140000,144999,Tax Professionals,,1
OD593,N/D,SCS1,Deputy Director Customer Services Communications,"The Director General, Personal Tax, has overall responsibility for policy and service delivery for individual customers (including employees and pensioners), and for PAYE, Self Assessment, National Insurance, other taxes including Inheritance Tax and Capital Gains Tax, and delivery of Real Time Information. The Director General is also HMRC’s Head of Profession for Operational Delivery and Diversity champion for gender.",Her Majesty's Revenue and Customs,Her Majesty's Revenue and Customs,PT Director,N/D,ContactUs@hmrc.gsi.gov.uk,OD103,745000,1,N/A,N/A,Operational Delivery,,1
OD598,N/D,SCS1,Deputy Director Planning and Performance Management,"The Director General, Personal Tax, has overall responsibility for policy and service delivery for individual customers (including employees and pensioners), and for PAYE, Self Assessment, National Insurance, other taxes including Inheritance Tax and Capital Gains Tax, and delivery of Real Time Information. The Director General is also HMRC’s Head of Profession for Operational Delivery and Diversity champion for gender.",Her Majesty's Revenue and Customs,Her Majesty's Revenue and Customs,PT Director,N/D,ContactUs@hmrc.gsi.gov.uk,OD373,3651000,1,N/A,N/A,Operational Delivery,,1
OD600,N/D,SCS1,Head of Operational Delivery Profession,"The Director General, Personal Tax, has overall responsibility for policy and service delivery for individual customers (including employees and pensioners), and for PAYE, Self Assessment, National Insurance, other taxes including Inheritance Tax and Capital Gains Tax, and delivery of Real Time Information. The Director General is also HMRC’s Head of Profession for Operational Delivery and Diversity champion for gender.",Her Majesty's Revenue and Customs,Her Majesty's Revenue and Customs,PT Director,N/D,ContactUs@hmrc.gsi.gov.uk,OD103,453000,1,N/A,N/A,Operational Delivery,,1
TBC,N/D,SCS2,Director Estates & Support Services,"Estates and Support Services' role is to provide HMRC with an estate that meets the future needs of the business. That includes the provision of a safe and secure environment, with affordable services that help support the delivery of business objectives.",Her Majesty's Revenue and Customs,Her Majesty's Revenue and Customs,Estates & Support Services,N/D,ContactUs@hmrc.gsi.gov.uk,OD105,12813000,0.9,N/A,N/A,Operational Delivery,Job Share,1
OD274,Melissa Tatton,SCS2,Director - Individuals & Small Business Compliance,"The Individuals and Small Business Compliance (ISBC) directorate deals with HMRC's largest and most diverse group of customers, nearly 35 million individuals and businesses - the people who drive the UK's economy. ISBC leads work tackling the hidden economy, international trade, and National Minimum Wage enforcement, and it hosts HMRC's anti money laundering supervision team. The directorate plays a key role in improving joint working across government, and in using data to inform and shape policy and operational responses.",Her Majesty's Revenue and Customs,Her Majesty's Revenue and Customs,Individuals & Small Business Compliance,N/D,ContactUs@hmrc.gsi.gov.uk,OD106,0,1,95000,99999,Tax Professionals,,1
OD297,N/D,SCS1,Deputy Director Individuals & Small Business Compliance Operations,"The Individuals and Small Business Compliance (ISBC) directorate deals with HMRC's largest and most diverse group of customers, nearly 35 million individuals and businesses - the people who drive the UK's economy. ISBC leads work tackling the hidden economy, international trade, and National Minimum Wage enforcement, and it hosts HMRC's anti money laundering supervision team. The directorate plays a key role in improving joint working across government, and in using data to inform and shape policy and operational responses.",Her Majesty's Revenue and Customs,Her Majesty's Revenue and Customs,Individuals & Small Business Compliance,N/D,ContactUs@hmrc.gsi.gov.uk,OD274,8877000,1,N/A,N/A,Tax Professionals,,1
OD298,N/D,SCS1,Deputy Director SME,"The Individuals and Small Business Compliance (ISBC) directorate deals with HMRC's largest and most diverse group of customers, nearly 35 million individuals and businesses - the people who drive the UK's economy. ISBC leads work tackling the hidden economy, international trade, and National Minimum Wage enforcement, and it hosts HMRC's anti money laundering supervision team. The directorate plays a key role in improving joint working across government, and in using data to inform and shape policy and operational responses.",Her Majesty's Revenue and Customs,Her Majesty's Revenue and Customs,Individuals & Small Business Compliance,N/D,ContactUs@hmrc.gsi.gov.uk,OD274,155520000,1,N/A,N/A,Tax Professionals,,1
OD301,N/D,SCS1,"Deputy Director Local Compliance, Central Compliance Operations","The Individuals and Small Business Compliance (ISBC) directorate deals with HMRC's largest and most diverse group of customers, nearly 35 million individuals and businesses - the people who drive the UK's economy. ISBC leads work tackling the hidden economy, international trade, and National Minimum Wage enforcement, and it hosts HMRC's anti money laundering supervision team. The directorate plays a key role in improving joint working across government, and in using data to inform and shape policy and operational responses.",Her Majesty's Revenue and Customs,Her Majesty's Revenue and Customs,Individuals & Small Business Compliance,N/D,ContactUs@hmrc.gsi.gov.uk,OD274,42273000,1,N/A,N/A,Tax Professionals,,1
OD303,N/D,SCS1,Deputy Director CITEX Operations,"The Individuals and Small Business Compliance (ISBC) directorate deals with HMRC's largest and most diverse group of customers, nearly 35 million individuals and businesses - the people who drive the UK's economy. ISBC leads work tackling the hidden economy, international trade, and National Minimum Wage enforcement, and it hosts HMRC's anti money laundering supervision team. The directorate plays a key role in improving joint working across government, and in using data to inform and shape policy and operational responses.",Her Majesty's Revenue and Customs,Her Majesty's Revenue and Customs,Individuals & Small Business Compliance,N/D,ContactUs@hmrc.gsi.gov.uk,OD274,31185000,1,N/A,N/A,Operational Delivery,,1
OD305,N/D,SCS1,"Deputy Director ISB Compliance - Planning, Performance & Governance.","The Individuals and Small Business Compliance (ISBC) directorate deals with HMRC's largest and most diverse group of customers, nearly 35 million individuals and businesses - the people who drive the UK's economy. ISBC leads work tackling the hidden economy, international trade, and National Minimum Wage enforcement, and it hosts HMRC's anti money laundering supervision team. The directorate plays a key role in improving joint working across government, and in using data to inform and shape policy and operational responses.",Her Majesty's Revenue and Customs,Her Majesty's Revenue and Customs,Individuals & Small Business Compliance,N/D,ContactUs@hmrc.gsi.gov.uk,OD274,3686000,1,N/A,N/A,Operational Delivery,,1
OD554,N/D,SCS1,Deputy Director ISB policy strategy & Customer insight,Counter-Avoidance directorate brings together in one place the Department’s casework on marketed tax avoidance schemes and policy work on avoidance.,Her Majesty's Revenue and Customs,Her Majesty's Revenue and Customs,Counter Avoidance Directorate,N/D,ContactUs@hmrc.gsi.gov.uk,OD274,9560000,1,N/A,N/A,Operational Delivery,Job Share,1
OD114,N/D,SCS1,Assistant Director,"The Large Business Directorate (LB) is responsible for assuring the tax compliance of the 2,000+ largest businesses operating in the UK. LB's Customer Relationship Managers - experienced tax professionals, trained to the highest levels of tax compliance - lead teams of highly skilled specialists to man-mark these most complex and potentially high-risk business customers. LB employs around 2550 people across 27 sites around the country and also draws on the expertise of specialists in other BT directorates.",Her Majesty's Revenue and Customs,Her Majesty's Revenue and Customs,Large Business,N/D,ContactUs@hmrc.gsi.gov.uk,OD193,0,1,N/A,N/A,Tax Professionals,Salary costs included in OD193,1
OD167,N/D,SCS1,Assistant Director,"The Large Business Directorate (LB) is responsible for assuring the tax compliance of the 2,000+ largest businesses operating in the UK. LB's Customer Relationship Managers - experienced tax professionals, trained to the highest levels of tax compliance - lead teams of highly skilled specialists to man-mark these most complex and potentially high-risk business customers. LB employs around 2550 people across 27 sites around the country and also draws on the expertise of specialists in other BT directorates.",Her Majesty's Revenue and Customs,Her Majesty's Revenue and Customs,Large Business,N/D,ContactUs@hmrc.gsi.gov.uk,OD531,0,1,N/A,N/A,Tax Professionals,Salary costs included in OD531,1
OD169,N/D,SCS1,Assistant Director,"The Large Business Directorate (LB) is responsible for assuring the tax compliance of the 2,000+ largest businesses operating in the UK. LB's Customer Relationship Managers - experienced tax professionals, trained to the highest levels of tax compliance - lead teams of highly skilled specialists to man-mark these most complex and potentially high-risk business customers. LB employs around 2550 people across 27 sites around the country and also draws on the expertise of specialists in other BT directorates.",Her Majesty's Revenue and Customs,Her Majesty's Revenue and Customs,Large Business,N/D,ContactUs@hmrc.gsi.gov.uk,OD180,0,1,N/A,N/A,Tax Professionals,Salary costs included in OD180,1
OD170,N/D,SCS1,Assistant Director,"The Large Business Directorate (LB) is responsible for assuring the tax compliance of the 2,000+ largest businesses operating in the UK. LB's Customer Relationship Managers - experienced tax professionals, trained to the highest levels of tax compliance - lead teams of highly skilled specialists to man-mark these most complex and potentially high-risk business customers. LB employs around 2550 people across 27 sites around the country and also draws on the expertise of specialists in other BT directorates.",Her Majesty's Revenue and Customs,Her Majesty's Revenue and Customs,Large Business,N/D,ContactUs@hmrc.gsi.gov.uk,OD193,0,1,N/A,N/A,Tax Professionals,Salary costs included in OD193,1
OD172,N/D,SCS1,HRCP Programme Leader,"The Large Business Directorate (LB) is responsible for assuring the tax compliance of the 2,000+ largest businesses operating in the UK. LB's Customer Relationship Managers - experienced tax professionals, trained to the highest levels of tax compliance - lead teams of highly skilled specialists to man-mark these most complex and potentially high-risk business customers. LB employs around 2550 people across 27 sites around the country and also draws on the expertise of specialists in other BT directorates.",Her Majesty's Revenue and Customs,Her Majesty's Revenue and Customs,Large Business,N/D,ContactUs@hmrc.gsi.gov.uk,OD185,380000,1,N/A,N/A,Tax Professionals,,1
OD174,N/D,SCS1,Assistant Director,"The Large Business Directorate (LB) is responsible for assuring the tax compliance of the 2,000+ largest businesses operating in the UK. LB's Customer Relationship Managers - experienced tax professionals, trained to the highest levels of tax compliance - lead teams of highly skilled specialists to man-mark these most complex and potentially high-risk business customers. LB employs around 2550 people across 27 sites around the country and also draws on the expertise of specialists in other BT directorates.",Her Majesty's Revenue and Customs,Her Majesty's Revenue and Customs,Large Business,N/D,ContactUs@hmrc.gsi.gov.uk,OD193,0,1,N/A,N/A,Operational Delivery,Salary costs included in OD492,1
OD175,N/D,SCS1,Assistant Deputy Director,"The Large Business Directorate (LB) is responsible for assuring the tax compliance of the 2,000+ largest businesses operating in the UK. LB's Customer Relationship Managers - experienced tax professionals, trained to the highest levels of tax compliance - lead teams of highly skilled specialists to man-mark these most complex and potentially high-risk business customers. LB employs around 2550 people across 27 sites around the country and also draws on the expertise of specialists in other BT directorates.",Her Majesty's Revenue and Customs,Her Majesty's Revenue and Customs,Large Business,N/D,ContactUs@hmrc.gsi.gov.uk,OD532,0,1,N/A,N/A,Operational Delivery,Salary costs included in OD532,1
OD176,N/D,SCS1,Assistant Director,"The Large Business Directorate (LB) is responsible for assuring the tax compliance of the 2,000+ largest businesses operating in the UK. LB's Customer Relationship Managers - experienced tax professionals, trained to the highest levels of tax compliance - lead teams of highly skilled specialists to man-mark these most complex and potentially high-risk business customers. LB employs around 2550 people across 27 sites around the country and also draws on the expertise of specialists in other BT directorates.",Her Majesty's Revenue and Customs,Her Majesty's Revenue and Customs,Large Business,N/D,ContactUs@hmrc.gsi.gov.uk,OD201,0,1,N/A,N/A,Tax Professionals,Salary costs included in OD201,1
OD177,N/D,SCS1,Assistant Director,"The Large Business Directorate (LB) is responsible for assuring the tax compliance of the 2,000+ largest businesses operating in the UK. LB's Customer Relationship Managers - experienced tax professionals, trained to the highest levels of tax compliance - lead teams of highly skilled specialists to man-mark these most complex and potentially high-risk business customers. LB employs around 2550 people across 27 sites around the country and also draws on the expertise of specialists in other BT directorates.",Her Majesty's Revenue and Customs,Her Majesty's Revenue and Customs,Large Business,N/D,ContactUs@hmrc.gsi.gov.uk,OD531,0,1,N/A,N/A,Tax Professionals,Salary costs included in OD531,1
OD178,N/D,SCS1,Assistant Director,"The Large Business Directorate (LB) is responsible for assuring the tax compliance of the 2,000+ largest businesses operating in the UK. LB's Customer Relationship Managers - experienced tax professionals, trained to the highest levels of tax compliance - lead teams of highly skilled specialists to man-mark these most complex and potentially high-risk business customers. LB employs around 2550 people across 27 sites around the country and also draws on the expertise of specialists in other BT directorates.",Her Majesty's Revenue and Customs,Her Majesty's Revenue and Customs,Large Business,N/D,ContactUs@hmrc.gsi.gov.uk,OD206,0,1,N/A,N/A,Tax Professionals,Salary costs included in OD206,1
OD179,N/D,SCS1,Head of Accountancy,"The Large Business Directorate (LB) is responsible for assuring the tax compliance of the 2,000+ largest businesses operating in the UK. LB's Customer Relationship Managers - experienced tax professionals, trained to the highest levels of tax compliance - lead teams of highly skilled specialists to man-mark these most complex and potentially high-risk business customers. LB employs around 2550 people across 27 sites around the country and also draws on the expertise of specialists in other BT directorates.",Her Majesty's Revenue and Customs,Her Majesty's Revenue and Customs,Large Business,N/D,ContactUs@hmrc.gsi.gov.uk,OD185,0,1,N/A,N/A,Tax Professionals,Salary costs included in OD185,1
OD180,N/D,SCS1,LBS Deputy Director (Birmingham),"The Large Business Directorate (LB) is responsible for assuring the tax compliance of the 2,000+ largest businesses operating in the UK. LB's Customer Relationship Managers - experienced tax professionals, trained to the highest levels of tax compliance - lead teams of highly skilled specialists to man-mark these most complex and potentially high-risk business customers. LB employs around 2550 people across 27 sites around the country and also draws on the expertise of specialists in other BT directorates.",Her Majesty's Revenue and Customs,Her Majesty's Revenue and Customs,Large Business,N/D,ContactUs@hmrc.gsi.gov.uk,OD204,7526000,1,N/A,N/A,Tax Professionals,Includes salary costs for OD209,1
OD181,N/D,SCS1,Assistant Director,"The Large Business Directorate (LB) is responsible for assuring the tax compliance of the 2,000+ largest businesses operating in the UK. LB's Customer Relationship Managers - experienced tax professionals, trained to the highest levels of tax compliance - lead teams of highly skilled specialists to man-mark these most complex and potentially high-risk business customers. LB employs around 2550 people across 27 sites around the country and also draws on the expertise of specialists in other BT directorates.",Her Majesty's Revenue and Customs,Her Majesty's Revenue and Customs,Large Business,N/D,ContactUs@hmrc.gsi.gov.uk,OD206,0,1,N/A,N/A,Tax Professionals,Salary costs included in OD206,1
OD182,N/D,SCS1,Assistant Director,"The Large Business Directorate (LB) is responsible for assuring the tax compliance of the 2,000+ largest businesses operating in the UK. LB's Customer Relationship Managers - experienced tax professionals, trained to the highest levels of tax compliance - lead teams of highly skilled specialists to man-mark these most complex and potentially high-risk business customers. LB employs around 2550 people across 27 sites around the country and also draws on the expertise of specialists in other BT directorates.",Her Majesty's Revenue and Customs,Her Majesty's Revenue and Customs,Large Business,N/D,ContactUs@hmrc.gsi.gov.uk,OD201,0,1,N/A,N/A,Operational Delivery,Salary costs included in OD201,1
