Ratepayer,Billing Account Balance ,Liable Unit Balance ,Year,Property Address,Billing Address,Date Start,Date End
Amatex Catering Services Ltd [In Administration],-212.72,-212.72,2007,"Square Road, Halifax, HX1 1QG","Ashcroft Business, Recovery & Insolvency, 601 High Road, Leytonstone, London, E11 4PA",12/15/06,09/27/07
D T S Yorkshire Ltd,-53.41,-53.41,2008,"Unit HM14 Holmfield Mills, Holdsworth Road, Halifax, HX3 6SN","27 Illingworth Close, Halifax, HX2 9JQ",12/01/06,10/28/08
Cheque Centres Properties Ltd (In Liquidation),-395.2,-395.2,2014,"6 Cheapside, Halifax, HX1 1TQ","Kpmg, Saltire Court, 20 Castle Terrace, Edinburgh, EH1 2EG",03/23/07,07/02/14
Halifax Property Services Ltd,-1361.5,-1361.5,2012,"Unit 2a, West Parade, Halifax, HX1 2TE","Fagley Lane, Eccleshill, Bradford, BD2 3NT",04/01/10,03/31/12
,-23.78,-23.78,2008,"Upperfoot Farm Shop, Burnley Road, Luddendenfoot, Halifax              HX2 6HL",,12/19/06,03/02/09
,-1.1,-1.1,2012,"27 Southgate, Elland, HX5 0BW",,05/04/07,
,-47.84,-47.84,2009,"Unit 6G, Calderdale Business Park, Club Lane, Halifax              HX2 8DB",,04/01/07,09/30/09
Calderdale Healthcare N.H.S Trust,-40.09,-40.09,1999,"Todmorden Health Centre, Rose Street, Todmorden, OL14 5AT","Royal Halifax Infirmary, Free School Lane, Halifax, HX1 2YF",04/01/91,03/31/00
,-4.22,-4.22,2007,"Unit 5b Mill House Works, Mill House Lane, Triangle, HX6 3LN",,11/07/06,01/01/08
Fred Howarth Ltd,-9.5,-9.5,2011,"Unit 25 Robinwood Mill, Burnley Road, Todmorden, OL14 8JA","Jumps Road, Livegate, Todmorden, OL14 8HJ",08/01/07,03/31/12
Global Textiles Associates Ltd,-19.32,-19.32,2012,"Office H M 3.0, Holmfield Mills, Holdsworth Road, Halifax              HX3 6SN","Office H M 3.0, Holmfield Mills, Holdsworth Road, Halifax, HX3 6SN",03/01/07,03/31/14
,-884.65,-884.65,2016,"Brow Side Farm, Medley Lane, Northowram, Halifax              HX3 7SX",,04/25/07,03/31/16
Maramar Properties Ltd,-810.3,-810.3,2007,"Carlton Chambers, 1 King Cross Street, Halifax, HX1 2SG","Mile Thorn Works, Gibbet Street, Halifax, HX1 4JR",05/01/07,09/30/07
Tefonica O2 (Uk) Ltd,-254.1,-666.7,2013,"Telecommunication Mast, Site Ref 18479, Old Lindley Road, Holywell Green       HX4 9DF","Fao Telecoms Rating Team, C/O Cluttons Llp, Portman House, 2 Portman Street, London, W1H 6DU",04/01/05,
Haley Bros [ Builders] Ltd [In Liquidation],-3.61,-3.61,2008,"Suite 3, 1st Floor, Burlees House, Hangingroyd Lane, Hebden Bridge       HX7 7DD","C/O X.L Business Solutions, 1st Floor, 2-4 West Street, Cleckheaton, BD19 5AJ",08/31/07,12/10/08
,-25.29,-25.29,2008,"43 Crown Street, Halifax, HX1 1JB",,06/01/08,03/18/09
Pouchpak Ltd,-18.9,-18.9,2010,"161B First Floor, King Cross Road, Halifax, HX1 3LN","6 Princess Terrace, Halifax, HX1 2NH",06/01/08,10/01/10
Quarmby Promotions Ltd,-1209.84,-1209.84,2010,"Unit 1, Sherwood Road, Brighouse, HD6 1QG","Units 22-23, Howley Park Business Village, Howley Park Road, Morley, Leeds, LS27 0BZ",05/14/08,07/31/10
Broadbent Stanley Ltd,-81,-81,2014,"Quarry House, Burnley Road, Sowerby Bridge, HX6 2TF","Holmfield Works, Shay Lane, Halifax, HX3 6RS",10/01/06,05/11/14
,-577.55,-577.55,2008,"Market Stall 101-103, Market Hall, Borough Market, Halifax             HX1 1DZ",,04/01/08,11/21/08
Lets Talk Phones Ltd,-149.53,-149.53,2008,"270 Queens Road, Halifax, HX1 4NJ","270 Queens Road, Halifax, HX1 4NJ",04/01/08,09/13/08
,-6.88,-6.88,2012,"Prince Albert Inn, 17 St Martins View, Brighouse, HD6 2AZ",,11/11/08,03/04/13
,-55.65,-55.65,2008,"619 Bradford Road, Bailiff Bridge, Brighouse, HD6 4DL",,08/15/08,06/05/09
,-224.21,-900.19,2010,"Market Stall 5,6-8, Borough Market, Halifax, HX1 1DZ",,12/01/08,11/09/12
,-402.45,-806.33,2011,"11/13 Albion Street, Halifax, HX1 1DU",,04/01/09,12/31/11
,-184.01,-806.33,2012,"11/13 Albion Street, Halifax, HX1 1DU",,04/01/09,12/31/11
Blackshaw Holdings Ltd,-224.07,-224.07,2013,"Swales Moor Yard, Swales Moor Road, Halifax, HX3 6UF","St Bernards Mill, Gelderd Road, Gildersome, Leeds, LS27 7NA",08/13/13,12/31/13
Aspire Crafts Ltd,-301.42,-301.42,2014,"Unit 5 Riverside Mills, Saddleworth Road, Elland, HX5 0RY","Second Floor, Unit 5 Wellington Mills, Quebec Street, Elland, HX5 9AS",07/19/13,08/31/14
,-0.57,-0.57,2012,"95 Gibbet Street, Halifax, HX1 5BP",,09/01/08,
,-0.55,-0.55,2012,"Unit 8A Robinwood Mill, Burnley Road, Todmorden, OL14 8JA",,09/01/08,
,-14.98,-14.98,2010,"Unit 11 First Floor, Mearclough Works, Mearclough Road, Sowerby Bridge       HX6 3LF",,08/11/09,05/18/10
Calder High School,-226.36,-226.36,2012,"Stubb Playing Fields, Mytholmroyd, Hebden Bridge, HX7 5AP","Midgley Road, Mytholmroyd, Hebden Bridge, HX7 5QN",04/01/09,11/07/12
Floor My Home Ltd In Administration,-134.98,-396.2,2011,"Unit 2 Halifax Retail Park, Pellon Lane, Halifax, HX1 5QP","Haslers, Old Station Road, Loughton, Essex, IG10 4PL",09/26/09,08/24/11
Primesight Ltd,-0.03,317.97,2014,"Boards 1026 & 4022, Co-Op Supermarket, King Cross Road, Halifax              HX1 3RJ","Unit 9 Westpoint Enterprise Pk, Clarence Avenue, Trafford Park, Manchester, M17 1QS",09/01/09,
M.E Pubs Ltd,-169.19,-169.19,2010,"Shoulder Of Mutton Inn, 1 Carr House Lane, Shelf, Halifax             HX3 7RB",No Forwarding Address,03/16/10,10/26/10
,-5.51,-5.51,2011,"103/105 Gibbet Street, Halifax, HX1 5BP",,02/01/10,05/01/11
,-18.99,-18.99,2012,"27 Old Lane, Brighouse, HD6 1UB",,01/01/10,
,-2206.88,-5812.39,2011,"Cromwell Bottom, Elland Road, Brighouse, HD6 2RG",,04/01/10,03/31/10
West Yorkshire Plant Hire Ltd,-10,-10,2010,"Unit 5 Springwood Bu'ss Park, Brookwoods Industrial Estate, Burrwood Way, Holywell Green       HX4 9BH","Unit 6, Woodman Works, South Lane, Elland, HX5 0PA",04/26/10,06/11/10
,-241.07,-130.46,2011,"Heaton Street, Brighouse, HD6 1HG",,04/01/10,03/31/16
,-843.27,-843.27,2009,"Stanley Works, Lucy Street, Halifax, HX3 6AL",,06/01/04,05/31/04
Abbey Business Contracts Ltd (In Liquidation),-55.4,-55.4,2010,"18 Huddersfield Road, Elland, HX5 9DW","O'Hara & Co, C/O Wesley House, Huddersfield Road, Birstall, Batley, WF17 9EJ",09/01/10,09/13/10
,-50.02,-69.42,2011,"Market Stall 124/131, Market Hall, Borough Market, Halifax             HX1 1DZ",,11/22/10,03/31/13
,-1609.46,-1609.46,2011,"Sedburgh Road, Halifax, HX3 9HB",,03/28/11,04/30/11
,-94.79,-94.79,2012,"2 Westfield Place, Halifax, HX1 3YH",,04/01/11,03/31/13
,-1277.35,-8289.02,2011,"Unit 3G / H South Mill, White Rose Mill, Holdsworth Road, Halifax              HX3 6SN",,09/01/10,
,-1327.5,-8289.02,2012,"Unit 3G / H South Mill, White Rose Mill, Holdsworth Road, Halifax              HX3 6SN",,09/01/10,
Millwood Vehicle Services Ltd,-56,-56,2012,"Unit 2 Harley House Mill, Todmorden, OL14 5JE","Harley Mill, Harley Street, Todmorden, OL14 5JE",04/01/12,03/31/12
,-11.87,-11.87,2015,"7A Stansfield Road, Todmorden, OL14 5DN",,04/01/12,01/21/16
,-244.94,-244.94,2014,"17 Commercial Street, Brighouse, HD6 1AF",,07/01/12,11/26/14
,-1036.5,-1036.5,2013,"Opp Victoria Works, Calder Street, Brighouse, HD6 1LZ",,09/29/12,09/28/12
Kimpton Building Services Ltd,-259.89,-259.89,2014,"Office 1, 4 Albert Street, Hebden Bridge, HX7 8AH",No Forwarding Address,01/01/13,08/31/14
National Trust For Scotland,-2614.68,-2614.68,2014,"Part First Floor, Unit H6 Premier Way, Lowfields Business Park, Elland               HX5 9HF","Hermiston Quay, 5 Cultins Road, Edinburgh, EH11 4DF",04/22/13,11/12/14
Primesight Ltd,-0.04,239.96,2014,"Advertising Right, 115 Gibbet Street, Halifax, HX1 5BP","Unit 9 Westpoint Enterprise Pk, Clarence Avenue, Trafford Park, Manchester, M17 1QS",09/01/09,
Primesight Ltd,-0.03,317.97,2014,"Adj 38 Halifax Road, Hipperholme, Halifax, HX3 8ER","Unit 9 Westpoint Enterprise Pk, Clarence Avenue, Trafford Park, Manchester, M17 1QS",09/01/09,
,-11,29,2013,"Unit 4 Hope Mill, Raglan Street, Todmorden, OL14 5HF",,04/01/10,
S & A Health Ltd,-11.84,-11.84,2012,"93 Turner Avenue South, Illingworth, Halifax, HX2 8EF","30 Keighley Road, Bingley, BD16 2EZ",02/27/10,03/27/13
,-70.22,-70.22,2012,"9A/10A &11A, Lees Buildings, Halifax Road, Hipperholme",,03/01/11,06/30/12
,-281.1,-281.1,2011,"Arches At Bowling Dyke, Under North Bridge, Halifax, HX3 6TD",,05/23/10,12/23/11
,-97.71,-97.71,2011,"1 Whitwell Grove, Elland, HX5 9EJ",,10/18/10,01/31/12
,-0.01,-0.01,2014,"7 Northgate, Halifax, HX1 1UR",,03/01/11,08/20/16
Rand & Asquith Ltd,-362.4,-727.82,2015,"Hunters Hill Quarry, Withens Road, Wainstalls, Halifax              HX2 7TZ","Tuck Royd Quarry Stoneyard, Halifax Road, Brighouse, HD6 2PL",04/01/10,
,-1.07,-1.07,2012,"Units 3 & 4A, Catherine Street, Elland, HX5 0EZ",,03/27/11,
,-5.6,-5.6,2012,"Storeroom 3 Market Hall, Brook Street, Todmorden, OL14 5AJ",,09/01/11,01/13/13
,-65.65,-65.65,2013,"Unit 2A Crossley Works, Cragg Road, Mytholmroyd, Hebden Bridge        HX7 5HR",,12/01/12,06/30/13
,-41.75,-41.75,2014,"Norset House, West View, Boothtown, Halifax              HX3 6PG",,01/17/13,12/31/14
,-1606.4,-16287.27,2010,"Windmill Court Country Hotel, Keighley Road, Halifax, HX2 8YB",,04/01/10,
,-2520,-16287.27,2012,"Windmill Court Country Hotel, Keighley Road, Halifax, HX2 8YB",,04/01/10,
Trustees Of The Oddyssey Glass Pension Scheme,-872.61,-872.61,2015,"Unit 4B, High Level Way, Queens Road, Halifax              HX1 4PS","C/O Walker Singleton, Property House, Lister Lane, Halifax, HX1 5AS",03/19/13,06/30/15
Bizspace Ltd,-842.62,-842.62,2015,"Unit 16I & Unit 16J, Calderdale Business Park, Club Lane, Halifax              HX2 8DB","Sovereign House, Fao Mital Shah, 1 Albert Place, Finchley, London, N3 1QB",01/01/14,01/24/16
Marrtree Investments Limited,-1264.55,-2093.75,2014,"Unit 22, Branxholme Industrial Est., Bradford Road, Brighouse            HD6 4EA","4a Greengate, Cadale Park, Harrogate, HG3 1GY",02/08/14,12/07/14
Marrtree Investments Limited,-829.2,-2093.75,2015,"Unit 22, Branxholme Industrial Est., Bradford Road, Brighouse            HD6 4EA","4a Greengate, Cadale Park, Harrogate, HG3 1GY",02/08/14,12/07/14
Welcome Independent Living Ltd,-600,-600,2015,"2ND Floor Unit 1, New Oxford House, Albert Street, Hebden Bridge        HX7 8AH","F.A.O Mr Mark Coup, New Oxford House, Albert Street, Hebden Bridge, HX7 8AH",04/01/15,03/31/15
Ovenden Road Ltd (Company Dissolved 6.10.15),-1229.01,-1381.47,2014,"White Horse Inn, Spring Gardens, Burnley Road, Sowerby Bridge      HX6 2TW","2 South Lane, Elland, HX5 0HG",07/21/14,05/01/15
K D T Accountancy & Taxation Services Ltd,-0.01,-0.01,2010,"20 Cow Green, Halifax, HX1 1HX",,08/14/10,
,-435.79,-435.79,2014,"Northern Timber Merchants, Gooder Lane, Brighouse, HD6 1HF",,12/08/14,01/31/15
Bizspace Ltd,-192.3,-192.3,2016,"Unit 18H, Calderdale Business Park, Club Lane, Halifax              HX2 8AX","Sovereign House, Fao Mital Shah, 1 Albert Place, Finchley, London, N3 1QB",11/01/14,12/02/15
James Robinson Fibres Ltd,-225.2,-361.52,2016,"56 Huddersfield Road, Elland, HX5 9AA","Millersdale Close, Euroway Industrial Estate, Bradford, BD4 6SG",03/07/16,03/06/16
Wattlid Ltd,-4613.29,-4613.29,2015,"Units 18C, 18D & 18E, Moderna Business Park, Burnley Road, Mytholmroyd          HX7 5QQ","The Continuum, Moderna Business Park, Mytholmroyd, HX7 5QQ",07/01/14,08/31/15
Marie Curie Cancer Care,-1200.08,-1200.08,2013,"1 Corn Market, Halifax, HX1 1TH","Suite One Enterprise House, Cheney Manor Industrial Estate, Swindon, Wiltshire, SN2 2YZ",03/01/14,
,-1144.84,-1144.84,2016,"19 Crown Street, Hebden Bridge, HX7 8EH",,09/27/15,10/01/16
The Wakefield Diocesan Board Of Education,-4996.75,-4996.75,2016,"Adult Education Centre, Church Lane, Brighouse, HD6 1AT","Church House, 1 South Parade, Wakefield, WF1 1LP",09/05/15,
Carillion Utility Services Group Ltd,-1235.7,-1235.7,2014,"Carillion, Black Brook Way, Stainland Road, Greetland            HX4 8BQ","P O Box 4919, Sheffield, S1 9FY",11/01/13,05/31/14
Dean Clough Ltd,-5416.5,-12118.95,2014,"Crib Lane Level 3 Bottom, Dean Clough Mils, Halifax, HX3 5AX","Office Suite E345, Dean Clough, Halifax, HX3 5AX",12/24/12,05/31/13
Melling Construction Ltd,-62.73,-62.73,2015,"Unit 36A, Phoebe Lane Industrial Est., Phoebe Lane, Halifax              HX3 9EX","Shed 1 Merton Grange, Bielby, York, YO42 4JW",12/01/15,02/19/16
Golden Monkeys Ltd,-0.01,1566.35,2015,"Golden Lion Hotel, Fielden Square, Todmorden, OL14 6LZ","21 Hyde Park Road, Leeds, LS6 1PY",03/01/15,
,-5749.99,-8232.32,2015,"Part First Floor, 25B Union Street, Halifax, HX1 1PR",,06/27/14,04/30/15
T E V Ltd,-464.54,29631.46,2013,"Unit 4 Armytage Road, Brighouse, HD6 1QF","Armytage Road, Brighouse, HD6 1QF",01/01/14,
,-318.45,-318.45,2015,"Unit 1B, Dean Hey Country Business Pk, Cragg Road, Mytholmroyd          HX7 5RU",,04/01/14,12/31/15
,-257.18,-257.18,2016,"10 Wards End, Halifax, HX1 1BX",,10/01/14,06/18/16
Calderdale Mbc,-8328.15,-8328.15,2016,"Cmbc Museum, Square Road, Halifax, HX1 1QG","Land And Property Services, Northgate House, Northgate, Halifax, HX1 1UN",04/01/13,08/10/16
Bizspace Ltd,-149.35,-149.35,2015,"Units 12A & 12B, Calderdale Business Park, Club Lane, Halifax              HX2 8AX","Sovereign House, Fao Mital Shah, 1 Albert Place, Finchley, London, N3 1QB",06/02/14,09/30/14
,-147.88,-147.88,2015,"Unit 4 Victoria Lodge, 30 Lister Lane, Halifax, HX1 5AX",,10/02/14,05/30/15
Kino & Co,-198.91,-450.56,2016,"Unit HM30 Holmfield Mills, Holdsworth Road, Halifax, HX3 6SN","Office H M 2.0, Holmfield Mills, Holdsworth Road, Halifax, HX3 6SN",04/01/15,04/30/16
,-199.89,-199.89,2015,"Stanley Works, Lucy Street, Halifax, HX3 6AL",,05/20/15,06/21/15
Marrtree Investments Limited,-309.09,-309.09,2015,"Unit 5 Branxholme Estate, Bradford Road, Bailiff Bridge, Brighouse            HD6 4EA","4a Greengate, Cadale Park, Harrogate, HG3 1GY",10/10/14,12/22/14
Controlled Speed Ltd In Administration,-748.28,-1599.81,2011,"St Pegs House, Thornhill Beck Lane, Brighouse, HD6 4AW","Frp Advisory Llp, 1 St Ann Street, Manchester, M2 7LR",09/15/01,11/16/11
,-0.01,-0.01,2010,"Model Railway Club, Cawcliffe Road, Brighouse, HD6 2HP",,04/01/90,
Adtech Studios Ltd (In Liquidation),-9.95,-9.95,2002,"Unit 2, County Workshops, Clifton Road, Brighouse           HD6 1SL","C/O Messrs Revell Ward, Horton, Norwich Union House, High StreetHuddersfield",10/14/91,11/09/92
Dempster H Lister Ltd [In Liquidation],-543.81,-543.81,2002,"9 Commercial Street, Brighouse, HD6 1AF","C/O Cork Gully, Benson House, 33 Wellington Street, Leeds, LS1 4JP",04/01/90,12/12/98
Eccles & Scott Ltd,-214.38,-214.38,2004,"Ground Floor, Cromwell House, Elland Road, Brighouse            HD6 2RG","Cromwell House, 421 Elland Road, Brighouse, HD6 2RG",12/01/00,01/24/05
Jack Pearson (Turf Accountants) Ltd,-8.43,-8.43,2012,"16 Victoria Road, Elland, HX5 0PU","44 Wood Street, Huddersfield, HD1 1EG",04/01/90,07/17/12
,-55.88,-55.88,2002,"Albert Street, Halifax, HX1 5NW",,03/21/95,03/01/96
A H Fabrications (Halifax) Ltd (In Receivership),-224.82,-224.82,2002,"Arundel Street, Halifax, HX1 4LE","C/O Messrs Grant Thornton, St Johns Centre, 110 Albion Street, Leeds, LS2 8LA",04/01/90,04/01/91
,-1.08,-1.08,2012,"95 Ovenden Road, Ovenden, Halifax, HX3 5RQ",,11/12/01,
,-0.3,-0.3,2012,"35 Borough Market, Halifax, HX1 1DY",,04/01/90,
G.J.B Upholstery Services Ltd [In Liquidation],-258.49,-258.49,2002,"51 Smithy Carr Lane, Brighouse, HD6 4BG","C/O A M Rogers, 9 South Lane, Holmfirth, HD7 1HN",04/01/90,01/27/94
,-6.58,-6.58,2002,"Unit 2, Upper Bonegate, Brighouse, HD6 1RT",,04/01/01,09/29/02
Woodvale Holdings Ltd [In Liquidation],-391.78,-391.78,2002,"Oak House, Woodvale Road, Brighouse, HD6 4AB","C/O Pannell Kerr & Forster, Ref L/73057/CVL/1304/DMH/IPS, 6 Queen Street, Leeds,, LS1 2TW",11/29/91,10/11/93
,-7104,-77567.88,2007,"The Surgery, Burley Street, Elland, HX5 0AQ",,04/01/90,
,-131.17,-131.17,2016,"Elland Lane, Elland, HX5 9ER",,06/09/92,
Neal Brothers (Leicester)Ltd,-34.46,-34.46,2001,"Bay 1, Rosemount Estate, Huddersfield Road, Elland               HX5 0EE","Queens Buildings, Hastings Road, LEICESTERle5 Olj",10/16/00,09/29/01
,-22.75,-22.75,2012,"Rear 59 Huddersfield Road, Elland, HX5 9AA",,01/01/97,
J W Mitchell & Sons Ltd (In Liquidation),-2.67,-2.67,2002,"Unit 11, The Ainleys, Huddersfield Road, Elland              HX5 9DW","C/O Messrs K W Howarth & Co, 36 Clare Road, Halifax, HX1 2HX",04/22/91,09/30/92
,-12.81,-12.81,2002,"Pressers Arms Inn, 2 South Lane, Elland, HX5 0HG",,10/10/96,05/21/97
Outsourced Credit Management Ltd,-287.26,-287.26,2006,"3 Carlton Place, Halifax, HX1 2SB","3 Carlton Place, Halifax, HX1 2SB",08/01/99,04/30/06
,-25.99,-25.99,2002,"Goose Inn, 24 Causeway Foot, Halifax, HX2 8YB",,11/01/94,06/23/95
,-361.78,-361.78,2002,"Part 1ST Floor, 18 Clare Road, Halifax, HX1 2HX",,09/18/00,03/31/01
,-107.95,-107.95,2012,"Coal Lane, Ogden, Halifax, HX2 9PG",,04/01/93,
Halifax Estate Agencies Ltd,-2441.61,-2441.61,2009,"15/17/19 Commercial Street, Halifax, HX1 1HJ","C/O B N P Paribas Real Estate, Rating Support Unit, 9 Colmore Row, Birmingham, B3 2BT",01/31/92,01/15/10
Joseph Walker & Son Ltd [In Liquidation],-320.26,-320.26,2002,"561 Gibbet Street, Halifax, HX2 0AL","C/O Pannell Kerr Forster, Pannell House, 6 Queen Street, Leeds, LS1 2TW",04/01/90,11/09/94
,-0.91,-0.91,2012,"10 Cow Green, Halifax, HX1 1JF",,05/04/92,
,-200,-200,2003,"6a Dodge Holme Drive, Mixenden, Halifax, HX2 8PE",,04/08/02,07/17/03
Kelly Services (Uk) Ltd,-477,-477,2007,"25 Bull Green, Halifax, HX1 2RZ","Finance Dept, Apple Market House, 17 Union Street, Kingston Upon Thames, KT1 1RR",03/06/98,03/25/07
,-53.26,-53.26,2009,"Friendly Quarry, Burnley Road, Luddendenfoot, Halifax             HX2 6BD",,04/01/96,01/31/10
Reichenbacher (Uk) Ltd [In Liquidation],-311.03,-311.03,2003,"Unit 8/9 Victoria Park, Lightowler Road, Pellon, Halifax             HX1 5NB","C/O Kanzlei Linse, 22 Rosenstrasse, Coburg, Germany",10/01/90,01/31/04
,-1.51,-1.51,2012,"'Unofficial Address', 2A Mile Cross Terrace, Halifax, HX1 4HP",,05/12/97,
Calderdale P C T,-6278.5,-18042.06,2006,"Mixenden Stones Surgery, Mixenden Stones, Mixenden, Halifax             HX2 8RQ","C/O Gl Hearn Management Ltd, Po Box 1610, Southampton, SO15 3WX",02/04/00,04/30/08
Treble Vision Ltd [In Administration],-386.94,-386.94,2004,"Unit A4, Lower Ladyship Mills, Old Lane, Halifax              HX3 5QN",,12/03/96,08/15/04
,-8.68,-8.68,2002,"358 Ovenden Road, Halifax, HX3 5TJ",,07/01/93,10/31/95
,-163.38,-163.38,2004,"14a Hall Street North, Boothtown, Halifax, HX3 6TS",,10/01/02,02/08/05
B.T Plc,-112.5,1521.5,2012,"Hanson Lane, Halifax, HX1 5PG","Colliers Int Rating Uk Llp, 12th Flr, 11 Brindleyplace, 2 Brunswick Square, Brindleyplace, Birmingham, B1 2LP",04/01/95,
,-47.08,-47.08,2002,"Hansonlane Enterprise Centre, Hanson Lane, Halifax, HX1 5PG",,04/01/00,01/02/03
Gamblinns Ltd [In Liquidation],-180.03,-180.03,2002,"Unofficial Address, Harrison Social, 11 Harrison Road, Halifax              HX1 2AF","C/O Baker Tilly, Carlton House, Grammar School Street, Bradford, BD1 4NF",10/26/90,08/08/95
D Midgley & Sons Ltd,-494.61,-9103.4,2010,"Holmfield Industrial Estate, Holmfield, Halifax, HX2 9TN","85 Riley Lane, Bradshaw, Halifax, HX2 9QE",04/01/90,03/31/10
D Midgley & Sons Ltd,-1820.67,-9103.4,2014,"Holmfield Industrial Estate, Holmfield, Halifax, HX2 9TN","85 Riley Lane, Bradshaw, Halifax, HX2 9QE",04/01/90,03/31/10
,-41.77,-41.77,2004,"14 Hunger Hill, Halifax, HX1 2JT",,04/01/90,08/05/04
B Rhodes & Son Ltd (In Liq.)(Moorfield Wireworkers Ltd),-387.87,-387.87,2002,"Moorfield Works, Ingram Street, Halifax, HX1 3HA","C/O Messrs. Revell Ward, Horton,, Lister House,, Lord Street,Halifax",04/01/90,01/25/91
,-68.06,-68.06,2002,"113 Keighley Road, Halifax, HX2 8JE",,04/01/90,03/02/02
,-14289,-112580.43,2006,"Beechwood Medical Centre, Keighley Road, Halifax, HX2 8AL",,09/01/98,10/13/12
,-22.11,-22.11,2010,"201 Queens Road, Halifax, HX1 4NE",,03/01/99,09/06/10
,-33.27,-33.27,2002,"212 Queens Road, Halifax, HX1 4NE",,09/02/96,09/09/96
Premier Accident Management Uk (Yorkshire)Ltd,-523,-523,2009,"327a Queens Road, Halifax, HX1 4PY",No Forwarding Address,04/26/02,03/31/09
Cunninghams (Halifax) Ltd [In Admin Receivership],-399.1,-399.1,2002,"Range Lane, Halifax, HX3 6DL","C/O Armitage & Co, Park House, Park Square, Leeds, LS1 2PS",04/01/90,10/13/93
Fred Wade Ltd (In Liquidation),-146.14,-146.14,2013,"14 Rawson Street, Halifax, HX1 1NH","C/O Lee & Company, Crown House, Armley Road, Leeds, LS12 2EJ",04/01/90,12/05/13
,-4226.5,-24371.08,2015,"Rosegarth Surgery, Rothwell Mount, Halifax, HX1 2HB",,04/01/90,
,-177.5,-24371.08,2016,"Rosegarth Surgery, Rothwell Mount, Halifax, HX1 2HB",,04/01/90,
,-5275,-54139.62,2005,"Kos Clinic, 4 Roydlands Street, Hipperholme, Halifax             HX3 8AF",,04/01/90,
,-5775,-54139.62,2008,"Kos Clinic, 4 Roydlands Street, Hipperholme, Halifax             HX3 8AF",,04/01/90,
,-2469.05,-54139.62,2010,"Kos Clinic, 4 Roydlands Street, Hipperholme, Halifax             HX3 8AF",,04/01/90,
,-6255.75,-54139.62,2013,"Kos Clinic, 4 Roydlands Street, Hipperholme, Halifax             HX3 8AF",,04/01/90,
,-230.57,-230.57,2002,"1 Roydlands Terrace, Hipperholme, Halifax, HX3 8NG",,04/01/90,12/02/93
,-3.23,-3.23,2002,"76 Saddleworth Road, Greetland, Halifax, HX4 8AG",,04/09/95,12/11/99
Neaversons Of Halifax Ltd,-577.84,-577.84,2011,"12 The Old Arcade, Halifax, HX1 1TJ","5 Russell Street, Halifax, HX1 1RL",04/01/90,06/24/11
Wilko Retail Ltd,-0.01,55394.99,2013,"2 Southgate, Halifax, HX1 1DR","C/O Rate Account Management, Colliers Int Rating Uk Llp, 12th Flr Eleven Brindleyplace, 2 Brunswick Square, Brindleyplace, Birmingham, B1 2LP",12/28/98,
J C Decaux Uk Ltd,-24,333.61,2015,"Adj 54 Southgate, Halifax, HX1 1DL","991 Great West Road, Brentford, TW8 9DN",04/01/96,
Vodafone Ltd,-248.4,-536.4,2010,"Telecommunications Mast, Site Ref 4628  Shroggs Farm, Sowerby Lane, Luddendenfoot        HX2 6JP","C/O Ctil, Rate A/C Management, Colliers Int Rating Uk Llp, 12th Floor, 11 Brindley Place, 2 Brunswick Square, Brindley Place, Birmingham, B1 2LP",09/01/98,
,-1.41,-1.41,2012,"45 Stainland Road, Greetland, Halifax, HX4 8BD",,04/01/90,
,-1.42,-1.42,2012,"59 Stainland Road, Greetland, Halifax, HX4 8BD",,04/01/90,
,-99.57,292.43,2014,"West Vale Filling Station, Stainland Road, Greetland, Halifax             HX4 8BQ",,08/01/92,
,-17.8,-17.8,2002,"Part 3rd Floor, Mount Pleasant Mill, Mytholmroyd, Hebden Bridge       HX7 5NR",,04/01/90,06/18/91
,-11.97,-36.96,2002,"Stubbing Wharf Hotel, Hebden Bridge, HX7 6LU",,04/24/02,06/10/04
,-24.99,-36.96,2004,"Stubbing Wharf Hotel, Hebden Bridge, HX7 6LU",,04/24/02,06/10/04
,-108.36,-108.36,2005,"Flyover Works, 30 West Parade, Halifax, HX1 2TE",,05/01/01,08/12/05
H & C Cardiem Ltd,-5459.75,-19042.2,2015,"Cal-Val Works, Hoo Hole Cragg Road, Mytholmroyd, Hebden Bridge       HX7 5JT","Fao Pauline Houghton, C/O H & C Merchandising Ltd, Station Road, Strines,Stockport, Cheshire, SK12 3AQ",12/17/90,12/31/13
,-53.35,-53.35,2008,"1ST Floor, 4 Garden Street, Hebden Bridge, HX7 8AQ",,02/03/98,12/31/08
,-1.4,-1.4,2012,"8 West Street, Sowerby Bridge, HX6 3AN",,10/20/97,
Kasshall Ltd T/A Custom Kitchens [In Liquidation],-17.44,-17.44,2002,"R/O 88 Wharf Street, Sowerby Bridge, HX6 2AF","C/O Cork Gully, Albion Court, 5 Albion Place, Leeds, LS1 6JP",04/01/90,03/24/95
Norman Jowett Ltd,-705,-705,2004,"Opp Portsmouth Mill, Burnley Road, Todmorden, OL14 8PP","159 Knowlwood Road, Todmorden, OL14 6RD",04/01/90,03/31/04
,-76.78,-76.78,2002,"Duke Of York Inn, 20 Halifax Road, Todmorden, OL14 5AD",,10/03/97,11/09/01
,-4.53,-4.53,2010,"Market Stall 89-90, Market Hall, Borough Market, Halifax             HX1 1DZ",,11/25/03,04/20/10
,-27.39,-27.39,2005,"Rooms 7 & 8, Victoria Buildings, Luddendenfoot, Halifax             HX2 6AA",,05/28/03,06/30/05
Halifax Property Restoration Ltd,-200,-200,2001,"2ND Floor, Westfield, Sowerby New Road, Sowerby Bridge, HX6 3AS","Westfield House, Sowerby New Road, Sowerby Bridge, Halifax, HX6 1AB",01/21/01,01/20/01
Tefonica O2 (Uk) Ltd,-259.8,-106.36,2011,"Telecommunications Mast, Site Ref 15864 Brow Mills, Brighouse Road, Halifax              HX3 8DD","Fao Telecoms Rating Team, C/O Cluttons Llp, Portman House, 2 Portman Street, London, W1H 6DU",04/01/03,
Tefonica O2 (Uk) Ltd,-270,-106.36,2012,"Telecommunications Mast, Site Ref 15864 Brow Mills, Brighouse Road, Halifax              HX3 8DD","Fao Telecoms Rating Team, C/O Cluttons Llp, Portman House, 2 Portman Street, London, W1H 6DU",04/01/03,
,-81.89,-81.89,2007,"First Floor, 14 Portland Place, Halifax, HX1 2QN",,07/10/03,01/31/08
,-75.5,-75.5,2003,"1 Elland Road, Ripponden, Sowerby Bridge, HX6 4DB",,09/01/03,02/13/04
,-189.3,-189.3,2006,"39 Horton Street, Halifax, HX1 1QE",,09/01/04,02/04/07
,-20,-20,2003,"Queen Hotel, 97 Stainland Road, Greetland, Halifax             HX4 8BD",,01/13/04,04/26/04
Blue Lagoon (Uk) Ltd [In Liquidation],-203.73,-203.73,2007,"Unit 18, Hansonlane Enterprise Centre, Hanson Lane, Halifax             HX1 5PG","C/O Mazars Llp, Mazars House, Gelderd Road, Gildersome , Leeds, LS27 7JN",07/09/04,12/12/07
Repack Services Ltd,-227.07,-227.07,2005,"Unit 16, Sdh Industrial Estate, West Street, Sowerby Bridge       HX6 3BS","Unit 2 S.D.H Industrial Estate, West Street, Sowerby Bridge, HX6 3BT",04/01/04,08/31/05
,-156.37,-156.37,2004,"3 Garden Street, Hebden Bridge, HX7 8AQ",,01/02/04,10/31/04
Chief Environmental Health Officer,-299.24,-994.84,2000,"Stainland Road, Barkisland, Halifax","Fao Wendy Backhouse, Northgate House, Northgate, Halifax, HX1 1UN",04/01/90,03/31/00
Matrix Chemie Ltd,-167,-167,2004,"Mezzanine Office 6 & 7, Lumbrook Mills, Westercroft Lane, Halifax              HX3 7TY","Offices 6 & 7, Mezzanine Floor, Lumbrook Mills, Westercroft Lane, Halifax, HX3 7TY",12/06/03,12/05/03
Rastrick Racing,-49.5,-49.5,2008,"9 Church Street, Brighouse, HD6 3NF","Fao Ben Stephens, 9 Church Street, Rastrick, Brighouse, HD6 3NF",04/01/04,09/30/08
,-99.63,-99.63,2005,"18d Lydgate, Northowram, Halifax, HX3 7EJ",,05/31/04,12/11/05
