Ratepayer,Billing Account Balance ,Liable Unit Balance ,Year,Property Address,Billing Address,Date Start,Date End
On Time Logistics Ltd [In Admin Receivership],-2080.85,-2080.85,2002,"Leopold Works, George Street, Brighouse, HD6 1PU",,01/10/99,10/27/00
Calder Felts Ltd [In Liquidation],-54.5,-54.5,2002,"Prince Of Wales Mill, Armytage Road, Brighouse, HD6 1QF","C/O Cork Gully, Abacus Court, 6 Minshull Street, Mancheste, RM1 3ED",02/18/94,03/20/95
Service Garage (1981) Ltd (In Liquidation),-391.38,-391.38,2002,"Unit 5, Armytage Road, Brighouse, HD6 1PT","C/O Messrs Halpern Woolf &, Partners, 16-18 North Parade, Bradford, BD1 3HT",04/01/90,11/11/92
Vodafone Ltd,-288,-588,2015,"Telecommunications Mast, Site Ref  3661, Brighouse, HD6 1SP","C/O Ctil, Rate A/C Management, Colliers Int Rating Uk Llp, 12th Floor, 11 Brindley Place, 2 Brunswick Square, Brindley Place, Birmingham, B1 2LP",01/01/98,
,-3.69,-3.69,2012,"2 Bracken Road, Brighouse, HD6 2HW",,04/01/00,03/31/14
Controlled Speed Ltd In Administration,-851.53,-1599.81,2010,"St Pegs House, Thornhill Beck Lane, Brighouse, HD6 4AW","Frp Advisory Llp, 1 St Ann Street, Manchester, M2 7LR",09/15/01,11/16/11
Claude Dyson & Son Ltd (In Receivership),-146,-146,2002,"17 Commercial Street, Brighouse, HD6 1AF","C/O Arthur Andersen & Co, St Pauls House, Park Square, Leeds, LS1 2PJ",04/01/90,11/09/95
Universal Mobility Ltd [In Liquidation],-430,-1085.45,2001,"Unit 2 & G, Royd Mills Business Park, Dyehouse Lane, Brighouse           HD6 1LL","C/O Begbies Traynor, 30 Park Cross Street, Leeds, LS1 2QH",02/01/94,10/17/02
Brighouse Transport & Maintenance Ltd,-4.49,-4.49,2006,"Unit 3a, Royd Mills Business Park, Dyehouse Lane, Brighouse           HD6 1LL",,05/01/98,03/30/07
,-22.5,-22.5,2003,"18/20 Gooder Lane, Brighouse, HD6 1HF",,01/17/98,10/30/03
,-95.31,-95.31,2002,"12 Southgate, Elland, HX5 0BW",,07/16/95,11/05/95
Shaw Motors Ltd (In Liquidation),-147.94,-147.94,2002,"Unit 1A Moorlea Garage, Albert Road, Halifax, HX2 0DF","C/O The Official Receiver, 1ST Floor, 25 Queen Street, Leeds, LS1 2TW",06/01/95,06/23/98
,-1.75,-1.75,2012,"16 Bank Edge Road, Halifax, HX2 8JU",,10/28/91,
,-0.37,-0.37,2012,"Unit 51 Bowers Mill, Branch Road, Barkisland, Halifax             HX4 0AD",,09/01/97,
Brighouse Textiles [Wholesale] Ltd [ In Liquidation],-577.19,-577.19,2011,"Section 19, Thornhill Briggs Mill, Thornhills Beck Lane, Brighouse           HD6 4AW","O'Hara & Co, Wesley House, Huddersfield Road, Birstall, WF17 9EJ",04/01/90,02/28/11
,-12,-12,2002,"Unit 5 (3rd Floor), Wellington Mills, Quebec Street, Elland              HX5 9AS",,09/01/93,06/30/94
The Automatic Standard Screwco (1983) Ltd-In Admin Reciv,-1414.23,-1414.23,2002,"17 Charles Street, Halifax, HX1 1NA","C/O Arthur Anderson & Co, St Paul's House, Park Square, Leeds, LS1 2PJ",04/01/90,02/23/93
,-10.58,-10.58,2002,"Part First Floor, 38 Clare Road, Halifax, HX1 2HX",,04/01/90,05/28/93
Headway Plc,-486.4,-4521.46,2003,"Unit 16, Calderdale Business Park, Club Lane, Halifax             HX2 8AX","C/O Petchey Holdings Plc, Exchange House, 13/14 Clements Court, Ilford, IG1 2QY",10/03/00,05/14/01
,-783.98,-783.98,2003,"Unit 18, Calderdale Business Park, Club Lane, Halifax             HX2 8AX",,04/01/00,06/30/03
,-1237.16,-1237.16,2004,"2 George Street, Halifax, HX1 1HA",,11/08/01,08/03/04
,-13.61,-13.61,2004,"103 Gibbet Street, Halifax, HX1 5BP",,09/01/00,03/20/05
Johnson Cleaners Uk Ltd,-1269.95,-1269.95,2016,"10 Commercial Street, Halifax, HX1 1TA","C/O Bellrock F M Ltd, Enterprise House, Sunningdale Road, Leicester, LE3 1UR",04/01/90,06/24/16
,-66.64,-66.64,2002,"Unit H1f, Dean Clough Industrial Park, Halifax, HX1 1XG",,07/01/93,03/31/94
,-10,-10,2002,"Trimmingham Garage, Burnley Road, Halifax, HX2 7JG",,07/01/98,06/02/99
Primesight Ltd,-0.02,113.98,2014,"Advertising Right, Cote Hill Service Station, Burnley Road, Halifax              HX2 7NB","Unit 9 Westpoint Enterprise Pk, Clarence Avenue, Trafford Park, Manchester, M17 1QS",04/01/01,
W A Shearings Ltd,-3318.36,-8103.61,2015,"2 Market Street, Halifax, HX1 1RN","C/O G L Hearn Management Ltd, P.O Box 1610, Southampton, Hants, SO15 3WX",04/02/91,
,-13.14,-13.14,2002,"The Hebble Brook, 2 Mill Lane, Mixenden, Halifax             HX2 8SE",,03/16/95,05/01/95
Calderdale P C T,-4774.96,-18042.06,2005,"Mixenden Stones Surgery, Mixenden Stones, Mixenden, Halifax             HX2 8RQ","C/O Gl Hearn Management Ltd, Po Box 1610, Southampton, SO15 3WX",02/04/00,04/30/08
,-580.23,-580.23,2002,"Highfield House, 85 Parkinson Lane, Halifax, HX1 3QQ",,04/01/90,02/24/01
,-274.11,-274.11,2002,"The Airborne, 15 Green Lane, Sowood, Stainland            HX4 9JL",,04/01/90,11/04/02
Aquarius Bathrooms Ltd,-31.91,-31.91,2005,"Unit 4 Windsor Business Park, Hanson Lane, Halifax, HX1 4SD","Hanson Lane, Halifax, HX1 4QU",11/01/99,03/23/06
D Midgley & Sons Ltd,-1407.28,-9103.4,2011,"Holmfield Industrial Estate, Holmfield, Halifax, HX2 9TN","85 Riley Lane, Bradshaw, Halifax, HX2 9QE",04/01/90,03/31/10
D Midgley & Sons Ltd,-1785.88,-9103.4,2013,"Holmfield Industrial Estate, Holmfield, Halifax, HX2 9TN","85 Riley Lane, Bradshaw, Halifax, HX2 9QE",04/01/90,03/31/10
,-0.3,-0.3,2012,"11 Horton Street, Halifax, HX1 1QE",,04/01/90,
,-756.13,-756.13,2002,"Commercial Inn, 83 Keighley Road, Halifax, HX2 8HY",,07/02/90,04/01/91
,-14697,-112580.43,2010,"Beechwood Medical Centre, Keighley Road, Halifax, HX2 8AL",,09/01/98,10/13/12
,-8730.86,-112580.43,2012,"Beechwood Medical Centre, Keighley Road, Halifax, HX2 8AL",,09/01/98,10/13/12
Pennine Computer Group Ltd In Receivership,-423.44,-423.44,2002,"West House, 98 King Cross Street, Halifax, HX1 2TU","C/O Messrs Robson Rhodes, St George House, 40 Great George Street, Leeds, LS1 3DQ",04/01/90,08/29/91
Saw Services (Halifax) Ltd [In Liquidation],-4556.11,-4864.12,2002,"Unit 2 Copperwood Court, Queens Road, Halifax, HX1 3NS","C/O Baker Tilly, 2 Whitehall Quay, Leeds, LS1 4HG",04/01/90,08/31/01
,-46.5,-46.5,2002,"220 Queens Road, Halifax, HX1 4NE",,04/01/98,03/31/99
,-3996,-24371.08,2013,"Rosegarth Surgery, Rothwell Mount, Halifax, HX1 2HB",,04/01/90,
,-5550,-54139.62,2007,"Kos Clinic, 4 Roydlands Street, Hipperholme, Halifax             HX3 8AF",,04/01/90,
Ferguson Wools Ltd,-2665.7,-2886.77,2002,"Canal Side, Tillotson Holme, Luddendenfoot, Halifax              HX2 6AF","23 Hillcrest, Sowerby Bridge, Halifax, HX6 2TJ",04/01/90,02/28/02
Ryburn Valley Surfacing Products Ltd(In Receivership,-897.54,-897.54,2002,"Unit 11, Station Industrial Park, Station Road, Luddendenfoot","Messrs Wilson Pitts, Devonshire House, 38 York Place, Leeds, LS1 2ED",04/01/90,04/01/92
Speaks Building Systems Ltd,-544.44,-544.44,2005,"Unit 1 Shay Lane Works, Shay Lane, Halifax, HX3 6SF","C/O 1 Goosegate Farm, Heathy Lane, Holmefield, HX2 9UN",05/06/99,12/20/05
Avco Trust Ltd,-306.66,-306.66,2014,"First Floor, 18 Silver Street, Halifax, HX1 1HS","Citibank Na, C/O Cbre Fao Ap Rates Team, Cornwall Court 4th Floor, 19 Cornwall Street, Birmingham, B3 2DT",04/01/90,06/24/14
Vodafone Ltd,-259.8,-536.4,2011,"Telecommunications Mast, Site Ref 4628  Shroggs Farm, Sowerby Lane, Luddendenfoot        HX2 6JP","C/O Ctil, Rate A/C Management, Colliers Int Rating Uk Llp, 12th Floor, 11 Brindley Place, 2 Brunswick Square, Brindley Place, Birmingham, B1 2LP",09/01/98,
T W Leach Ltd,-40.8,-40.8,2016,"173b Spring Hall Lane, Halifax, HX1 4JG","173B Spring Hall Lane, Halifax, HX1 4JG",03/01/99,06/30/16
The Imperial Crown Hotel Ltd,-7.8,-7.8,2005,"31 Square Road, Halifax, HX1 1QG","Corus Hotels Ltd, Rossway Park, Berkhamstead, HP4 3TZ",07/31/92,03/31/05
,-379.8,-490.4,2005,"55 Stainland Road, Greetland, Halifax, HX4 8BD",,04/01/90,03/31/06
,-100,-100,2002,"33 Stanningley Road, Mixenden, Halifax, HX2 8RJ",,09/19/00,11/10/01
Capstan Wire Products Ltd [In Liquidation],-15.77,-15.77,2002,"Unit 27, Phoebe Lane Industrial Est., Halifax, HX3 9EX","C/O Baker Tilly, Carlton House, Grammar School Street, Bradford, BD1 4NS",07/02/93,08/09/96
,-0.96,-0.96,2012,"Unit 16, Phoebe Lane Industrial Est., Phoebe Lane, Halifax              HX3 9EX",,04/01/00,
Inglewood Studios Ltd,-3.58,-3.58,2003,"Unit T5/T10, Canal Wharf Mill, Burnley Road, Mytholmroyd         HX7 8NH","The Courtyard, Town Street, Rawdon, Leeds, LS19 6PU",09/01/97,09/30/03
,-52.41,-52.41,2004,"20 Market Street, Hebden Bridge, HX7 6AA",,09/16/00,09/20/04
,-4.81,-4.81,2016,"Mount Pleasant Mill Yard, Midgley Road, Mytholmroyd, Hebden Bridge       HX7 5LR",,04/01/99,
J B Hemming Co Ltd (In Liquidation),-507.94,-507.94,2002,"Unit 11, Westfield Mill, Mytholmroyd, Hebden Bridge       HX7 8SH","C/O Messrs Poppleton &, Appleby, 32 High Street, Mancheste, RM4 1QD",04/01/90,01/21/93
,-188.63,-188.63,2002,"The Brothers Grimm, 17 Causeway Head, Sowerby Bridge, HX6 2TG",,01/01/92,11/05/00
,-65.79,-65.79,2002,"Manchester House, 107 Halifax Road, Ripponden, Sowerby Bridge      HX6 4DA",,06/03/91,02/28/97
Halifax Plc,-30.75,1892.25,2014,"Hollas Lane, Wakefield Road, Halifax, HX2 0TP","Lloyds Banking Group, C/O Cbre Corporate Outsourcing Ltd, 55 Temple Row, Birmingham, B2 5LS",04/01/95,
Reconstruct & Design Ltd,-85.07,-85.07,2002,"Old Oxford House, Albert Street, Hebden Bridge, HX7 8AH",,04/01/90,02/29/92
Shelter National Campaign For Homeless People Ltd,-91,325,2014,"32 Bridge Gate, Hebden Bridge, HX7 8EX","88 Old Street, London, EC1V 9HU",04/01/90,
Dalebank Home Furnishing Ltd(In Liquidation),-324.68,-324.68,2002,"Unit 9, Moderna Business Park, Mytholmroyd, Hebden Bridge       HX7 5QQ","C/O Grant Thornton, Eldon Lodge, Eldon Place, Bradford, BD1 3AP",04/01/90,08/18/92
,-32.23,-32.23,2012,"Dale View, Mytholmroyd, Hebden Bridge, HX7 5DU",,04/01/90,
,-91.07,-91.07,2004,"5 Wharf Street, Sowerby Bridge, HX6 2EG",,03/31/02,06/12/04
,-81.94,-81.94,2012,"Garage 2, Raglan Street, Todmorden, OL14 5HF",,04/01/90,
,-91.13,-91.13,2005,"Square Garage, Rochdale Road, Todmorden, OL14 6SX",,04/01/02,05/16/05
,-0.89,-0.89,2012,"Cinderhill Joinery Works, Castle Street, Todmorden, OL14 5SR",,04/01/90,
S Horsfall (Plumbers) Ltd,-36,-36,2012,"2 Dale Street, Todmorden, OL14 5PX","Liddington, Peel Cottage Road, Todmorden, OL14 7QJ",04/01/90,04/30/14
,-23.97,-23.97,2002,"3 Margate Street, Sowerby Bridge, HX6 1DZ",,04/01/90,03/24/91
,-70.41,-70.41,2009,"Unit 11, Penair Works, Mill Fold, Ripponden           HX6 4DJ",,06/01/91,05/13/09
Mill House Furniture Makers Ltd,-0.36,-0.36,2012,"Unit 17, Mill House Works, Mill House Lane, Triangle            HX6 3LN","15 Savile Drive, Savile Park, Halifax, HX1 2EU",11/01/99,
,-0.34,-0.34,2012,"238 Oldham Road, Ripponden, Sowerby Bridge, HX6 4EU",,08/14/00,
,-144,-144,2012,"17 Stansfield Road, Todmorden, OL14 5DN",,04/01/90,
,-21.69,-21.69,2002,"16 Water Street, Todmorden, OL14 5AB",,08/01/96,02/03/01
,-136.02,-136.02,2006,"4 West Street, Todmorden, OL14 5HY",,04/01/98,09/30/06
,-732,-732,2015,"Nichols Yard, R/O 36 Town Hall Street, Sowerby Bridge, HX6 2EE",,02/20/03,03/31/15
,-17.94,-17.94,2012,"Garage 1, Raglan Street, Todmorden, OL14 5HF",,04/04/03,
,-21.87,-21.87,2006,"220 King Cross Road, Halifax, HX1 3JP",,05/01/03,09/22/06
,-281.79,-826.69,2011,"The Mill, Gardeners Square, Hipperholme, Halifax              HX3 8LL",,05/03/03,07/31/11
Central Holdings Ltd,-11.64,-11.64,2009,"1/3 Central Buildings, Town Hall Street, Sowerby Bridge, HX6 2QF","37 Spring Lane, Pannal, Harrogate, HG3 1NP",11/01/01,04/30/09
Hollins Park Sports & Social Club,-0.73,-0.73,2014,"Changing Rooms, Hollins Mill Lane, Sowerby Bridge, HX6 2RF",,11/01/02,
,-20,-20,2003,"Perry's Cafe Bar, 66 Rochdale Road, Halifax, HX2 7HB",,06/17/03,08/07/03
Tefonica O2 (Uk) Ltd,-288,-106.36,2015,"Telecommunications Mast, Site Ref 15864 Brow Mills, Brighouse Road, Halifax              HX3 8DD","Fao Telecoms Rating Team, C/O Cluttons Llp, Portman House, 2 Portman Street, London, W1H 6DU",04/01/03,
,-3.41,-453.41,2005,"2 Langdale Street, Elland, HX5 0JL",,04/01/03,03/31/03
Direct Door Panels [Brighouse] Ltd [In Liquidation],-234.94,-234.94,2006,"Office 4 First Floor, Princess Works, Birds Royd Lane, Brighouse            HD6 1LH","C/O Griffins, Tavistock House South, Tavistock Square, London, WC1H 9LG",01/01/04,09/29/06
Hanson Building Products Ltd,-3065.94,-3065.94,2004,"Dodgson Street, Elland, HX5 0PA","6 Dodgson Street (Garage), Elland, Halifax, HX5 0PB",04/01/91,07/21/04
,-25.82,-25.82,2006,"10 Bridge End, Brighouse, HD6 3DH",,11/01/03,03/01/07
Chief Environmental Health Officer,-363.3,-994.84,2002,"Stainland Road, Barkisland, Halifax","Fao Wendy Backhouse, Northgate House, Northgate, Halifax, HX1 1UN",04/01/90,03/31/00
,-0.66,-0.66,2012,"15 Borough Market, Halifax, HX1 1DY",,01/26/04,
Calderdale Mbc Adults Health And Social Care,-4837.24,-4837.24,2016,"Council Offices, Hollins Mill Lane, Sowerby Bridge, HX6 2QG","Attn Janet Green, 1 Park Road, Halifax, HX1 2TU",04/01/00,06/14/16
,-831.45,-2667.52,2006,"Junction Inn, 133 Moor Bottom Road, Illingworth, Halifax             HX2 9SX",,08/10/04,08/10/06
,-0.38,-0.38,2012,"40 Towngate, Clifton, Brighouse, HD6 4HS",,04/06/05,
,-7.48,-7.48,2005,"Union Cross Hotel, 12 Old Market, Halifax, HX1 1TN",,09/06/05,01/03/06
Asda Stores Ltd,-1368.55,-6628.3,2015,"Kwiksave, Burnley Road, Todmorden, OL14 7BU","C/O Gl Hearn Management Ltd, Po Box 1610, Southampton, SO15 3WX",03/24/05,02/28/16
Vodafone Ltd,-216.5,-33.69,2011,"Television Mast, Land Near Tinker Hey Farm, North Dean Road, Greetland            HX4 8QA","C/O Ctil, Rate A/C Management, Colliers Int Rating Uk Llp, 12th Floor, 11 Brindley Place, 2 Brunswick Square, Brindley Place, Birmingham, B1 2LP",11/01/04,
,-496.83,-1208.55,2011,"The Oddfellows Arms, 158 Haugh Shaw Road, Halifax, HX1 3BG",,06/09/05,06/12/11
,-43.85,-43.85,2010,"7 West Street, Sowerby Bridge, HX6 3AP",,08/27/05,08/26/10
Primesight Ltd,-0.01,113.99,2014,"Advertising Right, Adj Haley Hill Service Stn, Haley Hill, Halifax              HX3 6ED","Unit 9 Westpoint Enterprise Pk, Clarence Avenue, Trafford Park, Manchester, M17 1QS",04/01/05,
,-210.07,-210.07,2008,"Unit 2B, Calder Workshops, Gibbet Street, Halifax              HX1 4JQ",,05/01/05,12/22/08
,-1.03,-1.03,2012,"Unit 35, Phoebe Lane Industrial Est., Phoebe Lane, Halifax              HX3 9EX",,07/19/04,
,-263.79,-1534.14,2010,"Old Pond Inn, 15 Spout House Lane, Brighouse, HD6 2PL",,10/18/04,10/27/10
St Malachys Credit Union Ltd,-0.22,-0.22,2012,"26a Illingworth Road, Illingworth, Halifax, HX2 9EN","F.A.O. Mr Stuart Stott, 26a Illingworth Road, Illingworth, HX2 9EN",04/01/06,
D & S Baths Ltd [In Administration],-1998,-4364.05,2007,"Aquarius Building, 190 Hanson Lane, Halifax, HX1 4SD","C/O B D O Stoy Hayward Llp, 1 Bridgewater Place, Water Lane, Leeds, LS11 5RU",03/24/06,10/29/08
,-76.66,-76.66,2006,"68 West Street, Sowerby Bridge, HX6 3AP",,04/01/05,02/04/07
,-0.01,363.99,2014,"32 Crown Street, Halifax, HX1 1TT",,11/21/05,
,-71.15,-71.15,2012,"Miall Street Mills, Miall Street, Halifax, HX1 4AE",,04/01/90,12/31/11
,-367.42,-367.42,2012,"3 Common Lane, Southowram, Halifax, HX3 9PA",,01/01/06,
Timber Building Installations Ltd,-3.92,-3.92,2006,"Sowerby Bridge Sheds, Holby Business Centre, West Street, Sowerby Bridge      HX6 3BT","Unit 1, Calder Valley Motors, Burnley Rd, Mytholmroyd, Hebden Bridge, HX7 5AD",09/01/06,04/01/07
,-25.9,-25.9,2006,"Unit 13/14, Calder Workshops, Gibbet Street, Halifax             HX1 4JQ",,08/03/06,01/30/07
,-12.2,-12.2,2014,"Clarence Brass Works, Aked's Road, Halifax, HX1 2TR",,04/26/06,09/11/14
,-81.18,-81.18,2007,"3 Clare Road, Halifax, HX1 2HX",,04/01/07,03/31/07
Vodafone Ltd,-777.18,-1979.17,2013,"Telecommunications Mast, Site Ref 35452, Bowood Lane, Triangle             HX6 3DU","C/O Ctil, Rate A/C Management, Colliers Int Rating Uk Llp, 12th Floor, 11 Brindley Place, 2 Brunswick Square, Brindley Place, Birmingham, B1 2LP",04/01/06,
,-9.55,-9.55,2010,"297 Gibbet Street, Halifax, HX1 4JX",,10/01/06,04/30/10
Tefonica O2 (Uk) Ltd,-288,-786.4,2015,"Telecommunications Mast, Site Ref 37419, Royd Road, Todmorden           OL14 8DW","Fao Telecoms Rating Team, C/O Cluttons Llp, Portman House, 2 Portman Street, London, W1H 6DU",10/04/06,
,-0.2,-0.2,2012,"5 St Johns Lane, Halifax, HX1 2JD",,12/05/06,
Amazonails Ltd,-44.37,-44.37,2011,"Unit 1 Hope Mill, Crescent Street, Todmorden, OL14 5HJ","Unit 1, Hope Mill, Crescent Street, Todmorden, OL14 5HJ",03/01/07,07/07/11
Wiley Accessories Ltd,-205.64,-205.64,2015,"Junction Bradford Road/, Thornhills Beck Lane, Brighouse, HD6 4AH","Fao Michelle Bacon, Wiley Accessories Ltd, St Peg Mills, Bradford Road, Brighouse, HD6 4AU",04/01/07,02/04/16
Security Professionals Ltd,-20.39,-20.39,2008,"Unit 7B, Calderdale Business Park, Club Lane, Halifax              HX2 8AX","C/O 31 Willowfield Close, Willowfield, Halifax, HX2 7LP",06/01/06,10/30/08
,-602.76,-766.35,2008,"11/13 Lilly Street, Sowerby Bridge, HX6 3DG",,07/01/07,01/04/08
,-58.75,-58.75,2012,"Unit 1 Tower Block, Robinwood Mill, Burnley Road, Todmorden           OL14 8JA",,06/13/07,
Johnson Cleaners Uk Ltd,-226.57,-226.57,2016,"10 Commercial Street, Halifax, HX1 1TA","C/O Bellrock F M Ltd, Enterprise House, Sunningdale Road, Leicester, LE3 1UR",04/01/07,06/24/16
,-141.6,-966.7,2015,"Balcony Store 30, Borough Market, Halifax, HX1 1DZ",,04/01/07,03/31/10
Alfiman Ltd,-3193.51,-4117.44,2013,"Sovereign House, 8 Bonegate Road, Brighouse, HD6 1SP","181 Bramley Lane, Halifax, HX3 8JJ",10/01/07,05/31/13
Alfiman Ltd,-923.93,-4117.44,2014,"Sovereign House, 8 Bonegate Road, Brighouse, HD6 1SP","181 Bramley Lane, Halifax, HX3 8JJ",10/01/07,05/31/13
,-1.32,0,2016,"Part 2nd Floor, Berwick Street, Halifax, HX1 1QG",,11/03/07,
Romida Sports Ltd (In Administration),-214.73,-214.73,2012,"Unit 3 West Vale Buildings, Wakefield Road, Brighouse, HD6 1QD","Bdo Llp, 3 Hardman Street, Manchester, M3 3AT",04/01/07,10/04/12
Tefonica O2 (Uk) Ltd,-247.5,-666.7,2012,"Telecommunication Mast, Site Ref 18479, Old Lindley Road, Holywell Green       HX4 9DF","Fao Telecoms Rating Team, C/O Cluttons Llp, Portman House, 2 Portman Street, London, W1H 6DU",04/01/05,
Cheque Centres Properties Ltd (In Liquidation),-1994.61,-1994.61,2014,"68 Commercial Street, Brighouse, HD6 1AQ","Kpmg, Saltire Court, 20 Castle Terrace, Edinburgh, EH1 2EG",04/20/07,07/02/14
,-77.83,-77.83,2007,"16 Union Street, Halifax, HX1 1PR",,05/01/07,03/08/08
Equable Properties Ltd,-312.5,-312.5,2008,"Dog & Partridge, Sourhall Road, Todmorden, OL14 7JA","27/28 Eastcastle Street, London, W1W 8DH",02/06/08,07/23/09
Newbuild Masonry (Yorkshire) Ltd,-96.83,-96.83,2008,"Office 6 Britannia Works, Garden Street North, Halifax, HX3 6AE","Mr G Varley, 308 Skircoat Green Road, Halifax, HX3 0LJ",04/01/08,12/31/08
,-0.58,-0.58,2012,"18 Carr House Road, Shelf, Halifax, HX3 7QY",,04/20/08,
,-0.3,-0.3,2012,"The Delvers, Wainstalls, Halifax, HX2 7UA",,02/01/08,
,-28.5,-28.5,2008,"75 Burnley Road, Todmorden, OL14 7BS",,02/13/08,03/08/09
,-2.76,-2.76,2009,"Unit 3D Beehive Mills, Hebble End, Hebden Bridge, HX7 6HJ",,12/01/07,03/12/10
,-4.65,-4.65,2015,"Unit 2, 38 Sunderland Street, Halifax, HX1 5AF",,10/01/07,
,-243.14,-243.14,2009,"Unit 4D, Top Land Country Business Pk, Cragg Road, Mytholmroyd          HX7 5RU",,07/01/08,12/31/09
Oakenclough Buildings Ltd,-574.03,-574.03,2009,"Sowerby Bridge Sheds, Holby Business Centre, West Street, Sowerby Bridge      HX6 3BT","Attn Glenn Brady, Oakenclough Mill, Garstang, Preston, PR3 1TB",09/01/08,12/31/09
Calderdale Mbc Land & Property Services,-1441.3,-1441.3,2016,"West Yorkshire Fire Service, Hollins Mill Lane, Sowerby Bridge, HX6 2QG","Northgate House, Northgate, Halifax, HX1 1UN",04/01/08,06/14/16
The Brass Monkey Brewery Co Ltd,-995.97,-995.97,2012,"Units 24-26, Asquith Bottom Mills, Sowerby Bridge, HX6 3BS","Units 24/26, Asquith Bottom Mills, Ridge Street, Sowerby Bridge, HX6 3BS",10/01/08,05/31/12
,-85.77,-85.77,2011,"Part 2ND Floor Clifton House, Bradford Road, Bailiff Bridge, Brighouse            HD6 4JJ",,04/01/08,03/26/12
K Skips Ltd,-0.45,-0.45,2012,"Haulage Yard, Balkram Edge Farm, Mount Tabor, Halifax              HX2 0UB","Fao Mr M Kemp, Balkram Edge Farm, Mount Tabor, Halifax, HX2 0UB",01/01/09,
,-106.55,-106.55,2009,"Ground Floor, 24/26 Silver Street, Halifax, HX1 1HS",,11/17/08,03/17/10
,-176,-176,2010,"Unit 3B & Compound, Mitchell Street, Todmorden, OL14 7DP",,10/26/08,01/31/10
Intrepid Leisure Ltd,-58.46,-58.46,2009,"Maypole Inn, 32 Warley Town, Stock Lane, Halifax              HX2 7RZ","Po Box 496, Kingston Upon Hull, HU9 9GN",03/16/09,08/13/09
"Drs Mayland, Rastall & Cameron",-7263.07,-65363.82,2012,"Beechwood Medical Centre, 60A Keighley Road, Halifax, HX2 8AL","F A O Elliott Summers, Beechwood Medical Centre, 60A Keighley Road, Ovenden, Halifax, HX2 8AL",10/14/12,
"Drs Mayland, Rastall & Cameron",-16131.75,-65363.82,2013,"Beechwood Medical Centre, 60A Keighley Road, Halifax, HX2 8AL","F A O Elliott Summers, Beechwood Medical Centre, 60A Keighley Road, Ovenden, Halifax, HX2 8AL",10/14/12,
"Drs Mayland, Rastall & Cameron",-16885.25,-65363.82,2015,"Beechwood Medical Centre, 60A Keighley Road, Halifax, HX2 8AL","F A O Elliott Summers, Beechwood Medical Centre, 60A Keighley Road, Ovenden, Halifax, HX2 8AL",10/14/12,
Bizspace Ltd,-603.91,-603.91,2013,"Unit 16K, Calderdale Buslness Park, Club Lane, Halifax              HX2 8AX","Sovereign House, Fao Mital Shah, 1 Albert Place, Finchley, London, N3 1QB",07/01/13,12/31/13
Community Voice Ltd,-216.44,-216.44,2015,"Office 36 First Floor, The E W Innovation Centre, Hopwood Lane, Halifax              HX1 5ER","Unit 17 Hardmans Bus. Centre, Newhall Hey Road, Rawtenstall, BB4 6HH",11/13/13,10/31/15
Primesight Ltd,-0.04,407.96,2014,"Advertising Right No 4772, 365 Salterhebble Hill, Halifax, HX3 9LU","Unit 9 Westpoint Enterprise Pk, Clarence Avenue, Trafford Park, Manchester, M17 1QS",09/01/09,
,-10.8,-10.8,2012,"Room 2, Town Hall, Thornton Square, Brighouse           HD6 1ED",,02/18/09,03/31/12
,-127.8,-127.8,2012,"Unit 23 Robinwood Mill, Burnley Road, Todmorden, OL14 8JA",,03/01/10,
,-575.52,-575.52,2010,"Unit 11 Clifton Mills, Bradford Road, Bailiff Bridge, Brighouse            HD6 4JJ",,02/01/10,01/31/11
The Bradshaw Pub Co Ltd,-1.03,-1.03,2012,"Golden Fleece Inn, 1 Bradshaw Lane, Bradshaw, Halifax             HX2 9UZ","Fao Keith A Vear, 29 Whitley Drive, Holmfield, Halifax, HX2 9SJ",01/28/10,
,-9.58,-9.58,2012,"Unit 2 Robinwood Mill, Burnley Road, Todmorden, OL14 8JA",,07/01/10,
Administrators Of G F Interiors Ltd,-711.64,-711.64,2009,"Gooder Lane, Brighouse, HD6 1HF","C/O Begbies Traynor, 36 Clare Road, Halifax, HX1 1TP",02/27/10,04/20/10
,-2562.59,-5812.39,2012,"Cromwell Bottom, Elland Road, Brighouse, HD6 2RG",,04/01/10,03/31/10
,-493.41,-5812.39,2013,"Cromwell Bottom, Elland Road, Brighouse, HD6 2RG",,04/01/10,03/31/10
Anchor Trust,-24.13,-24.13,2011,"Office 3.8, 1ST Floor, White Rose Mill, Holdsworth Road, Holmfield            HX3 6SN","Burnbank House, Balliol Business Park, Longbenton, Newcastle Upon Tyne, NE12 8EW",04/01/10,10/01/11
Triplesix Ltd,-166.67,-166.67,2013,"Unit 6C & 6D, Topland Country Business Pk, Cragg Road, Mytholmroyd","Unit 2 B Orchard Business Pk, Scout Road, Mytholmroyd, Hebden Bridge, HX7 5HZ",05/01/10,03/03/14
,-19.4,-69.42,2010,"Market Stall 124/131, Market Hall, Borough Market, Halifax             HX1 1DZ",,11/22/10,03/31/13
,-1362.9,-8289.02,2013,"Unit 3G / H South Mill, White Rose Mill, Holdsworth Road, Halifax              HX3 6SN",,09/01/10,
Manningstead Ltd,-879.53,-879.53,2013,"12 Central Hall, Coronation Street, Elland, HX5 0DF","C/O Brent Turner, The Hayloft, Hullen Edge Farm, Goose Nest Lane, Norland, Halifax, HX6 3QW",12/06/11,07/15/13
,-5.16,-5.16,2012,"Unit 6 Victoria Works, Victoria Road, Hebden Bridge, HX7 8JX",,09/05/12,11/30/12
The Childrens Society,-552.16,-884.8,2015,"25/27 Silver Street, Halifax, HX1 1HS","F.A.O. Katherine Moore, Unit 4A, The Pavillions, Bridgehall Road, Bury, BL9 7NX",11/19/12,09/30/16
The Childrens Society,-332.64,-884.8,2016,"25/27 Silver Street, Halifax, HX1 1HS","F.A.O. Katherine Moore, Unit 4A, The Pavillions, Bridgehall Road, Bury, BL9 7NX",11/19/12,09/30/16
,-1.75,5032.25,2014,"20/22 Crown Street, Halifax, HX1 1TT",,11/14/12,
Tap Water Project Ltd,-0.48,-0.18,2016,"Hebble House, Old Gate, Hebden Bridge, HX7 6EN","Hebble House, Old Gate, Hebden Bridge, HX7 6EN",05/07/13,03/31/15
Car & Commercial Vehicle Dismantlers Ltd,-2.5,5465.5,2015,"Mill Lane, Brighouse, HD6 1PN",,05/01/13,
,-11.5,-11.5,2014,"39 Burnley Road, Todmorden, OL14 7BU",,07/01/09,03/20/12
Primesight Ltd,-0.04,239.96,2014,"229 Bradford Road, Brighouse, HD6 4BN","Unit 9 Westpoint Enterprise Pk, Clarence Avenue, Trafford Park, Manchester, M17 1QS",09/01/09,
Primesight Ltd,-0.03,317.97,2014,"R/O 2 Horton Street, Halifax, HX1 1PU","Unit 9 Westpoint Enterprise Pk, Clarence Avenue, Trafford Park, Manchester, M17 1QS",09/01/09,
,-320.59,-320.59,2010,"2 Swine Market, Halifax, HX1 5DT",,09/01/10,01/23/14
,-44.62,-44.62,2016,"Stall 16 Market Hall, Brook Street, Todmorden, OL14 5AJ",,01/26/11,
Calder Valley Steiner Education Ltd,-48.12,-48.12,2016,"St John's Centre, Church Bank Lane, Cragg Vale, Hebden Bridge        HX7 5TF",,09/06/10,
Castelite Ltd,-135,-135,2010,"Casa Del Lago, Elland Road, Brighouse, HD6 2AB","281 Elland Road, Brookfoot, Brighouse, HD6 2RG",06/17/09,04/30/10
,-310.38,-310.38,2011,"193 Queens Road, Halifax, HX1 4NE",,09/06/09,03/20/11
P.H.S Ltd,-1884,-1884,2011,"Armytage Road, Brighouse, HD6 1QF","Attn Andrew Knight, 7 Lancaster Way, Ermine Business Park, Huntingdon, Cambs, PE26 6XU",02/03/10,06/22/11
Atmosphere Bars & Clubs Ltd (In Administration),-1744.37,-1744.37,2013,"Abc Cinema, Commercial Street, Halifax, HX1 1BX","Fao Adrian Peter Berry, C/O Deloitte Llp, 1 City Square, Leeds, LS1 2AL",02/26/10,05/14/13
