2CS10,Matthew Gray,SCS1,Head of Infrastructure and Platforms,"Overall responsibility for the Platforms function.  Leading on the design, build and deployment of the core infrastructure underpinning the technology applications and services delivered to all Home Office businesses. 

One of the most technical roles in the department the Director of Platforms has a huge impact on the culture of the department and will be a key catalyst in the development of a new culture of technical excellence.

To work closely with the business to ascertain platform requirements for each application or service and to negotiate delivery timeframes and costs.  Forging close partnerships with internal and supplier teams to drive standards and common approaches and success  throughout the development lifecycle to ensure Platforms meets the needs of evolving systems and services requirements.",Home Office,Home Office,Platforms,0207 035 4848 or Mincom 0207 035 4742,public.enquiries@homeoffice.gsi.gov.uk,2CS05,9620000,1,0,0,Information Technology,,1
2CS08,Peter Rose,SCS1,"Director, Live Services","The Head of Live Services Service Support is accountable for the delivery and management of scalable and sustainable Level 2 technical Service Support, providing high quality, reliable and responsive services for core platforms, applications and toolset capabilities across the Home Office Business, Platform and Digital portfolios. 
A key objective is to seek to lower costs, progressively raise quality and improve the overall user experience, by actively promoting the transition of knowledge from Level 3 to Level 2 and to Level 1, thus reducing demand for Level 3 and 2 support services across the Home Office.",Home Office,Home Office,Live Services,0207 035 4848 or Mincom 0207 035 4742,public.enquiries@homeoffice.gsi.gov.uk,2CS05,0,1,140000,144999,Information Technology,Salary costs of reports included in 1CS39,1
1CS28,N/D,SCS1,TPT Programme Director,Provides leadership for the TPT programme to ensure delivery goals are met while adhering to tight timescales and budget constraints.,Home Office,Home Office,Platforms,0207 035 4848 or Mincom 0207 035 4742,public.enquiries@homeoffice.gsi.gov.uk,2CS10,0,1,0,0,Information Technology,Staff and staff costs included in 2CS10,1
2HOS01,Bernard Silverman,SCS2,Chief Scientific Adviser (CSA),"“The task of the Chief Scientific Adviser (CSA) is to provide personal independent scientific advice and support of the highest quality to the Home Secretary and other Home Office ministers and officials on the whole range of Home Office policies and operations. The CSA participates in the Executive Management Board, and reports direct to the Permanent Secretary.  Other important elements of the CSA role includes providing the highest quality independent scientific scrutiny and challenge to departmental decisions; fostering relations with other government departments, academia and industry, both in the UK and abroad; and overseeing the landscape of the Department's Research and Development.”",Home Office,Home Office,Home Office Science Secretariat and Services,0207 035 4848 or Mincom 0207 035 4742,public.enquiries@homeoffice.gsi.gov.uk,4PO01,0,0.8,120000,124999,Science and Engineering,,1
2HOS02,Alan Pratt,SCS2,Director of Science Engineering and Technology,"'The Director of Science, Engineering and Technology provides strategic oversight of the Home Office’s physical and social science teams. They also have responsibility for scientific regulatory functions, the delivery of the National DNA Database service, and the shared support for Home Office Science teams and independent advisory committees. As the Head of Profession for scientists and engineers in the Home Office they work as part of a cross-Government network to ensure specialist scientific skills are developed and used effectively.'",Home Office,Home Office,Home Office Science Secretariat and Services,0207 035 4848 or Mincom 0207 035 4742,public.enquiries@homeoffice.gsi.gov.uk,3CS01,2170000,1,90000,94999,Science and Engineering,,1
1HOS06,N/D,SCS1,Senior Biometrics Adviser (CAST),"'The Senior Biometrics Adviser provides advice to those projects and programmes in the Home Office, its agencies and law enforcement organisations which make use of biometrics for identity assurance, securing of borders and the prevention and the investigation of crime – from development of policy to procurement and deployment. The SBA offers independent assurance on programme feasibility, risk management and value for money. The Adviser leads on national and international standards within the Home Office, and is the interface to the supplier, integrator and academic communities, ensuring a coherent forward view on the application of biometrics in a privacy-respecting context.'",Home Office,Home Office,Biometrics Programme,0207 035 4848 or Mincom 0207 035 4742,public.enquiries@homeoffice.gsi.gov.uk,1HOS02,0,1,0,0,Science and Engineering,Salary costs included in 1HOS02,1
1HOS01,N/D,SCS1,Chief Statistician and Head of Profession for Statistics,"The Chief Statistician’s Unit is responsible for National Statistics publications on Scientific Procedures on Animals; Firearm Certificates; and Alcohol Licensing and three Official Statistics publications on the police use of tasers, deployment of firearms by the police and football banning orders. These support executive decision making in policy, strategic planning and delivery, performance management and meet the needs of Parliament and the wider public. The Chief Statistician reports to the National Statistician with respect to all professional matters and also has lead analytical strategic responsibility for a number of areas including Knowledge Management, Data collection, storage, handling, analysis and use across the Home Office.",Home Office,Home Office,Statistician's Unit,0207 035 4848 or Mincom 0207 035 4742,public.enquiries@homeoffice.gsi.gov.uk,2HOS02,580000,1,0,0,Statisticians,,1
1HOS02,N/D,SCS1,"Director, Centre for Applied Science & Technology (CAST)","The Centre for Applied Science & Technology (CAST) provides expert advice, innovation and frontline support for the Home Office and its agencies on any issue relating to science and technology. CAST supports the full range of Home Office priorities in the areas of policing and tackling crime, counter terrorism, border security and controlling immigration. CAST only operate where others cannot for reasons of impartiality, national security or market failure.'",Home Office,Home Office,The Centre for Applied Science & Technology,0207 035 4848 or Mincom 0207 035 4742,public.enquiries@homeoffice.gsi.gov.uk,2HOS02,710000,1,0,0,Science and Engineering,,1
1HOS04,N/D,SCS1,Head of Animals in Science Regulation Unit,"The Animals in Science Regulation Unit (ASRU) comprises the policy, licensing and inspectorate staff responsible for administering the Animals (Scientific Procedures) Act 1986 (ASPA) and related regulations.  The Policy Team advises ministers on issues related to ASPA and responds to correspondence (including PQs and FOI enquiries) from MPs and the public.  Inspectors (all registered medical or veterinary practitioners) provide advice on applications to the Licensing Team who grant the licences on behalf of the Secretary of State.  Inspectors also visit registered establishments to check for non-compliance and provide advice on applications and good practice. The majority of visits are unannounced.'",Home Office,Home Office,The Animals in Science Regulation Unit,0207 035 4848 or Mincom 0207 035 4742,public.enquiries@homeoffice.gsi.gov.uk,2HOS02,1940000,1,0,0,Vets,,1
1HOS15,N/D,SCS1,Chief Inspector - Animals in Science Regulation Unit,"The Animals in Science Regulation Unit (ASRU) comprises the policy, licensing and inspectorate staff responsible for administering the Animals (Scientific Procedures) Act 1986 (ASPA) and related regulations.  The Policy Team advises ministers on issues related to ASPA and responds to correspondence (including PQs and FOI enquiries) from MPs and the public.  Inspectors (all registered medical or veterinary practitioners) provide advice on applications to the Licensing Team who grant the licences on behalf of the Secretary of State.  Inspectors also visit registered establishments to check for non-compliance and provide advice on applications and good practice. The majority of visits are unannounced.'",Home Office,Home Office,The Animals in Science Regulation Unit,0207 035 4848 or Mincom 0207 035 4742,public.enquiries@homeoffice.gsi.gov.uk,1HOS04,0,1,0,0,Vets,Salary costs included in 1HOS04.,1
1HOS13,N/D,SCS1,Head of Migration & Border Analysis,Provides research and analysis to support migration and border policy.',Home Office,Home Office,Migration & Border Analysis,0207 035 4848 or Mincom 0207 035 4742,public.enquiries@homeoffice.gsi.gov.uk,2HOS02,1540000,1,0,0,Social Research,,1
1HOS12,N/D,SCS1,Head of Crime & Policing Analysis & Head of Profession for Social Research,Provides social science research and analysis to support Crime & Policing Group policy',Home Office,Home Office,Crime & Policing Analysis Unit,0207 035 4848 or Mincom 0207 035 4742,public.enquiries@homeoffice.gsi.gov.uk,2HOS02,2080000,1,0,0,Social Research,,1
1HOS09,N/D,SCS1,Head of Office for Security Counter-terrorism Research and Analysis and Home Office Chief Economist,"Provides research and analysis to support the Office of Security and Counter Terrorism. The Chief Economist provides economic advice to Ministers and senior officials across the full range of Home Office policy areas, manages the Economic Assessment Unit which assesses the quality of economic cases produced by the Home Office and acts as head of profession for economists in the Home Office.'",Home Office,Home Office,Office of Security and Counter Terrorism Analysis Unit,0207 035 4848 or Mincom 0207 035 4742,public.enquiries@homeoffice.gsi.gov.uk,2HOS02,1430000,1,0,0,Economics,,1
1HOS11,N/D,SCS1,Head of HO Science Decision Support for Operations,Deliver the  Commercial Directorate Objectives  by providing Leadership of a team that undertakes all Commercial activity (Procurement and Contract Management) through a business partnering approach for The Office of Security and Counter Terrorism (OSCT),Home Office,Home Office,Decision Support for Operations Unit,0207 035 4848 or Mincom 0207 035 4742,public.enquiries@homeoffice.gsi.gov.uk,2HOS02,1830000,0.8,0,0,Operational Research,,1
1HOS10,N/D,SCS1,Head of Regulatory and Strategic Support,"Oversees the provision of forensic pathology services in England & Wales ensuring the registration of appropriately qualified forensic pathologists on the HO Register, supporting the training of forensic pathologists, negotiating case fees and dealing with complaints against forensic pathologists.  The unit also provides operational and strategic support to the Forensic Science Regulator and Surveillance Camera Commissioner and futures work.",Home Office,Home Office,Regulatory and Strategic Support Unit,0207 035 4848 or Mincom 0207 035 4742,public.enquiries@homeoffice.gsi.gov.uk,2HOS02,600000,1,0,0,Science and Engineering,,1
2CS01,Hannah Witty,SCS2,Director of Finance and Estates,"The Finance and Estates Directorate plays a key role in ensuring that the Home Office gets the most from its resources and provides cost-effective financial advice and support to Ministers, the Department and key stakeholders to enable them to deliver the Home Office objectives. It aims to minimise demands on our businesses, improve financial processes and systems, drive out inefficiencies and support delivery across all areas of the Home Office Group.",Home Office,Home Office,Finance and Estates,0207 035 4848 or Mincom 0207 035 4742,public.enquiries@homeoffice.gsi.gov.uk,3CS01,730000,1,75000,79999,Finance,"Salary costs include 1CS18, 1CS44 and TBC1",1
1CS15,N/D,SCS1,Head of Financial Planning Unit,"The Financial Planning Unit is responsible for securing the forward finances of the Home Office, including developing and securing cabinet and parliamentary clearance of the immigration and visa fees package. FPU is also responsible for ensuring those resources are applied to ministerial priorities in a way that maximises value for money. This includes  advice on investment decisions and the investment approval process; and management of contract finance across the department.",Home Office,Home Office,Financial Planning Unit,0207 035 4848 or Mincom 0207 035 4742,public.enquiries@homeoffice.gsi.gov.uk,2CS01,1980000,1,0,0,Finance,,1
1CS20,N/D,SCS1,HM Passport Office Senior Finance Business Partner,"The HM Passport Office Senior Finance Business Partner is responsible for supporting these business areas in strategic and tactical decision making, ensuring financial consequences, risks and opportunities are understood and considered at the point at which decisions are taken; providing professional challenge to the business, ensuring financial plans, forecasts and underlying assumptions are robust and are appropriately tested; and working on behalf of the business to commission and oversee the delivery of expert financial support and advice from other areas of finance to time and quality in order to meet business objectives. In addition the unit manages both European grant funding and Finance Professionalism and Capability",Home Office,Home Office,HM Passport Office Finance Business Partner Unit,0207 035 4848 or Mincom 0207 035 4742,public.enquiries@homeoffice.gsi.gov.uk,2CS01,1700000,1,0,0,Finance,,1
1CS19,N/D,SCS1,Head of General Property,"Home Office General Property (HOPG) provides estates and accommodation services to the Home Office   It is  the strategic adviser to the Home Office Board member for  property matters and sustainable development policy. Its primary objective is to provide best value accommodation services, including budgetary control, planning, project and facilities management.'",Home Office,Home Office,Home Office General Property,0207 035 4848 or Mincom 0207 035 4742,public.enquiries@homeoffice.gsi.gov.uk,2CS01,5600000,1,0,0,Property and asset management,,1
1CS17,N/D,SCS1,Border Force Senior Finance Business Partner,"The Border Force Senior Finance Business Partner is responsible for supporting these business areas in strategic and tactical decision making, ensuring financial consequences, risks and opportunities are understood and considered at the point at which decisions are taken; providing professional challenge to the business, ensuring financial plans, forecasts and underlying assumptions are robust and are appropriately tested; and working on behalf of the business to commission and oversee the delivery of expert financial support and advice from other areas of finance to time and quality in order to meet business objectives.",Home Office,Home Office,Border Force Finance Business Partner Unit,0207 035 4848 or Mincom 0207 035 4742,public.enquiries@homeoffice.gsi.gov.uk,2CS01,570000,1,0,0,Finance,,1
1CS16,N/D,SCS1,Head of Adelphi Services,"The Home Office uses an Oracle ERP (Enterprise Resource Planning) system known as Adelphi to support its HR, Finance and Procurement services, which are provided to users across the department.  Adelphi Services is responsible for the strategic development, commissioning and management of this system and its associated services through our delivery partners.",Home Office,Home Office,Adelphi Services,0207 035 4848 or Mincom 0207 035 4742,public.enquiries@homeoffice.gsi.gov.uk,2CS01,1420000,1,0,0,Finance,,1
1CS21,N/D,SCS1,Financial Controller,"The Financial Controller leads key consolidated finance functions who are responsible for accountancy and taxation advice; production of the department’s interim and final consolidated annual report and accounts; and consolidated management reporting. Between them, these teams are responsible for supporting the Home Office’s Principal Accounting Officer by driving strong financial management and governance, including the provision of assurance to the Executive Management Board, the Supervisory Board, and HM Treasury, that Home Office financial resources are managed effectively.",Home Office,Home Office,Financial Management Unit,0207 035 4848 or Mincom 0207 035 4742,public.enquiries@homeoffice.gsi.gov.uk,2CS01,7750000,1,0,0,Finance,,1
1CS23,N/D,SCS1,Enablers Senior Finance Business Partner,"The Enablers Senior Finance Business Partner is responsible for supporting these business areas in strategic and tactical decision making, ensuring financial consequences, risks and opportunities are understood and considered at the point at which decisions are taken; providing professional challenge to the business, ensuring financial plans, forecasts and underlying assumptions are robust and are appropriately tested; and working on behalf of the business to commission and oversee the delivery of expert financial support and advice from other areas of finance to time and quality in order to meet business objectives.",Home Office,Home Office,Enablers Finance Business Partner Unit,0207 035 4848 or Mincom 0207 035 4742,public.enquiries@homeoffice.gsi.gov.uk,2CS01,430000,1,0,0,Finance,,1
1CS18,N/D,SCS1,Office for Security and Counter Terrorism Finance Business Partner,"The Office for Security and Counter Terrorism Senior Finance Business Partner is responsible for supporting these business areas in strategic and tactical decision making, ensuring financial consequences, risks and opportunities are understood and considered at the point at which decisions are taken; providing professional challenge to the business, ensuring financial plans, forecasts and underlying assumptions are robust and are appropriately tested; and working on behalf of the business to commission and oversee the delivery of expert financial support and advice from other areas of finance to time and quality in order to meet business objectives. Although reporting to the Director of Finance and Estates, the post is a shared resource, also responsible for non-finance aspects of OSCT’s performance.",Home Office,Home Office,Office of Security and Counter Terrorism Analysis Unit,0207 035 4848 or Mincom 0207 035 4742,public.enquiries@homeoffice.gsi.gov.uk,2CS01,0,1,0,0,Finance,Salary costs included in 2CS01,1
1CS45,N/D,SCS1,Law Enforcement Senior Finance  Business Partner,"The Law Enforcement Senior Finance Business Partner is responsible for supporting these business areas in strategic and tactical decision making, ensuring financial consequences, risks and opportunities are understood and considered at the point at which decisions are taken; providing professional challenge to the business, ensuring financial plans, forecasts and underlying assumptions are robust and are appropriately tested; and working on behalf of the business to commission and oversee the delivery of expert financial support and advice from other areas of finance to time and quality in order to meet business objectives.",Home Office,Home Office,Law Enforcement Finance Business Partner Unit,0207 035 4848 or Mincom 0207 035 4742,public.enquiries@homeoffice.gsi.gov.uk,2CS01,380000,1,0,0,Finance,,1
1CS44,N/D,SCS1,UK Visas and Immigration Senior Finance Business Partner,"The UK Visas and Immigration Senior Finance Business Partner is responsible for supporting these business areas in strategic and tactical decision making, ensuring financial consequences, risks and opportunities are understood and considered at the point at which decisions are taken; providing professional challenge to the business, ensuring financial plans, forecasts and underlying assumptions are robust and are appropriately tested; and working on behalf of the business to commission and oversee the delivery of expert financial support and advice from other areas of finance to time and quality in order to meet business objectives. In addition the unit manages European grant funding and provides effective control of asylum support expenditure.",Home Office,Home Office,UK Visas and Immigration Finance Business Partner,0207 035 4848 or Mincom 0207 035 4742,public.enquiries@homeoffice.gsi.gov.uk,2CS01,430000,1,0,0,Finance,,1
1CS48,N/D,SCS1,Immigration Enforcement Senior Finance Business Partner,"The Immigration Enforcement Senior Finance Business Partner is responsible for supporting these business areas in strategic and tactical decision making, ensuring financial consequences, risks and opportunities are understood and considered at the point at which decisions are taken; providing professional challenge to the business, ensuring financial plans, forecasts and underlying assumptions are robust and are appropriately tested; and working on behalf of the business to commission and oversee the delivery of expert financial support and advice from other areas of finance to time and quality in order to meet business objectives.",Home Office,Home Office,Immigration Enforcement Finance Unit,0207 035 4848 or Mincom 0207 035 4742,public.enquiries@homeoffice.gsi.gov.uk,2CS01,0,1,0,0,Finance,Salary costs included in 2CS01,1
1CS38,Vacant,SCS1,International and Immigration Policy Group Senior Finance Business Partner,"The International and Immigration Policy Group Senior Finance Business Partner is responsible for supporting these business areas in strategic and tactical decision making, ensuring financial consequences, risks and opportunities are understood and considered at the point at which decisions are taken; providing professional challenge to the business, ensuring financial plans, forecasts and underlying assumptions are robust and are appropriately tested; and working on behalf of the business to commission and oversee the delivery of expert financial support and advice from other areas of finance to time and quality in order to meet business objectives.",Home Office,Home Office,International and Immigration Policy Group Finance Unit,N/A,N/A,2CS01,0,1,0,0,Finance,Salary costs included in 2CS01,1
2CS04,Norman Driskell,SCS2,Chief Digital & Data Officer,The Chief Digital and Data Officer is responsible for setting and delivering the digital and data strategies for the Home Office. Digital is fundamental to the Home Office improvement plan and our work towards delivering the 2020 vision. The CDO maintains strong links with the cross-government digital community including the Government Digital Service at the Cabinet Office.,Home Office,Home Office,Chief Digital & Officer,0207 035 4848 or Mincom 0207 035 4742,public.enquiries@homeoffice.gsi.gov.uk,3CS01,0,1,130000,134999,Information Technology,,1
1CS22,N/D,SCS1,Deputy Director for Digital Capabilities,"The HO Data Analytics Capability  is a business change programme that delivers a Data Analytics capability to drive an intelligence-led organisation, in order to help make our communities safer and improve the public’s customer experience of interacting with the HO.

The objective of the Information Digitisation Programme is to break the department’s dependency on paper based transactions by delivering bespoke digital projects, in certain key areas, which prove concepts and demonstrate capability.  Successful projects should  have potential to empower the HO, its staff and customers to operate more effectively, efficiently and securely in a digital age.",Home Office,Home Office,Digital Capabilities,0207 035 4848 or Mincom 0207 035 4742,public.enquiries@homeoffice.gsi.gov.uk,2CS04,0,1,0,0,Information Technology,Salary costs included in 1CS22,1
1CS24,N/D,SCS1,Deputy Director for Delivery,"Digital Delivery is in the process of delivering 25 projects, ranging from a discovery for Police.uk to an alpha for Immigration and Enforcement Ticketing and Escorting and Beta for HMPO Online Passport renewals. Projects vary in scale and impact across departments. Digital Delivery sets standards and governance for digital services. Digital Delivery are setting quality standards to be shared across the Home Office to determine and build understanding of ‘what good looks like’ across each of the above functions.",Home Office,Home Office,Digital Delivery,0207 035 4848 or Mincom 0207 035 4742,public.enquiries@homeoffice.gsi.gov.uk,2CS04,0,1,0,0,Information Technology,,1
1CS43,N/D,SCS1,Deputy Director for Data,"Home Office Digital's Data team is broadly responsible for the Data Strategy and Standard; data sharing policy and processes; a data matching service (MIDAS); a technical solution for the Exit Checks programme; development of new ways of sharing data - for example, kicked off the Life Events Verification API and developed a proof of concept for accessing Police National Computer data via an API; Open Data policy and publishing and the development of a Data Catalogue.",Home Office,Home Office,Data,0207 035 4848 or Mincom 0207 035 4742,public.enquiries@homeoffice.gsi.gov.uk,2CS04,0,1,0,0,Information Technology,,1
2HR03,Martin Beecroft,SCS2,HR Corporate Director,The post holder is responsible for developing the department’s corporate HR programmes of work.,Home Office,Home Office,Corporate HR,0207 035 4848 or Mincom 0207 035 4742,public.enquiries@homeoffice.gsi.gov.uk,3HR01,7180000,1,110000,114999,Human Resources,,1
3HR01,Julie Taylor,SCS3,Director General,The Director General is a member of the Home Office Executive Management Board. The post holder leads on all people matters,Home Office,Home Office,HR Director Generals Office,0207 035 4848 or Mincom 0207 035 4742,public.enquiries@homeoffice.gsi.gov.uk,4PO01,400000,1,120000,124999,Human Resources,,1
