2HR02,Paula Leach,SCS2,"Director Leadership, Capability and Change","The post holder is responsible for developing the department’s leadership and capability programmes of work. This includes ensuring a continued succession of talented leaders; developing, maintaining and delivering a skills strategy; providing an HR service to the Senior Civil Service in the Home Office; and leading a business partner team.",Home Office,Home Office,"Leadership, Capability and Change",0207 035 4848 or Mincom 0207 035 4742,public.enquiries@homeoffice.gsi.gov.uk,3HR01,840000,1,110000,114999,Human Resources,,1
1HR07,N/D,SCS1,HR Director SCS Resourcing and Public Appointments/ Leadership Talent & Diversity,"Responsible for Senior Civil Service HR management, talent management and recruitment; public appointments.",Home Office,Home Office,"Leadership, Capability and Change",0207 035 4848 or Mincom 0207 035 4742,public.enquiries@homeoffice.gsi.gov.uk,2HR02,1650000,1,0,0,Human Resources,,1
1HR09,N/D,SCS1,"Deputy Director, Learning and Skills","This role leads on the development and implementation of the capability and talent strategies for the Home Office, developing management capability, building professionalism and ensuring value for money is achieved through our capability development activities.'",Home Office,Home Office,Learning and Skills,0207 035 4848 or Mincom 0207 035 4742,public.enquiries@homeoffice.gsi.gov.uk,2HR02,3080000,1,0,0,Human Resources,,1
1HR15,N/D,SCS1,HR Director for Border Force,Director responsible for leading the Border Force People Directorate and developing and implementing the workforce capability strategy.,Home Office,Home Office,HR Business Partner Team - Immigration Enforcement,0207 035 4848 or Mincom 0207 035 4742,public.enquiries@homeoffice.gsi.gov.uk,2HR03,400000,1,0,0,Human Resources,,1
1HR11,N/D,SCS1,HR Director workforce & HR Delivery,Leads Home Office workforce planning and management information relating to the Department’s workforce. Oversees the Department’s Honours Secretariat and Shared Services,Home Office,Home Office,"HR Delivery, HR Workforce Planning and MI",0207 035 4848 or Mincom 0207 035 4742,public.enquiries@homeoffice.gsi.gov.uk,2HR03,1930000,1,0,0,Human Resources,,1
1HR17,N/D,SCS1,"Deputy Director Employee Relations; Reward; Health, Safety and Wellbeing; HR Policy","The purpose of this role is to ensure that the department adheres to employment law and safeguards the health, safety and wellbeing of its staff; to defend the department against employment tribunal and PI claims and to manage staff reward solutions and HR policies",Home Office,Home Office,Reward and Employee Relations,0207 035 4848 or Mincom 0207 035 4742,public.enquiries@homeoffice.gsi.gov.uk,2HR03,1790000,1,0,0,Human Resources,,1
1HR19,N/D,SCS1,HR Director for HM Passport Office and UK Visas and Immigration,Provides strategic HR support to HM Passport Office and UK Visas and Immigration,Home Office,Home Office,HR Business Partner Team - HM Passport Office and UK Visas and Immigration,0207 035 4848 or Mincom 0207 035 4742,public.enquiries@homeoffice.gsi.gov.uk,2HR03,780000,1,0,0,Human Resources,,1
1HR24,N/D,SCS1,HR Director for Immigration Enforcement,Provides strategic HR support to Immigration Enforcement,Home Office,Home Office,HR Business Partner Team - Immigration Enforcement,0207 035 4848 or Mincom 0207 035 4742,public.enquiries@homeoffice.gsi.gov.uk,2HR03,810000,1,0,0,Human Resources,,1
1HR23,N/D,SCS1,"HR Director, Policy and Enablers and Resourcing",Provides strategic HR support to policy and enabling functions in the Department and has overall responsibility for resourcing for posts at Grade 6 and below across the Department.,Home Office,Home Office,HR Delivery,0207 035 4848 or Mincom 0207 035 4742,public.enquiries@homeoffice.gsi.gov.uk,2HR03,1000000,1,0,0,Human Resources,,1
1HR29,N/D,SCS1,"Director, Career Transition Service",The post holder is responsible for the service that line manages and supports surplus staff throughout the Home Office while they transition to a new stage in their careers.,Home Office,Home Office,Career Transition Service,0207 035 4848 or Mincom 0207 035 4742,public.enquiries@homeoffice.gsi.gov.uk,2HR03,480000,1,0,0,Human Resources,,1
3EXM01,Vacant,SCS3,Director General,"Director General, Counter Extremism Directorate",Home Office,Home Office,Office for Counter-Extremism,0207 035 4848 or Mincom 0207 035 4742,public.enquiries@homeoffice.gsi.gov.uk,4PO01,0,1,0,0,Policy,,1
2EXM01,Tim Foy,SCS2,Director,"Director, Counter Extremism Directorate",Home Office,Home Office,Office for Counter-Extremism,0207 035 4848 or Mincom 0207 035 4742,public.enquiries@homeoffice.gsi.gov.uk,4PO01,2280000,1,85000,89999,Policy,,1
1EXT01,N/D,SCS1,Head of Strategy Delivery,"The Head of Strategy Delivery is responsible for delivering four critical areas of work at the heart of the Counter-Extremism Strategy: Building a network of community partners, national strategic communications campaigns, Joint programmes across government, Tackling online extremism",Home Office,Home Office,Office for Counter-Extremism,0207 035 4848 or Mincom 0207 035 4742,public.enquiries@homeoffice.gsi.gov.uk,2EXM01,340000,1,0,0,Policy,,1
3CPG01,Mary Calam,SCS3,"Director General, Crime and Policing Group",Responsible for all aspects of the Crime and Policing Group. Member of the Executive Management Board.,Home Office,Home Office,Director General's Office,0207 035 4848 or Mincom 0207 035 4742,public.enquiries@homeoffice.gsi.gov.uk,4PO01,0,1,130000,134999,Policy,Includes 2CPG15 costs to protect salary info,1
3CPGSEC,Stephen Rimmer,SCS3,On Secondment,On secondment,Home Office,Home Office,On secondment,0207 035 4848 or Mincom 0207 035 4742,public.enquiries@homeoffice.gsi.gov.uk,3CPGSEC,0,1,130000,134999,Other,Included in 3CPG01 entry above to protect individual salary data,1
2CPG04,David Lamberti,SCS2,"Director, Policing",Responsible for developing and implementing the Government’s programme of police reforms. Member of the CPG Board.,Home Office,Home Office,Policing,0207 035 4848 or Mincom 0207 035 4742,public.enquiries@homeoffice.gsi.gov.uk,3CPG01,1980000,1,90000,94999,Policy,Includes 1CPG20 & 1CPG26 costs to protect salary info,1
2CPG05,Diana Luchford,SCS2,"Director, Crime",Responsible for developing and implementing the Modern Crime Prevention Strategy. Member of the CPG Board.,Home Office,Home Office,Crime,0207 035 4848 or Mincom 0207 035 4742,public.enquiries@homeoffice.gsi.gov.uk,3CPG01,3480000,1,90000,94999,Policy,Includes 1CPG16 & 1CPG36 costs to protect salary info,1
2CPG07,Alexander Macdonald,SCS2,"Director, Finance and Strategy","Responsible for finance for the group, corporate support and the group's strategic functions. Member of CPG Board.",Home Office,Home Office,Finance and Strategy,0207 035 4848 or Mincom 0207 035 4742,public.enquiries@homeoffice.gsi.gov.uk,3CPG01,3930000,1,90000,94999,Planning,"Included 3CPG01, 2CPG15 & 1CPG48 costs to protect salary info",1
2CPG10,Gordon Shipley,SCS2,Emergency Service Mobile Communications Programme and Airwave Director,"Responsible for the introduction of a better, smarter and cheaper communications system for the emergency services than the Airwave system currently in use.  Member of the CPG Board",Home Office,Home Office,Emergency Services Mobile Communications Programme,0207 035 4848 or Mincom 0207 035 4742,public.enquiries@homeoffice.gsi.gov.uk,3CPG01,3360000,1,135000,139999,Programme and Project Management (PPM),Includes 1CPG44 & 1CPG45 costs to protect salary info,1
2CPG13,Stephen Webb,SCS2,"Portfolio Director, Law Enforcement Technology Programmes","The Home Office is responsible for a range of major technology change programme which are vital for the future success of police forces and other law enforcement partners.  The Portfolio Director is accountable for ensuring that this portfolio of programmes delivers the agreed business benefits, within the agreed budgets, and is governed responsibly. Member of the CPG Board.",Home Office,Home Office,Law Enforcement Technology Programmes,0207 035 4848 or Mincom 0207 035 4742,public.enquiries@homeoffice.gsi.gov.uk,3CPG01,0,1,85000,89999,Programme and Project Management (PPM),Includes 1CPG43 costs to protect salary info,1
2CPG12,Jeremy Oppenheim,SCS2,"Director, Safeguarding","Responsibility for safeguarding, modern slavery and public protection. Member of the CPG Board",Home Office,Home Office,Safeguarding Unit,0207 035 4848 or Mincom 0207 035 4742,public.enquiries@homeoffice.gsi.gov.uk,3CPG01,3860000,1,100000,104999,Policy,Includes 1CPG46 costs to protect salary info,1
1CPG08,N/D,SCS1,Head of Police Strategy and Reform Unit,Responsible for modernisation and reform of police forces.,Home Office,Home Office,Police Strategy and Reform Unit,0207 035 4848 or Mincom 0207 035 4742,public.enquiries@homeoffice.gsi.gov.uk,2CPG04,1480000,1,0,0,Policy,Includes 1CPG49 & 1CPG50 to protect salary info,1
1CPG42,N/D,SCS1,Head of Public Protection Unit,Responsible for public protection and interpersonal violence policy,Home Office,Home Office,Public Protection,0207 035 4848 or Mincom 0207 035 4742,public.enquiries@homeoffice.gsi.gov.uk,2CPG12,1500000,1,0,0,Policy,TCA to SCS. Includes 1CPG14 costs to protect salary info.,1
1CPG14,N/D,SCS1,Head of Modern Slavery Unit,Responsibility for delivering a cross-government strategy to address Modern Slavery,Home Office,Home Office,Modern Slavery Unit,0207 035 4848 or Mincom 0207 035 4742,public.enquiries@homeoffice.gsi.gov.uk,2CPG12,0,1,0,0,Policy,TCA to SCS. Included in 1CPG42,1
1CPG15,N/D,SCS1,Head of Tackling Crime Unit,Responsible for delivering the Government’s strategy to prevent crime,Home Office,Home Office,Tackling Crime Unit,0207 035 4848 or Mincom 0207 035 4742,public.enquiries@homeoffice.gsi.gov.uk,2CPG05,1540000,1,0,0,Policy,Includes 1CPG12 costs to protect salary info,1
1CPG16,N/D,SCS1,Deputy Director,Projects,Home Office,Home Office,Crime,0207 035 4848 or Mincom 0207 035 4742,public.enquiries@homeoffice.gsi.gov.uk,2CPG05,0,1,0,0,Policy,Included in 2CPG05,1
1CPG20,N/D,SCS1,Head of Police Workforce and Capability Unit,"Responsible for ensuring that there is a modern framework for the police workforce that is seen by the public to be professional, skilled and rewarded appropriately.",Home Office,Home Office,Police Workforce and Efficiency Unit,0207 035 4848 or Mincom 0207 035 4742,public.enquiries@homeoffice.gsi.gov.uk,2CPG04,0,1,0,0,Policy,Includes 1CPG26 to protect salary info,1
1CPG26,N/D,SCS1,Head of Police Integrity & Powers Unit,"Responsible for improving the police disciplinary system and misconduct regulations to create a more open, independent and transparent disciplinary system that commands public confidence.",Home Office,Home Office,Police Integrity and Powers Unit,0207 035 4848 or Mincom 0207 035 4742,public.enquiries@homeoffice.gsi.gov.uk,2CPG04,0,1,0,0,Policy,Included in 2CPG04,1
1CPG26,N/D,SCS1,Head of Police Integrity & Powers Unit,"Responsible for improving the police disciplinary system and misconduct regulations to create a more open, independent and transparent disciplinary system that commands public confidence.",Home Office,Home Office,Police Integrity and Powers Unit,0207 035 4848 or Mincom 0207 035 4742,public.enquiries@homeoffice.gsi.gov.uk,2CPG04,0,0.6,0,0,Policy,,1
1CPG36,N/D,SCS1,Head of Crime and Policing Knowledge Hub,"Responsible for  the analytical expertise and knowledge on crime and policing issues, combined with the local relationships and intelligence flows from the Force Insight Team.",Home Office,Home Office,Crime and Policing Knowledge Hub,0207 035 4848 or Mincom 0207 035 4742,public.enquiries@homeoffice.gsi.gov.uk,2CPG05,0,1,0,0,Policy,Included in 2CPG05,1
1CPG12,N/D,SCS1,Head of Drug and Alcohol Unit,Responsible for key reforms to tackle alcohol and drug misuse including a new cross government drug strategy.,Home Office,Home Office,Drug and Alcohol Unit,0207 035 4848 or Mincom 0207 035 4742,public.enquiries@homeoffice.gsi.gov.uk,2CPG05,0,1,0,0,Policy,Included in 1CPG15,1
1CPG43,N/D,SCS1,"Police, Science and Technology","To lead on the transformation of police capabilities, which Ministers and the Permanent Secretary regard as a top priority, and in particular:",Home Office,Home Office,Police Science and Technology Unit,0207 035 4848 or Mincom 0207 035 4742,public.enquiries@homeoffice.gsi.gov.uk,2CPG04,0,1,0,0,Policy,Included in 2CPG13,1
1CPG44,N/D,SCS1,Deputy Programme Director – Transition and Airwave,Responsible for leading and delivering the Emergency Service Mobile Communications Programme,Home Office,Home Office,Emergency Services Mobile Communications Programme,0207 035 4848 or Mincom 0207 035 4742,public.enquiries@homeoffice.gsi.gov.uk,2CPG10,0,1,0,0,Programme and Project Management (PPM),Included in 2CPG10,1
1CPG45,N/D,SCS1,"Deputy Programme Director, Technical and Requests Unit, ESMCP",Responsible for leading and delivering the Emergency Service Mobile Communications Programme,Home Office,Home Office,Emergency Services Mobile Communications Programme,0207 035 4848 or Mincom 0207 035 4742,public.enquiries@homeoffice.gsi.gov.uk,2CPG10,0,1,0,0,Programme and Project Management (PPM),Included in 2CPG10,1
1CPG46,N/D,SCS1,Head of Safeguarding Unit,Responsibility for the safeguarding of children and vulnerable adults.,Home Office,Home Office,Safeguarding Unit,0207 035 4848 or Mincom 0207 035 4742,public.enquiries@homeoffice.gsi.gov.uk,2CPG12,0,1,0,0,Policy,Included in 2CPG12,1
1CPG48,N/D,SCS1,Head of Efficiency and Resources Unit,"Responsible for delivering the annual parliamentary police funding settlement process, implementation of the Police Innovation Fund, providing contingency funding to the police, reforming existing legislation around riot compensation and developing a new funding model for the police.",Home Office,Home Office,Efficiency and Resources Unit,0207 035 4848 or Mincom 0207 035 4742,public.enquiries@homeoffice.gsi.gov.uk,2CPG07,0,1,0,0,Policy,Included in 2CPG07,1
1CPG49,N/D,SCS1,Head of Historic Police Misconduct Investigations,The Unit acts as sponsor to a number of historic police misconduct panels,Home Office,Home Office,Historic Police Misconduct Investigations,0207 035 4848 or Mincom 0207 035 4742,public.enquiries@homeoffice.gsi.gov.uk,2CPG04,0,1,0,0,Policy,Included in 1CPG08,1
1CPG50,N/D,SCS1,"Secretariat, Daniel Morgan Enquiry",Secretariat for the Daniel Morgan inquiry panel,Home Office,Home Office,Historic Police Misconduct Investigations,0207 035 4848 or Mincom 0207 035 4742,public.enquiries@homeoffice.gsi.gov.uk,2CPG04,0,1,0,0,Policy,Included in 1CPG08,1
1CPG51,N/D,SCS1,"Deputy Programme Director, ESMCP",Responsible for leading and delivering the Emergency Service Mobile Communications Programme,Home Office,Home Office,Emergency Services Mobile Communications Programme,0207 035 4848 or Mincom 0207 035 4742,public.enquiries@homeoffice.gsi.gov.uk,2CPG10,0,1,0,0,Programme and Project Management (PPM),Includes 1CS05 costs to protect salary info,1
2CPG15,Daniel Greaves,SCS1,"Director, Fire & Resilience",Responsible for delivering the transfer of fire and rescue policy from DCLG to the Home Office. Member of CPG Board,Home Office,Home Office,Fire and Resilience,0207 035 4848 or Mincom 0207 035 4742,public.enquiries@homeoffice.gsi.gov.uk,3CPG01,0,1,70000,74999,Policy,Included in 3CPG01 entry above to protect individual salary data,1
2CPG14,John O'Brien,SCS2,Secretary to Historic Child Sexual Abuse Inquiry,"The Head of Secretariat to the Independent Panel Inquiry into Child Sex Abuse is a high-profile and demanding post, requiring strong leadership skills, strategic thinking and the ability to represent the Inquiry effectively with a wide range of stakeholders including survivors.  The Head of Secretariat is expected to scope the full requirement for staff and other resources, and whilst there has been cover at SCS PB1 level for the day to day running of the Secretariat to date, more senior leadership is now required in order to establish and lead the team.  Other critical aspects of the Director role heading up the Secretariat will be to work with the Panel to get the inquiry properly up and running and then to oversee the proper running of the inquiry, providing advice to the Chair and the Panel and lead the delivery of the Panel’s report(s).",Home Office,Home Office,Child Sexual Abuse Inquiry,0207 035 4848 or Mincom 0207 035 4742,public.enquiries@homeoffice.gsi.gov.uk,3CPG01,2340000,1,125000,129999,Policy,,1
4PO02,Oliver Robbins,SCS4,Second Permanent Under Secretary,Second Permanent Under Secretary,Home Office,International & Immigration Policy Group,2nd PUS Office,0207 035 4848 or Mincom 0207 035 4742,public.enquiries@homeoffice.gsi.gov.uk,4PO01,1150000,1,140000,144999,Policy,,1
1IIPG12,N/D,SCS1,Head of International Criminality Unit,"The International Criminality Unit (ICU) is responsible for policy around international police and judicial cooperation, such as extradition, sharing criminal conviction data, international biometrics sharing and Interpol. It also oversees work to reduce the level of foreign criminality in the UK. The UK Central Authority, within International Criminality Unit, is responsible for extradition and mutual legal assistance casework",Home Office,International & Immigration Policy Group,Head of International Criminality Unit,0207 035 4848 or Mincom 0207 035 4742,public.enquiries@homeoffice.gsi.gov.uk,2IIPG04,2320000,1,0,0,Policy,,1
2IIPG06,Glyn Williams,SCS2,Director of Immigration and Border Policy Directorate,"Provide effective policy advice to support the government’s objective of reducing net migration; Provide a strategic policy framework to protect the UK from illegal immigration, crime and terrorism, through effective end-to end border controls; Provide an effective set of policies that protect the public by removing illegal immigrants, deporting foreign national criminals and denying the privileges of British nationality to those who harm the UK; Support an effective asylum system, through effective policies, both in the UK and in Europe; Ensure we have a fit for purpose legal framework, and manage litigation effectively'",Home Office,International & Immigration Policy Group,Director of Immigration and Border Policy Directorate,0207 035 4848 or Mincom 0207 035 4742,public.enquiries@homeoffice.gsi.gov.uk,4PO02,860000,1,90000,94999,Policy,,1
1IIPG13,N/D,SCS1,"Head of Illegal Migration, Identity Security and Enforcement Policy Unit","Lead policy to tackle illegal migration through denial of services, tackling illegal working, a secure identity system for migrants, making it easier to remove illegal migrants and ensure a sustainable detention policy.",Home Office,International & Immigration Policy Group,"Head of Illegal Migration, Identity Security and Enforcement Policy Unit",0207 035 4848 or Mincom 0207 035 4742,public.enquiries@homeoffice.gsi.gov.uk,2IIPG06,1680000,1,0,0,Policy,,1
1IIPG19,N/D,SCS1,Head of Migration Policy,"Lead policy on all migration routes including visitors, temporary migration (work, study) and permanent migration (family) as well as passport policy. Sets the framework of rules on permission to enter and stay. Current focus is on delivering the programme to reduce net migration",Home Office,International & Immigration Policy Group,Head of Migration Policy,0207 035 4848 or Mincom 0207 035 4742,public.enquiries@homeoffice.gsi.gov.uk,2IIPG06,1280000,1,0,0,Policy,,1
1IIPG17,N/D,SCS1,Head of Legal Strategy Team,"Lead on managing legal risk through the Litigation Strategy Board; co-ordinating changes to legislation; litigation policy, including legal aid and appeals, and relationship with higher courts'",Home Office,International & Immigration Policy Group,Head of Legal Strategy Team,0207 035 4848 or Mincom 0207 035 4742,public.enquiries@homeoffice.gsi.gov.uk,2IIPG06,1900000,1,0,0,Policy,,1
1IIPG18,N/D,SCS1,Border and Visa Policy Unit,Lead policy on borders and visas to support a secure UK border.,Home Office,International & Immigration Policy Group,Border and Visa Policy Unit,0207 035 4848 or Mincom 0207 035 4742,public.enquiries@homeoffice.gsi.gov.uk,2IIPG06,1110000,1,0,0,Policy,,1
1IIPG16,N/D,SCS1,Head of Migration Advisory Committee Secretariat,"The Migration Advisory Committee (MAC) secretariat supports the MAC in providing independent and evidence-based advice to the Government on matters relating to migration, including on migration impacts, labour market shortages and limits on tiers 1 and 2 of the Points Based System'",Home Office,International & Immigration Policy Group,Head of Migration Advisory Committee Secretariat,0207 035 4848 or Mincom 0207 035 4742,public.enquiries@homeoffice.gsi.gov.uk,2IIPG06,570000,1,0,0,Policy,,1
2IIPG10,Shona Riach,SCS2,"Director, Borders & Immigration Systems","The Border and Immigration System Directorate supports the  second permanent secretary by providing an overview of the Border, Immigration and Citizenship System and supporting its future development. 
Coordination and oversight of the implementation of Immigration legislation  and supporting operational areas to prepare for inspection by the Independent Chief Inspector.",Home Office,International & Immigration Policy Group,Immigration Operations,0207 035 4848 or Mincom 0207 035 4742,public.enquiries@homeoffice.gsi.gov.uk,4PO02,0,1,90000,94999,Policy,Salary costs included with 2IIPG04,1
1IIPG02,N/D,SCS1,Head of Asylum & Family Policy,Lead policy to support the operation of an effective family migration route and an efficient asylum system which protects vulnerable people in accordance with our international obligations.,Home Office,International & Immigration Policy Group,Head of Asylum & Family Policy,0207 035 4848 or Mincom 0207 035 4742,public.enquiries@homeoffice.gsi.gov.uk,2IIPG06,2010000,1,0,0,Policy,,1
1IIPG21,N/D,SCS1,Head of HO Wales Team and Cross cutting,The Home Office Team Wales works closely with the Welsh Government in taking forward reserved home affairs matters.,Home Office,International & Immigration Policy Group,Head of HO Wales Team and Cross cutting,0207 035 4848 or Mincom 0207 035 4742,public.enquiries@homeoffice.gsi.gov.uk,2IIPG04,510000,1,0,0,Policy,,1
1IIPG28,N/D,SCS1,Director Border & Immigration System,"Provide cross-cutting secretariat and strategy function for the border, immigration and citizenship system to ensure effective system-wide briefing and communications; cross-system planning, strategy and consultancy support and liaison/relationship management for the Independent Chief Inspector, the office for the Immigration Services Commissioner and the Migration Advisory Committee.",Home Office,International & Immigration Policy Group,Director Border & Immigration System,0207 035 4848 or Mincom 0207 035 4742,public.enquiries@homeoffice.gsi.gov.uk,2IIPG10,1340000,1,0,0,Policy,,1
1IIPG23,N/D,SCS1,Free Movement and Migrant Criminality unit,"Lead policy and strategy on EU free movement, as well as the 'public good' and public protection issues in immigration policy across the board.",Home Office,International & Immigration Policy Group,Free Movement and Migrant Criminality unit,0207 035 4848 or Mincom 0207 035 4742,public.enquiries@homeoffice.gsi.gov.uk,2IIPG06,1040000,1,0,0,Policy,,1
1IIPG07,N/D,SCS1,"Deputy Director, International Directorate: Europe","The Deputy International Director supports the International Director in ensuring the Home Office meets its objectives in Europe and bilaterally with European states. The Home Office business areas understand the European Union procedures, negotiations on draft European legislation, international obligations and opportunities for delivering the Government’s international justice and home affairs (JHA) agenda.”",Home Office,International & Immigration Policy Group,"Deputy Director, International Directorate: Europe",0207 035 4848 or Mincom 0207 035 4742,public.enquiries@homeoffice.gsi.gov.uk,2IIPG04,1300000,1,0,0,Policy,,1
2IIPG04,Peter Storr,SCS2,Director of International Directorate,"The International Director heads the Directorate which delivers the European Union and wider international aspects of Home Office priorities, with its international partners. The Directorate works closely with many Home Office units and agencies, and with other government departments and posts overseas to ensure that the Home Office’s international priorities are identified and coherently managed, negotiated and delivered.",Home Office,International & Immigration Policy Group,Director of International Directorate,0207 035 4848 or Mincom 0207 035 4742,public.enquiries@homeoffice.gsi.gov.uk,4PO02,510000,1,100000,104999,Policy,,1
1IIPG01,N/D,SCS1,"Deputy Director, International Directorate: Strategy and Engagement",The Deputy Director International Strategy and Engagement supports the International Director in the work set out in 2IIPG04 and ensures that the Home Office builds its international capability and contributes fully and effectively in helping to deliver the Government’s foreign policy and strategy agenda.,Home Office,International & Immigration Policy Group,International Strategy,0207 035 4848 or Mincom 0207 035 4742,public.enquiries@homeoffice.gsi.gov.uk,2IIPG04,1410000,1,0,0,Policy,,1
