Ratepayer,Billing Account Balance ,Liable Unit Balance ,Year,Property Address,Billing Address,Date Start,Date End
,-581.7,-8669.56,2012,"High Cross Barn, High Cross Lane, Shelf, Halifax              HX3 7TH",,04/01/09,03/31/10
,-100.58,-100.58,2011,"53 Bethel Street, Brighouse, HD6 1JR",,09/24/10,05/03/11
Limehouse Films Ltd,-314.89,-314.89,2011,"Off 5, 2ND Flr W Grove Mill, The E W Innovation Centre, Hopwood Lane, Halifax              HX1 5ER","The E W Innovation Centre, Hopwood Lane, Halifax, HX1 5EP",09/01/10,05/18/11
,-309.2,-309.2,2010,"Unit 3 Hill Top Farm, Pepper Hill, Cock Hill Lane, Shelf                HX3 7TH",,09/25/10,04/14/11
British Waterways,-1794.36,-1794.36,2012,"Victoria Works, Mill Lane, Brighouse, HD6 1PP","Fao Simon Moore, Navigation Road, Northwich, Cheshire, CW8 1BH",12/23/11,12/11/12
Dr D Chin & Partners,-10551.25,-40609.25,2015,"Northowram Surgery, 53 Northowram Green, Northowram, Halifax              HX3 7JE",,04/01/12,
Inomed Health Ltd,-595.38,-595.38,2012,"Office 38 First Floor, The E W Innovation Centre, Hopwood Lane, Halifax              HX1 5ER",,04/01/11,10/31/14
Cafe Dino's Ltd,-310.86,-736.56,2014,"23 Alexandra Street, Halifax, HX1 1BS","23 Alexandra Street, Halifax, HX1 1BS",07/16/11,
,-30.79,-30.79,2013,"Manchester House, 68 Carr House Road, Shelf, Halifax             HX3 7RJ",,01/23/12,02/02/14
,-114.73,-114.73,2013,"23 Bull Close Lane, Halifax, HX1 2EF",,08/05/12,01/25/14
C J Morton & Co Ltd,-6648,-3690.1,2014,"Pendleton Mills, James Street, Elland, HX5 0HB","F.A.O. Stephen Walker, Morton Meadow Logistics Ltd, Brookfoot Business Centre, Elland Road, Brighouse, HD6 2RW",04/01/10,
Coal Pension Properties Ltd,-6115.36,-6115.36,2015,"12 Woolshops, Halifax, HX1 1RU","C/O Capita Property &, Infrastructure Ltd, 65 Gresham Street, London, EC2V 7NQ",09/28/12,10/19/15
Nhs Property Services Ltd,-1479,-11962,2015,"St Johns Health Centre, Lightowler Road, Pellon, Halifax             HX1 5NB","C/O Gl Hearn Management Ltd, Po Box 1610, Southampton, SO15 3WX",04/01/13,
Preston Derwent Estates Ltd,-103.65,-103.65,2013,"Office Block(First Floor), North Dean Business Park, Stainland Road, Greetland           HX4 8LR","C/O K Duffy, 19 Silverdale Drive, Lees, Oldham, OL4 3DX",03/16/13,10/31/13
Nutranet Ltd,-6.17,-6.17,2012,"Unit 3A South Mill, White Rose Mill, Holdsworth Road, Halifax              HX3 6SN","27 Illingworth Close, Halifax, HX2 9JQ",04/01/09,12/31/12
Primesight Ltd,-0.03,211.97,2014,"Gable 54 Carr House Road, Shelf, Halifax, HX3 7RJ","Unit 9 Westpoint Enterprise Pk, Clarence Avenue, Trafford Park, Manchester, M17 1QS",09/01/09,
,-33.92,-33.92,2013,"12 Westgate, Halifax, HX1 1DJ",,02/01/11,08/12/13
Trustees Of B Holmes Discretionary Settlement,-620.04,-620.04,2013,"Part 7th Floor, 60 Crown Street, Halifax, HX1 1HY","C/O Walker Singleton, Property House, Lister Lane, Halifax, HX1 5AS",05/11/11,02/28/14
,-206.68,-206.68,2012,"38 Well Green Lane, Brighouse, HD6 2NS",,04/01/10,03/31/12
,-1.58,-1.58,2012,"Unit 1, Mearclough Works, Mearclough Road, Sowerby Bridge       HX6 3LF",,02/15/10,
Virgin Care Leeds Llp,-5054.42,-45536.25,2011,"Meadow Dale Group Practice, 120 Nursery Lane, Ovenden, Halifax              HX3 5SX","6400 Daresbury Business Park, Daresbury, Warrington, WA4 4GE",04/07/11,
,-220.69,-220.69,2014,"55 Hanson Lane, Halifax, HX1 5NX",,04/01/10,01/04/15
"L Roberts, S Dinning, D Van Gestel & L Van Gestel",-1250.51,-1250.51,2011,"Salt Warehouse, Canal Wharf, Sowerby Bridge, HX6 2AG",,07/30/10,10/09/11
La Salle [Uk] Investment Property Co,-1856.69,-1856.69,2011,"Unit G17, Riverbank Way, Lowfields Business Park, Elland               HX5 9DN","Lim Accounts Payable, Po Box 3515, Norwich, NR7 7QX",10/29/10,10/13/11
Blackshaw Holdings Ltd,-9823.89,-9823.89,2015,"Suite 1 First Floor, Clifton House, Bradford Road, Brighouse            HD6 4JJ","St Bernards Mill, Gelderd Road, Gildersome, Leeds, LS27 7NA",01/07/12,05/25/15
Communitas Eu Ltd,-83,-83,2012,"Office Suite D107, Dean Clough Mills, Halifax, HX3 5AX","Office Suites D107/D109, Dean Clough Mills, Halifax, HX3 5AX",06/01/11,05/31/11
P G Freight Ltd,-30.67,-30.67,2013,"Unit 3, 535 Bradford Road, Bailiff Bridge, Brighouse            HD6 4DL","C/O Wilkinson And Partners, Fairfax House, 6A Mill Field Road, Cottingley, BD16 1PY",10/01/11,02/28/14
C-Tech Innovation  Ltd,-15.93,-15.93,2015,"Office 40 First Floor, The E W Innovation Centre, Hopwood Lane, Halifax              HX1 5ER","Capenhurst Technology Park, Capenhurst, Chester, CH1 6EH",05/15/12,04/30/15
,-62.89,-62.89,2014,"Unit 4, Hawksclough Industrial Est., Burnley Road, Mytholmroyd          HX7 5AD",,10/01/12,08/01/14
Prohold Ltd,-12,-12,2013,"Unit 2 Grantham Garage, Dewsbury Road, Brighouse, HD6 3QB","C/O 24 Meadowcroft, Honley, Holmfirth, HD9 6GJ",02/01/13,01/30/14
Moderna Ltd,-280,-280,2015,"Units 12A / B, Moderna Business Park, Burnley Road, Mytholmroyd          HX7 5QQ","Unit 17, Moderna Business Park, Burnley Road, Mytholmroyd, HX7 5QQ",12/15/12,05/31/15
Nhs Property Services Ltd,-10965.5,-26447.37,2014,"Clinic, Lawson Road, Brighouse, HD6 1NY","C/O Gl Hearn Management Ltd, Po Box 1610, Southampton, SO15 3WX",04/01/13,
Trustees Of Whiteleys Engineering,-183,163,2013,"Former Cottage, Rishworth Business Complex, Rishworth, Sowerby Bridge       HX6 4EW","Attn Property Management A/C's, C/O Walker Singleton, Property House, Lister Lane, Halifax, HX1 5AS",12/07/10,
Bizspace Ltd,-2088.82,-2088.82,2013,"Unit 2, Calderdale Business Park, Club Lane, Halifax              HX2 8AX","Sovereign House, Fao Mital Shah, 1 Albert Place, Finchley, London, N3 1QB",05/02/13,05/01/13
,-3.99,-3.07,2013,"35 Broad Street, Halifax, HX1 1YA",,03/01/14,
,-2518,-2518,2012,"Unit 3B, Brunswick Industrial Estate, Brassey Street, Halifax              HX1 2EL",,10/05/12,
Orean Personal Care Ltd,-1314.51,-1314.51,2013,"Units 14-20, Branxholme Industrial Estate, Bradford Road, Brighouse            HD6 4EA","Unit E1, Stubs Beck Lane, West 26 Ind Estate, Cleckheaton, BD19 4TT",12/01/13,12/31/13
,-226.36,-226.36,2015,"13 St James Road, Halifax, HX1 1YS",,01/10/14,06/28/15
South West Yorkshire Partnership Nhs Foundation Trust,-811.15,-811.15,2014,"The Laura Mitchell Clinic, Great Albion Street, Halifax, HX1 1YR","Creditor Payments, Ward 4, Castleford, Normanton Hospital, Lumley Street, Castleford, WF10 5LT",01/22/14,01/19/15
Tesco Stores Ltd,-0.01,269507.99,2014,"Tesco Stores Ltd, Huddersfield Road, Brighouse, HD6 1LE","C/O G L Hearn Management Ltd, P.O Box 1610, Southampton, SO15 3WX",04/01/10,
,-0.38,-0.38,2012,"Stainland Road, Stainland, Halifax, HX4 9PD",,02/27/06,
G.H.P Ltd,-1371.7,-1371.7,2015,"Empire House, Mulcture Hall Road, Halifax, HX1 1SP","Empire House, Mulcture Hall Road, Halifax, HX1 1SP",06/01/14,09/22/15
Birds Royd Property Co Ltd,-229.25,-229.25,2014,"Princess Works, Birds Royd Lane, Brighouse, HD6 1LH","C/O R A S Sports, Princess Works, Bird Royd Lane, Brighouse, HD6 1LJ",07/01/14,02/28/15
Langfield Investments Ltd,-255.08,-255.08,2015,"Unit 2 & 3, Langfield Business Park, Norland Road, Sowerby Bridge       HX6 3DF","23 Dorchester Road, Bradley Bar, Huddersfield, HD2 2JZ",07/01/14,09/03/15
O & M Electrical Services Ltd,-109.83,-109.83,2015,"Unit 2 Providence Works, Queens Road, Halifax, HX1 3NS","Oldroyd Properties Ltd, C/O Burniston, Skircoat Moor Road, Halifax, HX3 0JW",03/01/15,08/31/15
Setbray Properties Ltd,-215.87,-215.87,2015,"Mytholmroyd Medical Centre, Burnley Road, Mytholmroyd, Hebden Bridge        HX7 5LF","Suite 1 2nd Floor, Burlees House, Hangingroyd Lane, Hebden Bridge, HX7 7DD",08/16/15,10/14/15
Blenheim Displays Ltd,-0.05,-0.05,2014,"Unit 16K, Calderdale Buslness Park, Club Lane, Halifax              HX2 8AX","27 Church Street, West Lavington, Devizes, SN10 4LF",02/01/15,03/31/15
B W Sipp Trustees Limited,-669.56,-669.56,2014,"Bay 1, Rosemount Estate, Huddersfield Road, Elland               HX5 0EE","C/O Throstle Nest, Warley Wood Lane, Luddendenfoot, Halifax, HX2 6BW",04/01/14,09/07/14
Willow Storage Limited,-0.65,-0.65,2015,"Units 12A & 12B, Calderdale Business Park, Club Lane, Halifax              HX2 8AX","Willow Storage Limited, Milton House, Church Street, West Lavington, Devizes Wiltshire, SN10 4LF",04/01/15,05/31/15
,-113.01,-113.01,2015,"Unit 4, Hawksclough Industrial Est., Burnley Road, Mytholmroyd          HX7 5AD",,02/01/15,10/31/15
Tosca North East Ltd,-7047.04,-7047.04,2015,"3/5/7 Wellington Arcade, Briggate, Brighouse, HD6 1DN","Management Ltd, 8 Elmbank Gardens, Charing Cross, Glasgow, G2 4NQ",02/15/15,05/14/15
,-263.04,-263.04,2014,"7 Victoria Road, Elland, HX5 0AB",,10/10/14,10/13/14
C3S Projects Ltd,-3290,-3290,2015,"Adj Ardeth Engineering Ltd, Elland Bridge, Elland, HX5 0SQ","Canal Mills, Elland Bridge, Elland, HX5 0SQ",04/01/15,
Thornber Chicks Ltd,-218.56,-218.56,2015,"Units 1A & 1B, Brier Hey, Burnley Road, Mytholmroyd          HX7 5PF","Dean Hey Farm, Cragg Road, Mytholmroyd, Hebden Bridge, HX7 5RU",05/01/15,06/30/15
Thornber Chicks Ltd,-108.48,-310.48,2014,"Unit 1, Topland Country Business Pk, Cragg Road, Mytholmroyd          HX7 5RU","Dean Hey Farm, Cragg Road, Mytholmroyd, Hebden Bridge, HX7 5RU",07/01/14,02/28/15
R H & G Travis & Sons Ltd,-74.37,-74.37,2012,"1a Birds Royd Lane, Brighouse, HD6 1LQ",,04/01/90,
,-5.4,-5.4,2006,"Birkby Lane, Bailiff Bridge, Brighouse, HD6 4EN",,04/01/90,05/07/06
Tote Bookmakers Ltd,-545.55,-545.55,2012,"5 Canal Street, Brighouse, HD6 1NR","Westgate House, Chapel Lane, Wigan, WN3 4HS",07/01/95,10/14/13
,-3768,-35432,2014,"Longroyde Surgery, 38 Castle Avenue, Brighouse, HD6 3HT",,04/01/90,
,-12820.5,-88446.92,2008,"24 Church Lane, Brighouse, HD6 1AT",,04/01/90,06/27/12
Stereosound Productions Ltd T/A Sentra Consumer Products,-3168.87,-3168.87,2002,"Locksley Works, Armytage Road, Brighouse, HD6 1QF",,04/01/90,06/28/90
,-3.63,-3.63,2002,"77 New Hey Road, Brighouse, HD6 3PY",,09/11/98,01/24/99
,-50.53,-50.53,2003,"12 Southgate, Elland, HX5 0BW",,10/01/00,03/14/04
,-374.31,-374.31,2002,"11a Aked's Road, Halifax, HX1 2TR",,03/18/91,10/31/93
,-66.05,-66.05,2004,"120 Albert View, Pellon, Halifax, HX2 0DD",,06/29/94,07/23/04
,-7.18,-7.18,2002,"5 Albion Street, Halifax, HX1 1DU",,04/01/90,06/29/02
Casson & Co Ltd,-262.7,-298.19,2010,"Market Stall 25-26, Market Hall, Borough Market, Halifax             HX1 1DZ","117 Huddersfield Road, Oldham, OL1 3NY",04/01/92,04/30/11
,-0.88,-0.88,2012,"Dundee Farm, Brighouse&Denholmegate Rd, Shelf, Halifax             HX3 7TG",,06/01/98,
Hardcastle Bros (Brighouse) Ltd,-0.63,-0.63,2012,"24 Rastrick Common, Brighouse, HD6 3DR","22 Rastrick Common, Brighouse, HD6 8DR",04/01/90,
Brewster Ltd [In Liquidation],-55.16,-55.16,2002,"Grove Inn, 2/4 Tofts Grove Fold, Rastrick, Brighouse           HD6 3NW","C/O Neville Russell, Airedale House, 77 Albion Street, Leeds, LS1 5HT",11/01/97,02/02/98
,-6928,-77567.88,2006,"The Surgery, Burley Street, Elland, HX5 0AQ",,04/01/90,
,-7392,-77567.88,2008,"The Surgery, Burley Street, Elland, HX5 0AQ",,04/01/90,
,-6922.35,-77567.88,2013,"The Surgery, Burley Street, Elland, HX5 0AQ",,04/01/90,
,-88.08,-88.08,2002,"Fast Lane Buildings, Elizabeth Street, Elland, HX5 0JH",,12/13/93,09/30/96
,-833.14,-475.17,2014,"Elland Lane, Elland, HX5 9ER",,06/09/92,
Benjamin Whiteley & Sons Ltd,-0.3,-0.3,2012,"Park Road Mills, Park Road, Elland, HX5 9HX","Park Road Mills, Park Road, Elland, HX5 9HX",08/01/01,
Nova Clothing Ltd,-70.68,-70.68,2002,"Unit 5 (3rd Floor), Wellington Mills, Quebec Street, Elland              HX5 9AS",,07/01/94,08/31/97
Tyne Insulation Supplies Ltd,-1197.78,-1197.78,2004,"Unit 19 Woodman Works, South Lane, Elland, HX5 0PA","Unit 6, 30 City Link Industrial Park, Phoenix Way, Bradford, BD4 8JP",10/18/95,01/31/05
Talk Line Communications Ltd[In Liquidation],-406.35,-406.35,2002,"20 Crown Street, Halifax, HX1 1TT","C/O Jennings Johnson, 19 Borough Road, Sunderland, SR1 1LA",03/03/97,11/04/98
V T L [Europe] Ltd,-1612.07,-3645.24,2012,"Cooper House Works, Luddendenfoot, Halifax, HX2 6EL","St Thomas Road, Huddersfield, HD1 3LG",04/01/90,06/07/12
,-23.09,-136.31,2000,"Adjacent Coliseum, Fountain Street, Halifax, HX1 2AB",,11/01/00,03/31/02
Calderdale P C T,-4396.38,-39280.46,2005,"St Johns Health Centre, Lightowler Road, Pellon, Halifax             HX1 5NB","5J6 Payables 4265, Phoenix House, Topcliffe Lane, Wakefield, WF3 1WE",04/01/00,03/31/13
,-5.37,-5.37,2004,"Wheatsheaf Hotel, 42 Mount Pellon, Pellon, Halifax             HX2 0EE",,03/27/98,03/30/05
Brewster Ltd [In Liquidation],-1300.32,-1300.32,2002,"Union Cross Hotel, 12 Old Market, Halifax, HX1 1TN","C/O Neville Russell, Airedale House, 77 Albion Street, Leeds, LS1 5HT",11/01/97,02/02/98
,-70.8,-70.8,2003,"98a Oxford Lane, Siddal, Halifax, HX3 9BJ",,10/02/01,08/09/03
,-154,-154,2002,"21/23 Park Drive, Rochdale Road, Halifax, HX2 7NP",,04/01/90,12/01/91
,-141.64,-141.17,2015,"64 Haley Hill, Halifax, HX3 6ED",,02/28/98,
B B M (Electronic Office)Ltd[In Liquidation],-56.2,-56.2,2002,"Whitehall Chambers, Halifax Road, Hipperholme, Halifax             HX3 8EN","C/O Grant Thornton, [B2688/MEGS/JW/NMH], St Johns Centre, 110 Albion St, Leeds, LS28LA",04/01/90,08/10/93
Gamblinns Ltd [In Liquidation],-180.03,-180.03,2002,"Bar Eleven, 11 Harrison Road, Halifax, HX1 2AF","C/O Baker Tilly, Carlton House, Grammar School Street, Bradford, BD1 4NF",10/26/90,08/08/95
Saville Machine Tools Ltd,-26.21,-26.21,2002,"Hope Street, Halifax, HX1 5DW","C/O Messrs Coopers & Lybrand, 1 East Parade, Sheffield, S1 2ET",04/01/90,08/06/93
Central Garage (Mirfield)Ltd,-2888.07,-2888.07,2003,"Hanson Lane Garage, 1 Hope Street, Halifax, HX1 5DW",No Forwarding Address,04/01/90,12/04/03
,-14652,-104172.38,2007,"Beechwood Medical Centre, Keighley Road, Halifax, HX2 8AL",,09/01/98,10/13/12
Calderdale P C T,-562.9,-3049.47,2006,"Health Clinic, Kershaw Drive, Luddendenfoot, Halifax             HX2 6PD","5J6 Payables 4265, Phoenix House, Topcliffe Lane, Wakefield, WF3 1WE",04/01/00,03/31/13
Calderdale P C T,-630.5,-3049.47,2009,"Health Clinic, Kershaw Drive, Luddendenfoot, Halifax             HX2 6PD","5J6 Payables 4265, Phoenix House, Topcliffe Lane, Wakefield, WF3 1WE",04/01/00,03/31/13
Calderdale P C T,-47.18,-3049.47,2011,"Health Clinic, Kershaw Drive, Luddendenfoot, Halifax             HX2 6PD","5J6 Payables 4265, Phoenix House, Topcliffe Lane, Wakefield, WF3 1WE",04/01/00,03/31/13
,-208.52,-208.52,2002,"163 King Cross Road, Halifax, HX1 3LN",,04/01/90,03/15/95
,-12820.5,-114197.32,2008,"King Cross Surgery, 199 King Cross Road, Halifax, HX1 3LW",,04/01/90,
,-13458.75,-114197.32,2009,"King Cross Surgery, 199 King Cross Road, Halifax, HX1 3LW",,04/01/90,
,-10039.41,-114197.32,2011,"King Cross Surgery, 199 King Cross Road, Halifax, HX1 3LW",,04/01/90,
,-8545.5,-70621.74,2005,"252 Queens Road, Halifax, HX1 4NJ",,04/01/90,
,-29.31,-29.31,2002,"58 Rochdale Road, Greetland, Halifax, HX4 8AX",,04/01/92,04/11/99
,-14899.5,-139065.32,2008,"51 Sandbeds Road, Pellon, Halifax, HX2 0JF",,04/14/93,
Primesight Ltd,-0.02,75.98,2014,"Advertising Right, At Stump Cross Inn, Stump Cross, Halifax             HX3 7AU","Unit 9 Westpoint Enterprise Pk, Clarence Avenue, Trafford Park, Manchester, M17 1QS",08/14/00,
B.K Ventures Ltd,-1599.92,-1599.92,2001,"Old Cock Hotel, Halifax, HX1 1DS","The Coiners, 16 Silver Street, Halifax, HX1 1HS",04/02/01,10/28/01
,-13344.41,-63823.41,2010,"173c Spring Hall Lane, Halifax, HX1 4JG",,03/01/99,
,-1.62,-1.62,2015,"Square Chapel Arts Centre, 10 Square Road, Halifax, HX1 1QG",,05/28/93,
,-219.12,-219.12,2002,"Unit 6, 25 Square Road, Halifax, HX1 1QG",,12/31/99,11/27/01
,-110.6,-490.4,2006,"55 Stainland Road, Greetland, Halifax, HX4 8BD",,04/01/90,03/31/06
,-702.12,-702.12,2004,"42 The Colonnade, Piece Hall, Halifax, HX1 1RE",,09/30/02,06/23/04
,-1.25,-1.13,2012,"52 Market Street, Hebden Bridge, HX7 6AA",,02/15/91,
,-143.6,-143.6,2004,"58 Market Street, Hebden Bridge, HX7 6AA",,11/01/02,09/30/04
Mitaz Ltd,-50.18,-50.18,2003,"13 New Road, Hebden Bridge, HX7 8AD","C/O Mr D Boud, 2 Damems Lane, Keighley, BD22 7AP",06/01/01,04/30/03
,-92.62,-92.62,2004,"Second Floor, Old Town Mill, Wadsworth, Hebden Bridge       HX7 8SP",,06/01/00,09/30/04
,-20.91,-20.91,2008,"Unit 8, Bridge Mill, St Georges Square, Hebden Bridge       HX7 8ET",,11/01/99,01/31/09
,-230,-230,2012,"Unit 7, Bridge Mill, St Georges Square, Hebden Bridge       HX7 8ET",,07/01/98,
,-758.75,-257312.34,2014,"Valley Medical Centre, Valley Road, Hebden Bridge, HX7 7BE",,05/01/98,
,-93.19,-93.19,2002,"224 Halifax Road, Ripponden, Sowerby Bridge, HX6 4BG",,02/04/93,02/04/93
,-2.22,-2.22,2002,"Walnut Street, Halifax, HX1 5JB",,04/01/96,09/30/97
F Lucas & Co Ltd,-0.51,-0.51,2012,"West End Works, Warley Road, Halifax, HX1 3TG","Registered Office, West End Studios, Warley Road, Halifax, HX1 3TG",05/24/98,06/05/15
,-1267.71,-699.64,2007,"Horse & Jockey Inn, 301 Warley Road, Halifax, HX2 0AD",,12/15/93,04/24/08
,-0.66,-0.66,2012,"Wellington Garage, Wellington Street West, Halifax, HX1 2TQ",,04/01/90,
Autec Electronics Ltd [In Liquidation],-312.14,-312.14,2002,"Portland House, West Vale, Halifax, HX4 8NY","C/O Jacksons Joliffe Cork, 33 George Street, Wakefield, WF1 1LX",04/01/90,08/21/96
,-2431.92,-5915.41,2006,"Albert Hotel, 3 Albert Street, Hebden Bridge, HX7 8AH",,11/10/99,10/17/06
,-65.68,-65.68,2005,"16a Bridge Gate, Hebden Bridge, HX7 8EX",,04/01/99,06/30/05
,-0.41,-0.41,2012,"4 Burnley Road, Mytholmroyd, Hebden Bridge, HX7 5LH",,04/01/90,
G Dunkley & Son [H.B] Ltd [In Liquidation],-19.09,-19.09,2002,"3 Carlton House, Crown Street, Hebden Bridge, HX7 8ES","C/O Baker Tilly, Carlton House, Grammar School Street, Bradford, BD1 4NS",10/01/93,07/15/97
,-4.45,-4.45,2002,"22 Town Hall Street, Sowerby Bridge, HX6 2EA",,04/01/97,05/03/99
,-67.9,-67.9,2006,"2nd Floor, Barclays Bank Chambers, 21 Town Hall Street, Sowerby Bridge      HX6 2EA",,10/01/93,12/15/06
Repack Services Ltd,-662.84,-662.84,2005,"Unit 2 Sdh Industrial Estate, West Street, Sowerby Bridge, HX6 3BT","Unit 2 S.D.H Industrial Estate, West Street, Sowerby Bridge, HX6 3BT",02/20/99,10/08/05
,-225.97,-225.97,2005,"Dental Surgery, 92 Wharf Street, Sowerby Bridge, HX6 2AF",,04/01/90,11/01/05
Calderdale P C T,-211,-961.56,2005,"Todmorden Health Centre, Rose Street, Todmorden, OL14 5AT","5J6 Payables 4265, Phoenix House, Topcliffe Lane, Wakefield, WF3 1WE",04/01/00,10/30/09
,-150,1163.84,2014,"129/135 Halifax Road, Todmorden, OL14 5BE",,04/01/90,
,-35.73,-35.73,2004,"Thornlea East, Holme House Road, Todmorden, OL14 8LD",,04/01/00,12/17/04
Joint Admin Receivers Of Lois Fabric Printing Co Ltd,-7.11,-7.11,2002,"Caldervale Mill, Pudsey Road, Todmorden, OL14 8NJ","C/O Coopers & Lybrand, Abacus Court, 6 Minshull Street, Manchester, M1 3ED",09/03/94,09/09/94
A C S Products Ltd,-334.32,-334.32,2002,"Units 5 & 7, Penair Works, Mill Fold, Ripponden           HX6 4DJ","Units 5 & 7, Mill Fold, Ripponden, HX6 4DJ",06/30/98,11/30/99
A Kinghorn & Co Ltd-In Receivership,-2184.48,-2184.48,2002,"Hammer Mill, Stackhills Road, Todmorden, OL14 5QW","C/O Messrs Grant Thornton, Heron House, Albert Square, Manchester, M2 5HD",04/01/90,01/06/93
Primesight Ltd,-0.02,75.98,2014,"Crowtrees Garage, Huddersfield Road, Brighouse, HD6 1HA","Unit 9 Westpoint Enterprise Pk, Clarence Avenue, Trafford Park, Manchester, M17 1QS",05/01/02,
Continental Books,-40.75,-40.75,2003,"51 Crown Street, Halifax, HX1 1JB","F.A.O. Mr Phillip Rhodes, 51 Crown Street, Halifax, HX1 1JB",07/06/03,01/31/04
,-6.66,-6.66,2006,"Hole In The Wall Inn, Hebden Bridge, HX7 7DD",,08/18/03,04/12/07
Haley Bros [ Builders] Ltd [In Liquidation],-9.64,-9.64,2008,"Suite 4, 1ST Floor Burlees House, Hangingroyd Lane, Hebden Bridge        HX7 7DD","C/O X.L Business Solutions, 1st Floor, 2-4 West Street, Cleckheaton, BD19 5AJ",04/28/03,12/10/08
,-49.51,-49.51,2008,"Office Suite D254, Dean Clough Office Park, Halifax, HX3 5AX",,06/01/04,07/01/08
,-222,-453.41,2003,"2 Langdale Street, Elland, HX5 0JL",,04/01/03,03/31/03
,-228,-453.41,2004,"2 Langdale Street, Elland, HX5 0JL",,04/01/03,03/31/03
,-66,-66,2004,"2ND & 3RD Floors, Blue Note, Bridge Street, Todmorden           OL14 5AQ",,07/01/04,06/30/04
Bar Refreshments [Uk] Ltd,-877.8,-1799.3,2008,"Martins Mill, Pellon Lane, Halifax, HX1 5QJ",No Forwarding Address,01/01/04,03/31/08
,-41.6,-41.6,2005,"5 Clare Road, Halifax, HX1 2HX",,04/01/04,03/31/05
,-16.67,-16.67,2008,"4 South Parade, Stainland, Halifax, HX4 9HW",,03/22/04,06/05/08
,-51.09,-51.09,2007,"Unit 2D Crossley Works, Cragg Road, Mytholmroyd, Hebden Bridge        HX7 5EY",,08/01/04,07/01/07
,-50.38,-76.72,2011,"219 King Cross Road, Halifax, HX1 3JL",,03/01/05,03/13/11
,-0.51,-0.51,2012,"Unit 3A, Mitchell Street, Todmorden, OL14 7DW",,04/01/05,
,-27.86,-27.86,2009,"44 Clough Lane, Mixenden, Halifax, HX2 8SN",,04/01/05,06/29/09
,-104.05,-104.05,2005,"Branch House, Saddleworth Road, Barkisland, Halifax              HX4 8NU",,09/23/05,03/19/06
Starway Motorcycles Ltd [In Administration],-91.88,-91.88,2006,"Unit 6 & 7, 370 Bradford Road, Brighouse, HD6 4DJ","C/O Milner Boardman & Partners, Century House, Ashley Road, Hale, WA15 9TG",05/01/05,02/14/07
,-10,-10,2006,"65 Rustic, Piece Hall, Halifax, HX1 1RE",,05/11/05,06/30/06
,-0.34,-0.34,2014,"38 Boothtown Road, Halifax, HX3 6NE",,07/30/05,
,-169.96,-169.96,2005,"Office 7, 162A Haugh Shaw Road, Halifax, HX1 3BG",,01/01/05,12/01/05
Hebden Bridge Brass Band,-0.18,-0.16,2012,"Unit 1A, Topland Country Business Pk, Cragg Road, Mytholmroyd          HX7 5RU","Fao Mr Steve Gardiner, Unit 1A, Topland Country Bus Park, Cragg Road, Mytholmroyd, HX7 5RU",08/01/04,
,-1.4,-1.4,2012,"Unit 26, Phoebe Lane Industrial Est., Halifax, HX3 9EX",,09/01/05,
Repack Services Ltd,-4.73,-4.73,2005,"Unit 22 Sdh Industrial Est, West Street, Sowerby Bridge, HX6 3BS","Unit 2 S.D.H Industrial Estate, West Street, Sowerby Bridge, HX6 3BT",04/01/04,10/08/05
K Hamnett [Machinery Removers],-242.02,-242.02,2007,"Philmar House, Gibbet Street, Halifax, HX2 0AR","Philmar House, Highroad Well Works, Gibbet Street, Halifax, HX2 0AR",04/01/04,06/17/07
,-0.38,-0.38,2012,"3 Tower Hill, Sowerby Bridge, HX6 2EQ",,04/01/06,
,-20.45,-20.45,2012,"Moderna Business Park, Mytholmroyd, Hebden Bridge, HX7 5QQ",,07/03/06,
V E S (Halifax) Ltd,-20.96,-20.96,2008,"Listers Road, Halifax, HX3 6AG","The Old Tannery, 224 Spen Lane, Gomersal, Cleckheaton, BD19 4PJ",05/03/06,05/05/08
,-0.96,-0.96,2012,"56 Market Street, Hebden Bridge, HX7 6AA",,11/11/05,
,-90,-90,2010,"15 Hill Crest, Burnley Road, Sowerby Bridge, HX6 2TJ",,10/01/05,06/30/09
Powder Coaters Ltd [In Liquidation],-1824.66,-1824.66,2004,"Part Lock Hill Mills, Holmes Road, Sowerby Bridge, HX6 3LD","C/O Begbies Traynor, 30 Park Cross Street, Leeds, LS1 2QH",04/01/04,03/31/04
1st 4 Training Ltd,-30.55,-30.55,2006,"Unit 15B, Calderdale Business Park, Club Lane, Halifax              HX2 8AX","12 Prospect Court, Norton Tower, Halifax, HX2 0NR",07/14/05,02/14/07
Nature Cameras Ltd,-0.91,-0.91,2012,"3b Bonegate Road, Brighouse, HD6 1TQ","Fao Mr David Turner, 3b Bonegate Road, Brighouse, HD6 1TQ",11/19/05,
,-20,283.2,2006,"196 Rochdale Road, Todmorden, OL14 7NA",,12/19/05,03/31/08
,-1.08,-1.08,2012,"38 Halifax Road, Todmorden, OL14 5QG",,08/21/06,
,-17871.59,-163184.07,2012,"Stainland Rd Medical Centre, 70 Stainland Road, Greetland, Halifax              HX4 8BD",,01/24/06,
Admiral Taverns Ltd,-8.6,-8.6,2006,"Big D's, 355 Halifax Road, Todmorden, OL14 5SR","Purchase Ledger Dept, Suite H3, Steam Mill Business Centre, Steam Mill Street, Chester, CH3 5AN",09/07/06,03/30/07
Osprey Land & Homes Ltd,-10.68,-10.68,2006,"Health Centre, Thrush Hill Road, Mytholmroyd, Hebden Bridge       HX7 5AQ","2 Park Farm Courtyard, High Easthorpe, Malton, North Yorkshire, YO17 6QX",10/12/06,10/31/06
,-66.32,-66.32,2010,"27 Borough Market, Halifax, HX1 1DY",,10/02/06,03/31/11
,-1088.12,-1088.12,2010,"2 Swine Market, Halifax, HX1 5DT",,12/11/06,08/31/10
,-25.28,-25.28,2007,"Heart Gallery Arts Centre, 4 Market Street, Hebden Bridge, HX7 6AA",,10/01/06,09/30/07
Cheque Centres Properties Ltd (In Administration),-395.2,-395.2,2014,"6 Cheapside, Halifax, HX1 1TQ","Access Europe, Ratho Park, Station Road, New Bridge, Edinburgh, EH28 8QQ",03/23/07,07/02/14
,-163.59,-766.35,2007,"11/13 Lilly Street, Sowerby Bridge, HX6 3DG",,07/01/07,01/04/08
Calderdale Mbc Children & Young People's Services,-4591.15,-4591.15,2015,"Adult Education Centre, Church Lane, Brighouse, HD6 1AT","Fao Paul Ward Finance Manager, 3rd Floor, Westgate House, Halifax, HX1 1PS",04/01/90,09/04/15
Calderdale Mbc Children & Young People's Services,-5943.28,-5943.28,2015,"Lower Ground Floor, Carlton Mill, Wharf Street, Sowerby Bridge      HX6 2AS","Fao Paul Ward Finance Manager, 3rd Floor, Westgate House, Halifax, HX1 1PS",05/18/98,
Calderdale P.C.T,-18648,-107914.84,2007,"Horne Street Surgery, Horne Street, Halifax, HX1 5UA","4th Floor , S Mill, Dean Clough, Halifax, HX3 5AX",11/20/06,03/31/13
C.C.L Group Ltd [In Administration],-346.5,-899.1,2008,"Armytage Road, Brighouse, HD6 1QF","C/O Price Waterhouse Coopers, Hill House, Richmond Hill, Bournemouth, BH2 6HR",07/06/07,02/02/10
Hebden Bridge Group Practice,-23632,-213967.48,2005,"Grange Dene Medical Centre, Grange Dene, Burnley Road, Mytholmroyd          HX7 5LF","Valley Medical Centre, Valley Road, Hebden Bridge, HX7 7BZ",04/01/05,
Hebden Bridge Group Practice,-24248,-213967.48,2006,"Grange Dene Medical Centre, Grange Dene, Burnley Road, Mytholmroyd          HX7 5LF","Valley Medical Centre, Valley Road, Hebden Bridge, HX7 7BZ",04/01/05,
,-27.09,-27.09,2007,"39/41 Thornhill Road, Brighouse, HD6 3AX",,01/05/07,03/12/08
The Bradford T.P.S,-637.76,-637.76,2010,"Bradford T P S, Halifax Road, Shelf, Halifax              HX3 7JT","C/O Halifax V W, Halifax Road, Shelf, Halifax, HX3 7JT",08/01/07,05/31/10
Bailiff Bridge Cafe Ltd,-13.36,-13.36,2014,"611 Bradford Road, Brighouse, HD6 4DN",,03/01/07,
