Ratepayer,Billing Account Balance ,Liable Unit Balance ,Year,Property Address,Billing Address,Date Start,Date End
,-20,-20,2002,"Council Offices, Oldham Road, Ripponden, Sowerby Bridge      HX6 4DN",,02/18/91,03/31/01
,-16.53,-16.53,2011,"Ambulance Hall, Victoria Road, Todmorden, OL14 5LP",,04/01/90,05/24/11
,-210.37,0,2007,"15 Water Street, Todmorden, OL14 5AB",,10/01/00,06/01/08
Falk Europe Ltd,-87.23,-87.23,2007,"Part 2ND Floor, Woodvale House, Woodvale Road, Brighouse            HD6 4AB","2nd Floor, Woodvale House, Woodvale Road, Brighouse, HD6 4AB",03/26/03,03/31/08
,-544.9,-826.69,2010,"The Mill, Gardeners Square, Hipperholme, Halifax              HX3 8LL",,05/03/03,07/31/11
,-86.28,-86.28,2007,"Unit 3/4 Queens Road Works, Queens Road, Halifax, HX1 3XX",,06/01/03,02/07/08
,-1150,-1150,2014,"33 Market Street, Hebden Bridge, HX7 6EU",,11/01/02,
,-6.37,-6.37,2005,"8 Church Street, Brighouse, HD6 3NF",,06/04/03,06/10/05
,-62.45,-858.05,2009,"Bulls Head Hotel, Town Hall Street, Sowerby Bridge, HX6 2EA",,07/25/03,05/17/09
,-3.4,-3.4,2003,"74 Huddersfield Road, Elland, HX5 9AA",,07/25/03,10/14/03
,-6.53,-6.53,2008,"23 West End, Hebden Bridge, HX7 8UQ",,08/16/03,03/29/09
Airwave Solutions Ltd,-0.01,1343.99,2013,"Telecommunications Mast, Site Ref Wyo 081A, Hanson Lane, Halifax              HX1 4SD","C/O Gva, C/O Po Box 16097, 3 Brindley Place, Birmingham, B2 2UY",06/01/03,
,-53.13,-53.13,2012,"40 Town Hall Street, Sowerby Bridge, HX6 2EA",,04/01/03,
Connexions (West Yorkshire),-1766.88,-1766.88,2008,"Second & Third Floors, Park View House, Woodvale Road, Brighouse            HD6 4AB","2nd Floor & 3rd Floors, Park View House, Woodvale Road, Brighouse, HD6 4AB",08/31/02,06/29/08
,-253.25,-555.13,2009,"South Grain Farm, Bacup Road, Todmorden, OL14 7HT",,05/28/04,12/31/08
Beds By Design Ltd,-0.5,2231.5,2014,"Unit 19, Sdh Industrial Estate, West Street, Sowerby Bridge       HX6 3BS","Unit 19 Sdh Industrial Estate, West Street, Sowerby Bridge, HX6 3BT",04/01/03,
,-8.77,-8.77,2005,"32 Town Hall Street, Sowerby Bridge, HX6 2EA",,11/24/03,10/13/05
,-3107.38,-3107.38,2006,"17/21 The Old Arcade, Halifax, HX1 1TJ",,02/04/04,11/30/05
Dodnaze Community Association,-0.03,-0.03,2011,"54 Hirst Grove, Hebden Bridge, HX7 8DN","Dodnaze Community Centre, 54 Hirst Grove, Hebden Bridge, HX7 8DN",06/21/04,
Wilko Retail Ltd,-0.01,34511.99,2013,"Briggate, Brighouse, HD6 1EF","C/O Rate Account Management, Colliers Int Rating Uk Llp, 12th Flr Eleven Brindleyplace, 2 Brunswick Square, Brindleyplace, Birmingham, B1 2LP",11/29/04,
Admedia Ltd,-0.04,217.96,2014,"Ad Rt Adm'Ia Bd 2420-2426 Wb, Hartshead Moor Service Area, Hartshead Moor, Brighouse            HD6 4JX","320 Regent Street, London, W1B 3BE",04/01/04,
J.H.P Group Ltd,-1563.9,-1563.9,2012,"1st Floor, 5 Clare Road, Halifax, HX1 2HX","Unit 3 Riverstone Court, Siskin Drive, Middlemarch Business Park, Coventry, CV3 4FJ",03/01/04,09/28/12
,-91.84,-91.84,2012,"Unit 7, Mill Lane, Halifax, HX3 6TR",,04/01/05,
,-0.02,-0.02,2012,"Lower Brockholes Farm, Lane Head Lane, Ogden, Halifax              HX2 8XQ",,11/15/04,
,-373.68,-373.68,2006,"7 Victoria Road, Elland, HX5 0AB",,06/27/05,02/14/07
Halifax Opportunities Trust,-700.06,-700.06,2015,"Community Enterprise Centre, Hanson Lane, Halifax, HX1 5PG","Attn Barbara Harbinson, The Elsie Whiteley Centre, Hopwood Lane, Halifax, HX1 5ER",04/19/05,
,-218.74,-218.74,2007,"Wagon & Horses Inn, 786 Rochdale Road, Todmorden, OL14 7UA",,03/28/06,08/26/07
J & T Clothing Ltd,-404.04,-404.04,2010,"Unit 6, Brunswick Industrial Estate, Brassey Street, Halifax              HX1 2EA","Registered Office, The Counting House, Wade House Road, Shelf, HX3 7PB",10/03/05,02/13/11
Yorkshire Mouldings Ltd [In Administration],-1068,-1068,2005,"Armytage Road, Brighouse, HD6 1UJ","Price Waterhouse Coopers, Benson House, 33 Wellington Street, Leeds, LS1 4JP",04/01/05,06/17/05
,-208.87,-208.87,2009,"Little Foot Day Nursery, Luddenden Lane, Luddendenfoot, Halifax              HX2 6NW",,09/03/06,11/22/09
,-6712.71,-163184.07,2014,"Stainland Rd Medical Centre, 70 Stainland Road, Greetland, Halifax              HX4 8BD",,01/24/06,
,-1.18,-1.18,2012,"Unit 4, L R P Business Park, Halifax Road, Hipperholme, Halifax              HX3 8ER",,01/01/07,
,-209.48,-209.48,2012,"Ground & First Floors, 51 Crown Street, Halifax, HX1 1JB",,10/16/06,05/14/13
,-7.95,-7.95,2012,"Star Garage, Wakefield Road, Copley, Halifax             HX3 0TP",,01/06/07,04/30/11
Amatex Catering Services Ltd [In Administration],-212.72,-212.72,2007,"Square Road, Halifax, HX1 1QG","Ashcroft Business, Recovery & Insolvency, 601 High Road, Leytonstone, London, E11 4PA",12/15/06,09/27/07
D T S Yorkshire Ltd,-53.41,-53.41,2008,"Unit HM14 Holmfield Mills, Holdsworth Road, Halifax, HX3 6SN","27 Illingworth Close, Halifax, HX2 9JQ",12/01/06,10/28/08
Halifax Property Services Ltd,-1361.5,-1361.5,2012,"Unit 2a, West Parade, Halifax, HX1 2TE","Fagley Lane, Eccleshill, Bradford, BD2 3NT",04/01/10,03/31/12
,-23.78,-23.78,2008,"Upperfoot Farm Shop, Burnley Road, Luddendenfoot, Halifax              HX2 6HL",,12/19/06,03/02/09
,-1.1,-1.1,2012,"27 Southgate, Elland, HX5 0BW",,05/04/07,
,-47.84,-47.84,2009,"Unit 6G, Calderdale Business Park, Club Lane, Halifax              HX2 8DB",,04/01/07,09/30/09
,-189.33,-347.46,2014,"2ND Floor, 52 Manor Heath Road, Halifax, HX3 0BE",,08/01/07,
Calderdale Healthcare N.H.S Trust,-40.09,-40.09,1999,"Todmorden Health Centre, Rose Street, Todmorden, OL14 5AT","Royal Halifax Infirmary, Free School Lane, Halifax, HX1 2YF",04/01/91,03/31/00
Director Of Safer & Stronger Communities,-2428.64,-2428.64,2015,"Adj Shay Hotel, Shay Syke, Halifax, HX1 2ND","Leisure Services, Westgate House, Westgate, Halifax, HX1 1PS",04/01/99,03/31/15
,-4.22,-4.22,2007,"Unit 5b Mill House Works, Mill House Lane, Triangle, HX6 3LN",,11/07/06,01/01/08
Fred Howarth Ltd,-9.5,-9.5,2011,"Unit 25 Robinwood Mill, Burnley Road, Todmorden, OL14 8JA","Jumps Road, Livegate, Todmorden, OL14 8HJ",08/01/07,03/31/12
Global Textiles Associates Ltd,-19.32,-19.32,2012,"Office H M 3.0, Holmfield Mills, Holdsworth Road, Halifax              HX3 6SN","Office H M 3.0, Holmfield Mills, Holdsworth Road, Halifax, HX3 6SN",03/01/07,03/31/14
Maramar Properties Ltd,-810.3,-810.3,2007,"Carlton Chambers, 1 King Cross Street, Halifax, HX1 2SG","Mile Thorn Works, Gibbet Street, Halifax, HX1 4JR",05/01/07,09/30/07
Haley Bros [ Builders] Ltd [In Liquidation],-3.61,-3.61,2008,"Suite 3, 1st Floor, Burlees House, Hangingroyd Lane, Hebden Bridge       HX7 7DD","C/O X.L Business Solutions, 1st Floor, 2-4 West Street, Cleckheaton, BD19 5AJ",08/31/07,12/10/08
,-25.29,-25.29,2008,"43 Crown Street, Halifax, HX1 1JB",,06/01/08,03/18/09
Pouchpak Ltd,-18.9,-18.9,2010,"161B First Floor, King Cross Road, Halifax, HX1 3LN","6 Princess Terrace, Halifax, HX1 2NH",06/01/08,10/01/10
Quarmby Promotions Ltd,-1209.84,-1209.84,2010,"Unit 1, Sherwood Road, Brighouse, HD6 1QG","Units 22-23, Howley Park Business Village, Howley Park Road, Morley, Leeds, LS27 0BZ",05/14/08,07/31/10
Broadbent Stanley Ltd,-81,-81,2014,"Quarry House, Burnley Road, Sowerby Bridge, HX6 2TF","Holmfield Works, Shay Lane, Halifax, HX3 6RS",10/01/06,05/11/14
,-577.55,-577.55,2008,"Market Stall 101-103, Market Hall, Borough Market, Halifax             HX1 1DZ",,04/01/08,11/21/08
Lets Talk Phones Ltd,-149.53,-149.53,2008,"270 Queens Road, Halifax, HX1 4NJ","270 Queens Road, Halifax, HX1 4NJ",04/01/08,09/13/08
,-6.88,-6.88,2012,"Prince Albert Inn, 17 St Martins View, Brighouse, HD6 2AZ",,11/11/08,03/04/13
,-511.55,-511.55,2014,"Market Stall 82-84, Market Hall, Borough Market, Halifax             HX1 1DZ",,12/01/08,
,-55.65,-55.65,2008,"619 Bradford Road, Bailiff Bridge, Brighouse, HD6 4DL",,08/15/08,06/05/09
,-224.21,-900.19,2010,"Market Stall 5,6-8, Borough Market, Halifax, HX1 1DZ",,12/01/08,11/09/12
,-402.45,-806.33,2011,"11/13 Albion Street, Halifax, HX1 1DU",,04/01/09,12/31/11
,-184.01,-806.33,2012,"11/13 Albion Street, Halifax, HX1 1DU",,04/01/09,12/31/11
Blackshaw Holdings Ltd,-224.07,-224.07,2013,"Swales Moor Yard, Swales Moor Road, Halifax, HX3 6UF","St Bernards Mill, Gelderd Road, Gildersome, Leeds, LS27 7NA",08/13/13,12/31/13
Marshalls Mono Ltd,-14427.01,-14427.01,2015,"West Lane, Southowram, Halifax, HX3 9TW","A Johnson - Group Prop Manager, Marshalls Plc, Landscape House, Premier Way, Lowfields Business Park, Elland, HX5 9HT",08/01/13,
Aspire Crafts Ltd,-301.42,-301.42,2014,"Unit 5 Riverside Mills, Saddleworth Road, Elland, HX5 0RY","Second Floor, Unit 5 Wellington Mills, Quebec Street, Elland, HX5 9AS",07/19/13,08/31/14
Synergy Health Laboratory Services Ltd,-460.42,-460.42,2015,"Unit 6A/6B, Topland Country Bus. Pk, Cragg Road, Hebden Bridge        HX7 5RU","Rutherford House, Stephenson Way, Derby, DE21 6LY",06/01/13,
,-0.57,-0.57,2012,"95 Gibbet Street, Halifax, HX1 5BP",,09/01/08,
,-0.55,-0.55,2012,"Unit 8A Robinwood Mill, Burnley Road, Todmorden, OL14 8JA",,09/01/08,
,-14.98,-14.98,2010,"Unit 11 First Floor, Mearclough Works, Mearclough Road, Sowerby Bridge       HX6 3LF",,08/11/09,05/18/10
Calder High School,-226.36,-226.36,2012,"Stubb Playing Fields, Mytholmroyd, Hebden Bridge, HX7 5AP","Midgley Road, Mytholmroyd, Hebden Bridge, HX7 5QN",04/01/09,11/07/12
Primesight Ltd,-0.03,211.97,2014,"Boards 1026 & 4022, Co-Op Supermarket, King Cross Road, Halifax              HX1 3RJ","Unit 9 Westpoint Enterprise Pk, Clarence Avenue, Trafford Park, Manchester, M17 1QS",09/01/09,
M.E Pubs Ltd,-169.19,-169.19,2010,"Shoulder Of Mutton Inn, 1 Carr House Lane, Shelf, Halifax             HX3 7RB",No Forwarding Address,03/16/10,10/26/10
J.H.P Group Ltd,-1290.63,-1290.63,2012,"3 Clare Road, Halifax, HX1 2HX","Unit 3 Riverstone Court, Siskin Drive, Middlemarch Business Park, Coventry, CV3 4FJ",05/23/11,09/28/12
,-5.51,-5.51,2011,"103/105 Gibbet Street, Halifax, HX1 5BP",,02/01/10,05/01/11
,-18.99,-18.99,2012,"27 Old Lane, Brighouse, HD6 1UB",,01/01/10,
,-2206.88,-5812.39,2011,"Cromwell Bottom, Elland Road, Brighouse, HD6 2RG",,04/01/10,03/31/10
West Yorkshire Plant Hire Ltd,-10,-10,2010,"Unit 5 Springwood Bu'ss Park, Brookwoods Industrial Estate, Burrwood Way, Holywell Green       HX4 9BH","Unit 6, Woodman Works, South Lane, Elland, HX5 0PA",04/26/10,06/11/10
,-843.27,-843.27,2009,"Stanley Works, Lucy Street, Halifax, HX3 6AL",,06/01/04,05/31/04
Abbey Business Contracts Ltd (In Liquidation),-55.4,-55.4,2010,"18 Huddersfield Road, Elland, HX5 9DW","O'Hara & Co, C/O Wesley House, Huddersfield Road, Birstall, Batley, WF17 9EJ",09/01/10,09/13/10
,-50.02,-69.42,2011,"Market Stall 124/131, Market Hall, Borough Market, Halifax             HX1 1DZ",,11/22/10,03/31/13
,-1609.46,-1609.46,2011,"Sedburgh Road, Halifax, HX3 9HB",,03/28/11,04/30/11
,-94.79,-94.79,2012,"2 Westfield Place, Halifax, HX1 3YH",,04/01/11,03/31/13
Millwood Vehicle Services Ltd,-56,-56,2012,"Unit 2 Harley House Mill, Todmorden, OL14 5JE","Harley Mill, Harley Street, Todmorden, OL14 5JE",04/01/12,03/31/12
,-244.94,-244.94,2014,"17 Commercial Street, Brighouse, HD6 1AF",,07/01/12,11/26/14
,-1036.5,-1036.5,2013,"Opp Victoria Works, Calder Street, Brighouse, HD6 1LZ",,09/29/12,09/28/12
Kimpton Building Services Ltd,-259.89,-259.89,2014,"Office 1, 4 Albert Street, Hebden Bridge, HX7 8AH",No Forwarding Address,01/01/13,08/31/14
Nhs Property Services Ltd,-5181,-11962,2013,"St Johns Health Centre, Lightowler Road, Pellon, Halifax             HX1 5NB","C/O Gl Hearn Management Ltd, Po Box 1610, Southampton, SO15 3WX",04/01/13,
Nhs Property Services Ltd,-5302,-11962,2014,"St Johns Health Centre, Lightowler Road, Pellon, Halifax             HX1 5NB","C/O Gl Hearn Management Ltd, Po Box 1610, Southampton, SO15 3WX",04/01/13,
Calderdale Mbc Children & Young People's Services,-970.2,-3912.3,2013,"The Outback, Pt Jubilee Childrens Centre, Lightowler Road, Halifax              HX1 5NB","Fao Paul Ward Finance Manager, 3rd Floor, Westgate House, Halifax, HX1 1PS",04/01/12,03/31/12
Primesight Ltd,-0.04,155.96,2014,"Advertising Right, 115 Gibbet Street, Halifax, HX1 5BP","Unit 9 Westpoint Enterprise Pk, Clarence Avenue, Trafford Park, Manchester, M17 1QS",09/01/09,
Primesight Ltd,-0.03,211.97,2014,"Adj 38 Halifax Road, Hipperholme, Halifax, HX3 8ER","Unit 9 Westpoint Enterprise Pk, Clarence Avenue, Trafford Park, Manchester, M17 1QS",09/01/09,
,-11,0,2013,"Unit 4 Hope Mill, Raglan Street, Todmorden, OL14 5HF",,04/01/10,
S & A Health Ltd,-11.84,-11.84,2012,"93 Turner Avenue South, Illingworth, Halifax, HX2 8EF","30 Keighley Road, Bingley, BD16 2EZ",02/27/10,03/27/13
,-70.22,-70.22,2012,"9A/10A &11A, Lees Buildings, Halifax Road, Hipperholme",,03/01/11,06/30/12
,-281.1,-281.1,2011,"Arches At Bowling Dyke, Under North Bridge, Halifax, HX3 6TD",,05/23/10,12/23/11
,-97.71,-97.71,2011,"1 Whitwell Grove, Elland, HX5 9EJ",,10/18/10,01/31/12
,-0.01,-0.01,2014,"7 Northgate, Halifax, HX1 1UR",,03/01/11,
Blushale Ltd,-0.01,2382.95,2012,"9 Russell Street, Halifax, HX1 1RL","C/O Rushtons Insolvency Ltd, 3 Merchants Quay, Ashley Lane, Shipley, BD17 7BD",04/03/11,07/28/15
Interserve Integrated Services Ltd,-1593.74,-1593.74,2015,"Part 1ST & 2ND Floors, Westgate House, Market Street, Halifax              HX1 1PD","Ebony House, Castlegate Way, Dudley, West Midlands, DY1 4TA",11/16/11,
,-1.07,-1.07,2012,"Units 3 & 4A, Catherine Street, Elland, HX5 0EZ",,03/27/11,
,-5.6,-5.6,2012,"Storeroom 3 Market Hall, Brook Street, Todmorden, OL14 5AJ",,09/01/11,01/13/13
Halifax Opportunities Trust,-14.84,-14.84,2011,"Office 41 First Floor, The E W Innovation Centre, Hopwood Lane, Halifax              HX1 5ER","Elsie Whiteley Innovation Cent, Hopwood Lane, Halifax, HX1 5ER",09/20/11,07/10/12
,-65.65,-65.65,2013,"Unit 2A Crossley Works, Cragg Road, Mytholmroyd, Hebden Bridge        HX7 5HR",,12/01/12,06/30/13
Trustees Of The Oddyssey Glass Pension Scheme,-872.61,-872.61,2015,"Unit 4B, High Level Way, Queens Road, Halifax              HX1 4PS","C/O Walker Singleton, Property House, Lister Lane, Halifax, HX1 5AS",03/19/13,06/30/15
Wattlid Ltd,-1002.03,-1002.03,2014,"Units 1 & 2, Moderna Business Park, Mytholmroyd, Hebden Bridge       HX7 5QQ","Attn Mr R Hayes, Lakeside Farm , Turf Lane, Cullingworth, Bradford, BD13 5JT",03/29/14,10/31/14
Marrtree Investments Limited,-1264.55,-2093.75,2014,"Unit 22, Branxholme Industrial Est., Bradford Road, Brighouse            HD6 4EA","4a Greengate, Cadale Park, Harrogate, HG3 1GY",02/08/14,12/07/14
Marrtree Investments Limited,-829.2,-2093.75,2015,"Unit 22, Branxholme Industrial Est., Bradford Road, Brighouse            HD6 4EA","4a Greengate, Cadale Park, Harrogate, HG3 1GY",02/08/14,12/07/14
Welcome Independent Living Ltd,-600,-600,2015,"2ND Floor Unit 1, New Oxford House, Albert Street, Hebden Bridge        HX7 8AH","F.A.O Mr Mark Coup, New Oxford House, Albert Street, Hebden Bridge, HX7 8AH",04/01/15,03/31/15
K D T Accountancy & Taxation Services Ltd,-0.01,-0.01,2010,"20 Cow Green, Halifax, HX1 1HX",,08/14/10,
Marie Curie Cancer Care,-1200.08,-1200.08,2013,"1 Corn Market, Halifax, HX1 1TH","Suite One Enterprise House, Cheney Manor Industrial Estate, Swindon, Wiltshire, SN2 2YZ",03/01/14,
,-116.6,-116.6,2015,"Suite 3, Nursery Lane Health Care, Nursery Lane, Halifax              HX3 5SW",,12/10/13,
Dean Clough Ltd,-5416.5,-12118.95,2014,"Crib Lane Level 3 Bottom, Dean Clough Mils, Halifax, HX3 5AX","Office Suite E345, Dean Clough, Halifax, HX3 5AX",12/24/12,05/31/13
Daniel Thwaites Plc,-559.83,-559.83,2015,"The Winterburn, 1 Winterburn Hill, Warley, Halifax              HX2 7SQ","Star Brewery, Penny Street, Blackburn, Lancs, BB1 6HL",07/09/14,08/04/15
Halifax Opportunities Trust,-532.44,-535.29,2015,"Office 34 First Floor, The E W Innovation Centre, Hopwood Lane, Halifax              HX1 5ER","Elsie Whiteley Innovation Cent, Hopwood Lane, Halifax, HX1 5ER",10/01/14,03/29/15
H D I Trendsure Ltd,-3081,-3081,2015,"Hdi Trendsure Ltd, Stansfield Road, Todmorden, OL14 5DL","Hdi Trendsure Ltd, Stansfield Road, Todmorden, OL14 5DL",10/01/12,03/31/15
Bizspace Ltd,-149.35,-149.35,2015,"Units 12A & 12B, Calderdale Business Park, Club Lane, Halifax              HX2 8AX","Sovereign House, Fao Mital Shah, 1 Albert Place, Finchley, London, N3 1QB",06/02/14,09/30/14
Marrtree Investments Limited,-309.09,-309.09,2015,"Unit 5 Branxholme Estate, Bradford Road, Bailiff Bridge, Brighouse            HD6 4EA","4a Greengate, Cadale Park, Harrogate, HG3 1GY",10/10/14,12/22/14
,-0.01,-0.01,2010,"Model Railway Club, Cawcliffe Road, Brighouse, HD6 2HP",,04/01/90,
Calderdale P C T,-1039.5,-5184.63,2008,"Health Centre, Chapel Croft, Brighouse, HD6 3NA","5J6 Payables 4265, Phoenix House, Topcliffe Lane, Wakefield, WF3 1WE",04/01/00,03/31/13
,-11710.5,-88446.92,2005,"24 Church Lane, Brighouse, HD6 1AT",,04/01/90,06/27/12
Adtech Studios Ltd (In Liquidation),-9.95,-9.95,2002,"Unit 2, County Workshops, Clifton Road, Brighouse           HD6 1SL","C/O Messrs Revell Ward, Horton, Norwich Union House, High StreetHuddersfield",10/14/91,11/09/92
Calderdale P C T,-7151.66,-16169.35,2012,"Clinic, Lawson Road, Brighouse, HD6 1NY","5J6 Payables 4265, Phoenix House, Topcliffe Lane, Wakefield, WF3 1WE",04/01/00,03/31/13
Dempster H Lister Ltd [In Liquidation],-543.81,-543.81,2002,"9 Commercial Street, Brighouse, HD6 1AF","C/O Cork Gully, Benson House, 33 Wellington Street, Leeds, LS1 4JP",04/01/90,12/12/98
Eccles & Scott Ltd,-214.38,-214.38,2004,"Ground Floor, Cromwell House, Elland Road, Brighouse            HD6 2RG","Cromwell House, 421 Elland Road, Brighouse, HD6 2RG",12/01/00,01/24/05
Jack Pearson (Turf Accountants) Ltd,-8.43,-8.43,2012,"16 Victoria Road, Elland, HX5 0PU","44 Wood Street, Huddersfield, HD1 1EG",04/01/90,07/17/12
,-55.88,-55.88,2002,"Albert Street, Halifax, HX1 5NW",,03/21/95,03/01/96
A H Fabrications (Halifax) Ltd (In Receivership),-224.82,-224.82,2002,"Arundel Street, Halifax, HX1 4LE","C/O Messrs Grant Thornton, St Johns Centre, 110 Albion Street, Leeds, LS2 8LA",04/01/90,04/01/91
,-1.08,-1.08,2012,"95 Ovenden Road, Ovenden, Halifax, HX3 5RQ",,11/12/01,
Whitbread Plc [Attn Alan Chapman],-85.63,-85.63,2000,"Above Bar Centro, Barum Top, Halifax, HX1 1NL","Whitbread House, Park Street West, Luton, Beds, LU1 3BG",06/12/98,05/18/00
,-0.3,-0.3,2012,"35 Borough Market, Halifax, HX1 1DY",,04/01/90,
G.J.B Upholstery Services Ltd [In Liquidation],-258.49,-258.49,2002,"51 Smithy Carr Lane, Brighouse, HD6 4BG","C/O A M Rogers, 9 South Lane, Holmfirth, HD7 1HN",04/01/90,01/27/94
,-6.58,-6.58,2002,"Unit 2, Upper Bonegate, Brighouse, HD6 1RT",,04/01/01,09/29/02
Woodvale Holdings Ltd [In Liquidation],-391.78,-391.78,2002,"Oak House, Woodvale Road, Brighouse, HD6 4AB","C/O Pannell Kerr & Forster, Ref L/73057/CVL/1304/DMH/IPS, 6 Queen Street, Leeds,, LS1 2TW",11/29/91,10/11/93
,-7104,-77567.88,2007,"The Surgery, Burley Street, Elland, HX5 0AQ",,04/01/90,
Neal Brothers (Leicester)Ltd,-34.46,-34.46,2001,"Bay 1, Rosemount Estate, Huddersfield Road, Elland               HX5 0EE","Queens Buildings, Hastings Road, LEICESTERle5 Olj",10/16/00,09/29/01
,-22.75,-22.75,2012,"Rear 59 Huddersfield Road, Elland, HX5 9AA",,01/01/97,
J W Mitchell & Sons Ltd (In Liquidation),-2.67,-2.67,2002,"Unit 11, The Ainleys, Huddersfield Road, Elland              HX5 9DW","C/O Messrs K W Howarth & Co, 36 Clare Road, Halifax, HX1 2HX",04/22/91,09/30/92
,-12.81,-12.81,2002,"Pressers Arms Inn, 2 South Lane, Elland, HX5 0HG",,10/10/96,05/21/97
Outsourced Credit Management Ltd,-287.26,-287.26,2006,"3 Carlton Place, Halifax, HX1 2SB","3 Carlton Place, Halifax, HX1 2SB",08/01/99,04/30/06
,-25.99,-25.99,2002,"Goose Inn, 24 Causeway Foot, Halifax, HX2 8YB",,11/01/94,06/23/95
,-361.78,-361.78,2002,"Part 1ST Floor, 18 Clare Road, Halifax, HX1 2HX",,09/18/00,03/31/01
,-107.95,-107.95,2012,"Coal Lane, Ogden, Halifax, HX2 9PG",,04/01/93,
Halifax Estate Agencies Ltd,-2441.61,-2441.61,2009,"15/17/19 Commercial Street, Halifax, HX1 1HJ","C/O B N P Paribas Real Estate, Rating Support Unit, 9 Colmore Row, Birmingham, B3 2BT",01/31/92,01/15/10
Joseph Walker & Son Ltd [In Liquidation],-320.26,-320.26,2002,"561 Gibbet Street, Halifax, HX2 0AL","C/O Pannell Kerr Forster, Pannell House, 6 Queen Street, Leeds, LS1 2TW",04/01/90,11/09/94
,-0.91,-0.91,2012,"10 Cow Green, Halifax, HX1 1JF",,05/04/92,
,-200,-200,2003,"6a Dodge Holme Drive, Mixenden, Halifax, HX2 8PE",,04/08/02,07/17/03
Kelly Services (Uk) Ltd,-477,-477,2007,"25 Bull Green, Halifax, HX1 2RZ","Finance Dept, Apple Market House, 17 Union Street, Kingston Upon Thames, KT1 1RR",03/06/98,03/25/07
,-53.26,-53.26,2009,"Friendly Quarry, Burnley Road, Luddendenfoot, Halifax             HX2 6BD",,04/01/96,01/31/10
Calderdale P C T,-4884,-39280.46,2007,"St Johns Health Centre, Lightowler Road, Pellon, Halifax             HX1 5NB","5J6 Payables 4265, Phoenix House, Topcliffe Lane, Wakefield, WF3 1WE",04/01/00,03/31/13
Reichenbacher (Uk) Ltd [In Liquidation],-311.03,-311.03,2003,"Unit 8/9 Victoria Park, Lightowler Road, Pellon, Halifax             HX1 5NB","C/O Kanzlei Linse, 22 Rosenstrasse, Coburg, Germany",10/01/90,01/31/04
Treble Vision Ltd [In Administration],-386.94,-386.94,2004,"Unit A4, Lower Ladyship Mills, Old Lane, Halifax              HX3 5QN",,12/03/96,08/15/04
,-8.68,-8.68,2002,"358 Ovenden Road, Halifax, HX3 5TJ",,07/01/93,10/31/95
,-163.38,-163.38,2004,"14a Hall Street North, Boothtown, Halifax, HX3 6TS",,10/01/02,02/08/05
,-47.08,-47.08,2002,"Hansonlane Enterprise Centre, Hanson Lane, Halifax, HX1 5PG",,04/01/00,01/02/03
,-41.77,-41.77,2004,"14 Hunger Hill, Halifax, HX1 2JT",,04/01/90,08/05/04
B Rhodes & Son Ltd (In Liq.)(Moorfield Wireworkers Ltd),-387.87,-387.87,2002,"Moorfield Works, Ingram Street, Halifax, HX1 3HA","C/O Messrs. Revell Ward, Horton,, Lister House,, Lord Street,Halifax",04/01/90,01/25/91
,-68.06,-68.06,2002,"113 Keighley Road, Halifax, HX2 8JE",,04/01/90,03/02/02
,-14289,-104172.38,2006,"Beechwood Medical Centre, Keighley Road, Halifax, HX2 8AL",,09/01/98,10/13/12
,-11293.74,-114197.32,2010,"King Cross Surgery, 199 King Cross Road, Halifax, HX1 3LW",,04/01/90,
,-22.11,-22.11,2010,"201 Queens Road, Halifax, HX1 4NE",,03/01/99,09/06/10
,-33.27,-33.27,2002,"212 Queens Road, Halifax, HX1 4NE",,09/02/96,09/09/96
,-8768.25,-70621.74,2006,"252 Queens Road, Halifax, HX1 4NJ",,04/01/90,
,-9821.25,-70621.74,2009,"252 Queens Road, Halifax, HX1 4NJ",,04/01/90,
,-4321.81,-70621.74,2013,"252 Queens Road, Halifax, HX1 4NJ",,04/01/90,
Premier Accident Management Uk (Yorkshire)Ltd,-523,-523,2009,"327a Queens Road, Halifax, HX1 4PY",No Forwarding Address,04/26/02,03/31/09
Cunninghams (Halifax) Ltd [In Admin Receivership],-399.1,-399.1,2002,"Range Lane, Halifax, HX3 6DL","C/O Armitage & Co, Park House, Park Square, Leeds, LS1 2PS",04/01/90,10/13/93
Fred Wade Ltd (In Liquidation),-146.14,-146.14,2013,"14 Rawson Street, Halifax, HX1 1NH","C/O Lee & Company, Crown House, Armley Road, Leeds, LS12 2EJ",04/01/90,12/05/13
,-5275,-61278.62,2005,"Kos Clinic, 4 Roydlands Street, Hipperholme, Halifax             HX3 8AF",,04/01/90,
,-5775,-61278.62,2008,"Kos Clinic, 4 Roydlands Street, Hipperholme, Halifax             HX3 8AF",,04/01/90,
,-2469.05,-61278.62,2010,"Kos Clinic, 4 Roydlands Street, Hipperholme, Halifax             HX3 8AF",,04/01/90,
,-6255.75,-61278.62,2013,"Kos Clinic, 4 Roydlands Street, Hipperholme, Halifax             HX3 8AF",,04/01/90,
,-230.57,-230.57,2002,"1 Roydlands Terrace, Hipperholme, Halifax, HX3 8NG",,04/01/90,12/02/93
,-3.23,-3.23,2002,"76 Saddleworth Road, Greetland, Halifax, HX4 8AG",,04/09/95,12/11/99
,-12448.75,-139065.32,2011,"51 Sandbeds Road, Pellon, Halifax, HX2 0JF",,04/14/93,
,-13857.5,-139065.32,2014,"51 Sandbeds Road, Pellon, Halifax, HX2 0JF",,04/14/93,
Neaversons Of Halifax Ltd,-577.84,-577.84,2011,"12 The Old Arcade, Halifax, HX1 1TJ","5 Russell Street, Halifax, HX1 1RL",04/01/90,06/24/11
Wilko Retail Ltd,-0.01,43959.99,2013,"2 Southgate, Halifax, HX1 1DR","C/O Rate Account Management, Colliers Int Rating Uk Llp, 12th Flr Eleven Brindleyplace, 2 Brunswick Square, Brindleyplace, Birmingham, B1 2LP",12/28/98,
,-1.41,-1.41,2012,"45 Stainland Road, Greetland, Halifax, HX4 8BD",,04/01/90,
,-1.42,-1.42,2012,"59 Stainland Road, Greetland, Halifax, HX4 8BD",,04/01/90,
,-99.57,-99.57,2014,"West Vale Filling Station, Stainland Road, Greetland, Halifax             HX4 8BQ",,08/01/92,
,-17.8,-17.8,2002,"Part 3rd Floor, Mount Pleasant Mill, Mytholmroyd, Hebden Bridge       HX7 5NR",,04/01/90,06/18/91
,-11.97,-36.96,2002,"Stubbing Wharf Hotel, Hebden Bridge, HX7 6LU",,04/24/02,06/10/04
,-24.99,-36.96,2004,"Stubbing Wharf Hotel, Hebden Bridge, HX7 6LU",,04/24/02,06/10/04
,-33957,-257312.34,2008,"Valley Medical Centre, Valley Road, Hebden Bridge, HX7 7BE",,05/01/98,
,-35647.5,-257312.34,2009,"Valley Medical Centre, Valley Road, Hebden Bridge, HX7 7BE",,05/01/98,
,-26792.46,-257312.34,2011,"Valley Medical Centre, Valley Road, Hebden Bridge, HX7 7BE",,05/01/98,
,-0.3,-0.3,2013,"Gatelands Farm Caravan Site, Bowood Lane, Triangle, Sowerby Bridge      HX6 3DU",,10/31/97,
,-108.36,-108.36,2005,"Flyover Works, 30 West Parade, Halifax, HX1 2TE",,05/01/01,08/12/05
,-53.35,-53.35,2008,"1ST Floor, 4 Garden Street, Hebden Bridge, HX7 8AQ",,02/03/98,12/31/08
,-1.4,-1.4,2012,"8 West Street, Sowerby Bridge, HX6 3AN",,10/20/97,
Kasshall Ltd T/A Custom Kitchens [In Liquidation],-17.44,-17.44,2002,"R/O 88 Wharf Street, Sowerby Bridge, HX6 2AF","C/O Cork Gully, Albion Court, 5 Albion Place, Leeds, LS1 6JP",04/01/90,03/24/95
Norman Jowett Ltd,-705,-705,2004,"Opp Portsmouth Mill, Burnley Road, Todmorden, OL14 8PP","159 Knowlwood Road, Todmorden, OL14 6RD",04/01/90,03/31/04
,-76.78,-76.78,2002,"Duke Of York Inn, 20 Halifax Road, Todmorden, OL14 5AD",,10/03/97,11/09/01
,-36.43,-36.43,2012,"120 Oak Avenue, Todmorden, OL14 5PD",,05/05/92,
