Property Address,RATEPAYER,RV,LIABILITY_START
"Unit 19 Mearclough Works, Mearclough Road, Sowerby Bridge, HX6 3LF",,1175,01/04/2016
"""Unofficial"" Jjk Interiors, Civic Hall, Rochdale Road, Greetland",J J K Interiors Ltd,5000,01/04/2015
"Civic Hall, Rochdale Road, Greetland, Halifax              HX4 8AH",G & W Developments Ltd,18500,01/04/2015
"Pf Gf Unit 11 Nanholme Mill, Shaw Wood Road, Todmorden, OL14 6DA",Homestart Calderdale,680,01/04/2015
"1ST Flr, Unit 11 Nanholme Mill, Shaw Wood Road, Todmorden           OL14 6DA",The Arc & Throstle Property Ltd,5100,01/04/2015
"114-116 Gibbet Street, Halifax, HX1 5BZ",,5400,22/07/2015
"Units 9D & 9E, Top Land Country Business Pk, Burnley Road, Mytholmroyd",L S Audio Tech Ltd,6100,01/01/2016
"202 King Cross Road, Halifax, HX1 3JP",,6400,02/11/2015
"Unit 24 Birkby House, Birkby Lane, Brighouse, HD6 4JJ",Blackshaw Holdings Ltd,1950,01/07/2016
"Unit 4A, Lrp Business Park, Halifax Road, Hipperholme          HX3 8ER",,9400,04/04/2016
"Unit 4B, Ladyship Industrial Park, Old Lane, Halifax              HX3 6TA",4x4 Overlander Ltd,8100,01/05/2016
"10 Wards End, Halifax, HX1 1BX",,9900,19/06/2016
"3 Sod House Green, Halifax, HX3 6QR",,2500,27/05/2016
"41 Westgate House, Market Street, Halifax, HX1 1PD",Coral Racing Ltd,45750,29/04/2016
"14 Market Street, Hebden Bridge, HX7 6AA",,6900,28/06/2016
"Unit 20, Moderna Business Park, Mytholmroyd, Hebden Bridge        HX7 5QQ",,10000,01/07/2016
"6 King Cross Street, Halifax, HX1 2SH",Joseph & Khan Solicitors,5200,01/07/2016
"Rear 296 Queens Road, Halifax, HX1 4NS",,3450,02/07/2016
"Unit 1C, Canteen Mill Ind. Units, Burnley Road, Todmorden           OL14 7DR",,2600,01/03/2016
"Unit 9 Lower Brearley Mill, Luddendenfoot, Halifax, HX2 6HU",,4400,20/12/2015
"40 Town Hall Street, Sowerby Bridge, HX6 2EA",,3400,01/04/2016
"First Floor, 259/261 Queens Road, Halifax, HX1 4NS",,3150,14/12/2015
"224 King Cross Road, Halifax, HX1 3JP",Just Give It A Go Ltd,6700,01/04/2016
"29 Lombard Street, Halifax, HX1 3PA",Just Give It A Go Ltd,1900,01/04/2016
"1st & Part Ground Floor, Holme End, Hebden Bridge, HX7 8NX",,2125,01/01/2015
"121 Savile Park Road, Halifax, HX1 2XH",,5900,05/03/2016
"163 King Cross Road, Halifax, HX1 3LN",,23750,01/01/2016
"Unit 16, Sdh Industrial Estate, West Street, Sowerby Bridge       HX6 3BS",,3300,01/07/2016
"26 Market Street, Halifax, HX1 1PD",,15500,02/07/2016
"Unit 1A Moorlea Garage, Albert Road, Halifax, HX2 0DF",,6400,01/06/2016
"Mount Pleasant Mill Yard, Midgley Road, Mytholmroyd, Hebden Bridge       HX7 5LR",,530,01/01/2016
"Mount Pleasant House, Midgley Road, Mytholmroyd, Hebden Bridge        HX7 5LR",,370,02/01/2016
"Carillion, Black Brook Way, Stainland Road, Greetland            HX4 8BQ",Ace Gas Ltd,3150,01/05/2015
"2 The Old Vicarage, Coley Road, Northowram, Halifax             HX3 7SA",,8600,16/02/2016
"24 Rochdale Road, Todmorden, OL14 7LD",Damson Brook Ltd,5600,01/01/2016
"19 Mixenden Road, Mixenden, Halifax, HX2 8PE",,2850,08/02/2016
"Unit A/B, Ridings Business Park, Hopwood Lane, Halifax              HX1 3TT",Ammori Polymers Ltd,45250,01/03/2016
"Units E, F Pt J, Ridings Business Park, Hopwood Lane, Halifax              HX1 3TT",Weir Valves & Controls Uk Ltd,45750,23/03/2016
"Units G/H, Ridings Business Park, Hopwood Lane, Halifax              HX1 3TT",Stair World Ltd,39500,18/04/2016
"Woodman Works, South Lane, Elland, HX5 0PA",Caecillian Limited,1300,01/04/2016
"Ground Floor, West Yorkshire Fire Station, Hollins Mill Lane, Sowerby Bridge       HX6 2QG",Sowerby Bridge Fire And Water Ltd,2200,05/05/2015
"117 Boothtown Road, Halifax, HX3 6PD",,6000,03/07/2016
"211 Gibbet Street, Halifax, HX1 5JW",,4250,01/04/2015
"Unit 5, South Street, Halifax, HX1 2EL",Sher Prints Ltd,3650,01/04/2015
"West Parade Ind Est, West Parade, Halifax, HX1 2TE",Frank Marshall Estates Ltd,2075,01/04/2016
"Basement Right Hand, Jubilee Mill, West Parade, Halifax              HX1 2TA",Frank Marshall Estates Ltd,2075,01/04/2016
"Unit 8G, Calderdale Business Park, Club Lane, Halifax              HX2 8AX",Mrs Mopps Cleaning Services Ltd,2750,16/05/2016
"Slitheroe Works, Oldham Road, Rishworth, Sowerby Bridge       HX6 4EW",,5600,01/07/2016
"Former Cottage, Rishworth Business Complex, Rishworth, Sowerby Bridge       HX6 4EW",,3500,01/07/2016
"Part 2ND Floor, Northvale Mills, Bradford Road, Brighouse            HD6 4DJ",Sparkle Events Limited,850,01/04/2011
"Unit 74 Bowers Mill, Branch Road, Barkisland, Halifax              HX4 0AD",,3500,04/03/2016
"Part 4TH Floor, Northvale Mills, Bradford Road, Brighouse            HD6 4DJ",,1950,01/03/2015
"Part 2ND Floor (Whse), Northvale Mills, Bradford Road, Brighouse            HD6 4DJ",Clifton Lighting Ltd,2500,01/06/2014
"Storage & Id Cars, Queens Road Works, Queens Road, Halifax              HX1 3NS",,4000,01/11/2015
"Unit 1 Bridge Road Works, Bridge Road, Brighouse, HD6 1EP",,5200,18/04/2016
"Unit 2 Bridge Road Works, Bridge Road, Brighouse, HD6 1EP",,5600,18/04/2016
"1 Central Buildings, Town Hall Street, Sowerby Bridge, HX6 2QF",,4650,26/03/2016
"Unit 6, South Street, Halifax, HX1 2EL",,3350,20/11/2011
"Office 36 First Floor, The E W Innovation Centre, Hopwood Lane, Halifax              HX1 5ER",Healthwatch Kirklees,3900,01/04/2016
"Palladium Buildings, 165 King Cross Road, Halifax, HX1 3LN",,2200,01/07/2016
"75 Southgate, Elland, HX5 0DQ",,3500,27/06/2016
"Travellers Rest, 83 Stainland Road, Greetland, Halifax             HX4 8BD",Admiral Taverns Ltd,10500,05/07/2016
"Unit 16, Mearclough Works, Mearclough Road, Sowerby Bridge       HX6 3LF",,920,01/01/2016
"Unit 21, Mearclough Works, Mearclough Road, Sowerby Bridge       HX6 3LF",,920,01/04/2015
"Unit 18, Mearclough Works, Mearclough Road, Sowerby Bridge       HX6 3LF",,1175,01/04/2015
"Unit 17, Mearclough Works, Mearclough Road, Sowerby Bridge       HX6 3LF",,920,01/04/2015
"Units 5E/5F Craggs C/Ty B Pk, New Road, Cragg Vale, Hebden Bridge        HX7 5TT",Blazing Saddles Ltd,10500,14/03/2016
"Unit 4A, 148/150 Hanson Lane, Halifax, HX1 5PQ",,4200,01/09/2015
"Units 2/3, Vine Industrial Estate, Elland Road, Brighouse            HD6 2QS",,8500,01/02/2016
"Unit 2, Kirklees Steelworks, Grove Street, Brighouse            HD6 1PL",Yfr Autos Ltd,5800,01/02/2016
"2ND Flr, 3 Carlton Place, Halifax, HX1 2SB",,13000,01/04/2016
"1ST Flr, 3 Carlton Place, Halifax, HX1 2SB",,13000,01/04/2016
"1st Floor Over Unit 1, Woodman Works, South Lane, Elland              HX5 0HQ",Rotary Club Of Elland,1300,28/12/2015
"Unit R4, Tenterfields Business Park, Luddendenfoot, Halifax             HX2 6EQ",,6900,17/06/2016
"Unit 8, Wellington Business Centre, Quebec Street, Elland               HX5 9AS",Footwear Accessories And Bags Ltd,7000,06/06/2016
"Unit 5, Wilkin Royd Mills, Mill Lane, Brighouse            HD6 1PN",,3450,10/09/2015
"1ST & 2ND Floors, 5 Stainland Road, Greetland, Halifax              HX4 8AD",,4350,06/06/2016
"253 King Cross Road, Halifax, HX1 3JL",,7700,30/06/2016
"Unit 1A, Caldervale Business Park, River Street, Brighouse            HD6 1LU",Lmp Tasty Trades Ltd,2500,01/04/2015
"Unit 1C, Caldervale Business Park, River Street, Brighouse            HD6 1LU",Lmp Tasty Trades Ltd,2950,01/04/2015
"Unit 1D, Caldervale Business Park, River Street, Brighouse            HD6 1LU",Lmp Tasty Trades Ltd,2600,01/04/2015
"Unit 1, Caldervale Business Park, River Street, Brighouse            HD6 1LU",Lmp Tasty Trades Ltd,25000,01/04/2015
"Unit 1B, Caldervale Business Park, River Street, Brighouse            HD6 1LU",Lmp Tasty Trades Ltd,1625,01/04/2015
"George Hotel, 2 Commercial Street, Brighouse, HD6 1AQ",The Craft Union Pub Company Ltd,16500,08/06/2016
"Office 1, 11 Owler Ings Road, Brighouse, HD6 1EJ",Harrington Family Law Ltd,900,20/06/2016
"Mount Pleasant Mill Yard, Mytholmroyd, Hebden Bridge, HX7 5NR",Units To Let [Northern] Ltd,470,01/11/2013
"Riverside Works, Mearclough Road, Sowerby Bridge, HX6 3LF",,4300,01/04/2016
"Howarth Street Garage, Howarth Street, Todmorden, OL14 8JA",,3900,01/07/2016
"Unit 8, Margram Business Centre, Horne Street, Halifax             HX1 5UA",Howdens Joinery Properties Ltd.,5200,04/07/2016
"6 Witchfield Hill, Shelf, Halifax, HX3 7QH",,3600,01/06/2016
"Over4-10 Albion Street, Halifax, HX1 1DU",O & C Management Ltd,6500,01/07/2016
"Suite 2 Burlees House, Hangingroyd Lane, Hebden Bridge, HX7 7DD",Butterworth Solicitors & Dfg Solicitors,6100,01/06/2016
"82 Southgate, Elland, HX5 0EP",,7700,19/05/2016
"Unit 4A Bridge Road Works, Bridge Road, Brighouse, HD6 1EP",,3950,03/05/2016
"2 Towngate, Hipperholme, Halifax, HX3 8JB",,7400,07/07/2016
"Part 1st Floor, Mount Pleasant House, Midgley Road, Mytholmroyd         HX7 5LR",,325,01/06/2016
"Unit 9 Church View Offices, Elland Road, Ripponden, HX6 4DB",,3500,29/03/2016
"Office 8, Church View Office Centre, Elland Road, Ripponden            HX6 4DB",,2050,29/03/2016
"Unit 4 Rear, 2 Silver Street, Halifax, HX1 1HS",,2175,01/06/2016
"Unit 4 Front, 2 Silver Street, Halifax, HX1 1HS",,2650,01/06/2016
"Part 7th Floor, 60 Crown Street, Halifax, HX1 1HY",Trustees Of B Holmes Discretionary Settlement,15500,12/03/2016
"63 Hanson Lane, Halifax, HX1 5NX",,2075,01/04/2014
"14 Albert Street, Hebden Bridge, HX7 8AH",,5100,01/04/2016
"Unit 12, Thrum Hall Business Park, Albert Road, Halifax              HX2 0DB",Suez Recyclng And Recovery Uk Ltd,40500,06/07/2016
"Office 3 Lower Gf, Croft Myl, West Parade, Halifax              HX1 2EQ",,6200,01/02/2016
"Central Street, Hebden Bridge, HX7 6HB",,7200,11/06/2016
"The Long Chimney, 1 West Street, Sowerby Bridge, HX6 3AN",,2600,11/07/2016
"25 Roils Head Road, Halifax, HX2 0NQ",,1950,01/07/2016
"Unit J6 Lowfields Way, Lowfields Business Park, Elland, HX5 9DA",Threadneedle Uk Property Trust,500000,09/07/2016
"33 Market Street, Hebden Bridge, HX7 6EU",,8300,01/04/2016
"Unit 23 2ND Floor, The Town Hall, St George's Street, Hebden Bridge        HX7 7BY",,2000,01/05/2016
"Unit 12 First Floor, The Town Hall, St George's Street, Hebden Bridge        HX7 7BY",Ayup Digital Ltd,2050,01/05/2016
"71 Bradford Road, Brighouse, HD6 1RS",Owram Estates Ltd,12000,03/07/2016
"Wainwright Hall, Jepson Lane, Elland, HX5 0PY",C H Property Trstee Bands Capital Limited,4850,19/05/2016
"Unit 10 First Floor, The Town Hall, St George's Street, Hebden Bridge        HX7 7BY",,1875,14/10/2015
"Unit 16 1ST Floor, The Town Hall, St George's Street, Hebden Bridge        HX7 7BY",Upper Calder Valley Renaissance (Phase 2) Ltd,1125,18/01/2016
"Unit 6 1ST Floor, The Town Hall, St George's Street, Hebden Bridge        HX7 7BY",Gibbons Associates Ltd,1525,18/01/2016
"19a Crown Street, Hebden Bridge, HX7 8EH",,8600,01/07/2016
"Units 12A & 12B, Calderdale Business Park, Club Lane, Halifax              HX2 8AX",Calderdale Stairlifts Ltd,2950,01/07/2016
"Storeroom 9 Market Hall, Brook Street, Todmorden, OL14 5AJ",,220,16/05/2016
"Unit 16I & Unit 16J, Calderdale Business Park, Club Lane, Halifax              HX2 8DB",Itv Moorside Ltd,4650,25/01/2016
"Office B18 First Floor, Croft Myl, West Parade, Halifax              HX1 2EQ",,1625,31/07/2015
"Unit 10, The Ainleys, Huddersfield Road, Elland              HX5 9JR",K & M Hulme Ltd,2650,01/04/2016
"Unit 2A, The Old Arcade, Halifax, HX1 1TJ",Inky Jims Tattoos,6000,01/06/2015
"73 Southgate, Elland, HX5 0DQ",,5300,29/02/2016
"Unit 14C, Calderdale Business Park, Club Lane, Halifax              HX2 8AX",Bizspace Ltd,1025,01/05/2012
"352 Ovenden Road, Halifax, HX3 5TJ",,3550,19/01/2016
"Unit 15, Topland Country Business Pk, Cragg Road, Mytholmroyd          HX7 5RU",,4200,01/04/2016
"7a Commercial Street, Brighouse, HD6 1AF",E.P.I.C Plc,4750,09/10/2014
"8 Bull Green, Halifax, HX1 5AB",,22000,29/06/2016
"Offices T01-T03&T05 1ST Flr, Cromwell House, Elland Road, Brighouse            HD6 2RG",Kip McGrath (Brighouse) Lp,5200,01/12/2015
"Units 18A & 18B, Calderdale Business Park, Club Lane, Halifax              HX2 8AX",Subsidium Recruitment Ltd,3250,01/06/2016
"Unit 16, Station Industrial Park, Station Road, Luddendenfoot        HX2 6AD",Yorkshire Heritage Bus Co. Ltd,26500,12/01/2016
"37 Stainland Road, Greetland, Halifax, HX4 8AD",,1825,01/06/2016
"15a Woolshops, Halifax, HX1 1RU",3 Uk Retail Ltd,7000,01/04/2016
"Unit 11 First Floor, The Town Hall, St George's Street, Hebden Bridge        HX7 7BY",Cansquared Ltd,1475,01/06/2016
"Unit 17 Woodman Works, South Lane, Elland, HX5 0PA",Green Valley Arborists Ltd,5800,11/07/2016
"4 Clare Road, Halifax, HX1 2HX",Makin Dixon Solicitors,5400,14/06/2016
"First Floor Unit B8, Warhurst Road, Lowfields Business Park, Elland               HX5 9DF",Wayne Fuel Management Uk Ltd,25500,18/04/2016
"Units 1 & 2, The Old Post Office, Station Road, Sowerby Bridge       HX6 3AA",Marmerel Ltd,12250,26/07/2016
"27 Southgate, Halifax, HX1 1DL",Calderdale Mbc Economy & Environment,13750,13/07/2016
"Office 7 James Street Mills, South Lane, Elland, HX5 0HB",Viewstone Ltd,1175,01/03/2014
"Unit T1, Dean Clough Industrial Park, Halifax, HX3 5WL",Dean Clough Ltd,15750,01/11/2013
"Unit 2 Lower Brea, Leeds Road, Halifax, HX3 7AQ",,3250,01/04/2015
"Unoffical Address, Unit A Atlas Mill Road, Brighouse, HD6 1ES",V S Engineering Ltd,5000,03/02/2016
"Ground Floor, 46 Prescott Street, Halifax, HX1 2QW",D L Partnership (Uk) Ltd,4700,01/01/2016
"1ST & 2ND Floor, 46 Prescott Street, Halifax, HX1 2QW",D L Partnership (Uk) Ltd,7700,01/01/2016
"Storeroom 7 Market Hall, Brook Street, Todmorden, OL14 5AJ",,215,01/01/2016
"Unit 4B, 148/150 Hanson Lane, Halifax, HX1 5PQ",,5700,01/09/2015
"Office 1 2ND Floor, New Oxford House, Albert Street, Hebden Bridge        HX7 8AH",Welcome Independent Living Ltd,2750,04/04/2016
"Office 2 2ND Floor, New Oxford House, Albert Street, Hebden Bridge        HX7 8AH",Welcome Independent Living Ltd,760,04/04/2016
"1ST Floor, New Oxford House, Albert Street, Hebden Bridge        HX7 8AH",Welcome Independent Living Ltd,14500,04/04/2016
"Office 3 2ND Floor, New Oxford House, Albert Street, Hebden Bridge        HX7 8AH",,5500,04/04/2016
"8-9 Market Hall, Brook Street, Todmorden, OL14 5AJ",,3200,01/01/2016
"10 Market Hall, Brook Street, Todmorden, OL14 5AJ",,1300,01/01/2016
"Star Inn, 29 Bridge End, Brighouse, HD6 3DN",,6400,31/08/2015
"Front Land Old Watson Bakery, Adelaide Street, Halifax, HX1 4LY",,5900,01/05/2015
"7 Cross Street West, Halifax, HX2 0HA",,3950,01/12/2015
"17/19 Burnley Road, Todmorden, OL14 7BU",,7000,05/08/2015
"Rear Land Old Watson Bakery, Adelaide Street, Halifax, HX1 4LY",,7100,01/05/2015
"Suite 5 Craggs Country B/Pk, New Road, Cragg Vale, Hebden Bridge        HX7 5TT",Craggs Country Business Park Llp,2325,01/04/2016
"Adj 9 Wade House Road, Shelf, Halifax, HX3 7PF",,4500,06/10/2015
"9 Square, Bradford Road, Northowram, Halifax              HX3 7HW",,2750,01/06/2016
"Unit 35, Mill House Works, Mill House Lane, Triangle            HX6 3LN",,2375,01/04/2016
"3 Batley Street, Lee Mount, Halifax, HX3 5DG",,2050,01/04/2015
"1st Floor, Burlees House, Hangingroyd Lane, Hebden Bridge       HX7 7DD",,2375,01/07/2016
"44 Southgate, Elland, HX5 0ES",Trustees Of The Doreen Harker Sipp,13250,17/05/2016
"295 Claremount Road, Halifax, HX3 6AW",Claremount Laundry Ltd,3700,20/07/2016
"6 Rochdale Road, Todmorden, OL14 5AA",Sk Excel Ltd,8600,01/05/2016
"Unit 12A Washer Lane Works, Washer Lane, Halifax, HX2 7DX",,1875,01/04/2013
"3 Wesley Court, Halifax, HX1 1UH",The Grayston Unity Ltd,1700,24/05/2016
"13 New Road, Mytholmroyd, Hebden Bridge, HX7 5DZ",,2450,01/07/2016
"66 Commercial Street, Brighouse, HD6 1AQ",The Laptop Store Brighouse Ltd,10500,10/10/2015
"Unit 12, Branxholme Industrial Estate, Bradford Road, Brighouse            HD6 4EA",Dennis Ruabon Commercial Ltd,5700,01/04/2015
"Unit 4C, Topland Country Business Pk, Cragg Road, Mytholmroyd          HX7 5RU",Thornber Chicks Ltd,3650,01/07/2016
"Unit 4B, Topland Country Business Pk, Cragg Road, Mytholmroyd          HX7 5RU",,2600,30/05/2016
"Unit 10, Thornhill Briggs Mill, Thornhills Beck Lane, Brighouse            HD6 4AW",,3500,01/08/2016
"Office Suite E339, Dean Clough Office Park, Halifax, HX3 5AX",Combined Selection Group Ltd,11250,04/12/2015
"Beard Enterprises, Old Town Mill, Wadsworth, Hebden Bridge        HX7 8SW",,8000,01/08/2016
"Level 0 The 1850 Mill, Shaw Lodge Mills, Shaw Lane, Halifax              HX3 9ET",Shaw Lodge Mills Ltd,13250,30/07/2016
"1st, 2nd & 3rd Floors, 14/16 Old Market, Halifax, HX1 1TN",Scottish Widows Trustee Limited,8200,01/04/2016
"Unit 2, New Oxford House, Albert Street, Hebden Bridge       HX7 8AH",,6700,01/08/2016
"Age Concern, Harley Street, Todmorden, OL14 5JE",Kinect Build Ltd (In Liquidation),6600,01/02/2016
"45 Back Clough, Northowram, Halifax, HX3 7HH",,3200,29/03/2016
"87 Northgate, Halifax, HX1 1XF",,4550,16/06/2015
"4/8 Bridge End, Brighouse, HD6 3DH",,990,29/11/2015
"4/8 Bridge End, Brighouse, HD6 3DH",,3900,29/11/2015
"PH2K, Todmorden Community College, Burnley Road, Todmorden           OL14 7BX",Calderdale Mbc,770,08/07/2016
"New Bond Works, New Bond Street, Halifax, HX1 2NB",,7500,13/07/2016
"Office 4, Church Of St John Evangelist, Calder Street, West Vale            HX4 8AQ",Community Transport Ltd,1425,01/04/2015
"Unit 7 The Nurseries, Halifax Road, Brighouse, HD6 2QD",Ultimate Secret Ltd,4050,01/04/2016
"Site Office Front A & B Mill, Dean Clough Mills, Halifax, HX3 5AX",Dean Clough Ltd,5300,01/06/2016
"Globe Works, Victoria Road, Sowerby Bridge, HX6 3AF",V C E P Limited,71000,01/10/2015
"8 Victoria Road, Sowerby Bridge, HX6 3AE",V C E P Limited,1975,01/10/2015
"Unit 32 Mill House Works, Mill House Lane, Triangle, Sowerby Bridge       HX6 3LN",,1575,01/08/2015
"Unit 2 Moderna Business Park, Mytholmroyd, Hebden Bridge, HX7 5QG",Nobilia [G.B] Ltd,15250,01/05/2016
"West Yorkshire Fire Service, Hollins Mill Lane, Sowerby Bridge, HX6 2QG",Sowerby Bridge Fire And Water Ltd,3650,15/06/2016
"Sowerby Bridge Baths, Hollins Mill Lane, Sowerby Bridge, HX6 2QG",Sowerby Bridge Fire And Water Ltd,2000,15/06/2016
"Council Offices, Hollins Mill Lane, Sowerby Bridge, HX6 2QG",Sowerby Bridge Fire And Water Ltd,12250,15/06/2016
"Office Suite D176, Dean Clough Office Park, Halifax, HX3 5AX",Dean Clough Ltd,1650,01/08/2016
"Unit 8, Mill House Works, Mill House Lane, Triangle            HX6 3LN",,1625,07/11/2015
"105 Northgate, Halifax, HX1 1XF",,8600,19/07/2016
"19 King Cross Street, Halifax, HX1 2SH",Amal Solicitors Ltd,5200,01/01/2016
"199 Pellon Lane, Halifax, HX1 5RL",,9000,01/10/2015
"5 Oldham Road, Ripponden, Sowerby Bridge, HX6 4DN",,1700,01/04/2016
"62 Southgate, Elland, HX5 0PS",,3000,27/07/2015
"Unit Hm 1.04, Holmfield Mills, Holdsworth Road, Halifax              HX3 6SW",Kino & Co,1125,01/01/2016
"Market Stall 101-103, Market Hall, Borough Market, Halifax             HX1 1DZ",,3850,18/07/2016
"Pear Tree Inn, Station Road, Norwood Green, Halifax             HX3 8QD",G & G Taverns Ltd,11750,21/07/2016
"7 Crown Street, Hebden Bridge, HX7 8EH",,7300,01/08/2016
"Stubb Playing Fields, Mytholmroyd, Hebden Bridge, HX7 5AP",Stubb Fields Community Association,1275,13/07/2016
"Unit 2, 10A Nanholme Mill, Shaw Wood Road, Todmorden           OL14 6DA",,1900,18/04/2016
"Heaton Street, Brighouse, HD6 1HG",,810,01/04/2016
"Kingfisher House, Portland Place, Halifax, HX1 2JQ",Sharma Investments Ltd,37000,14/05/2014
"The Brass Cat Hotel, 20-22 Cheapside, Halifax, HX1 1TQ",The Northern Counties Pub Co Ltd,20750,26/08/2015
"Unit 2 Station Industrial Pk, Station Road, Luddendenfoot, HX2 6AD",Mak Autohaus Ltd,5000,27/07/2016
"Unit 6 Branxholme Estate, Bradford Road, Bailiff Bridge, Brighouse            HD6 4EA",Marrtree Investments Limited,7600,01/04/2016
"Office 3, Church View Office Centre, Elland Road, Ripponden            HX6 4DB",,1475,29/03/2016
"Office 3, 11 Owler Ings Road, Brighouse, HD6 1EJ",,2125,03/05/2016
"Office 10 James Street Mills, South Lane, Elland, HX5 0HB",Kellan Group Plc,3300,01/02/2016
"113 Bolton Brow, Sowerby Bridge, HX6 2BD",,2450,22/07/2016
"New Street Hotel, 38 Sutcliffe Street, Pellon, Halifax             HX2 0HG",,2650,23/07/2016
"Unit G6a, Tenterfields Business Park, Luddendenfoot, Halifax             HX2 6EQ",Brogan Business Parks Ltd,3600,01/04/2016
"Unit 7, South Street, Halifax, HX1 2EL",,3750,20/11/2011
"59/61 Bradford Road, Brighouse, HD6 1RS",,6700,30/07/2016
"Office 20, 11 Owler Ings Road, Brighouse, HD6 1EJ",,1900,09/10/2015
"First Floor, Surefix Motoring Centre, Portland Place, Halifax              HX1 2QN",,5300,20/06/2016
"Office 19, The Spire, Leeds Road, Lightcliffe, Halifax              HX3 8ND",The Spire Halifax Ltd,2600,07/03/2016
"Office 16/17 The Spire, Leeds Road, Halifax, HX3 8NU",The Spire Halifax Ltd,4800,07/03/2016
"Part Units 4/5, Dominion Industrial Park, Denholmegate Road, Hipperholme         HX3 8JG",Blackshaw Holdings Ltd,5800,04/04/2016
"Room 12, The Spire, Leeds Road, Halifax             HX3 8NU",The Spire Halifax Ltd,2425,07/03/2016
"2nd Floor, The Spire, Leeds Road, Halifax             HX3 8NU",The Spire Halifax Ltd,9700,07/03/2016
"Office 10 The Spire, Leeds Road, Lightcliffe, Halifax              HX3 8NU",The Spire Halifax Ltd,6000,07/03/2016
"Office 20, The Spire, Leeds Road, Lightcliffe, Halifax              HX3 8NU",The Spire Halifax Ltd,2400,07/03/2016
"Office 8 The Spire, Leeds Road, Lightcliffe, Halifax              HX3 8NU",The Spire Halifax Ltd,1075,07/03/2016
"Offices 2,3,6,9,14&15, The Spire, Leeds Road, Lightcliffe          HX3 8NU",The Spire Halifax Ltd,12000,07/03/2016
"Office 7, The Spire, Leeds Road, Lightcliffe          HX3 8NU",The Spire Halifax Ltd,1575,07/03/2016
"1 Catherine Street, Elland, HX5 0EZ",Jr Property And Restorations Ltd,7200,07/03/2016
"Part First Floor, I E S House, Mission Street, Brighouse            HD6 1NQ",Oakwood Development (Holdings) Ltd In Administration,10250,23/07/2016
"118 Hanson Lane, Halifax, HX1 5PG",,2075,02/01/2016
"Unit 2 Washer Lane Works, Washer Lane, Halifax, HX2 7DX",,1250,01/04/2014
"Shop 1 Croft Mill, Hebden Bridge, HX7 8AS",,9000,08/07/2016
"Unit 6, Heywoods Industrial Park, Birds Royd Lane, Brighouse            HD6 1NA",Younger Homes ( Northern ) Ltd,11750,02/06/2016
"Unit 1 Washer Lane Works, Washer Lane, Halifax, HX2 7DX",,1800,01/03/2015
"Unit 5 Park Road Mills, Park Road, Elland, HX5 9HX",V-Seal Ltd,29250,18/07/2016
"149 Shay Lane, Halifax, HX3 6RR",,5800,01/11/2015
"4 Atlas Mill Road, Brighouse, HD6 1ES",,3800,01/08/2016
"Atm C'Tronic (E/Bnd Pfs), Hartshead Moor Service Area, Hartshead Moor, HD6 4JX",Cardtronics Uk Ltd,900,01/04/2010
"Atm C'Tronic E Bound, Hartshead Moor Service Area, Hartshead Moor, HD6 4JX",Cardtronics Uk Ltd,1300,01/04/2010
"Atm C'Tronic (W/Bnd Pfs), Hartshead Moor Service Area, Hartshead Moor, HD6 4JX",Cardtronics Uk Ltd,1300,01/04/2010
"Welcome Break, Hartshead Moor Service Area, Hartshead Moor, HD6 4JX",Welcome Break Group Plc,1290000,01/04/2010
"4 Dale Street, Todmorden, OL14 5PX",,1550,08/07/2016
"Unit W1, Tenterfields Business Park, Luddendenfoot, Halifax             HX2 6EQ",P I Consultants Limited,4650,01/02/2016
"Unit W5, Tenterfields Business Park, Burnley Road, Luddendenfoot        HX2 6EJ",Brogan Business Parks Ltd,8000,27/12/2015
"Unit W6, Tenterfield Business Park, Luddendenfoot, Halifax             HX2 6EQ",Brogan Business Parks Ltd,7300,27/12/2015
"Unit W3, Tenterfield Business Pk, Burnley Road, Luddendenfoot        HX2 6EQ",P I Consultants Limited,3500,24/01/2016
"109 Wakefield Road, Lightcliffe, Halifax, HX3 8SH",,7100,16/05/2016
"Unit 18 Windsor Works, Victoria Road, Hebden Bridge, HX7 8JX",Setbray Properties Ltd,1700,01/07/2016
"Unit 11 Hebble End Mill, Hebble End, Hebden Bridge, HX7 6HJ",,1025,01/04/2016
"Milk Distribution Depot, Queens Road, Halifax, HX1 3NT",Resource Medical (Uk) Ltd,13750,07/07/2016
"Trafalgar Inn, Aachen Way, Halifax, HX1 3ND",Resource Medical (Uk) Ltd,12250,07/07/2016
"Unit 5C Craggs Country B/Pk, New Road, Cragg Vale, Hebden Bridge        HX7 5TT",,4250,07/07/2016
"Market Stall 82-84, Market Hall, Borough Market, Halifax             HX1 1DZ",,7600,11/07/2016
"Unit 3, Kirklees Steelworks, Grove Street, Brighouse            HD6 1PL",Warmco Space Heating Ltd,4750,01/04/2016
"26 Cheapside, Halifax, HX1 1TQ",Keighley Discount Furnishers Ltd,24500,17/02/2014
"Birds Royd Lane, Brighouse, HD6 1LQ",Anthony Piccioni,30000,28/07/2016
"Unit 1, Royd Mills Business Park, Dyehouse Lane, Brighouse           HD6 1LL",Brackenridge Hanson Tate Ltd,12750,28/07/2016
"Unit 3 First Floor, No. 4 Warehouse, Canal Wharf, Sowerby Bridge       HX6 2AG",Integro Insurance Brokers Ltd,6000,16/10/2014
"33 Crown Street, Hebden Bridge, HX7 8EH",Marshall Bakers Ltd,6500,13/06/2016
"Units 9/10 Emstead Works, Old Lane, Halifax, HX3 5QN",Master Matting Installations Limited,3850,01/08/2016
"91 Northgate, Halifax, HX1 1XF",,12000,09/08/2016
"93 Northgate, Halifax, HX1 1XF",,3000,09/08/2016
"Holme Street Arts Centre, Holme Street, Hebden Bridge, HX7 8EE",,4350,16/08/2016
"Harrison House, 10 Harrison Road, Halifax, HX1 2AF",F C F M Group Ltd,540,03/03/2016
"Harrison House, 10 Harrison Road, Halifax, HX1 2AF",F C F M Group Ltd,1375,03/03/2016
"Harrison House, 10 Harrison Road, Halifax, HX1 2AF",F C F M Group Ltd,10000,03/03/2016
"Harrison House, 10 Harrison Road, Halifax, HX1 2AF",F C F M Group Ltd,3950,03/03/2016
"Harrison House, 10 Harrison Road, Halifax, HX1 2AF",F C F M Group Ltd,4550,03/03/2016
"Harrison House, 10 Harrison Road, Halifax, HX1 2AF",F C F M Group Ltd,3800,03/03/2016
"Harrison House, 10 Harrison Road, Halifax, HX1 2AF",F C F M Group Ltd,5300,03/03/2016
"Office Suite D172, Dean Clough Office Park, Halifax, HX3 5AX",Dean Clough Ltd,1350,11/08/2016
"Harrison House, 10 Harrison Road, Halifax, HX1 2AF",F C F M Group Ltd,1150,03/03/2016
"Office Suite D202, Dean Clough Mills, Halifax, HX3 5AX",Dean Clough Ltd,475,11/08/2016
"Richmond Street Mill, Richmond Street, Todmorden, OL14 5RD",Weir Minerals Europe Limited,12750,01/07/2016
"Office Suite D 132, Dean Clough Mills, Halifax, HX3 5AX",,2950,13/05/2016
"51 Hanson Lane, Halifax, HX1 5NX",The Hub Pharmacy Ltd,2250,01/07/2016
