bookrank,id,title,bookauthor,publicationyear,publisher,languagecode,numpages,averagerating,ratingscount
1378,164760,The Winter of Frankie Machine,Don Winslow,,,eng,,4.14,4828
1378,9435890,Edge,Jeffery Deaver,2010,Simon & Schuster,eng,416,3.99,8481
1380,418626,"See Jane Die (Stacy Killian, #1; The Malones, #2)",Erica Spindler,2005,Mira Books,eng,474,4.11,6252
1380,99461,Split Infinity  (Apprentice Adept #1),Piers Anthony,1987,Del Rey,eng,368,3.96,15030
1380,822995,"A Clash of Kings (A Song of Ice and Fire, #2)",George R.R. Martin,2003,HarperVoyager,en-US,913,4.41,8561
1380,31259,"The Bourne Ultimatum (Jason Bourne, #3)",Robert Ludlum,2004,Orion,eng,725,4.05,53255
1384,800758,"Death Is Not the End (Inspector Rebus, #10.5)",Ian Rankin,2000,St. Martin's Minotaur,eng,80,3.74,864
1384,8543,To the Hilt,Dick Francis,2004,G.P. Putnam's Sons,eng,352,4.12,5485
1384,6713625,The Complaints,Ian Rankin,2009,Orion Books,eng,381,3.86,8844
1384,226791,Total Control,David Baldacci,1997,Vision,eng,720,4.08,28327
1388,4008488,"The 7th Victim (Karen Vail, #1)",Alan Jacobson,2008,Vanguard Press,eng,352,3.62,3575
1388,8582850,Blood Vines,Erica Spindler,2011,St. Martin's Paperbacks,eng,382,4.05,76
1388,3764,"From Russia With Love (James Bond, #5)",Ian Fleming,2002,Penguin Books,eng,259,3.89,23780
1391,24469,"Flower Net (Red Princess, #1)",Lisa See,1997,Harper Paperbacks,eng,465,3.51,3708
1391,15062217,"14 (Threshold, #1)",Peter Clines,2012,Permuted Press,eng,372,3.95,27686
1393,153590,"Playback (Philip Marlowe, #7)",Raymond Chandler,1988,Vintage Crime/Black Lizard,eng,166,3.79,5687
1393,391880,"Ripley Under Water (Ripley, #5)",Patricia Highsmith,2005,Bloomsbury,en-GB,250,3.8,952
1393,16429,The Husband,Dean Koontz,2006,Bantam,eng,400,3.8,39761
1393,10148340,You're Next,Gregg Andrew Hurwitz,2011,Brilliance Audio,eng,436,3.93,7388
1393,2922110,The Dirty Secrets Club (Jo Beckett #1),Meg Gardiner,2008,Brilliance Audio,eng,5,3.63,2630
1398,84054,The Stars Shine Down,Sidney Sheldon,,HarperCollins Publishers,eng,448,3.69,14691
1398,3073043,"Sanctuary (Jack Taylor, #7)",Ken Bruen,2008,Transworld Ireland,eng,208,4.03,894
1400,16312,"One, Two, Buckle My Shoe (Hercule Poirot, #23)",Agatha Christie,2004,HarperCollins Publishers,eng,0,3.76,14580
1400,15776309,Reconstructing Amelia,Kimberly McCreight,2013,HarperCollins,eng,382,3.83,101702
1400,31125554,"The Fourth Monkey (4MK Thriller, #1)",J.D. Barker,2017,Houghton Mifflin Harcourt,eng,404,4.15,7153
1400,33128934,"Stillhouse Lake (Stillhouse Lake, #1)",Rachel Caine,,,eng,301,4.12,97080
1404,625956,"Hamlet, Revenge! (Sir John Appleby, #2)",Michael Innes,2008,House of Stratus,eng,312,3.81,771
1404,1050383,"The Sleeping Doll (Kathryn Dance, #1)",Jeffery Deaver,2007,Hodder & Stoughton,eng,448,3.93,13231
1404,13636815,"New Orleans Mourning (Skip Langdon, Mystery #1)",Julie Smith,2012,booksBnimble,eng,352,3.67,1294
1407,83399,"Sins of the Fathers (Inspector Wexford, #2)",Ruth Rendell,1986,Ballantine Books,eng,256,3.63,1027
1407,160472,"The Boy Who Followed Ripley (Ripley, #4)",Patricia Highsmith,,,eng,292,3.64,1056
1407,13044811,15 Seconds,Andrew Gross,2012,William Morrow,eng,324,3.75,4596
1407,10000269,Prey,Linda Howard,2011,Random House Audio,eng,12,3.75,6789
1411,271299,"A Grave Denied (Kate Shugak, #13)",Dana Stabenow,2004,St. Martin's Press,en-US,352,4.29,2750
1411,411171,Blood and Money,Thomas Thompson,2001,Running Press Book Publishers,en-US,512,4.21,2213
1411,8437913,"Tick Tock (Michael Bennett, #4)",James Patterson,2011,"Little, Brown and Company",eng,448,4.05,19878
1411,10680329,"A Trick of the Light (Chief Inspector Armand Gamache, #7)",Louise Penny,2011,Minotaur Books,eng,339,4.31,32997
1411,13596166,Joyland,Stephen King,2013,Hard Case Crime,eng,283,3.91,94703
1416,7134201,The Postcard Killers,James Patterson,2010,"Little, Brown and Company",eng,420,3.8,20860
1416,16333,"At Bertram's Hotel (Miss Marple, #11)",Agatha Christie,2002,HarperCollins,eng,223,3.7,18215
1416,16335,"The Mystery of the Blue Train (Hercule Poirot, #6)",Agatha Christie,2007,Black Dog & Leventhal Publishers,eng,317,3.81,23720
1416,432,"City of Glass (The New York Trilogy, #1)",Paul Auster,1987,Penguin Books,eng,203,3.79,12563
1420,249870,The Hours Before Dawn,Celia Fremlin,1996,Virago Press (UK),eng,216,3.81,401
1420,763677,"Under the Bright Lights (Renee Shade, #1)",Daniel Woodrell,1998,Pocket Books,eng,,3.57,619
1420,34310,The Glass Lake,Maeve Binchy,2005,The Orion Publishing Group Ltd,eng,704,3.93,17719
1420,19668,"Without Remorse (John Clark, #1; Jack Ryan Universe Publication Order #6)",Tom Clancy,1994,Berkley Books,eng,750,4.18,54241
1424,429940,"Cotton Comes to Harlem (Harlem Cycle, #7)",Chester Himes,1988,Vintage Crime/Black Lizard,eng,160,3.83,1344
1424,8045080,"Hell's Corner (Camel Club, #5)",David Baldacci,2010,MacMillan,eng,448,4.11,23332
1426,1257531,"The Four Last Things (Roth, #1)",Andrew  Taylor,,HarperCollins Publishers,eng,402,3.68,524
1426,72750,"Shoulder the Sky (World War I, #2)",Anne Perry,2005,Ballantine Books,eng,336,3.97,1996
1426,2676229,"Flesh House (Logan McRae, #4)",Stuart MacBride,2008,,eng,480,4.14,4507
1426,983545,"Trophy Hunt (Joe Pickett, #4)",C.J. Box,2005,G.P. Putnam's Sons,eng,352,4.09,6395
1426,1105468,"The Abominable Man (Martin Beck, #7)",Maj Sjöwall,2007,Harper Perennial,eng,216,4.04,2448
1426,205262,"Strip Jack (Inspector Rebus, #4)",Ian Rankin,1998,St. Martin's Paperbacks,eng,269,3.85,7221
1432,3659,The Book of Evidence (The Freddie Montgomery Trilogy #1),John Banville,2001,Vintage Books,eng,220,3.71,3223
1432,498371,"The Blood Spilt (Rebecka Martinsson, #2)",Åsa Larsson,2007,Delacorte Press,eng,339,3.65,5509
1432,618880,"The Woman Who Married a Bear (Cecil Younger, #1)",John Straley,2005,Soho Crime,eng,240,3.49,658
1435,6369098,Final Sin,Chelle Cordero,2009,Vanilla Heart Publishing,eng,256,4.07,11
1435,9504832,Digger's Bones,Paul Mansfield Keefe,,,en-GB,336,3.74,36
1435,6949853,The Hollow Man: A (Transgressive) Novel Of Suspense,G. Patrick Huskins,2009,Murder Ink Press,eng,352,3.5,11
1435,30195,Cast of Shadows,Kevin Guilfoile,2006,Vintage,eng,336,3.64,648
1435,10153215,"Take No More (James Blake, #1)",Seb Kirby,2010,amazon,en-GB,252,3.55,270
1435,11176800,"Death By Honeymoon (Caribbean Murder, #1)",Jaden Skye,2011,Jaden Skye,en-CA,220,3.41,1969
1435,8373201,"Scene Stealer (An Augusta Weidenmaier Mystery, #1)",Elise Warner,2010,Carina Press,eng,235,3.62,13
1435,11312041,Lessons of Evil,Linda B. Myers,2011,Mycomm One,eng,286,3.54,23
1435,11368348,"Endangered (Summer Westin Mystery, #1)",Pamela Beason,2011,Berkley,eng,320,4.31,265
1435,12690450,Eight of Jacks,T.D. McMichael,2011,Magnus Corner Books,eng,,4.23,12
1435,13014526,And Then There Was Life!,André Jacob,,,eng,,4,6
1435,10610084,Number One Bestseller,Brian  Morley,2011,Savant Books & Publications LLC,eng,320,3.86,14
1435,8307302,"The Keepers (The Keepers Trilogy, #1)",Heather Graham,2010,Harlequin,eng,288,3.8,791
1435,13182986,A Life Lived Ridiculously,Annabelle R. Charbit,2012,Firefly Publishing & Entertainment,eng,246,3.93,35
1435,15905037,Oracle,J.C.  Martin,2012,J. Taylor Publishing,eng,299,4.08,44
1435,6470875,Both Sides Of The Fence: A Life Undercover,David  Corbett,2003,Mainstream Publishing,eng,208,3.92,23
1435,13266174,The Stand In,Brad Geagley,2011,BookBaby,en-US,,3.92,13
1435,13410893,"Zero Balance (Eviscerating the Snake, #2)",Ashley Fontainne,2012,World Castle Publishing,eng,260,4.29,35
1435,13321884,The Mirror in the River,Dale Lovin,2011,Sunstone Press,eng,260,4,19
1435,12101743,"The Choice (Walk the Right Road, #1)",Lorhainne Eckhart,2012,,eng,301,3.65,199
1435,13455355,"Swamp Donkey (Booze, Drugs, Gambling, Hookers, Murder and the bothersome hangovers that sometimes result)",Thad Staffall,2012,MMD Publishing,eng,168,3.76,17
1435,13491829,Short Thrills: Pia Sabel Stories,Seeley James,2012,KDP Amazon,eng,71,4.89,9
1435,13498321,"The Penance List (David Trilogy, #1)",S.C. Cunningham,2011,Createspace,eng,502,4.28,44
1435,13064385,Unaccounted For,Nan Willard Cappo,2011,Tadmar Press,en-GB,330,3.57,25
1435,8413921,"The Sleepwalkers (Willi Kraus, #1)",Paul Grossman,,,eng,309,3.71,143
1435,10188593,Myth Man,Alex Mueck,2010,iUniverse,eng,304,4.42,75
1435,13138117,The Monarch,Shannon Esposito,2011,Shannon Esposito,eng,201,4.17,30
1435,13493779,Hill Country,R. Thomas Brown,2012,CreateSpace,eng,198,3.75,31
1435,13508732,Tainted Souls,Steven J. Wangsness,2012,Ploughshare Point,eng,300,3.98,60
1435,12433807,The Calypso Directive,Brian  Andrews,2012,Arcade,eng,336,3.89,91
1435,3151688,The Adventures of the Great Mouse Detective (Classic Storybook),Walt Disney Company,,,eng,,3.84,90
1435,15720038,The Curious Case of Daniel Walter,Rose Carter,2011,Amazon.com,eng,81,2.5,1
1435,15705112,Drawn in Blood: A Rick Stone Mystery,N.P. Statham,2012,Trilby Publishing House,eng,242,4.33,9
1435,7673244,Carnal: Somewhere Over 40 Winks,Rom LcO'Feer,2009,Lulu.com,eng,222,3.65,91
1435,15993357,The Swimmer,David      Haynes,2012,David Haynes,eng,329,3.7,41
1435,16120723,Resolve,J.J. Hensley,2013,The Permanent Press,eng,248,4.09,225
1435,17203292,"Here Be Monsters (Tyler Cunningham, #1)",Jamie Sheffield,2013,Smart Pig and CreateSpace Independent Publishing Platform,eng,294,4.03,77
1435,13605932,The Shoulders of Giants (Jake Abraham Mysteries Book 1),Jim Cliff,2012,Antbear Books,eng,252,3.66,345
1435,16124549,Death on a Cold Night,Jess Faraday,2012,Elm Books,eng,,4.19,7
1435,15733030,Blood Remembered (Max Sawyer #1),Douglas  Pratt,2011,Douglas Pratt,eng,184,4.05,186
1435,8432181,In the Belly of Jonah (Liv Bergen Mystery #1),Sandra Brannan,2010,Greenleaf Book Group,eng,252,3.8,665
1435,16107302,Distortion,Lucie Smoker,2012,Buzz Books USA,eng,316,4.26,16
1435,18189084,"Blood and Justice (Jake and Annie Lincoln, #1)",Rayven T. Hill,2013,Smashwords Edition,eng,301,3.69,1092
1435,18105634,The Evil Beneath,A.J. Waines,2013,CreateSpace Independent Publishing Platform,en-GB,444,3.89,233
1435,17854431,"Shadows of Morrow (Elkhart Case File, #1)",A.C. Haury,2013,Createspace,en-US,408,4.09,20
1435,18756754,"Marsh Island (Hirebomber Crime Series, #1)",Oliver F. Chase,2013,"AEC Stellar Publishing, Inc.",en-US,330,4.33,12
1435,18759743,Dr. 2 (Issue 1),Peter Tieryas,2013,,en-GB,40,3.97,26
1435,18810102,Find Virgil,Frank Freudberg,2013,Inside Job Media,eng,356,3.98,105
1435,22172801,"Lamb to the Slaughter (Serenity's Plain Secrets, #1)",Karen Ann Hopkins,2014,,eng,293,4.05,3376
1435,2112823,"Mind Fuck (The Administration, #1)",Manna Francis,2007,Casperian Books,eng,264,3.95,2670
1435,21857232,The Consecration (Dichotomy of Evil #1),Jesse Merwin,2014,The Umbrage Press,eng,233,4.33,12
1435,20986629,Conduit (Emily Monroe #1),Angie Martin,2014,Indie World Publishing & Author Services,eng,354,3.94,323
1435,22884960,Twisted Tears,Stan Taylor,2014,Jonathon Jones,eng,,4.04,16
1435,24424919,Song to the Moon (Damnatio Memoriae #2),Laura Giebfried,,Amazon Digital Services,eng,,4.27,33
1435,24700669,Dirt Nap Rhapsody,Jules Cassard,2015,Hopewell Manhattan Press,eng,322,4.19,3
1435,25137843,In the Shadow of Angels,Donnie J. Burgess,,,en-CA,,4.17,11
1435,24855900,The Death in Sioux Lookout Trilogy,Richard   Schwindt,1997,Richard Schwindt,eng,,4.57,7
1435,25997563,Pitfall,Cameron Bane,,,en-GB,332,4.11,56
1435,28192570,Corruption of Power,G.W. Eccles,2015,Peach Publishing,eng,324,4.23,41
1435,29388297,"The Very Devil, Herself!",Loren Molloy,2016,Loren Molloy,eng,558,3.77,26
1435,27853361,Double Trouble,D.M. Wolfenden,2015,DM Wolfenden,eng,105,4.43,53
1435,31308524,Brazen Violations,Jonathan Macpherson,,,en-CA,201,4.12,68
1435,26077311,"Secondhand Smoke (Jake Brand, PI, Series, Book 2)",M. Louis,2015,Palisades Publishing,eng,320,4.08,10
1435,34806114,Murder In A Minute,Shouvik Bhattacharya,,,eng,,3.8,487
1435,36481391,"The Blame Game: She lies, even when the truth makes a better story",Terri Reynolds,,,eng,,4.71,24
1435,40209645,The Missing Activist,Louise Burfitt-Dons,6,New CenturyDigibooks,eng,,4.54,37
1435,40164525,Death in Focus: Passion and photography meet a multimillion dollar cover-up and murder.,S.R. Garrae,,,eng,,4.4,24
1435,44200541,Deep and Dirty: A Novel,Douglas Dell,2019,"Bulldog Publications, Est. 1980",eng,280,5,5
1435,46029371,"A Will To Kill (Athreya, #1)",R.V. Raman,2019,HarperCollins India,eng,340,4.23,41
1435,45837927,Epiphany’s Gift,Mallory M. O’Connor,,,eng,,4.11,9
1505,620,"Small Vices (Spenser, #24)",Robert B. Parker,1998,G.P. Putnam's Sons,eng,384,4.01,4111
1505,9505607,By A Thread,Marty Beaudet,2011,CreateSpace,eng,290,3.96,19
1505,12946152,The Belle Stalker,Minnette Meador,2011,Resplendence Publishing,eng,258,4.89,9
1505,12528758,Lucky Stiffs,Curt Batson,,,eng,,5,5
1505,13065746,Tune in to Danger,Donald J. McGill,,The Dangerous Press,eng,,4,4
1505,76816,"Cadillac Jukebox (Dave Robicheaux, #9)",James Lee Burke,1997,Hachette Books,eng,464,4.03,4698
1505,13447875,Rendezvous in Quebec,Steve O'Driscoll,2012,CreateSpace,eng,142,4.5,4
1505,13641537,The High Blue Arena,Jack Prendergast,2012,,eng,263,4.88,8
1505,1255956,"The Marshal at the Villa Torrini (Marshal Guarnaccia Mystery, #9)",Magdalen Nabb,1993,HarperCollins Publishers,eng,192,3.69,78
1505,13635238,Sins of the Father,R.J.  Palmer,2012,,en-GB,232,4.1,23
1505,12240419,Table 21,T. Rafael Cimino,2011,BMG/ Akula Media Group,eng,287,3.64,386
1505,1017537,Open and Shut (Andy Carpenter #1),David Rosenfelt,2003,Grand Central Publishing,eng,292,4,6947
1505,17563791,The Rose Red Reaper (Chicago Serial Crimes),Kristi Loucks,2013,Amazon Digital Services,eng,215,3.9,69
1505,18811828,"Boy Made of Dawn (Navajo Nation Mystery, #2)",R. Allen Chappell,2013,Createspace Independent Publishing Platform,en-US,140,4.16,41
1505,18831382,Navajo Autumn (A Navajo Nation Mystery #1),R. Allen Chappell,,,eng,188,3.83,1295
1505,18283339,Never to Know,Patricia Fincken,2012,Patricia Fincken,eng,328,4.38,25
1505,42855699,"Exposed: The Education of Sarah Brown (The Checkpoint, Berlin Detective Series #1)",Michele E. Gwynn,2018,,eng,327,4.08,5
1505,23876664,A Rented World,Merle Temple,2014,Southern Literature Publishing,eng,,4.73,30
1505,23342416,The Photographer Trilogy Box Set (Tainted Series Books 1-3),Sarah  Robinson,2015,,eng,999,4.26,101
1505,25159239,The Girl with Ghost Eyes (The Daoshi Chronicles #1),M.H. Boroson,2015,Talos,eng,288,3.89,2355
1505,25411210,Cuts Like Glass,Dana S. Feldman,,CreateSpace Independent Publishing Platform,eng,330,4.04,19
1505,18114335,Pietr the Latvian,Georges Simenon,2013,Penguin Classics,eng,176,3.47,2545
1505,25475281,The Lipstick Murders,Ricky Corum,,,en-CA,,3.44,21
1505,28869962,One Fateful Summer,Vanessa Star,2016,Mbi Publishing,en-US,540,4.27,25
1505,29089365,"Mad for Mel (The Morelville Mysteries, #7)",Anne Hagan,,,eng,,4.3,40
1505,20455343,The Forgotten Girls (Louise Rick #7),Sara Blaedel,2015,Grand Central Publishing,eng,312,3.57,8483
1505,29762106,The Anonymous Man,Vincent L. Scarsella,,Digital Crime Fiction,eng,,3.83,299
1505,35104010,The Insomniacs' Club,Vasily Pugh,2017,Midland Monkey,eng,282,4.42,19
1505,38137746,Enochi: 3 of Light,Syquan Perrett,2018,Createspace Independent Publishing Platform,eng,122,4.75,4
1505,35744961,Devil's Bait,Debbie Boek,2017,Debra Boek,eng,248,4.2,129
1505,19063,The Book Thief,Markus Zusak,2006,Alfred A. Knopf,eng,552,4.37,1541262
1505,39071348,Happy Holiday Homicides,Micah Minnefer,,,eng,,4.55,11
1505,43074651,Deadly Diamond: A Diamond to Die For,Rob W. Davis,2018,,eng,318,4.8,5
1538,838668,"The Vesuvius Club (Lucifer Box, #1)",Mark Gatiss,2005,Simon & Schuster Ltd,eng,240,3.59,4439
1538,5933841,Inherent Vice,Thomas Pynchon,2009,The Penguin Press,eng,369,3.75,21819
1538,9654874,Act of Passion,Georges Simenon,2011,New York Review Books,eng,216,3.84,370
1538,411565,The Tattoo Murder Case (Detective Kamizu),Akimitsu Takagi,2003,Soho Crime,eng,324,3.79,837
1538,7871404,Beautiful Bad Girl,Gordon Basichis,2010,Minstrel's Alley,en-GB,,3.33,153
1538,11448659,Damage Control,Denise Hamilton,2011,Scribner,eng,372,3.55,477
1538,12249248,This Doesn't Happen In The Movies (Reed Ferguson Mystery #1),Renee Pawlish,2011,,en-GB,227,3.52,2759
1538,9447145,Katar,Stanisław Lem,1988,Wydawnictwo Literackie,pol,176,3.7,148
1538,15740918,"The Sultan of Monte Cristo (Sequels to the Count of Monte Cristo, #1)",Holy Ghost Writer,2012,Xlibris Corporation,eng,67,4.19,360
1538,18107175,Girl on a Train,A.J. Waines,2013,CreateSpace Independent Publishing Platform,en-US,434,3.85,358
1538,11243724,"Falling Immortality (Casey Holden, Private Investigator #1)",Robert Downs,2011,"Rainbow Books, Inc.",eng,231,3.17,57
1538,449575,The Satan Bug,Alistair MacLean,1967,HarperCollins,eng,256,3.7,1066
1538,18474117,"Interviews With the Dead, Part 1",Collette Sinclaire,2013,Risch Media Group,eng,40,4.21,24
1538,18804363,"Tin God (Delta Crossroads Trilogy, #1)",Stacy Green,2013,Twisted Minds,eng,404,3.96,45
1538,16119032,Blue Coyote Motel (Coyote #1),Dianne Harman,2012,Dianne Harman,eng,297,3.67,461
1538,12898,Death of a Salesman,Arthur  Miller,,Heinemann Library,eng,117,3.52,155688
1538,21902777,"Untainted (Photographer Trilogy, #3)",Sarah  Robinson,2014,,eng,,4.27,223
1538,18656055,"Invisible (Invisible, #1)",James Patterson,2014,"Little, Brown and Company",eng,399,4.11,16466
1538,15815918,The Oligarch,G.W. Eccles,2012,G.W. Eccles,eng,,4.1,38
1538,35747029,The Drunk Detective: A Dotty Davis Comedy Suspense,Mary Jean Curry,2018,Prodigy Gold Books,eng,260,3.38,9
1558,6930579,The Island of Sheep,John Buchan,1956,Penguin Books,eng,245,3.76,14
1558,7172157,Broken Dreams,Nick Quantrill,2010,Caffeine Nights Publishing,eng,252,3.81,70
1558,7549835,"Random (Narey & Winter, #1)",Craig Robertson,2010,Simon & Schuster,eng,329,3.77,718
1558,9477992,"The Bayou Trilogy: Under the Bright Lights, Muscle for the Wing, and The Ones You Do",Daniel Woodrell,2011,Mulholland Books,eng,496,3.76,1319
1558,13505524,"Keyser Run (Evelyn Morgan, #1)",J.L. Austgen,2012,"Dreampipe Publishing, Inc.",eng,374,3.89,23
1558,11966966,One for the Road,Edgar J. Rossi,,,eng,208,4.75,4
1558,13280195,One Voice Raised: A Triumph Over Rape,Jennifer A. Wheatley-Wolf,2011,Current Tome Publishing,eng,530,4.18,17
1558,13583424,The Gateway to Hell: A Mike Shannon Novel,Ray Mileur,2012,iUniverse,eng,260,4.48,23
1558,14311690,Paladin,K.D. Lassiter,2009,CreateSpace,eng,452,4.71,6
1558,17344470,"Cliff Diver (Emilia Cruz Mysteries, #1)",Carmen Amato,2013,CreateSpace Independent Publishing Platform,eng,316,4.14,82
1558,45120,The Shape of Snakes,Minette Walters,2002,Jove,eng,384,3.77,3508
1558,20445713,"Tainted Bodies (Photographer Trilogy, #1)",Sarah  Robinson,2014,,eng,333,3.8,386
1558,18607725,"Shadow Maker (Nick Baron, #2)",James R. Hannibal,2014,Berkley,eng,384,4.16,47
1558,27245902,The Heavenly Table,Donald Ray Pollock,2016,Doubleday,eng,384,4.06,2897
1558,37643484,The Unexpected Warrior: an Ace Stone adventure #1,Nicholas A. Price,2018,"Bulldog Publications, Est. 1980",eng,656,4.92,8
1558,41452829,Boulevard Dreams,E. Ryan Janz,,,eng,,3.12,43
1558,38199561,"Conspirator (Inspector Dhruvi, #2)",R.V. Raman,2018,Hachette India,eng,359,4.25,33
1575,4411706,"Buckingham Palace Gardens (Charlotte & Thomas Pitt, #25)",Anne Perry,2009,Ballantine Books,eng,391,3.84,79
1575,9845530,Four Years from Home,Larry Enright,2010,Lawrence P. Enright,eng,325,3.56,517
1575,6621101,"Deception (Alex Delaware, #25)",Jonathan Kellerman,2010,Ballantine Books,eng,338,3.99,14305
1575,8614975,"Thirteen Hours (Benny Griessel, #2)",Deon Meyer,2011,Hodder & Stoughton,eng,560,4.1,2977
1575,294046,"The Judas Strain (Sigma Force, #4)",James Rollins,2007,William Morrow,eng,464,4.15,24868
1575,13562007,Shadows Gray (Shadows #1),Melyssa Williams,2012,Melyssa Williams,eng,292,3.99,145
1575,13600762,"Shadow War II, Deadly Contact  #2",T.R. Wallace,2012,self published E Book,eng,282,4.33,3
1575,11890816,"The Gods of Gotham (Timothy Wilde, #1)",Lyndsay Faye,,Amy Einhorn Books/Putnam,eng,408,3.88,10841
1575,18049553,BAD INTENT,Michael Tabman,,,eng,,4.75,6
1575,19513985,The Perfect Day (Detective Paul Friedman Thrillers #2),Gunnar Angel Lawrence,2013,G.A.L. Publiishing,eng,536,4.29,6
1575,20975446,"Tainted Pictures (Photographer Trilogy, #2)",Sarah  Robinson,2014,KDP,eng,330,4.24,263
1575,22585967,Fraudster,R.V. Raman,2014,Hachette,eng,289,3.92,216
1575,22918059,Licensed to Thrill: Volume 6 (Hunt For Jack Reacher #2-2.5),Diane Capri,,,eng,,3.8,62
1575,8610846,"Devil Red (Hap and Leonard, #8)",Joe R. Lansdale,2011,Knopf,eng,205,3.92,1210
1575,22859802,The Bones of You,Debbie Howells,2015,Kensington,eng,313,3.67,4074
1575,34553023,Reversione: Reset the Future,Chris A. Jones,2017,Green Ivy,eng,242,4.19,954
1575,29815670,Insider,R.V. Raman,2016,Hachette,eng,352,4.28,70
1592,2051,The Simple Art of Murder,Raymond Chandler,1988,Vintage Crime/Black Lizard,eng,384,4.15,4977
1592,1182523,Samaritan,Richard Price,2004,Vintage,eng,378,3.71,1724
1592,530643,"Desert Heat (Joanna Brady, #1)",J.A. Jance,1993,Avon,eng,373,4,9002
1592,194940,"Until Dark (FBI, #3; John Mancini, #3)",Mariah Stewart,2003,Ballantine Books,eng,394,4.03,786
1592,6393198,The Kult,Shaun Jeffrey,2009,Leucrota Press,en-GB,328,3.95,266
1592,314362,Derailed,James Siegel,,,eng,,3.77,1799
1592,10779163,No Darker Fate,John Corwin,2011,John Corwin,eng,,3.98,51
1592,5975729,Bath Massacre: America's First School Bombing,Arnie Bernstein,2009,The University of Michigan Press,eng,200,4.03,310
1592,13186274,Employee of the Year,Dmitri Ragano,,,eng,,4.22,28
1592,13550944,"Michael Jahn’s New York City Mysteries: Murder at the Cathedral of St. John the Divine (Bill Donovan Mysteries, #3)",Michael Jahn,2012,Kindle,eng,,3.56,2
1592,13342793,"Painted Black (Street Stories, #1)",Debra R. Borys,2011,New Libri Press,eng,,4.21,17
1592,15814401,"Claire DeWitt and the Bohemian Highway (Claire DeWitt Mysteries, #2)",Sara Gran,2013,Houghton Mifflin Harcourt,eng,288,3.77,2542
1592,16776,"I Dreamed I Married Perry Mason (A Cece Caruso Mystery, #1)",Susan Kandel,2005,Avon,eng,280,3.47,793
1592,76909,"Last Bus to Woodstock (Inspector Morse, #1)",Colin Dexter,1996,Ivy Books,eng,282,3.9,10186
1592,13153,Hide and Seek,James Patterson,1997,,eng,368,4.12,59405
1592,21363845,No Good Deed (Thriller Mystery),Russel K. Stevens,,,eng,,4.86,14
1592,30176077,Letters From The Attic,Gabriel Farago,2016,Gabriel Farago,eng,,4.15,16
1592,1914973,"The Likeness (Dublin Murder Squad, #2)",Tana French,,,eng,466,4.06,83637
1592,32418,"Hannibal (Hannibal Lecter, #3)",Thomas  Harris,2000,Arrow,eng,564,3.76,73652
1592,26101936,The Black Widows,Jane Finch,,,eng,,4.82,7
1612,1155492,"Mexican Hat (Kevin Kerney, #2)",Michael McGarrity,2004,Pocket Books,eng,,4.04,983
1612,950252,Missionary Stew,Ross Thomas,2004,St. Martin's Griffin,eng,288,4.09,253
1612,6388743,The Ghosts of Belfast (Jack Lennon Investigations #1),Stuart Neville,2009,"Soho Press, Inc.",eng,336,3.89,5003
1612,140730,Red Lights,Georges Simenon,2006,NYRB Classics,eng,154,3.83,621
1612,1535604,"Crusader's Cross (Dave Robicheaux, #14)",James Lee Burke,2006,Pocket Books,eng,325,4.15,5830
1612,13431425,Executive Severance,Robert K. Blechman,2011,NeoPoiesis Press,eng,148,4.88,7
1612,13599610,Death Draws Nigh,Brad Simpson,2012,,eng,119,3.5,2
1612,253792,New England White,Stephen L. Carter,,,eng,,3.51,2238
1612,21455492,"Ashes, Ashes (Shadows in the Nursery, #3)",Tamara Shoemaker,2014,Route 11 Publications,eng,204,4.05,29
1612,625103,The Little Man From Archangel,Georges Simenon,2014,Penguin Books Ltd,eng,176,4,129
1612,15816054,Dante's Wood (A Mark Angelotti Novel #1),Lynne Raimondo,2013,Seventh Street Books,eng,319,3.79,306
1612,22011687,Deadly Assets (Allison Campbell Mystery #2),Wendy Tyson,2014,Henery Press,eng,296,4.13,112
1612,34510510,"Saboteur (Inspector Dhruvi, #1)",R.V. Raman,2017,Hachette India,eng,352,4.45,46
1625,147210,Tishomingo Blues,Elmore Leonard,2003,Penguin,eng,416,3.69,7192
1625,815595,"The Last Detective (Peter Diamond, #1)",Peter Lovesey,,,eng,,3.74,3244
1625,6525439,"Blackbird Fly (Bennett Sisters, #1)",Lise McClendon,2009,Thalia Press,eng,312,3.61,866
1625,4728979,"Silent on the Moor (Lady Julia Grey, #3)",Deanna Raybourn,2009,Mira Books,eng,465,4.03,10346
1625,13328743,Blood Flats,Edward Trimnell,2011,,eng,356,4.24,24
1625,9299037,Wavering,Virginia Frazier,2010,,eng,240,3.67,8
1625,11865202,"The Caller (Konrad Sejer, #10)",Karin Fossum,2011,Harvill Secker,eng,304,3.71,3271
1625,24919537,"Dying Brand (Allison Campbell Mystery, #3)",Wendy Tyson,2015,Henery Press,eng,264,4.35,74
1625,20573672,A Good Hanging (Thriller Mystery),Russel K. Stevens,,,eng,,4.86,14
1625,91374,"Web of Evil (Ali Reynolds, #2)",J.A. Jance,2007,Touchstone Books,eng,368,3.78,3811
1625,28962906,"Stalking Jack the Ripper (Stalking Jack the Ripper, #1)",Kerri Maniscalco,2016,Jimmy Patterson,eng,327,4.01,24023
1625,36086536,"A Date with Murder (Murder, She Wrote, #47)",Jessica Fletcher,2018,Berkley Books,eng,294,3.67,321
1625,38649751,"Murder, She Wrote: Manuscript for Murder",Jessica Fletcher,2018,Berkley Books,eng,307,3.67,279
1638,808382,"The Curse of the Bronze Lamp (Sir Henry Merrivale, #16)",Carter Dickson,1997,Carroll & Graf,eng,192,3.72,145
1638,930472,Murder in Exile (Frank Cole #1),Vincent H. O'Neil,2006,Minotaur Books,eng,208,3.37,115
1638,467074,"Confess, Fletch (Fletch, #2)",Gregory McDonald,2002,Vintage Crime/Black Lizard,eng,192,3.89,1782
1638,19578,Lost Boy Lost Girl,Peter Straub,2004,Ballantine Books,eng,368,3.48,4036
1638,993736,The Day After Tomorrow,Allan Folsom,1995,Vision,eng,752,4.02,265
1638,13506758,The Limping Dog,J.R. Lindermuth,2012,Whiskey Creek Press,eng,246,4.15,9
1638,5171894,"The Doomsday Key (Sigma Force, #6)",James Rollins,2009,William Morrow,eng,448,4.16,22635
