ref-id,isbn,citation,parent_key
T84,978-3-642-60107-1,"W. KuhnzH. BlodeH. Zimmermann (1993). Pharmacokinetics of Exogenous Natural and Synthetic Estrogens and Antiestrogens. In: Estrogens and Antiestrogens II.. Springer, Berlin, Heidelberg.",DB13953
T84,978-3-642-60107-1,"W. KuhnzH. BlodeH. Zimmermann (1993). Pharmacokinetics of Exogenous Natural and Synthetic Estrogens and Antiestrogens. In: Estrogens and Antiestrogens II.. Springer, Berlin, Heidelberg.",DB13954
T84,978-3-642-60107-1,"W. KuhnzH. BlodeH. Zimmermann (1993). Pharmacokinetics of Exogenous Natural and Synthetic Estrogens and Antiestrogens. In: Estrogens and Antiestrogens II.. Springer, Berlin, Heidelberg.",DB13955
T84,978-3-642-60107-1,"W. KuhnzH. BlodeH. Zimmermann (1993). Pharmacokinetics of Exogenous Natural and Synthetic Estrogens and Antiestrogens. In: Estrogens and Antiestrogens II.. Springer, Berlin, Heidelberg.",DB13956
T41,978-1-4398-0713-2,"Iris F. F. Benzie, Sissi Wachtel-Galor (2011). Herbal Medicine: Biomolecular and Clinical Aspects (2nd ed.). CRC Press/Taylor & Francis.",DB13964
T224,978-1-4899-0729-5,"Bailey J. (1991). Prostaglandins, leukotrienes, lipoxins and PAF. Springer.",DB13964
T225,,Roland P. (2008). Otolaryngology: Head and Neck Surgery. J. Othons.,DB13964
T226,,Mueller R (2008). Small Animal Clinical Pharmacology. Elsevier.,DB13964
T227,,Braun L. and Cohen M. (2010). Herbs & Natural Supplement: An evidence-based guide. Elsevier.,DB13964
T151,9780323292658,"Kathy Moscou, Karen Snipe (2014). Pharmacology for Pharmacy Technicians. Elsevier Health Sciences.",DB13966
T132,978-3-527-32937-3,"Stefan Dubel, Janice M. Reichert (2014). Handbook of Therapeutic Antibodies, Volume 3: Approved Therapeutic Antibodies (3rd ed.). John Wiley & Sons.",DB13979
T604,,"Nairne J., Iveson P. and Meijer A. (2015). Progress in medicinal chemistry (54th ed.). Elsevier.",DB13980
T118,,Underwood E. (1977). Trace elements in human and animal nutrition (4th ed.). Academic press.,DB13995
T166,0309069491,"Institute of Medicine (US) Panel on Dietary Antioxidants and Related Compounds (2000). Dietary Reference Intakes for Vitamin C, Vitamin E, Selenium, and Carotenoids. National Academies Press (US).",DB14001
T166,0309069491,"Institute of Medicine (US) Panel on Dietary Antioxidants and Related Compounds (2000). Dietary Reference Intakes for Vitamin C, Vitamin E, Selenium, and Carotenoids. National Academies Press (US).",DB14002
T166,0309069491,"Institute of Medicine (US) Panel on Dietary Antioxidants and Related Compounds (2000). Dietary Reference Intakes for Vitamin C, Vitamin E, Selenium, and Carotenoids. National Academies Press (US).",DB14003
T156,,Washington N. (1961). Antacids and anti-reflux agents. CRC Press .,DB14005
T157,,Schueller R. and Romanowski P. (1999). Conditioning Agents for Hair and Skin. Marcel Dekker.,DB14005
T168,,Reilly R. (2013). The fundamental principles of compartmental pharmacokinetics illustrated by radiopharmaceuticals commonly used in nuclear medicine. ACPE.,DB14007
T167,,Zhou H. and Theil F. (2016). ADME amd translational pharmacokinetics/pharmacodynamics of therapeutic proteins. John Wiley & Sons.,DB14007
T231,,Randall E. Harris (2002). COX-2 Blockade in Cancer Prevention and Therapy. Humana Press.,DB14059
T232,,"Luka Milas, K. K Ang, C. Nieder (2003). Modification of Radiation Response: Cytokines, Growth Factors, and Other Biological Targets (Medical Radiology). Springer.",DB14059
T324,,"Sivapalasingam S., Steigbigel N. (2015). Mandell, Douglas and Bennett's Principles and practice of infectious diseases (8th ed.). Elsevier.",DB14126
T1,978-0-07-162442-8,"Goodman, Louis Sanford;Brunton, Laurence L.;Chabner, Bruce;Knollman, Bjorn (2011). The Pharmacological Basis of Therapeutics (12th ed.). McGraw-Hill Professional Publishing.",DB14146
T28,978-0-7020-3471-8,"45. (2012). In Rang and Dale's Pharmacology  (7th ed., pp. 553-557). Edinburgh: Elsevier/Churchill Livingstone.",DB14185
T36,978-0-07-17803-2,"Barrett KE, Barman SM, Boitano S, Brooks HL (2012). Ganong's Review of Medical Physiology (24th ed.). McGraw Hill.",DB14481
T797,,"Susan J. Dreyer MD, William Jeremy Beckworth MD (2011). Pain procedures in clinical practice: Commonly Used Medications in Procedures (3rd ed.). Elsevier.",DB14649
T116,978-1-25-958473-2,"Brunton LL, Hilal-Dandan R, Knollmann BC. eds (2018). Goodman & Gilman's: The Pharmacological Basis of Therapeutics (13th ed.). McGraw-Hill Education.",DB14879
T734,,Ankit Mangla; Moavia Ehsan; Smita Maruvada (2019). Sickle Cell Anemia. Stat Pearls.,DB14975
T734,,Ankit Mangla; Moavia Ehsan; Smita Maruvada (2019). Sickle Cell Anemia. Stat Pearls.,DB15271
T756,,Vijay Venugopal; Steven Pavlakis (2019). Duchenne Muscular Dystrophy. StatPearls Publishing.,DB15593
